"Find companies","Name","Description","Primary Industry","Size","Type","Location","Country","Domain","LinkedIn URL"
,"Koukakis Farm S.A.","""Φτιάχνουμε κάτι περισσότερο από ένα γάλα για τα παιδιά μας. Σας προσφέρουμε το γάλα, που πίναμε εμείς παιδιά”
Θανάσης Κουκάκης.

Κάτω Απόστολοι, Κιλκίς.
Εδώ, βρίσκονται οι εγκαταστάσεις της Φάρμα Κουκάκη ενταγμένες απόλυτα στο φυσικό περιβάλλον. Στην πεδιάδα του Κιλκίς, δίπλα στον εύφορο ποταμό Αξιό. Εδώ, όπου οι δικοί μας άνθρωποι συλλέγουν καθημερινά φρέσκο ελληνικό γάλα και παράγουν γαλακτοκομικά προϊόντα ημέρας, δίνοντας έμφαση στη γεύση και την ποιότητα. Διαχρονικά.
Τα προϊόντα μας διακρίνονται για την άριστη ποιότητα τους, αφού όλα παρασκευάζονται με αγνό, ολόφρεσκο, 100% ελληνικό γάλα, με εξαιρετικά αυστηρές προδιαγραφές.","Dairy","51-200 employees","Privately Held","Kilkis , Kato Apostoloi","Greece","koukakisfarm.gr","https://www.linkedin.com/company/koukakis-farm"
,"IndiaDairy.com","Since 1983, Dairy India is known for providing authentic information about the dairy sector of India. Founded and conceived with the encouragement and support of Dr Verghese Kurien, the doyen of Indian dairying, by the late P.R. Gupta and Late Sharad Gupta, Dairy India has evolved into one of the world’s most prestigious publications on dairying across the world.

With the changing times Dairy India has launched IndiaDairy.com.

IndiaDairy.Com is an all round dairy guide for you and is most popular because we provide a dairy database for your marketing and sales team.

IndiaDairy.Com is designed keeping in mind that you can cater to your dairy target audience as only people who are related to the dairy sector or are interested in the dairy sector visit our website.

This only dairy portal aims to make our close-knit dairy community even closer. Dairy information from all over India will be easily accessible to its members in their laptop, tablet, and phone on the go.","Dairy","2-10 employees","Self Employed","Gurugram, India","India","indiadairy.com","https://www.linkedin.com/company/indiadairy"
,"Letti A²","Nossa missão é produzir alimentos frescos e seguros, sempre por meio do respeito à terra, ao bem-estar animal e às pessoas.","Dairy","11-50 employees","Privately Held","Descalvado, SP","Brazil","leiteletti.com.br","https://www.linkedin.com/company/letti-a²"
,"Laticínio Saboroso","Nascemos para alimentar e criar oportunidade!

Em 1995 um Jovem produtor rural Sr. Antonio Alves de Toledo aos 32 anos de idade, apoiado pela jovem e também empreendedora Cássia de 29 anos,  se viu em uma situação complicada com seu pequeno rebanho de vacas leiteiras com um produção próxima de 500 litros por dia, quando a Gigante Nestlé, abandonou a compra de leite de pequenos produtores em sua região Palestina - SP.

Como sua propriedade estava direcionada a produção de leite entendeu que era o momento de fazer do limão uma doce limonada! já que seus 3 filhos     (de 12, 9, 6 anos ) ainda estavam no inicio de sua caminhada, Levantou recurso e montou um mini usina de beneficiamento de leite pasteurizado com alinhada a potencial de consumo de sua cidade os 500 litros/dia.                                                    Em menos de 1 ano os pequenos produtores de leite de sua região já estavam vendendo o leite para o pequeno laticínio, para não deixar a atividade desaparecer na região e dar condição, dar corpo ao novo negócio foi de encontro a novas oportunidades de escoar uma capitação maior

Hoje com 25 anos de historia, atuam na região noroeste do estado de São Paulo com planos de buscar o atendimento estadual até 2023 e Nacional na fase seguinte. 

Depois de muito esforço seu reconhecimento por onde passa com produtos e serviço tem gerado grandes impactos positivos, isso Graças a forte Time de profissionais que vem formando orientados ao desenvolvimento sustentável e coletivo.","Dairy","51-200 employees","Privately Held","São José do Rio Preto, São Paulo","Brazil","laticiniosaboroso.com.br","https://www.linkedin.com/company/laticiniosaboroso"
,"Puleva Food, S.L.",,"Dairy",,,,,"puleva.es","https://www.linkedin.com/company/puleva-food-s.l."
,"Associated Milk Producers Inc.","At AMPI, we make the dairy products that make some of the nation’s top brands. We know what we’re made of is just as important as what we make. Our core values -- commitment to quality, responsibility to others and determination to succeed -- guide us in all we do.

More than 1,050 employees help move the milk produced on Upper Midwest member dairy farms to customers across the U.S. and around the world. We do this with a manufacturing network that processes milk into dairy products for retail, foodservice and food ingredient customers. AMPI employees touch all facets of the food chain, from the farm to the market.

We're farmer-owned and Co-op Crafted, and our dairy cooperative reflects the values and commitment for which the Midwest is famous. AMPI offers rewarding jobs in a variety of fields, including manufacturing, accounting, communications, marketing, information services, supply chain and more.

Job positions will be posted as they become available. We'd love to have you join our team!","Dairy","1,001-5,000 employees","Privately Held","New Ulm, MN","United States","ampi.com","https://www.linkedin.com/company/associated-milk-producers-inc"
,"Dairy Campus","Dairy Campus in Leeuwarden is hét onderzoek- en praktijkcentrum voor de melkveehouderij en de zuivelketen. Alles draait hier om innovatie, onderzoek en educatie. Hiermee zijn we uniek in de wereld. Onze onderzoekers uit verschillende disciplines werken samen met het bedrijfsleven, onderwijs en de melkveehouders. Wetenschap en praktijk zitten hier onder één dak. Alle activiteiten zijn gericht op de ontwikkeling van een duurzame zuivelketen. 
De koeien produceren op Dairy Campus data én melk.","Dairy","11-50 employees","Educational","Leeuwarden, Friesland","Netherlands","dairycampus.nl","https://www.linkedin.com/company/dairy-campus"
,"AGROS, U.C.R.L.","MISSÃO
A AGROS, U.C.R.L. tem como missão promover o escoamento do leite produzido pelos Produtores, sócios das Cooperativas agrupadas, fomentando a melhoria contínua da qualidade do mesmo, satisfazendo o seu cliente e criando valor aos Produtores através da negociação que garanta o melhor preço.

VISÃO
Continuar a ser reconhecida como uma empresa credível, dinâmica e inovadora, assumindo a liderança do Movimento Cooperativo Agrícola, de forma a projetar e contribuir para que as novas gerações de Produtores usufruam de um desenvolvimento económico, social e cultural, equilibrado e sustentável.

VALORES
Ética e Deontologia
Valorização Humana – respeito mútuo, formação adequada e trabalho em equipa
Melhoria Contínua – rigor, disciplina, desempenho, inovação
Satisfação dos Stakeholders 
Gestão Responsável, Transparente e Sustentável","Dairy","201-500 employees","Privately Held","Póvoa de Varzim, Porto","Portugal","agros.pt","https://www.linkedin.com/company/agros"
,"荷兰皇家菲仕兰 FrieslandCampina China","On January 1st, 2016, FrieslandCampina Business Group China was officially established to be one of the five business groups (the others being Cheese, Butter and Milk Powder, Ingredients, Consumer Products Asia and Consumer Products Europe, Middle East and Africa). Among the seven key investment areas in updated Route2020, four directly related to China, including strenthening China market, high value-added ingredients, cheese business and e-commerce IFT. More resources will be directed to China and with our joint efforts, FrieslandCampina China will be a company with over 10 billion revenue by 2020!

FrieslandCampina China has five business units: FrieslandCampina Dairy Products (Shanghai) Co., Ltd., FrieslandCampina Trading (Shanghai) Co., Ltd., FrieslancCampina Ingredients (Beijing) Co., Ltd. FrieslancCampina Ingredients (Shanghai) Co., Ltd., FrieslandCampina Brand Management (Shanghai) Co., Ltd. and the joint venture FrieslandCampina Huishan Dairy Co., Ltd.","Dairy","501-1,000 employees","Privately Held","Shanghai","China","frieslandcampina.com","https://www.linkedin.com/company/荷兰皇家菲仕兰-royal-frieslandcampina-china"
,"Lancewood","Founded in 1996, Lancewood produces a range of cheese and dairy products that have rightly earned an excellent reputation for superior quality and flavour. Lancewood’s state of the art manufacturing facility is strategically situated in George in close proximity to the local farms ensuring milk is delivered with the minimum delay.

Only the finest milk is sourced from these farms where free range cows graze in lush green pastures of the Garden Route. Lancewood embraces a culture of innovation in order to continually meet the changing requirements of today’s discerning consumers.","Dairy","201-500 employees","Privately Held","Durbanville, Western Cape","South Africa","lancewood.co.za","https://www.linkedin.com/company/lancewood"
,"Cooperativa de Laticínios de São José dos Campos - Cooper","Com 86 anos de existência, a empresa lidera o mercado de leite pasteurizado nas regiões em que atua, graças aos investimentos em tecnologia e em qualidade.

Desde a sua inauguração em 1935, foram anos e anos de luta, crescimento e modernização para que a Cooper pudesse enfrentar a globalização da economia, adequar sua estrutura à realidade do mercado e se transformar no que é hoje: uma empresa forte, presente em 31 municípios, com um parque industrial moderno, atividades diversificadas e um serviço de marketing capaz de dar sustentabilidade à marca. 

Como empresa, a Cooperativa persegue a competitividade, a produtividade e a qualidade dos seus produtos. Para isto, investe no treinamento de seus funcionários, na melhoria constante da estrutura da empresa, no lançamento de novas opções para o consumidor e no rígido controle de qualidade desde a matéria-prima até o produto final.","Dairy","201-500 employees","Partnership","São José dos Campos","Brazil","cooper.com.br","https://www.linkedin.com/company/cooperativa-de-laticínios-de-são-josé-dos-campos"
,"PT Kalbe Morinaga Indonesia",".","Dairy","201-500 employees","Public Company",,,,"https://www.linkedin.com/company/pt-kalbe-morinaga-indonesia"
,"Diario Lechero","Diario Lechero nació como aporte a la difusión de información especializada acerca de esta importante actividad y motor de la economía del sur de Chile.","Dairy","2-10 employees","Self Owned","Chile","Chile","diariolechero.cl","https://www.linkedin.com/company/diariolechero"
,"Agri-Mark, Inc.","Agri-Mark farmers take pride in their Cabot, McCadam, and Agri-Mark products and have the toughest milk quality standards in the market. If you enjoy healthy, delicious, award-winning dairy products, you can count on the fact that the pride of both our farmers and our employees are vital ingredients in everything we make.

When you buy Cabot, McCadam, and Agri-Mark dairy products, you are directly supporting more than one third of the dairy farm families in New England! 

History
Agri-Mark's rich tradition as a cooperative dates back to 1916 with the formation of its predecessor, the New England Milk Producers Association. The cooperative flourished during the twentieth century and in 1980 became Agri-Mark. A dozen years later Agri-Mark merged with Cabot Creamery Cooperative, thereby ensuring that Northeast dairy farmers would continue their ownership of a valuable, time-honored consumer brand -- Cabot. Naturally aged Vermont cheddar cheese and fresh creamery butter top the list of Cabot's best known products. In 2003, Agri-Mark merged with the Chateaugay Cooperative in Upstate New York and acquired the assets of McCadam Cheese, including a plant located in Chateaugay. McCadam manufactures award-winning New York Cheddar, Muenster and European-type cheeses.","Dairy","1,001-5,000 employees","Privately Held","Andover, MA","United States","agrimark.net","https://www.linkedin.com/company/agri-mark-inc."
,"Vitalus Nutrition Inc","Vitalus is a global brand providing specialized dairy ingredients for use in a wide variety of food and beverage applications. We have grown from a small family owned business to a trusted supplier of ingredients for large scale processor and top- tier brands. 
We source milk from regional farms. Artificial growth hormones, like rbST, are not permitted and controlled measures are in place to prevent antibiotics from entering the milk supply. All production facilities meet the highest quality Food Safety Standards (FSSC22000) and all of our ingredients are Kosher and Halal certified.","Dairy","51-200 employees","Privately Held","Abbotsford, British Columbia","Canada","vitalus.com","https://www.linkedin.com/company/vitalus-nutrition-inc"
,"Clínica do Leite","No Laboratório da Clínica do Leite são realizados diversos tipos de análises no leite cru. Essas análises permitem obter informações sobre a qualidade do leite de tanques de resfriamento das fazendas, de silos nas indústrias e nos tanques dos caminhões transportadores. Além dessas, são feitas análises no leite individual de vacas para se avaliar a nutrição, a prenhes e a presença de mastite. Com isso o produtor poderá melhorar seus processos produtivos para conseguir mais sucesso e a indústria estará atendendo as exigências do MAPA com o mínimo de esforço, garantia de qualidade e de excelente atendimento.","Dairy","51-200 employees","Privately Held","Piracicaba, SP","Brazil","clinicadoleite.com.br","https://www.linkedin.com/company/clinicadoleite"
,"Dairy UK","Dairy UK is the trade association for the UK dairy supply chain and brings together processors, dairy co-operatives, manufacturers, farmers and bottled milk buyers throughout the country. This supply chain approach is unique within the global dairy industry. Between them, Dairy UK's members collect and process about 85% of UK milk production and Dairy UK is committed to promoting and protecting the interests of the sector in the UK and abroad. The dairy industry is a success story and is vital to the UK economy, environment and diet. Thanks to an 80,000-strong workforce, it provides wholesome, affordable and nutritious foods to consumers while investing constantly in research and innovation.","Dairy","11-50 employees","Non Profit","London","United Kingdom","dairyuk.org","https://www.linkedin.com/company/dairyuk"
,"OMFED","The Orissa State Cooperative Milk Producers' Federation Limited (OMFED) is an apex level Dairy Cooperative Society registered under Cooperative Society Act – 1962. It has come into existence to integrate the milk producers in rural areas with consumers in the urban areas with an enterprising aptitude.

OMFED's main activities includes promoting, production, procurement, processing and marketing of milk & milk products for economic development of the rural farming community in Orissa.","Dairy","1,001-5,000 employees","Non Profit","Bhubaneswar , Odisha","India","grozip.com","https://www.linkedin.com/company/omfed"
,"Yashili NZ Dairy Company Limited","Yashili is one of the leading infant formula producers for the domestic market in china. With one simple goal – to produce the highest quality infant formula and raise the healthiest babies – Yashili came to New Zealand in July 2012 and established a world leading manufacturing base in Pokeno.","Dairy","51-200 employees","Privately Held","Pokeno, Waikato","New Zealand","yashili.co.nz","https://www.linkedin.com/company/yashili-nz-dairy-company-limited"
,"Produco: Food Safety & Regulatory Compliance Specialists","Produco provides expert Food Safety, Quality, and Regulatory Compliance advice and consultancy services to Dairy and Food manufacturers throughout New Zealand and Australia.

We have extensive experience across all regulatory aspects, ensuring your products are compliant with regulatory requirements. 

We create, develop and implement Risk Management Programmes and world-class Quality Management Systems to ensure the safe manufacture of food and dairy products and to facilitate export.

We'll assist you to implement the necessary legal requirements for your unique food business such as Animal Products Act and Food Act via regulatory interpretation, process and procedural development, implementation, and training to ensure you and your staff are compliant.

We have extensive experience getting product across borders via compliance with OMARs (Overseas Market Access Requirements) and ICRs (Importing Country Requirements).

We facilitate communication with Regulatory Bodies and understand how they operate, thereby expediting your products to gain the required official assurances to most overseas countries. 

Team: 
A range of highly skilled consultants ranging from Senior QA Managers, Specialists and QA Officers are available dependent on your needs. 
- Part-time / Full-time 
- Long, Medium & Short term 
- On-site or Remote 
- Variable hours

We service all regions and cities throughout New Zealand and Australia. Our delivery can be via e-mail, phone, video conference and travel to your premises.","Dairy","2-10 employees","Self Owned","Hamilton, Waikato","New Zealand","produco.co.nz","https://www.linkedin.com/company/produco"
,"The Dairy Alliance","On behalf of dairy farm families, The Dairy Alliance works with schools, health professionals, retailers, dairy processors and the public to promote dairy products throughout Alabama, Georgia, Kentucky, Mississippi, North Carolina, South Carolina, Tennessee and Virginia.","Dairy","11-50 employees","Non Profit","Atlanta, GA","United States","thedairyalliance.com","https://www.linkedin.com/company/thedairyalliance"
,"Kurtsan Milking Systems & Farm Equipment","Founded in 1985, Kurtsan is a company which produces milking machines, dairy technologies and farming equipments headquartered in İstanbul, Turkey. Kurtsan is a family company and offers products in over 70 countries and  services at 269 destinations in Turkey.  With 160 employees and 32,000 m² indoor factory, Kurtsan is standing as the biggest production facility of milking machines in Turkey.  

In the factory of Kurtsan, there are head offices, stainless steel process center, plastic injection center, molding center, painting center, welding center, mounting center and quality department.

Since 1985, Kurtsan produced 275,000 mobile milking machines, installed over 800 farms in Turkey and 50 farms in different countries. 

kurtsantarim.com","Dairy","201-500 employees","Privately Held","Istanbul, Esenyurt","Turkey","kurtsantarim.com","https://www.linkedin.com/company/kurtsan"