"Find companies","Name","Description","Primary Industry","Size","Type","Location","Country","Domain","LinkedIn URL"
,"TONICORP","Tonicorp es una empresa de Arca Continental y The Coca Cola Company conformada por Toni, Topsy, Plásticos Ecuatorianos y Dipor. Comprometida con el desarrollo integral de sus colaboradores y su cadena de valor.","Dairy","1,001-5,000 employees","Privately Held","Guayaquil, Guayas","Ecuador","tonicorp.com","https://www.linkedin.com/company/tonicorp"
,"Alpura","Grupo alpura es una empresa líder en el mercado de lácteos en México, fundada en 1972 por ganaderos con el compromiso de entregar la mejor leche fresca con calidad desde el origen. Actualmente, emplea a más de 17 mil colaboradores. En 2019, el catálogo alpura se conforma por más de 100 productos, entre los que se encuentran leches frescas, leches especializadas, la línea de yoghurt batIdo y bebible, cremas, leche evaporada, quesos, mantequilla, teniendo como objetivo satisfacer las necesidades de los consumidores con productos de alta calidad, que brinden la mejor nutrición y confianza. 
Alpura es la única empresa de lácteos en México certificada por la agencia gubernamental de Estados Unidos The Food and Drug Administration (FDA) gracias a los altos estándares de calidad internacional de sus productos. 
Para más información visite http://alpura.com | Facebook: @alpuraoficial | Twitter: @alpuraoficial | Youtube: Alpura Oficial","Dairy","5,001-10,000 employees","Self Owned","México, Estado de México","Mexico","alpura.com","https://www.linkedin.com/company/alpura"
,"PIL Andina S.A.","Pil Andina S.A. es la empresa del Grupo Gloria líder en alimentos en Bolivia. La central administrativa se encuentra ubicada en Cochabamba y cuenta con tres plantas industriales en la Paz, Cochabamba y Santa Cruz de la Sierra.

Actualmente fabrica y comercializa: leche pasteurizada, leche larga vida UHT, leche entera en polvo, yogurt, quesos, mantequilla, crema de leche, jugos y otros productos, bajo las marcas Pil, Bonlé, Pura Vida, Aruba y otras. Utiliza en la fabricación la mejor calidad de leche de las cuencas aledañas a las plantas.","Dairy","1,001-5,000 employees","Privately Held","Bolivia","Bolivia","pilandina.com.bo","https://www.linkedin.com/company/pil-bolivia"
,"Betânia Lácteos","Nossa história se mistura com a de tantas famílias do Nordeste. 
O dia começa bem cedo, porque sabemos que há muito o que fazer. Na fazenda, a origem: o leite fresco, tirado, armazenado e preparado por mãos experientes de quem tem fé no trabalho. Famílias inteiras que fazem dessa produção seu sustento, sua morada, sua vida.
Do outro lado, o destino: o produto pronto, de qualidade, para quem valoriza sua origem. Famílias inteiras que apreciam leite de qualidade que dá força para suas rotinas e para todo o ecossistema de produção.
Em comum, a coragem de encarar mais um dia, o amor de pessoas que colocam suas famílias em primeiro lugar e a força para começar sempre tudo de novo.
Isso é o que alimenta, diariamente, nossos sonhos – que são do tamanho do horizonte. Cada um do seu jeito, vivemos cada dia para reforçar a confiança que é reconhecida por todas as famílias. Confiança de mãe.
Betânia Lácteos. Coragem que vem do leite.","Dairy","1,001-5,000 employees","Privately Held","Fortaleza, Ceará","Brazil","betanialacteos.com.br","https://www.linkedin.com/company/leitebetania"
,"SanCor","SanCor es una cooperativa de productores lecheros argentinos que industrializa y comercializa productos lácteos que proveen nutrición y salud.
Es históricamente la principal exportadora de productos lácteos de Argentina.
Sus principales líneas de productos son leches infantiles, quesos, dulce de leche, manteca, crema, yogures, flanes, postres, leche en polvo y leches especiales.","Dairy","1,001-5,000 employees","Privately Held","Sunchales, Santa Fe","Argentina","sancor.com","https://www.linkedin.com/company/sancor"
,"Hatsun Agro Product Ltd","Hatsun Agro Product Limited has been committed to enriching the lives of customers by providing a range of high-quality dairy products. HAP manufactures and markets products that cater to both cooking and consumption, like milk, curd, ice creams, dairy whitener, skimmed milk powder, ghee, paneer and lots more. Our brands have become household names in over one million Indian houses. Arun Icecreams, Arokya Milk, Hatsun Curd, Hatsun Paneer, Hatsun Ghee, Hatsun Dairy Whitener, Ibaco and have become popular choices across the country. The Company exports its dairy ingredients to 38 countries in the American, Middle East and South East Asian Markets. The Company offers dairy extension services to farmers for the development and productivity of livestock. Our key focus is on delivering quality, and to that end, we have a technically advanced system that works in accordance with a time-tested business processes across our 16 plants.","Dairy","5,001-10,000 employees","Public Company","Chennai, Tamil Nadu","India","hap.in","https://www.linkedin.com/company/hatsun-agro-product-ltd"
,"IGLOO Pakistan","Pakistan Dairy Products (Pvt.) Ltd “IGLOO” is among the pioneer frozen product manufacturers of Pakistan. The factory is located in the industrial zone of Karachi fully equipped with state of the art machinery. Working for more than 4 decades i.e. since 1974 IGLOO is serving the nation with unmatched range of ice lolly & many other frozen products. 

Having a distribution network that covers the whole of south region which includes Sindh and Balochistan, IGLOO distribute its products to retail outlets, hotels, restaurants, schools, colleges, cafeteria, catering services and other institutions. 

The ingredients selected for manufacturing are the finest from all around the globe. Under the brand name IGLOO, major segments of frozen products catered are: Bulk packs, impulse & Family packs. There are 30 different ice cream brands covering all age and income groups, while “King Cone” being the flag ship brand among them.","Dairy","51-200 employees","Privately Held","Karachi, Sindh","Pakistan","igloofun.com","https://www.linkedin.com/company/igloo-ice-cream---pakistan-dairy-products-pvt-ltd-"
,"Ipanema Queijos","Em 1982, a Queijos Ipanema foi fundada por uma tradicional família de laticinistas, que empregaram todo seu conhecimento e dedicação para criar queijos saborosos e de alta qualidade. Foi baseada nos princípios de respeito, tecnologia e inovação que a empresa se consolidou no mercado e há mais de três décadas oferece os melhores produtos para todos os perfis de consumidores e negócios. 

Por conseguinte, somos reconhecidos por aliar rígidos controles de qualidade, que começam na escolha das melhores matérias-primas, ao relacionamento transparente com clientes e consumidores. Nosso diferencial passa ainda por um sistemático aperfeiçoamento logístico e de processos, através do Centro de Distribuição em São Paulo e unidades produtoras em regiões estratégicas: São Paulo, Goiás e Mato Grosso.

Mas além de tudo isso, nosso maior motivo de orgulho é fazer parte da mesa de milhares de famílias brasileiras e valorizar os profissionais que nos ajudam a cumprir essa missão.","Dairy","201-500 employees","Privately Held","São Paulo, São Paulo","Brazil","ipanemaqueijos.com.br","https://www.linkedin.com/company/ipanemaqueijos"
,"Lactiangol - Lacticínios de Angola, S.A.","Como a primeira empresa láctea em Angola a produzir à escala industrial, a Lactiangol assumiu desde a sua fundação um papel essencial, garantindo aos Angolanos os melhores produtos lácteos Todos os nossos produtos são feitos com amor, em Luanda, e enviados para todo o país.

Somos uma empresa com mais de cento e cinquenta profissionais e colocamos amor no que fazemos. Trabalhamos em conjunto com clientes e distribuidores para concretizar a nossa visão de liderar a indústria de lacticínios no país, enquanto fortalecemos o sector lácteo de Angola no sentido de alcançar a auto-suficiência na produção de leite.

Estamos empenhados em liderar através da inovação, do fornecimento de alimentos nutritivos e essenciais e da promoção de uma vida saudável.

A Lactiangol também abraça todas as oportunidades de retribuir às nossas comunidades e contribuir para o bem-estar dos Angolanos e da nossa nação.","Dairy","51-200 employees","Partnership","Luanda, Luanda","Angola","lactiangol.co.ao","https://www.linkedin.com/company/lactiangol"
,"Yakult S/A Industria e Comercio",,"Dairy",,,,,"yakult.com.br","https://www.linkedin.com/company/yakult-s-a-industria-e-comercio"
,"Hoard's Dairyman","On January 23, 1885, William Dempster Hoard wrote his issue of a ""journal devoted to dairy farming."" Today the insert has grown to be the dairy industry's leading dairy publication, Hoard's Dairyman. The publication helps readers run their businesses more effectively, because Hoard's Dairyman operates a dairy farm themselves and writes about their experiences. The farm is home to the largest and longest continually registered Guernsey herd in the United States. The farm expanded, and added Jerseys in late 2009 and robotic milking units in 2019.","Dairy","11-50 employees","Privately Held","Fort Atkinson, WI","United States","hoards.com","https://www.linkedin.com/company/hoardsdairyman"
,"Lactalis International","Since its creation in France in 1933 by André Besnier, the Lactalis Group has remained faithful to its original commitment to dairy processing.

For more than 20 years, Lactalis International has been developing the positions of the Lactalis Group in Asia, in Africa, in the Middle East and in the French Overseas Territories.

With more than 350 coworkers based in our headquarters in France at Choisy-le-Roi and also abroad in more than 10 locations, we provide a range of more than 2 000 products, covering all the dairy product categories (milk, butter, cream, cheeses, dairy desserts), to all distribution networks, with the same objective: to meet at its best the needs of our customers.

The Lactalis Group draws its success from a strategy that is respectful to a strong dairy expertise, maintaining high quality and organoleptic standards for all products.

Each year, more than 17 000 containers are exported to more than 100 countries around the world by Lactalis International.","Dairy","201-500 employees","Privately Held","Choisy-le-Roi, Ile de France","France","lactalis-international.com","https://www.linkedin.com/company/lactalis-international"
,"Fonterra Brands Sri Lanka","For 40 years, Fonterra Brands Sri Lanka has provided Sri Lankans with high quality dairy nutrition through a range of products, including Anchor. As a dairy co-operative owned by over 10,000 New Zealand farmers, we are also focused on sharing our expertise locally. Today we work indirectly with 100,000 people across the country through our network of business partners including traders, retailers, distributors, agents and farmers towards our purpose of making Sri Lanka a healthier, happier nation.","Dairy","501-1,000 employees","Privately Held","Biyagama, Gampaha","Sri Lanka","fonterra.com","https://www.linkedin.com/company/fonterra-brands-sri-lanka"
,"Dairy Business Association","As the most effective lobbying organization for dairy farmers and business partners in Wisconsin, the Dairy Business Association ensures the interests of the dairy community are well represented in state and local government. Key to our mission is connecting with our communities and policymakers through advocacy, collaboration and continuous improvement. We work to foster a healthy business climate for dairy farmers and businesses, and serve as a dependable resource for members who face critical challenges. Our members are directly involved in our policy positions and lobbying efforts, and benefit from public relations, social media, education, networking and sustainability tools we provide. With our members, and for our members, we are building a trusted and vibrant dairy community that balances business, environmental and social responsibilities.

Follow us:
www.facebook.com/DairyForward
www.twitter.com/DairyForward
www.instagram.com/dairystrong","Dairy","2-10 employees","Non Profit","Green Bay, WI","United States","dairyforward.com","https://www.linkedin.com/company/dairy-business-association"
,"PT Indolakto","PT Indolakto is a subsidiary of Indofood. Indomilk is one of biggest brand in Indonesia. With the wide range of product makes PT Indolakto a Top 3 Dairy Industry in Indonesia","Dairy","1,001-5,000 employees","Public Company","Purwosari, East Java","Indonesia","indomilk.com","https://www.linkedin.com/company/ptindolakto"
,"Lactalis Heritage Dairy","Lactalis Group, the world leader in dairy, is a family-owned business with more than 85,000 pragmatic and ambitious professionals worldwide, committed to providing healthy and delicious dairy products that bring people together every day. At Lactalis, our core values of AMBITION, ENGAGEMENT, and SIMPLICITY are at the heart of everything we do.

If you’re looking for a unique experience with a company that offers strong brands, professional expertise, and a dynamic work environment that champions entrepreneurial spirt, hands-on responsibility and real opportunity for career development, we want to hear from you!

Lactalis Heritage Dairy: inviting you to share with us your STORY, your PASSION, and your EXPERTISE.","Dairy","501-1,000 employees","Privately Held","Chicago, Illinois","United States",,"https://www.linkedin.com/company/lactalisheritagedairy"
,"Coopatos","Uma das principais cooperativas do Brasil. Uma história de mais de meio século de muita dedicação e trabalho dos seus diretores, cooperados e funcionários.","Dairy","501-1,000 employees","Partnership","Patos de Minas, Minas Gerais","Brazil","coopatos.com.br","https://www.linkedin.com/company/coopatos"
,"INALPI","Inalpi è un'industria leader nel settore lattiero-caseario. 

Dal 1966 produce sulla base di valori giusti, buoni e sicuri utilizzando latte piemontese interamente proveniente da una filiera corta e certificata, fondata su principi cardine come qualità, benessere animale e sostenibilità.

Lo stabilimento è situato all'interno dell'area MaB (Man and Biosphere), tutelata dall'UNESCO come biosfera del Monviso.

Inalpi offre un ampio assortimento di prodotti: Latte in polvere, Burro e Panna per utilizzo professionale; oltre a Burro, Fettine di formaggio fuso, Formaggini e Yogurt acquistabili online e nelle principali catene di supermercati. 

Inalpi redige ogni anno il proprio bilancio sociale; il testo integrale è consultabile sul sito web.","Dairy","201-500 employees","Privately Held","Moretta, Cuneo","Italy","inalpi.it","https://www.linkedin.com/company/inalpi-s-p-a-"
,"BouMatic","We provide innovative solutions that help dairy farmers be more profitable, while safeguarding animal welfare.
Founded on a strong heritage of innovation and technical leadership, we deliver the future of productivity to dairy farms across the globe. Based on generations of experience, global R&D expertise and an intimate knowledge of the needs of local dairy businesses, our solutions answer tomorrow’s challenges.

www.BouMatic.com","Dairy","201-500 employees","Privately Held","Madison, Wisconsin","United States","boumatic.com","https://www.linkedin.com/company/boumatic"
,"Afimilk Ltd","Founded in 1977, afimilk Ltd. (S.A.E. Afikim) has become a global leader in developing, manufacturing and marketing advanced computerized systems for the modern dairy farm, and for herd management. The company , since its inception, has been a leader through innovation: afimilk  introduced the world’s first electronic milk meter more than 30 years ago, the first pedometer to monitor cows, the first dairy farm management software and the first online milk analyzer (AfiLab). These tools have enabled farm managers to improve performance and maximize efficiency, ultimately increasing profits.
afimilk systems and products are in use worldwide. The company is active in more than 50 countries: thousands of farms, hundreds of thousands of milk meters, millions of pedometers.

Solutions
afimilk leading product line, is an automated modular system for intensive dairy farm management. The fully integrated software program, AfiFarm, collects information about each animal, builds a database and generates reports. This gives the farmer real-time information about herd health, milk quality and other critical factors, and enables well-informed decision-making.","Dairy","201-500 employees","Privately Held","Kibbutz Afikim, Israel","Israel","afimilk.com","https://www.linkedin.com/company/afimilk-ltd"
,"FrieslandCampina Professional","At FrieslandCampina Professional, our mission is to nourish the heroes of food – proud, passionate food professionals – to create exceptional experiences for your customers. We understand the evolving market and challenges faced by food professionals. That's why we have a dedicated team of specialists who have the passion for, and deep knowledge on the use of dairy and dairy alternatives in the food and beverage industry. We wholeheartedly commit ourselves to sharing our capabilities, experiences, market insights and collaboration with you for innovative solutions to achieve joint success. 
 
Within our portfolio, you'll find an array of renowned brands including Debic, Lattiz, Kievit, Black & White, Royal Hollandia and Valess, each embodying our commitment to service experience and product excellence. Additionally, our portfolio offers high-performance ingredients and innovative solutions that meet our industrial customers’ needs. With our broad range of ingredients and cross-disciplinary team of experts, we can help overcome whatever challenges you face.  
 
Through our collaborative approach and innovative solutions, we aim to become your trusted partner. Let's inspire and elevate the culinary world together.","Dairy","10,001+ employees",,"Amersfoort, Utrecht","Netherlands","frieslandcampinaprofessional.com","https://www.linkedin.com/company/frieslandcampina-professional"
,"Pelwatte Dairy Industries Limited","Pelwatte Dairy Industries Ltd is a proudly Sri Lankan company committed to achieving national self-sufficiency in dairy. Since our establishment in 2006 in Buttala, we have worked to uplift local dairy farmers, ensure food security, and deliver high-quality, affordable dairy products to consumers across the country.

Our mission goes beyond business. By supporting rural dairy farming and investing in advanced production technologies, we empower communities, generate sustainable livelihoods, and contribute to Sri Lanka’s economic development.

We are an ISO 22000:2018 certified company, upholding international standards in food safety and quality. Our manufacturing process integrates advanced Danish technology, ensuring consistency, nutrition, and trust in every product that carries the Pelwatte name.

In addition to dairy, we are expanding into coconut-based products cultivated on our 17-acre land in Sri Lanka’s Coconut Triangle—furthering our commitment to natural goodness, diversification, and sustainable agriculture.

Pelwatte is more than a dairy brand—it’s a movement for national progress, rural empowerment, and global standards. With every product, we aim to nourish people, uplift communities, and help build a stronger, self-reliant Sri Lanka.","Dairy","501-1,000 employees","Privately Held","Colombo 03, Western Province","Sri Lanka","pelwattedairy.com","https://www.linkedin.com/company/pelwatte-dairy"
,"Kamaths Ourtimes Icecreams Pvt Ltd (Natural Ice Cream)","Established in 1984 in Mumbai, Natural ice cream has been pioneer in making artisan ice creams using only fruits, dry fruits, chocolates, milk and sugar. This idea was conceptualised by Mr. R S Kamath, CMD of Kamaths Ourtimes ice creams Pvt. Ltd.

With 30 years of being in the business, over 100 outlets across the country and the recently launched
state-of-the-art factory in Mumbai, Natural Ice Cream is still raring to go places. And it is the rare combination of traditional methods and modern technology that will take us there.","Dairy","51-200 employees","Privately Held","mumbai","India","naturalicecreams.in","https://www.linkedin.com/company/kamath-ourtimes-ice-cream-pvt-ltd"
,"Milma","Well-known by the popular sobriquet ‘Milma’, Kerala Co-operative Milk Marketing Federation (KCMMF) was formed in 1980 as a state adjunct of the National Dairy Programme ‘Operation Flood’. It is a three-tiered organization. The farmer memberships that stood at 45000 during take over from the erstwhile KLD&MM Board during 1983 has grown to over 9.77 lakhs through 3315 milk Co-operatives by February 2019. These primary societies are grouped under three Regional Co-operative Milk Producers’ Unions viz TRCMPU for Thiruvananthapuram region, ERCMPU for Ernakulam region and MRCMPU for Malabar region. At the apex level KCMMF functions from the headquarters at Thiruvananthapuram. From the different units managed directly by KCMMF and the various units under regional unions MILMA produces and distributes pasteurized Vitamin – A enriched milk and various milk-based products as well as mango drink throughout the state. MILMA has been instrumental in achieving the national goal of self-sufficiency in milk production in the state.The goal of KCMMF is ""The socio-economic progress of the dairy farmer through procuring, processing and marketing of milk"". Still the goal is receding as Kerala enjoys one of the highest ranges of per capita milk consumption. KCMMF is totally content in the realization of this vision which was set before it. KCMMF has achieved the distinction in its performance by close association and bond with National Dairy Development Board, Animal Husbandry Department and Dairy Development Department of the State and Kerala Livestock Development Board. Kerala Co-operative Milk Marketing Federation (KCMMF), popularly called ‘Milma’ was established in April, 1980 with is head office at Thiruvananthapuram for the successful implementation of ‘Operation Flood’ Programme in Kerala.","Dairy","10,001+ employees","Government Agency","Thiruvananthapuram, Kerala","India","milma.co.in","https://www.linkedin.com/company/milma"
,"Manuka","Fue en el año 2005 cuando dos familias de productores neozelandeses admiraron el potencial lechero que tenía el sur de Chile, reuniendo un puñado de cualidades admirables: Un buen clima para la producción, una amplia disponibilidad de tierra, y una economía estable con orientación exportadora.

Actualmente ubicados en el corazón del sur de Chile somos la empresa de producción de leche más grande del país. Contamos con 13.458 hectáreas de praderas permanentes y 5.130 hectáreas de bosque nativo dentro de la región de Los Ríos y Los Lagos.

Nuestro modelo productivo trabaja con la naturaleza, pero requiere de mucha habilidad, entrenamiento y eficiencia para implementarlo en forma correcta, es por eso que somos expertos en nuestra área de trabajo, lo que se evidencia en que nuestra producción representa el 10% del total nacional, con más de 180 millones de litros de leche producidos al año.

Para fortalecer el rubro lechero, Manuka participa en la creación de Fundación Tres Hojas, para brindar capacitaciones a las personas que quieran ahondar en sus conocimientos de producción y manejo. 

Te invitamos a visitar su web http://www.fundaciontreshojas.cl","Dairy","501-1,000 employees","Privately Held","Puerto Octay, Región de los Lagos","Chile","manuka.cl","https://www.linkedin.com/company/manuka-s-a-"
,"Madhusudan","In 1991, Madhusudan, one of India’s leading dairy brands established its first milk plant (SMC Foods Limited) at Nanauta village in the Saharanpur district. Buoyed by the success, the company came up with its second milk plant (Creamy Foods Limited) at Bartoli village (in Khurja town) in Bulandshahar district. Situated in the heart of North India in the state of Uttar Pradesh, the two milk plants cater to a huge market base and have transformed the life of milk producers in these regions.","Dairy","501-1,000 employees","Public Company","Noida, Uttar Pradesh","India","smc-madhusudan.co.in","https://www.linkedin.com/company/madhusudan"
,"SAFILAIT","Safilait est une S.a.r.l. de Production Agroalimentaire Situé a Constantine et Spécialisées dans les Produits Laitiers et Dérivés, Sa gamme riche et variée lui confère l’estime de ses consommateurs.","Dairy","201-500 employees","Privately Held","Ali mendjelli, constantine","Algeria","safilait.com","https://www.linkedin.com/company/safilait"
,"Whyte Farms","Farm Fresh Milk & Dairy produce","Dairy","51-200 employees","Privately Held","New Delhi, Delhi","India","whytefarms.com","https://www.linkedin.com/company/whyte-farms"
