"Find companies","Name","Description","Primary Industry","Size","Type","Location","Country","Domain","LinkedIn URL"
,"Centre Hospitalier de Clamecy","Le Centre Hospitalier de Clamecy est un hôpital de proximité, au service d'un bassin d'une population de 20.000 habitants, comprenant des activités sanitaires et médico-sociales : médecine, unité de soins continus, un service d'accueil des urgences, un SMUR. 
Deux résidences pour personnes âgées viennent compléter l'offre avec 129 places d'hébergement permanent (dont une unité de soins spécifiques Alzheimer, une unité de psychiatrie de la personne âgée), 6 places d'hébergement temporaire, un pôle d'activités et de soins adaptés, ainsi qu'un accueil de jour. 
L'établissement propose un plateau technique développé (scanner, imagerie conventionnelle, biologie délocalisée) ainsi qu'un plateau de consultations spécialisées, dont un centre périnatal de proximité. 

Le Centre Hospitalier de Clamecy fait partie du GHT UnYon, regroupant les CH d'Auxerre, d'Avallon, du Tonnerrois (organisés en Direction Commune) et du CHS de l'Yonne.

Clamecy est une commune de 4.000 habitants, proche du Morvan, offrant un cadre de vie agréable, située à 40 min d'Auxerre, 2h30 de Paris et à 2h de Dijon.","Hospitals","201-500 employees","Self Owned","Clamecy","France","ght-unyon.fr","https://www.linkedin.com/company/ch-de-clamecy"
,"Tula Hospitals","Tula Hospital is a 120-bedded Superspeciality hospital planned to be operational in winter of 2021. It is located in heart of the city - Palwal, Haryana on NH-2, Mathura Road.

The Hospital has urology, cardiology, gastroenterology, neurology, neurosurgery, ENT, etc. along with all secondary care departments.

The hospital has all facilities under one roof including pathology, high-end imaging, dialysis, etc.

The hospital has 4 modular OTs, 1 Cath Lab and 50 ICU beds.

Tula Hospital Palwal is owned by Bothanzi Medicals Pvt. Ltd. Going ahead Bothanzi Medicals looks forward to bring more hospitals in tier II and tier III cities/towns of northern India with superspeciality services.","Hospitals","51-200 employees","Privately Held","Palwal, Haryana","India","tulahospitals.com","https://www.linkedin.com/company/tulahospitals"
,"Dr. Hani Farhat Dermatology Clinic","Explorá el ambiente acogedor de nuestra clínica, donde la tecnología de vanguardia se combina con el cuidado compasivo de nuestros profesionales. Desde el momento en que entrás, nuestro enfoque empático, seguro y tecnológicamente avanzado garantiza que recibas el más alto estándar de servicio","Hospitals","11-50 employees","Self Owned","Escazú, San José","Costa Rica","drhanifarhat.com","https://www.linkedin.com/company/dr-hani-farhat-dermatology-clinic"
,"Sunrise Hospital kanhangad","Sunrise Group of Hospitals
Care Beyond Cure - First Light of Care, Lasting Hope of Healing

The Sunrise Group of Hospitals is Kerala’s fastest-growing multi-specialty healthcare network, delivering Care Beyond Cure across six advanced facilities from Kasaragod to Pathanamthitta. Established in 2005 under the visionary leadership of Dr. Hafeez Rahman Padiyath, a globally renowned laparoscopic surgeon and pioneer in minimally invasive procedures,

Sunrise has become a beacon of excellence, innovation, and compassion in healthcare. With 20+ years of service, Sunrise has cared for over 20 million patients, performed 4.5 lakh surgeries, and introduced multiple firsts in Kerala and South India — from MR-HIFU for fibroid treatment to advanced Volume CT and Cardiac CT. Our network is equipped with 35+ specialties, 60 operation theatres, 300 ICU beds, and 100 NICU beds, ensuring world-class treatment is always close to home.

What Sets Us Apart: Pioneering Medical Innovation – Multiple world-first surgical techniques and landmark procedures in India like the Meshplasty surgical procedure, where a ruptured womb was operated on while carrying the child, and the largest kidney tumour removed laparoscopically, which was done at Sunrise.","Hospitals","51-200 employees","Public Company","kanhangad, Kerala","India","sunrisehospitalkanhangad.com","https://www.linkedin.com/company/sunrise-hospital-kanhangad-kerala"
,"TechSteri Ltda","Fabricante de insumos hospitalares, focado na linha de Central de materiais esterilizados.","Hospitals","51-200 employees","Privately Held","LONDRINA, Parana","Brazil","techsteri.com","https://www.linkedin.com/company/techsteri"
,"Salud Concordia S.A.","Radioterapia Concordia es un centro oncológico de alta tecnología ubicado en Colonia Neuland, Paraguay. Ofrecemos tratamientos avanzados como radiocirugía con ZAP-X, radioterapia con Halcyon y quimioterapia integral. Combinamos innovación médica con atención humana y personalizada, brindando esperanza y calidad de vida a pacientes de todo el país.","Hospitals","2-10 employees","Privately Held","Neuland, Boquerón","Paraguay","saludconcordia.com","https://www.linkedin.com/company/salud-concordia-sa"
,"BHAGAT DENTAL HOSPITAL","Fully equipped Dental Hospital with all latest machines, instrumests & technologies.","Hospitals","11-50 employees","Privately Held","Mahendragarh, Haryana","India",,"https://www.linkedin.com/company/bhagat-dental-hospital"
,"Ceylon Hospital","Asia's Leading Indigenous Medicine Private Hospital","Hospitals","51-200 employees","Privately Held","Gampaha, Western","Sri Lanka","ceylonhospital.com","https://www.linkedin.com/company/ceylon-hospital"
,"SUO XI Hospital","SUO XI Hospital.
As painkillers lead to Kidney and Hear failure, so this center has started Advanced Physiotherapy, Traditional Chinese Method(TCM), Magnet Therapy & other advance scientific technologies to relieve pain without painkillers.
Our Goal: To help you decrease your level of suffering to return you to your maximum level of functioning and independence and to help sustainable restore your quality of life without any medicine.
Our Service :
(A) Acupuncture
(B) Chinese Therapy
(C) Traditional Chinese Method (TCM)
(D) Physiotherapy
(E) Medical Tourism
(F) Tele-Medicine
(G) Treatment Without Medicine
(H) 24/7 Ambulance Service
Scope of Treatment Facilities :-
1) Sexual Disorder(Impotency, Early Ejaculation etc. )
2) Pain (Shoulder Pain, Neck & Back Pain, Posture Correction, Ankle Stability, Knee Pain, Hip Stability and Alignment, Sports Injury, TMJ Pain, Vertigo, Migraine & headache, Arthritis, Chronic Pelvic Pain, Facial Palsy, Disc Prolapsed, Cervical & Lumbar Spondylitis, Nerve & Muscle related any other pain etc.)
3) Stoke, Paralysis, Motor Neuron Diseases(MND), Parkinson's
4) Cerebral Palsy(CP), Autism
5) Speech Difficulties","Hospitals","11-50 employees","Privately Held","Dhaka, Dhaka","Bangladesh",,"https://www.linkedin.com/company/suo-xi-hospital"
,"Crown Hospital","Crown Hospital in London, run by Crown Organization. 

We provide medical and surgical services for people worldwide.","Hospitals","10,001+ employees","Privately Held",,,"crownhospital.com","https://www.linkedin.com/company/crown-hospital"
,"VVOV","Het VVOV heeft als doel:
(Inter)nationaal uitwisselen van kennis en beroepservaring
Het bevorderen van opleiding en bijscholing van perioperatiever verpleegkundigen
Het bevorderen van de samenwerking met elkaar,
Het bevorderen van opleiding en bijscholing van perioperatieve verpleegkundigen
Het organiseren van wetenschappelijke bijeenkomsten
Het bevorderen van wetenschappelijk onderzoek
Het nastreven van eenvormigheid in de werking van het operatiekwartier
Het geven van informatie over bijeenkomsten, publicaties, vakliteratuur van andere verenigingen
Het informeren en adviseren van haar leden over de verschillende aspecten van hun beroep
Het verdedigen van de belangen van de verpleegkundigen bij de Vlaamse en Federale overheid
Overleggen met verschillende andere beroepsorganisaties
Luisteren naar de noden van onze leden.","Hospitals","201-500 employees","Non Profit","Kortrijk - Marke, Vlaanderen","Belgium","operatieverpleegkundige.be","https://www.linkedin.com/company/vvov"
,"Hospital For Trauma and Surgery","HTS is known for its efficient wellness, clinical, surgical and medical evaluation services delivered with an utmost client-centred focus similar to that available in developed countries to satisfy our clients ensure a one-stop delivery of all essential care.","Hospitals","11-50 employees","Privately Held",,,"htsurgery.com","https://www.linkedin.com/company/hospitalfortraumaandsurgery"
,"Dhulikhel Hospital (धुलिखेल अस्पताल)","Dhulikhel hospital is a not for profit, non-government, community hospital conceived and supported the community of Dhulikhel.","Hospitals","1,001-5,000 employees","Non Profit","Kavrepalanchowk, Bagmati/Province 3","Nepal","dhulikhelhospital.org","https://www.linkedin.com/company/dhulikhel-hospital-धुलिखेल-अस्पताल"
,"Tusa Hastanesi","2009 yılından bu yana edindiğimiz Sağlık Hizmet sunumu tecrubemizi TUSA HASTANESİ ile, TUZLA bölgesi başta olmak üzere İstanbul Anadolu Yakası’nda yaşayan halkımızın hizmetine sunuyoruz. Modern tıbbın olanaklarını, uzman kadromuzun deneyimiyle birleştirerek, iyilik temelli bir hizmet sunmak için çalışıyoruz. Tıbbi bakım ve tedavi deneyimini konforlu, huzurlu ve ayrıcalıklı edinmeniz için planlanmış mimari alanlarımızla siz ve yakınlarınızın hastane endişelerinizi en aza indirmeyi hedefliyoruz. TUSA HASTANESİ; güncel teknolojisi, memnuniyet odaklı, güler yüzlü, profesyonel sağlık kadrosu ile siz ve yakınlarınızı iyi hissettirecek. Tuzla’nın en kapsamlı sağlık konseptlerinden biri olarak planlanan TUSA HASTANESİ, yepyeni bir sağlık hizmeti sunumu anlayışı getiriyor.","Hospitals","201-500 employees","Privately Held","İstanbul, Tuzla","Bosnia and Herzegovina","tusahastanesi.com","https://www.linkedin.com/company/tusa-hastanesi"
,"SHARE Services, L.L.C.","Providing consulting and education by Susan Proctor, RN, BSN, MBA in Healthccare Management with over 10 years of experience with DNV Healthcare as a Clinical surveyor, ISO 9001 Lead Auditor, Team Lead, Technical Reviewer, and Standards Application and Interpretation Specialist. Having surveyed over 200 hospitals, reviewed all non-conformity reports while fulfilling the role of Technical Reviewer, answering client dropbox questions, approving corrective action plans, accepting or denying challenges to nonconformities and much more, she is ready to help clients continuously improve patient safety and meet or exceed the CMS Conditions of Participation for Hospitals, Critical Access Hospitals, Psychiatric Hospitals and Ambulatory Surgery Centers.  Susan also was previously the Director of Accreditation of a large healthcare system.","Hospitals","2-10 employees","Privately Held","Lexington, Indiana","United States",,"https://www.linkedin.com/company/share-services-l-l-c"
,"Clinica CERYA Especialidades Medicas","Clínica CERYA es una unidad medica especializada con infraestructura de primer nivel con mas de 10 años de experiencia y trayectoria en la ciudad de Monterrey. Estamos comprometidos a brindar atención de calidad con la calidez que requieren los pacientes, así como la continua actualización de nuestra infraestructura y capital humano para mantenernos a la vanguardia medica y poder ofrecer el mejor resultado con la mayor seguridad a cada uno de nuestros pacientes.


Todos nuestros médicos se encuentran titulados y certificados por su especialidad correspondiente, así como su trayectoria en el ámbito profesional que los ha colocado en los mejores lugares de la medicina.

Nuestra clínica cuenta con todos los permisos requeridos por las autoridades y cumple con todas las normas de seguridad para la atención medica.

Nos avalan importantes instituciones como:

-Consejo Mexicano de Cirugía General A.C.
-Consejo Mexicano de Certificación en Pediatría A.C.
-Consejo Nacional de Neumología, A.C.
-Consejo Nacional de Inmunología Clínica y Alergia
-Consejo Mexicano de Otorrinolaringología y Cirugía de Cabeza y Cuello
-Consejo Mexicano de Certificación en Pediatría A.C.
-Consejo Mexicano de Gastroenterología A.C.
-Consejo Mexicano de Ginecología y Obstetricia A. C.
-Consejo Nacional Mexicano de Urología A.C.","Hospitals","51-200 employees","Privately Held","Obispado, Nuevo León","Mexico","cerya.com.mx","https://www.linkedin.com/company/clinica-cerya-especialidades-medicas"
,"H+Brasil Hospital Dia","Hospital referência em cirurgias de baixa e média complexidade. 
Juntos por um único propósito: saúde.","Hospitals","201-500 employees","Privately Held",,,,"https://www.linkedin.com/company/h-brasil-hospital-dia"
,"Razi Hospital","Razi educational and therapeutic center is one of the largest educational and therapeutic hospitals and the only center in the province that accepts mental patients and drug addicts and tries with all its strength to treat and care for them. This center has 18 departments with 650 active beds (591 psychiatric beds and 68 non-psychiatric beds) and paraclinic departments, which include specialized clinics, ECT, EEG, EMG, TCD, radiology, ultrasound, vacocardiography, and a specialized laboratory and physiotherapy, with a team of psychiatric specialists. Psychologists, neurologists, internists, etc., and committed and trained nursing and paramedical experts are at the service of the people and patients around the clock. This center is in the shadow of the collective activities of the faculty colleagues with the training of specialized human resources and the treatment of mental patients, etc. It is known as one of the educational research and specialized treatment centers. Background of the center: Tabriz Razi Hospital was built in 1351 and affiliated to the Welfare and Rehabilitation Department on El Goli Road in a land of 8.5 hectares with a very beautiful and green landscape and in one of the pleasant climate areas of Tabriz.","Hospitals","501-1,000 employees","Public Company","Tabriz","Iran","tbzmed.ac.ir","https://www.linkedin.com/company/razihospital"
,"Sanatorium Hera","Moderne Medizin mit Tradition
Das Sanatorium Hera trägt seit über 100 Jahren zur ambulanten und stationären Krankenversorgung in Wien bei und ist heute aus der Spitalslandschaft der Stadt nicht mehr wegzudenken.

Unsere 15 Fachbereiche und 2 multidisziplinären Zentren bieten umfassende medizinische Versorgung und professionelle Pflege auf höchstem Niveau. Die fachliche Kompetenz unserer Mitarbeiter*innen sowie die topmoderne technische Ausstattung garantieren die Behandlung nach neuesten wissenschaftlichen Erkenntnissen.

Patient*innen schätzen neben der ausgezeichneten medizinischen Qualität die überschaubare Größe des Hauses, die eine sehr persönliche, individuelle Betreuung durch unsere Fachärzt*innen und das Pflegepersonal ermöglicht.

Wir sind für Sie da!
Die ambulanten Leistungen des Sanatorium Hera stehen allen Versicherten zur Verfügung. Der stationäre Aufenthalt ist KFA-Versicherten vorbehalten. Versicherte einer anderen österreichischen Sozialversicherung können diese Angebote ebenfalls in Anspruch nehmen, wenn sie eine private Zusatzversicherung haben, gegen Aufzahlung oder bei privater Bezahlung.","Hospitals","501-1,000 employees","Privately Held","Vienna","Austria","sanatoriumhera.at","https://www.linkedin.com/company/sanatoriumhera"
,"Lifeline Multispeciality Hospital","""About Lifeline Multispeciality Hospital established in 2013, the hospital has since been a landmark of healthcare service. Lifeline Hospital is a state of the art healthcare facility located in the heart of the Ahmedabad City. Excellent nursing care well-equipped operation theatres and a dedicated team of doctors are the hallmarks of the hospital. Lifeline Hospital provides multispecialty health care services and comprehensive treatment of International standards and has on panel eminent consultant of their respective fields. The Lifeline Hospital is giving 24*7 emergency treatment and ambulance facility also.""","Hospitals","11-50 employees","Partnership","Ahmedabad, Gujarat","India","lifelinehospitals.co.in","https://www.linkedin.com/company/lifeline-multispeciality"
,"INTERLAP - HOSPITAL INTERNACIONAL S.A DE C.V","En INTERLAP somos el centro quirúrgico de El Salvador con los equipos médicos de última generación, modernas instalaciones y personal altamente capacitado que le ayuda a recuperar su salud a la mayor brevedad con la máxima calidez humana posible. Ubicados en una zona segura y estratégica en San Salvador y en alianza con los más prestigiosos médicos de diferentes especialidades, ofrecemos servicios para usuarios nacionales e internacionales.","Hospitals","51-200 employees","Self Owned","San Salvador","El Salvador",,"https://www.linkedin.com/company/interlap-hospital-internacional-s-a-de-c-v"
,"Islamic International Dental Hospital",,"Hospitals","51-200 employees","Educational","Islamabad, Islamabad Capital Territory, Federal","Pakistan","riphahdental.com","https://www.linkedin.com/company/islamic-international-dental-hospital"
,"Hospital da Ordem Terceira - Belém/PA","Hospital da Ordem Terceira - Belém - Pará is a company based out of Tv. Frei Gil 59, Belém, Pa, Brazil","Hospitals","201-500 employees","Privately Held","Belém, Pa","Brazil","hospitalordemterceira.com.br","https://www.linkedin.com/company/hospital-da-ordem-terceira---belém---pará"
,"Kathmandu Cancer Center-KCC","For best and holistic cancer treatment in Nepal.

Our hospital is equipped with state-of-the-art equipment and highly skilled doctors who have years of experience in treating cancers.

We offer the best cancer treatment in Nepal with personal attention using advanced technology at affordable costs.","Hospitals","1,001-5,000 employees","Privately Held","Bhaktapur, 03","Nepal","kccrc.org","https://www.linkedin.com/company/kathmandu-cancer-center-kcc"
,"MercyOne Waterloo Medical Center","Help people recover from injury better.——Xin Zhang","Hospitals","201-500 employees","Self Employed",,,,"https://www.linkedin.com/company/mercyone-waterloo-medical-center"
,"Clínica de Ojos Reyes-Giobellina","CLÍNICA OFTALMOLÓGICA DE ALTA COMPLEJIDAD","Hospitals","11-50 employees","Public Company","Córdoba, Córdoba","Argentina","reyes-giobellina.com.ar","https://www.linkedin.com/company/clínica-de-ojos-reyes-giobellina"
,"Beautyclinics",,"Hospitals","51-200 employees","Public Company","Riyadh, Riyadh","Saudi Arabia","beautyclinics.com","https://www.linkedin.com/company/beautyclinics"
,"St Mary’s Clinic","Established for over 20 years, we strive to provide the best service in the med-aesthetic & radiology industry in Malta.","Hospitals","11-50 employees","Privately Held","Mosta","Malta","stmarysclinic.net","https://www.linkedin.com/company/st-mary’s-clinic"
,"Promedheus","  PROMEDHEUS to system wspierający cyfrową transformację szpitali. Automatyzuje i optymalizuje kluczowe procesy – od przygotowania pacjentów do zabiegów, przez planowanie operacji i zarządzanie blokiem operacyjnym, aż po wykorzystanie łóżek i zasobów na oddziałach.","Hospitals","11-50 employees","Partnership","Wrocław","Poland","promedheus.pl","https://www.linkedin.com/company/promedheus"
,"Tuzla Public Hospital","Our hospital building was built by Tuzla Municipality in 1997. It was transferred to the Social Insurance Institution in 2002 and started to serve as SSK Children's Diseases Hospital. In 2004, it was moved to the State Railways Yakacık Hospital Pediatric Clinic and served as SSK Kartal Hospital Tuzla District Polyclinic. With the transfer of SSK Hospitals to the Ministry of Health with the law no. 5283 dated 1902.2005, it was connected to Pendik State Hospital. It started to serve as Tuzla State Hospital on 26.04.2005 with the ministry approval numbered 3072. Tuzla State Hospital and Kartal Yavuz Selim State Hospital were merged and started to serve as Tuzla State Hospital in its new service building as of September 18, 2017. Tuzla State Hospital has 335 beds.","Hospitals","1,001-5,000 employees","Government Agency","Tuzla, Istanbul","Turkey","saglik.gov.tr","https://www.linkedin.com/company/tuzla-devlet-hastanesi"
,"COP Saúde Hospital","Hospital Dia com Centro avançado de tratamento da Dor , Centro de Tratamento de Feridas e lesões Complexas com uso de tecnologias avançadas, equipe de especialistas em Tratamento de lesões e deformidades ósseas e  traumas do aparelho músculo-esquelético, Fisioterapia, Centro de Diagnose por imagem, Hiperbárica, serviços ambulatoriais e demais espacialidades (cardiologia, neurologia, clinica geral, odontologia).","Hospitals","11-50 employees","Privately Held","Porto Nacional, Tocantins","Brazil","copsaude.com.br","https://www.linkedin.com/company/copsaudehospital"
,"Fishtail Hospital & Research Center Pvt. Ltd.","Fishtail Hospital & Research Center Pvt. Ltd. is a private healthcare institution located in the heart of Pokhara valley, Nepal. With years of experience, we provide high-quality medical services to our community, focusing on accessibility, affordability, and patient-centered care. Our hospital features a team of dedicated doctors, nurses, and support staff, state-of-the-art medical equipment, and a comfortable and modern facility. We are committed to working with social organizations, the Nepal government, NGOs, and INGOs to create positive change and improve the health and well-being of our community.","Hospitals","51-200 employees","Privately Held","Pokhara, Gandaki","Nepal",,"https://www.linkedin.com/company/fishtail-hospital-research-center-pvt-ltd"
,"Matilda Nepean","About Matilda Nepean

Matilda Nepean is a 90-bed sub-acute private hospital located in the Penrith health precinct at Kingswood in Western Sydney. The hospital provides inpatient rehabilitation, mental health, medical, geriatric and palliative care services. Day therapy services are available in rehabilitation and mental health care. 

Opened in February 2023, Matilda Nepean offers a new generation of health care to the Nepean region. It provides specialist inpatient care and day programs that foster health and well-being in a boutique hotel-style setting. 

The hospital features a best-in-class gymnasium and an expansive hydrotherapy centre in addition to a patient wellness centre. Patients enjoy luxury oversized private rooms with modern hotel-like amenities, restaurant-quality dining and a focus on recovery, wellness and wellbeing. 

Our model of care

Matilda Nepean’s mission is to provide high-quality, evidence-based, personalised health care to patients, led by our senior and experienced medical team. We take a personalised and multidisciplinary approach to each patient, delivered in a caring and comfortable environment to support and enable patient recovery and outcomes.

About Matilda Health Care

Matilda Nepean is operated by Matilda Health Care, an Australian private hospital network that provides multidisciplinary healthcare services in a boutique hotel-style setting to support patient recovery and other healthcare needs.

It provides a unique approach to care focused on:

- individualised treatment and care plans
- innovation in treatment and care, with a strong focus on wellness
- providing services within a superior purpose-built setting, which offers amenities more akin to a hotel-like environment

Matilda Health Care's vision is to set new benchmarks for private hospitals through the delivery of exceptional, evidence based health care in an environment that sets new standards in patient comfort, care and hospitality.","Hospitals","51-200 employees","Privately Held","Kingswood, New South Wales","Australia","matildanepean.com.au","https://www.linkedin.com/company/matilda-nepean"
,"Hospital La Bene Puebla","Somos un hospital con amplia experiencia, más de 100 años de servicio nos avalan. 
Ofrecemos servicios de salud con calidez humana, de la mano de especialistas médicos de excelencia, amplias instalaciones y tecnología en constante evolución. Estamos comprometidos con el bienestar de todos nuestros socios y pacientes.","Hospitals","201-500 employees","Partnership","Puebla, Puebla","Mexico","beneficenciaespanola.com.mx","https://www.linkedin.com/company/hospital-la-bene-puebla"
,"Dr Lovin Wilson -Medical Oncologist"," Best Cancer Specialists in Nashik 
Meet Dr. Lovin Wilson, a highly skilled Consultant Medical Oncologist in Nashik.
With expertise in Medical Oncology, ECMO (ESMO Certified), MBBS, MD (General Medicine), DrNB Medical Oncology, he is dedicated to providing world-class cancer treatment.

 Book a consultation today!","Hospitals","2-10 employees","Self Employed","Nashik, Maharashtra","India",,"https://www.linkedin.com/company/dr-lovin-wilson-medical-oncologist"
