"Find companies","Name","Description","Primary Industry","Size","Type","Location","Country","Domain","LinkedIn URL"
,"Rede D'Or Star","O estado da arte na saúde.
Um novo conceito de assistência médica.

Criamos uma experiência assistencial única de conforto e hospitalidade ao paciente e seus familiares. Com altíssimo padrão de qualidade e excelência no cuidado seguro e humanizado, oferecemos as tecnologias mais avançadas do mundo em diagnósticos e tratamentos.

Nossa história começou em 2016, com a inauguração do CopaStar no bairro de Copacabana, no Rio de Janeiro. A segunda unidade da marca foi concebida em 2018, na cidade de São Paulo: OncoStar, um centro de referência em tratamento do câncer. 

Em 2019, chegam os hospitais DF Star, em Brasília (DF), e o Vila Nova Star,  localizado no bairro da Vila Nova Conceição, em São Paulo. 

Em 2022, a Rede Star inovou mais uma vez com a inauguração da Maternidade São Luiz Star, também em São Paulo, trazendo um novo conceito de maternidade premium ao país. Mantendo o constante crescimento, 2024 foi marcado por mais duas importantes inaugurações, dessa vez no Nordeste: Memorial Star, em Recife, e o Aliança Star, em Salvador.

Nossas acomodações contam com um sistema desenvolvido exclusivamente, o Smart Hospitality, concebido para aumentar o bem-estar do paciente e seu acompanhante. Com essa tecnologia, através de um tablet, é possível controlar luminosidade e temperatura do quarto, fazer chamadas de vídeo para a equipe de enfermagem e médico assistente, além de solicitações para equipe de Hotelaria.

Contamos com uma estrutura física pensada nos mínimos detalhes, com ambientes harmônicos e sofisticados, decorados com obras de arte. Nossos restaurantes, por sua vez, são conduzidos por chefs renomados e oferecem um cardápio de alto padrão gastronômico, harmonizado com os requisitos de uma culinária saudável e de qualidade.

Orgulho de ser Star!     

RTs: 
Bruno Wunder de Alencar CRM 68434-1 RJ
Maria Gibelli - CRM: 82560 - SP
Thiago Romano - CRM: 117291 - SP
Guilherme Meyer - CRM: 28095 - DF","Hospitals","5,001-10,000 employees","Privately Held","Rio de Janeiro","Brazil",,"https://www.linkedin.com/company/rededor-star"
,"Rede Américas","A Rede Américas é a segunda maior rede de hospitais privados do Brasil.

Possui atuação em oito estados (SP, RJ, PR, BA, PE, MA, SE, RN) e no DF.  São 27 hospitais e 42 unidades oncológicas, resultado da joint venture entre Dasa e Amil.

Com mais de 34 mil colaboradores, 40 mil médicos atuantes e mais de 4.200 leitos, une excelência clínica, inovação contínua e olhar humano. Guiada pelo propósito “Paixão por cuidar”,  alia qualidade assistencial e segurança em cada etapa do atendimento aos pacientes.","Hospitals","10,001+ employees","Privately Held","São Paulo","Brazil","saudeamericas.com.br","https://www.linkedin.com/company/saude-americas"
,"Hospital São Lucas da PUCRS","Transformação em cada cuidado ","Hospitals","1,001-5,000 employees","Non Profit","Porto Alegre, Rio Grande do Sul","Brazil","pucrs.br","https://www.linkedin.com/company/hslpucrs"
,"Clínica del Country","Desde 1962 hemos entregado lo mejor para cuidar la vida de nuestros pacientes y sus familias, con servicios de alta calidad, complejidad e innovación.
Nuestra presencia en este espacio estará encaminada a brindar información relevante y especializada sobre el sector de la Salud. De la mano de nuestros especialistas, deseamos crear una comunidad unida por su vocación y compromiso con la vida.","Hospitals","1,001-5,000 employees","Privately Held","Bogotá, Colombia","Colombia","clinicadelcountry.com","https://www.linkedin.com/company/cl-nica-del-country"
,"Hospital Vozandes Quito","OUR PURPOSE: Provide safe care and excellence centered on love of God and love people.","Hospitals","201-500 employees","Privately Held","Quito, Pichincha","Ecuador","hospitalvozandes.com","https://www.linkedin.com/company/hospital-vozandes-quito"
,"Clínica Sagrada Esperança","Desde 1990, somos a maior rede de saúde privada de Angola, com presença em quase todo o território nacional e um compromisso firme com cuidados de saúde mais humanizados.","Hospitals","1,001-5,000 employees","Partnership","Luanda, Luanda","Angola","clinicasagradaesperanca.co.ao","https://www.linkedin.com/company/clinicasagradaesperanca"
,"HOPE - Hospital de Olhos de Pernambuco","O Hospital de Olhos de Pernambuco (HOPE), há mais de 70 anos é referência nas áreas de Oftalmologia e Otorrinolaringologia, sendo o único hospital de olhos do Norte e Nordeste certificado pela Qmentum Internacional Accreditation, um modelo de avaliação de saúde que assegura às organizações o cumprimento dos requisitos internacionais de governança e boas práticas assistenciais.

Com seis unidades de atendimento na Região Metropolitana do Recife e três unidades no Agreste, possui Urgência 24h situada no polo médico da capital e clínicas de atendimento nos principais shoppings. 

O HOPE faz parte da Vision One, uma rede nacional de hospitais especializados em oftalmologia.","Hospitals","501-1,000 employees","Privately Held","Recife, Pernambuco","Brazil","hope.com.br","https://www.linkedin.com/company/hopereferencia"
,"Hospital Evangélico de Vila Velha","O Hospital Evangélico de Vila Velha, filantrópico, é gerido pela Associação Evangélica Beneficente Espírito-Santense (Aebes).

É habilitado em alta complexidade e referência no Estado nas especialidades: Cardiovascular, Neurocirurgia, Bariátrica, Oftalmologia, Oncologia e transplantes de rim, córnea, coração, fígado e tecidos.

Possui certificação de excelência ONA nível 3 e tem como missão: cuidar da saúde das pessoas com carinho de forma sustentável e inovadora.


--------- INFORMAÇÃO IMPORTANTE ---------
O Hospital Evangélico de Vila Velha e as demais unidades sob gestão da Aebes não possuem contrato com empresa terceirizada para recrutamento de funcionários. Além disso, não há qualquer tipo de cobrança vinculada ao cadastro de candidatos. O único meio oficial para inscrição nas vagas de emprego é através do nosso site institucional: www.evangelicovv.com.br.","Hospitals","1,001-5,000 employees","Self Owned","Vila Velha, ES","Brazil","evangelicovv.com.br","https://www.linkedin.com/company/evangelicovv"
,"Clínica La Colina","Somos una Clínica privada de tercer nivel con una filosofía basada en la vocación de servicio a la comunidad gracias a nuestro cuerpo médico y valores institucionales. Contamos con un equipo humano altamente calificado para la atención integral de niños y adultos.



En este espacio queremos brindar información relevante y especializada sobre el sector de la Salud. De la mano de nuestros especialistas, deseamos crear una comunidad unida por su vocación y compromiso con la vida.","Hospitals","1,001-5,000 employees","Self Owned","Bogotá","Colombia","clinicalacolina.com","https://www.linkedin.com/company/clinica-la-colina"
,"Hospital de Alta Complejidad en Red ""El Cruce"", Dr. Nestor Carlos Kirchner","El Hospital El Cruce, Alta Complejidad en Red, surge como respuesta a la necesidad de los habitantes de Florencio Varela, Berazategui, Almirante Brown y Quilmes de acceder a una atención de mayor complejidad, que incluye entre otras cosas distintos estudios para diagnóstico e intervenciones quirúrgicas especializadas.
Constituye un nodo de la red de salud de la región, integrada por los hospitales Mi Pueblo de Florencio Varela; Evita Pueblo de Berazategui; Arturo Oñativia de Almirante Brown; Isidoro Iriarte y el Hospital Subzonal Especializado Materno Infantil Dr. Oller de San Francisco Solano de Quilmes.","Hospitals","1,001-5,000 employees","Self Owned","Florencio Varela, Buenos Aires","Argentina","hospitalelcruce.org","https://www.linkedin.com/company/hospital-el-cruce"
,"Hospital Clínica San Francisco de Guayaquil","Brindamos salud integral a nuestra comunidad, innovando en equipamiento,  y fomentando  la investigación.","Hospitals","201-500 employees","Self Owned","Guayaquil, Guayas","Ecuador","hospitalsanfrancisco.com.ec","https://www.linkedin.com/company/hospital-clínica-san-francisco-de-guayaquil"
,"Inova Saúde","A Inova Saúde é uma empresa do grupo Construcap que está há 80 anos realizando obras civis e de infraestrutura, sendo uma das 10 maiores construtoras do país. 

A Inova Saúde é especializada na administração e gestão de hospitais públicos por meio de Parcerias Público-Privadas (PPP) que tem como princípios a inovação tecnológica e a excelência no atendimento dos pacientes. A empresa busca quebrar um paradigma na saúde pública no Brasil, fazendo com que hospitais públicos tenham o mesmo padrão de atendimento e qualidade de hospitais privados. É responsável pela gestão da Bata Cinza dos hospitais: Planejamento e Gestão de Medicamentos e Materiais Especiais; Planejamento e Gestão de Próteses e Órteses; Serviços de Logística Hospitalar; Central de Material e Esterilização; Gestão e Manutenção da Tecnologia da Informação; Recepção e Portaria; Serviços da Segurança e Vigilância; Telefonia; Lavanderia; Rouparia; Unidade de Alimentação Nutricional; Engenharia Clínica; Serviços de Logística e Destinação de Resíduos; Transportes (ambulância e veículos); Conservação de Jardins; Limpeza e Higienização; Engenharia e Manutenção Predial.

Atualmente são três hospitais: Hospital da Mulher de São Paulo, Hospital Regional de Sorocaba e Hospital Regional de São José dos Campos. 

Nossa Missão: Promover os serviços de apoio não assistenciais a complexos hospitalares, com eficiência na gestão de recursos e qualidade operacional, atendendo as diretrizes estabelecidas no contrato e com foco na segurança e saúde do paciente.

Nossa Visão: Ser reconhecida como uma empresa inovadora e eficaz na prestação de serviços não assistenciais, cumprindo suas responsabilidades num ambiente socialmente responsável.

Nossos Valores:
- Excelência
- Humanização
- Integridade
- Sustentabilidade","Hospitals","501-1,000 employees","Privately Held","São Paulo, São Paulo","Brazil","inovasaudesa.com.br","https://www.linkedin.com/company/inovasaude"
,"Clínica de Marly","Somos la institución de salud privada más antigua y de mayor tradición en Colombia, institución que se ha caracterizado desde su fundación en 1903 por la calidad y calidez en la prestación de sus servicios. 

En el 2018 la Clínica de Marly Jorge Cavelier Gaviria, ubicada en el municipio de Chía - Cundinamarca, abre sus puertas para ampliar la cobertura en el norte de Bogotá. 

Somos instituciones sólidas con fortalezas ampliamente reconocidas a escala nacional e internacional, en donde nuestros pacientes reciben servicios en todos los niveles de complejidad en un ambiente moderno, cálido y confortable. 

La Clínica de Marly y la Clínica de Marly Jorge Cavelier Gaviria trabajan con la mejor tecnología y el mejor recurso humano, buscando siempre la comodidad y seguridad de nuestros pacientes.","Hospitals","1,001-5,000 employees","Self Employed","Chapinero, Distrito Capital","Colombia","marly.com.co","https://www.linkedin.com/company/clínica-de-marly"
,"Clínica Juan Pablo II","Clínica Juan Pablo II, es una institución con más de 40 años de trayectoria,  acreditada por la superintendencia de salud y  orientada a la salud de la familia, buscando excelencia en el servicio, haciendo énfasis en la calidad y seguridad  de la atención.","Hospitals","51-200 employees","Privately Held","Santiago","Chile","clinicajp2.cl","https://www.linkedin.com/company/clínica-juan-pablo-ii"
,"Hospital do Rim (HR)","Hospital HR, é hoje referência em Goiânia, contando com um corpo clínico, colaboradores altamente capacitados e sempre atualizados, além de equipamentos modernos. Isso se deve aos mais de 30 de anos de experiência na área da saúde, em que o Hospital HR vem zelando pela saúde e qualidade de vida de seus pacientes.

Além de Urologia, o Hospital é referência em especialidades como: gastroenterologia, proctologia, nefrologia, cirurgia plástica, cirurgia vascular e geral, infectologia, dentre outras.

Buscamos não apenas tratar as doenças, mas sim o paciente, sempre em busca da prevenção e do bem-estar com qualidade de vida.

A assistência humanizada e fidedigna ao paciente é a marca registrada do Hospital HR. Uma equipe multidisciplinar formada por médicos, enfermeiros e pessoal de apoio oferece ao paciente e seus familiares um atendimento adequado, com o objetivo de esclarecer dúvidas, passar informações para o bom andamento dos procedimentos e estabelecer um relacionamento de plena confiança na Instituição e seus profissionais.","Hospitals","201-500 employees","Privately Held","Goiânia, Goiás","Brazil","hospitalhr.com.br","https://www.linkedin.com/company/hospitalhr"
,"Hospital Municipal Albert Schweitzer","Somos referência no atendimento de urgência e emergência para toda a Zona Oeste do Rio de Janeiro.

 (21) 2042-2096 - WhatsApp

Rua Nilópolis, 239 - Realengo","Hospitals","1,001-5,000 employees","Government Agency",,,,"https://www.linkedin.com/company/hospitalalbertschweitzer"
,"Hospital Municipal Albert Schweitzer","Somos referência no atendimento de urgência e emergência para toda a Zona Oeste do Rio de Janeiro.

 (21) 2042-2096 - WhatsApp

Rua Nilópolis, 239 - Realengo","Hospitals","1,001-5,000 employees","Government Agency",,,,"https://www.linkedin.com/company/hmaschweitzer"
,"Fundación Pérez Scremini","Con el fin de mejorar el tratamiento y conocimiento sobre todos los aspectos del cáncer del niño, el adolescente y el adulto joven, creamos una Fundación que lleva el nombre del Dr. Alberto Pérez Scremini.

Nuestro objetivo será mejorar y optimizar los tratamientos y las condiciones de atención, de tal manera que en el futuro ningún niño muera de cáncer en nuestro país.

La Fundación trabajará desde el Servicio de Hemato Oncología Pediátrica del Centro Hospitalario Pereira Rossell, donde se atienden aproximadamente 100 nuevos casos oncológicos por año y se realizan miles de consultas anuales en policlínica.

Para hacer realidad nuestra visión, nos hemos propuesto una misión clara y objetivos ambiciosos.
Información General","Hospitals","51-200 employees","Non Profit","Montevideo, Montevideo","Uruguay","perezscremini.org","https://www.linkedin.com/company/perezscremini"
,"Fundación Pérez Scremini","Con el fin de mejorar el tratamiento y conocimiento sobre todos los aspectos del cáncer del niño, el adolescente y el adulto joven, creamos una Fundación que lleva el nombre del Dr. Alberto Pérez Scremini.

Nuestro objetivo será mejorar y optimizar los tratamientos y las condiciones de atención, de tal manera que en el futuro ningún niño muera de cáncer en nuestro país.

La Fundación trabajará desde el Servicio de Hemato Oncología Pediátrica del Centro Hospitalario Pereira Rossell, donde se atienden aproximadamente 100 nuevos casos oncológicos por año y se realizan miles de consultas anuales en policlínica.

Para hacer realidad nuestra visión, nos hemos propuesto una misión clara y objetivos ambiciosos.
Información General","Hospitals","51-200 employees","Non Profit","Montevideo, Montevideo","Uruguay","perezscremini.org","https://www.linkedin.com/company/fundacion-dr-perez-scremini"
,"Frisius MC","Wij zijn Frisius MC. Iedere dag maken wij ons sterk voor het leveren van algemene, complexe en topklinische zorg aan iedereen in Friesland en omgeving. In alle fasen van het leven. Vanaf de start van het leven tot het laatste moment. Van hart tot hoofd, van trauma tot revalidatie; onze deskundige teams staan 24 uur per dag voor u klaar. Dit maakt ons toonaangevend, open én persoonlijk. Met meer dan 5.000 medewerkers zorgen wij jaarlijks voor 250.000 patiënten vanuit onze locaties in Heerenveen en Leeuwarden. Samen werken we aan de zorg van morgen.","Hospitals","5,001-10,000 employees","Government Agency",,,,"https://www.linkedin.com/company/frisius-mc"
,"Johannesburg Surgical Hospital","Johannesburg Surgical Hospital (JSH) operates at the forefront of technological advancements in surgery and surgical rehabilitation. Emergency Unit Landline: 011 593 4488 OR 011 593 4490","Hospitals","51-200 employees","Partnership","Johannesburg, Gauteng","South Africa","jsh.co.za","https://www.linkedin.com/company/johannesburg-surgical-hospital"
,"Uniarch Klinik Mühendislik ve Klinik Alan Tasarım A.Ş","Uniarch, sağlık hizmetlerinin teknolojik anlamda iyi planlanmış tesislerde, doğru ekipman ile güvenli bir şekilde verilmesini hedefler. 
Bu amaçla tasarım aşamasından başlamak üzere her detayda hizmet arz eder. 
Sağlık hizmetinin sunulacağı alanın tasarlanması, kullanılacak teknolojilerin belirlenmesi, etkileşimlerinin ve hizmet süresince oluşacak trafiğin planlanması ve hizmet alanına doğru şekilde yerleştirilmesi için danışmanlık, planlama ve projelendirme hizmetleri sağlar. 
Fiilen hizmet veren sağlık tesislerinde kurulu teknolojinin güvenli, etkin ve verimli bir şekilde kullanılması için danışmanlık ve fiili operasyon hizmeti sunar. 
Bir sağlık tesisinin tıbbi teknolojisi ile ilgili olarak her türlü teknik satın alma, envanter yönetimi, bakım, onarım, kalibrasyon, validasyon, teknik eğitimler vb. hizmetleri sağlamaktadır.","Hospitals","201-500 employees","Privately Held","Kartal, İstanbul",,"uniarch.com.tr","https://www.linkedin.com/company/uniarch"
,"Hospital FOB","Há 40 anos, o Hospital FOB é referência em saúde para Ouro Branco e diversas cidades da região, como Barbacena, Belo Vale, Carandaí, Congonhas, Conselheiro Lafaiete, Entre Rios de Minas, Mariana, Ouro Preto, São Brás do Suaçuí, entre outras.

Com uma trajetória de inovação, investimento contínuo em tecnologia e capacitação profissional, o Hospital FOB se consolidou como uma instituição confiável e respeitada, que alia atendimento humanizado, agilidade e segurança assistencial.

Nosso compromisso com a qualidade é reconhecido pela Acreditação ONA Nível II – Pleno, e estamos em processo de avanço para o Nível III – Excelência, certificação máxima da saúde no Brasil, concedida apenas a hospitais que demonstram padrões superiores de gestão integrada, qualidade e melhoria contínua.","Hospitals","501-1,000 employees","Privately Held","Ouro Branco, MG","Brazil",,"https://www.linkedin.com/company/hospitalfob"
,"Hospital Samaritano Campinas","Hospital Geral","Hospitals","1,001-5,000 employees","Partnership","Campinas, São Paulo","Brazil","samaritanocampinas.com.br","https://www.linkedin.com/company/hospital-samaritano-campinas"
,"Hospital Mantevida","Sejam bem-vindos! Somos o Hospital Mantevida. Aqui, nosso propósito é simples: cuidar de você e de quem você ama, em cada fase da vida. Estamos prontos para te acolher com todo carinho e cuidado que você merece. Porque para nós, o cuidado é para toda vida.","Hospitals","501-1,000 employees","Privately Held","Taguatinga, DF","Brazil",,"https://www.linkedin.com/company/hospitalmantevida"
,"Hospital Monporto","Um movimento empreendedor realizado por médicos da região de Rio Grande/RS. 

Somando esforços com especialistas na concepção e implantação de negócios na área da Saúde no Brasil.

Para oferecer o cuidado certo, no custo certo a uma população que busca padrões metropolitanos de atendimento em saúde na sua própria região.","Hospitals","2-10 employees","Privately Held","Rio Grande, Rio Grande do Sul","Brazil","hospitalmonporto.com.br","https://www.linkedin.com/company/hospitalmonporto"
,"Natus Lumine Hospital e Maternidade","Possuímos equipe qualificada e preparada 24h para receber você e sua família. Estamos localizados no Olho D’água, desde de 2017, nós evoluímos e modernizamos toda a estrutura para prestar um atendimento humanizado e com foco no cliente.","Hospitals","501-1,000 employees","Privately Held",,,"natuslumine.com.br","https://www.linkedin.com/company/natus-lumine-hospital-maternidade"
,"MRR Children's Hospital","We are a comprehensive, super-speciality pediatric hospital with a multidisciplinary approach, in Mumbai. Designed with the aim to provide the best in the industry, our hospital specialises in various pediatric departments, including pediatrics, pediatric gastroenterology, pediatric hematology, pediatric neurology, pediatric oncology, pediatric surgery, pediatric urology, emergency care, etc. We leverage the latest technology to provide safe, high-quality and innovative child care. Additionally, we follow a family-centred approach towards patients and parents, which helps the family become part of the decision-making and treatment of their child.","Hospitals","201-500 employees","Privately Held","Thane, Maharashtra","India","mrrch.com","https://www.linkedin.com/company/mrr-childrens-hospital"
,"Prasidh Hospitals","Prasidh Hospital is recognized as the Multi Specialty Hospital in LB Nagar. Our innovative treatments, compassionate experts, and holistic care set us apart. Such medical specialties are provided by experienced and world-class experts, thereby ensuring the unparalleled care everyone deserves. Prasidh Hospital, being the Best Hospital in LB Nagar. We are fully equipped with high-quality healthcare delivered, with the most modern equipment and cutting-edge technology combined with expert doctors, technicians, and nursing staff with extensive experience. We also have 24/7 emergency & ambulance services","Hospitals","51-200 employees","Self Employed","Hyderabad, telangana","India","prasidhhospitals.com","https://www.linkedin.com/company/prasidh-hospitals"
,"Bodhi Mind Care Hospital","Bodhi Mind Care | Healthy Mind, Happy Life

At Bodhi Mind Care, we believe mental wellness is the foundation for personal, professional, and societal growth. Based in Coimbatore, India, Bodhi offers a comprehensive range of services in psychiatry, psychology, brain health, and holistic wellness. Our multidisciplinary team provides compassionate, evidence-based care — from outpatient clinics to inpatient rehabilitation, from brain mapping and rTMS to Ayurvedic therapies and community outreach.

We are redefining mind care by blending modern science with ancient wisdom, offering individuals a safe space to recover, reflect, and thrive. Whether it's anxiety, depression, addiction, neurodevelopmental issues, or stress-related difficulties, Bodhi stands with you.

Let’s create a world where seeking help is a strength — and healing is holistic.

 www.bodhimindcarehospital.com
Coimbatore, Tamil Nadu
 +91 975 123 3456","Hospitals","11-50 employees","Partnership",,,"bodhimindcarehospital.com","https://www.linkedin.com/company/bodhi-mind-car-hospital"
,"CENTRE HOSPITALIER DE CAMBRAI","CENTRE HOSPITALIER DE CAMBRAI is a medical practice company based out of 516 Av. de Paris, Cambrai, Nord-Pas-de-Calais, France.","Hospitals","1,001-5,000 employees","Government Agency","Cambrai, Nord-Pas-de-Calais","France","ch-cambrai.fr","https://www.linkedin.com/company/centre-hospitalier-de-cambrai"
,"CENTRE HOSPITALIER DE TOURCOING","Le Centre Hospitalier de Tourcoing est un Etablissement Public de Santé situé dans le Versant Nord-Est de la Métropole Lilloise (442 000 habitants) et adossé à la frontière belge.
Il a la particularité de posséder un service universitaire, le SUMIV (Service Universitaire des Maladies Infectieuses et du Voyageur). Il est membre du Groupement Hospitalier Territorial Lille Métropole Flandre Intérieure. Les partenariats de l'établissement sont établis en fonction d'activités à rayonnement régional (Infectiologie), de proximité (Obstétrique et Néonatologie, Médecine, Chirurgie, Cancérologie, SSR, Gériatrie, Addictologie) et transfrontalières (Maladies Infectieuses, Imagerie Médicale). En 2017, il débute le lancement du programme de modernisation de l'hôpital Chatiliez permettant de répondre aux enjeux suivants : 
- adaptation des prises en charge en Réanimation et en Surveillance continue
- contiguïté du secteur naissance et du bloc opératoire
- amélioration des prises en charge Mère-Enfant en Néonatologie
- mise aux normes du Laboratoire, - développement des prises en charge ambulatoires (chirurgie ambulatoire et hôpital de jour de médecine
- amélioration de l'accueil et de l'hébergement
- amélioration des secteurs de consultations. 
Le Centre Hospitalier de Tourcoing comptabilise près de 140 000 consultations et 49 000 passages aux urgences en 2019. 
Il possède 944 lits, dont 436 lits dédiés à la Médecine, Chirurgie et Obstétrique, localisés au niveau de l'hôpital Guy Chatiliez","Hospitals","1,001-5,000 employees","Government Agency","Tourcoing, Hautsdefrance","France","ch-tourcoing.fr","https://www.linkedin.com/company/centre-hospitalier-de-tourcoing"
,"Keepcare","Os melhores equipamentos para Hospitais e Home Care.","Hospitals","2-10 employees","Privately Held",,,"keepcaresaude.com.br","https://www.linkedin.com/company/keepcaresaude"
,"Evercare Hospital Lahore","Evercare Hospital Lahore is a modern, cutting-edge multi-disciplinary hospital in Lahore, Pakistan. It is the flagship hospital of the Evercare Group in Pakistan. This modern hospital, which opened in 2019, offers a wide range of clinical services and specialties. The hospital provides a full range of high-quality clinical, diagnostic, and treatment services using cutting-edge technology.","Hospitals","11-50 employees","Privately Held","Lahore, Punjab","Pakistan","marham.pk","https://www.linkedin.com/company/evercare-hospital-lahore"
