"Find companies","Name","Description","Primary Industry","Size","Type","Location","Country","Domain","LinkedIn URL"
,"Quooker España","Quooker, fundado en 1970 en los Países Bajos, ha revolucionado la industria de la cocina con su sistemas que proporcionan, de forma instantánea, agua hirviendo y agua filtrada refrigerada con y sin gas, previamente filtrada. 

Quooker ofrece una solución completa, combinando comodidad, salud y sostenibilidad.

· Comodidad: gracias a su innovador sistema, ya no es necesario esperar a que el agua hierva para preparar un té o cocinar, ni tampoco transportar y almacenar botellas de plástico. 

· Salud y bienestar: con Quooker se puede disfrutar de una dieta más sana ya que permite hervir y cocinar al vapor de forma más fácil, preparar infusiones saludables al instante y beber agua de la mejor calidad directamente desde el grifo.

· Sostenibilidad: hervir agua con Quooker es mucho más eficiente que con un sistema tradicional, permitiendo ahorrar agua y energía. Además, el Quooker CUBE ofrece agua filtrada refrigerada y con gas, eliminando así la necesidad de usar envases y generar residuos. 

Con sede en Barcelona, estamos presentes en España, Andorra y Gibraltar desde 2022, con equipos comerciales y técnicos propios que nos permiten ofrecer el mejor servicio a nuestros clientes.","Household Appliance Manufacturing","11-50 employees","Privately Held","Sant Just Desvern, Barcelona, Catalonia","Spain","quooker.es","https://www.linkedin.com/company/quookerespaña"
,"Fukuro Malaysia","Fukuro is a proud Malaysian home improvement products brand. 

We design, develop and distribute high quality products from kitchen utensils, kitchen gadgets, cookware, cutleries, knives to home cleaning and household hooks. Our objective is simply to provide with Malaysians with world class products without needing to pay extravagant prices. 

Fukuro products is available on e-commerce platforms and all major supermarket/hypermarkets in Malaysia.","Household Appliance Manufacturing","11-50 employees","Privately Held","Petaling Jaya, Selangor","Malaysia","fukuromalaysia.com","https://www.linkedin.com/company/fukuro-malaysia"
,"Master Kitchen Italia","Master Kitchen è il brand di elettrodomestici dal design Made in Italy che offre una vasta gamma di prodotti ad alta qualità e performance.

Esperienza, affidabilità e tecnologia sono gli ingredienti che utilizziamo per progettare i migliori elettrodomestici: forni, forni a microonde, piani cottura a gas e a induzione, cappe, lavastoviglie, frigoriferi. Un universo di prodotti pensati per rendere indimenticabile la tua esperienza in cucina.","Household Appliance Manufacturing","51-200 employees","Privately Held",,,"masterkitchen.it","https://www.linkedin.com/company/masterkitchenitalia"
,"Nowastec","NOWASTEC (NO WASte TEChnology) is a startup business by Lamec Cablaggi, which has been active in the electromechanical sector for 40 years. 

Our mission is as simple as it is ambitious – to proactively contribute to sustainability by creating technological solutions that help to improve the environment and prevent waste.","Household Appliance Manufacturing","2-10 employees","Privately Held","Conegliano, Veneto","Italy",,"https://www.linkedin.com/company/nowastec"
,"Forge & Flame","Half a century ago, Americans confronted an energy crisis, prompting homeowners to seek alternative heating methods to ensure their families' warmth. Founded on the principle that every household deserves a dependable heat source, Harman, Vermont Castings and Quadra-Fire emerged. After decades of bringing a warming glow to countless homes across the globe, these coveted brands became some of the most trusted names in the hearth industry—and for a good reason.

Now, allied under the banner Forge & Flame these iconic brands come together stronger than ever. United by a shared belief in the importance of American craftsmanship and an unwavering commitment to quality, Forge & Flame’s mission goes beyond providing essential warmth; it extends to fostering a genuine passion for fire and nurturing a sense of community.","Household Appliance Manufacturing","1,001-5,000 employees","Public Company","Lakeville, Minnesota","United States","forgenflame.com","https://www.linkedin.com/company/forge-n-flame"
,"WJMIA","About WJMIA

WJMIA is a leading OEM/ODM manufacturer of small kitchen appliances that integrates R&D, manufacturing, sales, and service. With over 68 acres and 70,000 sqm of space, we boast 60 injection molding machines and 30 assembly lines, producing over 8M units annually, worth more than 1 billion.

Mission: Create perfect kitchen appliances through intelligent manufacturing and promote healthy diets.

Business Philosophy: ""Prioritize technology as the primary productive force and quality as the foremost lifeline, crafting high-quality kitchen appliances with craftsmanship.""

Vision: ""For families, for life, for love."" Enabling every household to enjoy convenient, efficient, and safe kitchen lives.

Core Values:
• Quality First: Committed to deliver exceptional quality.
• Innovation in Technology: Enhancing Product Performance and user experience.
• Customer Centricity: Offering customized, one-stop solutions.
• Team Collaboration: Achieving mutual success through teamwork.

Strengths:
◆ Robust R&D Team: 40+ professionals covering structural design, electronic control, and hardware design, providing one-stop solutions.
◆ Cost Advantage: Significant production volumes and a comprehensive supply chain ensure lower procurement prices and higher delivery rates.
◆ Quality Assurance: Self-supplied core components with rigorous quality control and advanced testing equipment.

Services:
◈ OEM/ODM Services: From design to manufacturing, catering to personalized needs.
◈ Customized Solutions: Tailored solutions to launch competitive products quickly.
◈ Technical Support & After-Sales Service: Comprehensive assistance during use.

∎Products: Electric pressure cookers, rice cookers, air fryers, steamers, slow cookers, and other small appliances such as garbage disposers, sealing machines, and food processors. We also manufactured and sold the cookware.

Contact Us:
Email: wjmia@wjmia.com, marketing@wjmia.com
Website: http://www.wjmia.com","Household Appliance Manufacturing","501-1,000 employees","Self Owned","HangZhou","China","wjmia.com","https://www.linkedin.com/company/wjmia"
,"Dragon Group","DRAGON GROUP
Merupakan Perusahaan yang bergerak di bidang produksi peralatan kebersihan untuk kebutuhan rumah tangga dan komersial.

Dikelola secara independen, namun masih dipersatukan oleh kesamaan nilai dan histori perusahaan.

DRAGON GROUP selalu berkomitmen untuk terus melakukan inovasi dan mengasah kreativitas dalam persaingan industri 4.0, dengan di dukung dengan mesin - mesin berteknologi modern dan sumber daya manusia yang terampil. Terlepas dari semua itu, penghargaan tertinggi merupakan dukungan dari konsumen sehingga DRAGON GROUP mampu untuk menciptakan produk dengan kualitas tinggi dan unggul dalam persaingan pasar.","Household Appliance Manufacturing","501-1,000 employees","Self Owned","Tangerang, banten","Indonesia","dragonindonesia.co.id","https://www.linkedin.com/company/dragon-group-indonesia"
,"BOKZ Life","Bokz makes moving simple.
We deliver high-quality living essentials directly to students and new movers, all in one box - saving time, money, and stress.

With up to 71 carefully curated items, each Bokz contains everything you need to settle in from day one. Our one-price, one-delivery model offers unbeatable value - up to 36% cheaper than leading retailers.

No more last-minute shopping.
No more forgotten basics.
Just everything you need, ready when you arrive.","Household Appliance Manufacturing","11-50 employees","Privately Held",,,,"https://www.linkedin.com/company/bokz-international"
,"Coshare","Founded in 2022, Shenzhen Coshare Innovation Technology Co., Ltd., operating under the brand name ""Coshare,"" is at the forefront of household technology innovation. Our primary offering is a high-speed 110,000rpm hair dryer, meticulously crafted to streamline your daily routine.

At COSHARE, we firmly believe in the ethos that sharing is caring. Our mission is crystal clear: we endeavor to create and disseminate innovative home products, aiming to simplify life, one invention at a time—or perhaps, multiple breakthroughs all at once. We are dedicated to leveraging technology to enhance the usability of everyday items, allowing you to reclaim your time for more meaningful pursuits.

What sets us apart is our impressive manufacturing and research capabilities. Our sprawling 10,000-square-meter production and research facility is the beating heart of our innovation engine. It enables us to consistently deliver top-tier quality and cutting-edge solutions that cater to the ever-evolving needs of our customers.

Join us in embracing the future of household technology. Experience the distinctive COSHARE touch, where innovation seamlessly intertwines with genuine care, all while making life significantly simpler, one meticulously designed product at a time.

Thank you for choosing COSHARE, where sharing truly exemplifies care.

Contact information:

  Email:mandywong@cucosmart.com
 ✇Alibaba Website: https://coshareglobal.en.alibaba.com/?spm=a2700.7756200.0.0.290c71d2TOqOJi

Thank you for visiting us & we hope you enjoy your time on our page.","Household Appliance Manufacturing","201-500 employees","Partnership","Shenzhen, Guangdong","China",,"https://www.linkedin.com/company/shenzhen-coshare-innovation-technology-co-ltd"
,"Vardhman crockery jamnagar","Vardhman presents you with Stylish and elegant and Best Quality kitchenware. 
Affordability at its best.","Household Appliance Manufacturing","11-50 employees","Privately Held","Jamnagar , Gujarat","India","vardhmancrockery.com","https://www.linkedin.com/company/vardhman-crockery-jamnager"
,"Fora Kitchen","Crafting Quality for Your Kitchen: Fora Kitchen - Your Home's Culinary Companion. Elevate your cooking experience with our premium kitchen utensils and accessories. We're dedicated to bringing you the finest in kitchenware, enhancing every meal with style and precision. Join us in the art of cooking, where quality meets innovation.","Household Appliance Manufacturing","11-50 employees","Privately Held","Kochi, KErala","India",,"https://www.linkedin.com/company/fora-kitchen"
,"Magic Media for Advanced Business Ltd","We established Magic media to satisfy Sudanese market needs in all this services include :- Business services, advertising, Branding, outdoor advertising services, social media services, event management services, Tv production services , Auction services, Catering services , import and export services .Home appliance's business




We established Magic media to satisfy Sudanese market needs in all this services include :- Business services, advertising, Branding, outdoor advertising services, social media services, event management services, Tv production services , Auction services, Catering services , import and export services .Home appliance's business","Household Appliance Manufacturing","11-50 employees","Privately Held","khartoum, bahree","Sudan",,"https://www.linkedin.com/company/magic-media-for-advanced-business-ltd"
,"For the Kitchen (UK) Limited","Welcome to For The Kitchen UK Limited, your premier destination for top-quality kitchen appliances. We specialize in providing a comprehensive range of products designed to meet the needs of kitchen retailers and designers. Our extensive catalogue includes everything from Italian made range cookers to exclusive wine refrigerators.","Household Appliance Manufacturing","2-10 employees","Public Company","Burnley, England","United Kingdom","forthekitchen.co.uk","https://www.linkedin.com/company/forthekitchen"
,"Beko Česká republika","Firma Beko je součástí skupiny Arçelik A.Ş., která vznikla již v roce 1955 a od té doby se stala jednou z největších společností v Evropě, která vyrábí domácí spotřebiče. Po celém světě zaměstnává více jak 30 000 lidí, díky kterým má své zastoupení ve 146 zemích.

V České republice působíme již od roku 2005, na Slovenku od roku 2006. Od té doby jsme se stali jednou z předních značek domácích spotřebičů na trhu a jsme součástí více jak půl milionu domácností, kde svými šikovnými funkcemi a technologiemi pomáháme usnadnit každý den.","Household Appliance Manufacturing","51-200 employees","Public Company","Praha","Czechia","beko.com","https://www.linkedin.com/company/bekocz"
,"Gaabor Brasil",,"Household Appliance Manufacturing","51-200 employees","Privately Held",,,"gaabor.com.br","https://www.linkedin.com/company/gaabor"
,"CÔNG TY TNHH NEFA VIỆT NAM",,"Household Appliance Manufacturing","11-50 employees","Public Company",,,"nefa.vn","https://www.linkedin.com/company/công-ty-tnhh-nefa-việt-nam"
,"3D Production","3D Production SRLS è un’azienda italiana fondata nel 2020 con un obiettivo preciso:
supportare le imprese nel processo produttivo, con particolare attenzione alle fasi di assemblaggio, collaudo, imballaggio e stoccaggio.
Crescita Rapida, Risultati Concreti
In pochi anni abbiamo consolidato la nostra presenza nel settore, grazie a:
- Una struttura operativa spaziosa e organizzata
- Un team altamente qualificato
- Un approccio orientato alla precisione, efficienza e qualità

Un Partner Affidabile per il Tuo Business
Collaboriamo con aziende che desiderano:
- Esternalizzare fasi produttive
- Ottimizzare tempi e risorse
- Concentrarsi sul proprio core business

Affidandoci a noi, trovano un partner solido, flessibile e orientato alla soluzione.","Household Appliance Manufacturing","11-50 employees","Partnership","Cervinara , Avellino","Italy","3dproductionsrls.com","https://www.linkedin.com/company/3d-production-srls"
,"Deqin Sunny Plastic Products Co Ltd","Deqin Sunny owns 3 factories. Two factories are in China , the exporting port is Shanghai, China. One in Thailand and 
the exporting port is Bangkok, Thailand. Deqin Sunny has 4 warehouse locations in USA,which could provide 
convenient distribution service.Our goal is to be the one-stop supplier of high quality household products which 
covers not only food storage bags (zipper bags, slider bags, fold top sandwich bags, twist tie bags), but also trash 
bags, plastic wrap, aluminum foil, parchment paper with different sizes.
1.Three factory bases guarantee production capacity 20000 tons per year
2.Thailand factory save US customers 25% tariff for importing disposable food storage bags.
3.Four overseas distribution centers provide high efficiency in global supply chain management","Household Appliance Manufacturing","501-1,000 employees","Privately Held",,,"dqsunnyplastic.com","https://www.linkedin.com/company/deqin-sunny-plastic-products-co-ltd"
,"OCEANRICH GLOBAL CO., LTD","Oceanrich was established in 2007 in Taiwan. Over the past decade, we have stayed true to our brand in creating products that are as rich and luxurious as the ocean. We strictly adhere to our criteria that our designs have to be innovative, creative, and aesthetically pleasing appliances, especially for our OEM clients. In 2020, we recently set up our company's core R&D and design department in our hometown of Tainan, Taiwan. Since then Oceanrich finally established its brand. We focus on coffee and established patents for our unique design ""360° rotated pour-over system"" for coffee makers, in countries such as the USA, Japan, Taiwan, China, and the European market.

Our Vision:  
Oceanrich values good coffee that meets an international standard. We understand how essential an excellent brew can be.

Our Mission:
Oceanrich's mission is to bring the best user experience to our customers through innovative, unique, and easy-to-operate products. Oceanrich is committed to pursue ongoing research and development around coffee and tea products, thus ensuring its future as a leader in innovative coffee equipment and related products.

Our Value: 
Simple: We value easy, fast, and good coffee. 
Fun: We believe that the process of making coffee should be fun. 
Innovation: We value innovation, efficiency, and excellent product outcome. 
Aesthetics: we believe that our product should be robust, yet aesthetically pleasing. 

Global footprint: USA,  China, Korea, Japan, Vietnam, Philippines, Saudi Arabia","Household Appliance Manufacturing","11-50 employees","Self Owned","台南市","Taiwan","oceanrich.tw","https://www.linkedin.com/company/oceanrich-global-co-ltd"
,"Dlimity","Dlimity is a brand focused on the design, manufacturing and distribution of fences and gates for residential and commercial buildings. We deliver more than 100 different models, made of PVC, aluminium, WPC or the combination of these materials. Our cut-to-size department delivers the project wherever you need, ready to install.","Household Appliance Manufacturing","2-10 employees","Privately Held","Ceutí, Murcia","Spain","dlimity.net","https://www.linkedin.com/company/dlimity"
,"DAUSCHER.KZ","Сегодня, чтобы с уверенностью смотреть в будущее, важно уметь балансировать между высокой скоростью и наслаждением мгновением, гениальной простотой и функциональной сложностью. Бренд бытовой техники «DAUSCHER» предлагает технику и сервис, которые помогают найти баланс и наполняют будни новыми эмоциями. Мелкая и крупная бытовая техника представлена в широком ассортименте: от холодильников и стиральных машин, от пылесосов и очистителей воздуха до мультиварок и духовых шкафов, обогревателей. Приобретенные товары можно сразу оснастить всем необходимым – на сайте представлен богатый выбор аксессуаров и сопутствующих товаров. Сервис «DAUSCHER» строится на принципах оперативности, честности и индивидуального подхода к каждому клиенту. Покупки можно оплатить любым удобным способом.  Продажа бытовой техники осуществляется с доставкой по Алмате и по другим городам Казахстана. Купить бытовую технику можно с быстрой доставкой по всему Казахстану.","Household Appliance Manufacturing","51-200 employees","Privately Held","Алматы, Алматинская","Kazakhstan","dauscher.kz","https://www.linkedin.com/company/dauscher-kz"
,"WILLPY","WILLPY is the first and only electric container that slows down the deterioration process of municipal wet waste. It avoids the odours and leachate that pierce bio-bags. Allows waste to be managed at home for up to a week without any problems","Household Appliance Manufacturing","2-10 employees","Privately Held","Milano, MI","Italy","open59.com","https://www.linkedin.com/company/open59"
,"Wanrui Technology Co.,Ltd","We are  patented creative home products manufacturer from China,
who are specializing in the innovative household appliances based on the customer requirements.
We have integrated research and development, manufacture and sale module. 
all our creative products we got the patents with our exclusive mold,
So we are convinced that  our patented creative products can help u win the market if u are look for  new competive home products with favorable price.
Let us make amazing happen here","Household Appliance Manufacturing","51-200 employees","Partnership","佛山, 广东","China","caringme.com","https://www.linkedin.com/company/wanrui-technology-co-ltd"
,"Joyoung Official","Joyoung will bring the joy of exploring kitchens across every corner of the world.
#EnjoyBeingHealthy ","Household Appliance Manufacturing","1,001-5,000 employees","Public Company","杭州市","China","joyoung.com","https://www.linkedin.com/company/joyoung-official"
,"Philips Water España",,"Household Appliance Manufacturing","201-500 employees","Public Company",,,"philips.es","https://www.linkedin.com/company/philips-water-españa"
,"Mr. Appliance of Yukon, Stillwater and Edmond","Mr. Appliance of Yukon and Stillwater is locally owned and operated. We provide appliance repair services to Yukon, Piedmont, Mustang, Edmond, Guthrie, Stillwater, and the surrounding areas.

We understand the inconvenience of when your appliances break down and will schedule your appointment right away. Our pricing quotes are upfront, our parts and labor are guaranteed, and our technicians are friendly and experienced.
We can work on all makes, models, and brands of refrigerators, freezers, ovens, stoves, ranges, washers, and dryers. We even repair specialty items like ice makers, wine coolers, outdoor grills, and more.

We're proud to service high-end brands such as Wolf, Fisher & Paykel, Sub-Zero, Viking, Jenn-Air, Uline, Electrolux, KitchenAid, Thermador, Dacor, and more. Give us a call today for speedy, expert appliance repair service.","Household Appliance Manufacturing","2-10 employees","Self Employed","Yukon, Ok","United States","mrappliance.com","https://www.linkedin.com/company/mr-appliance-of-yukon-and-stillwater"
,"AIWA Industries","Welcome to AIWA, one of the most iconic brands in the Japanese industry, synonymous with quality, tradition and technological heritage since 1951. Our mission is to be leaders in the manufacture of quality household appliances, bringing excellence and innovation to every home.

At AIWA Industries, we merge the most innovative design with Japanese precision and cutting-edge technology to create household appliances that meet the needs of any home. We manufacture products that can enrich the daily life of the most demanding homes, providing them with a legacy of quality and Japanese tradition seeking the utmost trust from our customers.

Each AIWA product reflects our commitment to perfection, attention to detail and customer satisfaction, which establishes us as a premium brand in the global market.

At AIWA Industries we pride ourselves on being bearers of Japanese excellence, dedicated to exceeding expectations and paving the way for the future of technology in the world of household appliances.

With AIWA, discover a unique experience where tradition meets innovation to deliver unparalleled quality. Welcome to the future, welcome to AIWA.

AIWA domestic appliances - Design, innovative technology and Japanese tradition since 1951","Household Appliance Manufacturing","51-200 employees","Privately Held","Barcelona, Barcelona","Spain","aiwa-industries.com","https://www.linkedin.com/company/aiwa-industries-household-appliances"
,"HBIS New Material Technology Co., Ltd.","Hbis New Material is a company based out of Qingdao, China.","Household Appliance Manufacturing","10,001+ employees","Public Company","Qingdao","China","hbisnma.com","https://www.linkedin.com/company/hbis-new-material"
,"Bake & Bag","Winner of 2023 Innovate UK Transformative Technology fund
Winner of 2022 Techstart Proof of Concept fund
SME bakery packaging machine launch due 2023.
Consumer food packaging machine launch due 2024.","Household Appliance Manufacturing","Self-employed","Privately Held","Hillsborough, Northern Ireland","United Kingdom","bakeandbag.com","https://www.linkedin.com/company/bakeandbag"
,"Latinatec","Somos a Latinatec, a solução completa em peças de reposição para produtos Latina.  Oferecemos peças originais e com os melhores preços para lojas e revendedores, com a qualidade e confiança que você já conhece. ","Household Appliance Manufacturing","51-200 employees","Privately Held",,,"latina.com.br","https://www.linkedin.com/company/latinatec"
,"Dyson",,"Household Appliance Manufacturing","10,001+ employees","Privately Held",,,,"https://www.linkedin.com/company/www.dyson.in"
,"Guangdong Xiangji Electrical Appliances CO., LTD","广东祥基电器有限公司 is a company based out of China.","Household Appliance Manufacturing","501-1,000 employees","Self Employed","Zhongshan","China","zsxj.com","https://www.linkedin.com/company/广东祥基电器有限公司"
,"Trash Can Buddy","Trash Can Buddy is a revolutionary solution designed to assist in preventing the lid of your trash can from flying open. It will help to keep pesky “critters” away and provide peace of mind that your trash will stay more secure in your bin, even during occasional wind gusts. This innovative device provides a convenient way to help keep your neighborhood cleaner and healthier while supporting your local environment. Made in the USA, Trash Can Buddy is an easy-to-use, defense against gusts, critters, and nosey neighbors. It can be effortlessly attached to your bin, and left to do the work for you. Say goodbye to traditional methods like using rocks or excessive manual effort, and embrace the future of waste management with Trash Can Buddy.

Easy to Use & Light Weight
Critter-Resistant
Neighbor-Resistant","Household Appliance Manufacturing","2-10 employees","Self Owned",,,"trashcanbuddy.com","https://www.linkedin.com/company/trash-can-buddy"
