"Find companies","Name","Description","Primary Industry","Size","Type","Location","Country","Domain","LinkedIn URL"
,"Liliana Electrodomésticos","Somos una Empresa 100% Argentina, con más de 70 años de historia y con presencia en todo el país a través de nuestra amplia línea de productos que comprende las líneas de Alimentación, Calefacción, Ventilación, Jardín, Cuidado de Pisos y Ropa.

Conoce las oportunidades de Empleo de Liliana Electrodomésticos en: 
https://surl.li/jfodbv","Household Appliance Manufacturing","1,001-5,000 employees","Privately Held","Rosario, Santa Fe","Argentina","liliana.com.ar","https://www.linkedin.com/company/liliana-electrodomésticos"
,"Freudenberg Home and Cleaning Solutions","Freudenberg Home and Cleaning Solutions is a leading provider for branded cleaning and household products and services. As part of the Freudenberg Group, a global technology group with 40.000 employees in about 60 countries, we develop leading-edge technologies, and excellent products, solutions and services for more than 30 market segments. Freudenberg Home and Cleaning Solutions is the home of global leading brands like Vileda, Vileda Professional, O-Cedar, Marigold, Gimi, Wettex, Oates and Gala. Our highly talented, motivated and results-orientated employees continuously secure and expand our leadership in markets worldwide.

Considering a career at Freudenberg Home and Cleaning Solutions? Visit our Website below for more.","Household Appliance Manufacturing","1,001-5,000 employees","Privately Held","Weinheim, Baden-Wurttemberg","Germany","freudenberg-homeandcleaningsolutions.com","https://www.linkedin.com/company/freudenberg-home-and-cleaning-solutions-gmbh"
,"BSH Electrodomésticos España, S.A.","En el Grupo BSH trabajamos para mejorar la calidad de vida de las personas en el hogar a través de nuestras marcas reconocidas, productos de alta calidad y servicios y soluciones excepcionales. 

En España, fabricamos electrodomésticos en 5 plantas de producción ubicadas en Aragón, Cantabria y Navarra y contamos con marcas de electrodomésticos* establecidas en todo el mundo como Bosch, Siemens y Gaggenau, y nuestra marca local Balay. Con Home Connect, ofrecemos a los consumidores servicios digitales y soluciones sostenibles para mejorar su vida diaria.

Los empleados son la base de nuestro éxito. Por eso, fomentamos una cultura corporativa en la que nuestros más de 4.000 empleados se sienten valorados. En 2024, BSH Electrodomésticos España, S.A. ha sido certificada por duodécimo año consecutivo como empresa Top Employer.

Pero en BSH somos algo más que el fabricante de electrodomésticos líder en Europa y en España.

En el Grupo BSH creemos que la sostenibilidad tiene tres dimensiones que no se excluyen mutuamente, sino que están profundamente interrelacionadas. La protección del medio ambiente, la responsabilidad social y la sostenibilidad del negocio son los cimientos de cualquier empresa de éxito.

Nuestro objetivo es prevenir la contaminación ambiental y reducir nuestra huella. Por eso, reducimos constantemente nuestra huella de carbono e impulsamos el uso de materiales y componentes sostenibles, para que nuestros electrodomésticos estén preparados para una economía circular. 

Diseñamos tecnología dedicada a ahorrar energía y agua, y desarrollamos ideas e innovaciones que nos hacen la vida mucho más fácil a todos. 

Conoce más sobre nosotros en nuestra web http://www.bsh-group.com/es 

*BSH es licenciatario de marca para Siemens AG y Robert Bosch GmbH para las marcas Siemens y Bosch.","Household Appliance Manufacturing","1,001-5,000 employees","Privately Held","Zaragoza, Zaragoza","Mexico","bsh-group.com","https://www.linkedin.com/company/bsh-electrodomesticos"
,"Butterfly Gandhimathi Appliances Ltd","For over four decades, Butterfly has been a part of India’s everyday cooking journey — trusted in millions of homes and known for bringing practical innovation to the kitchen.

We believe every home has its own rhythm, personality, and way of evolving. And every kitchen is shaped by the ideas, tastes, and spirit of the people who cook in it. That belief inspires us to design appliances that are intuitive, reliable, and built for today’s evolving lifestyles.

Our culture is driven by craftsmanship, curiosity, humility, and a continual desire to improve. We take pride in being a homegrown brand built by original thinkers and everyday doers — inspired by real homes, powered by real people, and committed to making everyday living effortless and joyful.

Our renewed positioning, ‘Celebrating Change’, reflects a deep understanding of modern Indian homes — where roles shift, routines blend, and technology enhances everyday living. As a part of Crompton, one of India’s most respected home-solutions companies, we bring intelligent and intuitive solutions that simplify life in the kitchen and beyond. The fingerprint-inspired butterfly identiy brings this idea to life. Crafted from the unique swirls of a fingerprint, it represents every individual whose touch shapes Butterfly — from consumers in their homes to employees who make it possible to our partners who take the ideas forward. It reminds us that while life changes constantly, our essence, values, and personal imprint remain unmistakably our own.

Butterfly — Celebrating Change.
Where every idea, every kitchen, and every individual leaves a mark.","Household Appliance Manufacturing","1,001-5,000 employees","Public Company","Chennai, Tamil Nadu","India","butterflyindia.com","https://www.linkedin.com/company/butterfly-kitchen-appliances"
,"Worten España","Worten es una empresa de la distribución especializada en la venta de Electrodomésticos por Internet. La venta se realiza a través de la página web de Worten.es 


Nuestros compromisos están dirigidos a ofrecer la mejor tecnología al mejor precio: garantizamos la financiación 100% gracias a la tarjeta Worten, aseguramos la instalación y la retirada de los electrodomésticos, una devolución fácil hasta 100 días y un descuento del 5% permanente en todas las compras de dos o más grandes electrodomésticos.","Household Appliance Manufacturing","11-50 employees","Public Company","Madrid, Comunidad de Madrid","Spain","worten.es","https://www.linkedin.com/company/worten-españa"
,"Create","CREATE es muchas cosas, pero sobre todo es una compañía joven creada por jóvenes apasionados por el diseño, la  innovación, la tecnología y con el objetivo de mejorar y simplificar el día a día de nuestros clientes a través de productos únicos y accesibles para todo el mundo.

Somos un equipo que se mueve, se adapta y crece al mismo ritmo que nuestros clientes, que son el eje central de nuestro negocio. Buscamos perfiles que compartan nuestro mismo espíritu: que cada uno se sienta orgulloso de su trabajo y que disfrute consiguiéndolo. 

Sólo eso hará posible conseguir nuestro último objetivo, ser la marca más deseada en cualquiera de los más de diez países donde operamos (por ahora).","Household Appliance Manufacturing","51-200 employees","Privately Held","Madrid, Madrid","Spain","create-store.com","https://www.linkedin.com/company/createglobal"
,"GA.MA Italy - Brasil",".","Household Appliance Manufacturing","501-1,000 employees","Privately Held","São Paulo, São Paulo","Brazil","gamaitaly.com.br","https://www.linkedin.com/company/gama-italy-brasil"
,"upliance.ai","India’s first AI powered home appliance brand. Our first upliance has been designed for beginners and pros to start cooking fantastic food without any stress or hassle. 

Designed in India, Built in India & Made in India. 

The upliance offers guided recipes on its touchscreen, a jar that uses presets for cooking tasks and an integrated weighing scale that makes cooking for 1 or 4 easy and simple. With thousands recipes at your fingertips and an upliance that does all the work, you no longer have an excuse to eat boring food! 

Stop eating boring food with upliance.","Household Appliance Manufacturing","11-50 employees","Privately Held","Bengaluru, Karantaka","India","upliance.ai","https://www.linkedin.com/company/upliance"
,"The Washing Machine Project","We are The Washing Machine Project. 

The Washing Machine Project works to end the burden of hand washing clothes - a daily challenge faced by up to 50% of the global population, especially women and girls, in low-income, remote and displaced communities worldwide.

Based in the UK, The Washing Machine Project is a social enterprise working with corporate partnerships and collaborations, local organisations, charities, consultants and in-country partners in 13 countries to design, manufacture and distribute manual washing machines. The development of the Divya Washing Machine started in 2018 and since then, hundreds of machines have been distributed to households and communities, impacting 46,840 people as of August 2025. The Washing Machine Project and partners also provide support and advice to manual washing machine users to help them maintain the machines independently, whilst also providing grants and training for income related activities.

Our goal is to impact 1,000,000 people by 2030.

We can't do this alone - to find out how you can be part of an ecosystem committed to creating lasting change, that empowers women across the world then visit: https://www.thewashingmachineproject.org/contact-us

Through innovation, collaboration and care we will end the burden of hand washing clothes. One wash at a time.","Household Appliance Manufacturing","11-50 employees","Non Profit","London , London","United Kingdom","thewashingmachineproject.org","https://www.linkedin.com/company/thewashingmachineproject"
,"LG Colombia","Bienvenidos a la cuenta oficial de LG Colombia! 
Llevamos hasta tu hogar tecnología capaz de hacerte vivir experiencias únicas, llenas de detalles, innovación y accesibilidad.
¿Quieres ver de lo que puede ser capaz tu hogar?
#LifesGood","Household Appliance Manufacturing","501-1,000 employees","Privately Held","Bogotá","Colombia","lg.com","https://www.linkedin.com/company/lg_colombia"
,"Alessa Industries Co.","Alessa Group was founded by Hamad Abdullah Alessa in 1935. Today the Alessa group is known as the Alessa Industrial Company (AIC). Alessa is an integrated group in the cooling business. It include distributing appliances, electronics and manufacturing refrigerators, freezers, air conditioners and air handling units, as well as contracting and installation of personnel and commercial air conditioners and air handling units. The international department in Alessa supplies the Middle East and Africa markets with a full range of air conditioners and other products, such as chest freezers, refrigerators. AIC has exclusive brand distributorships and manufacturing brand under license, marketing , service divisions and R&D. 

Currently AIC includes 3 Strategic Business Units; a trading Company, Hamad A. Alessa & Sons Co. (HAASCO), a major factory, Alessa for Refrigeration and Air Conditioning Co. (ARAC) and Al Essa Advanced Projects Co. (AAPC). At the corporate level, apart from these BUs, AIC has a corporate office that includes Support Divisions of Finance, Administration & HR, IT, and performance management office.","Household Appliance Manufacturing","1,001-5,000 employees","Privately Held","Riyadh, Central","Saudi Arabia","alessa.com.sa","https://www.linkedin.com/company/alessa-industries-co-"
,"Ferre | Femas Group","FERRE is a leading Turkish manufacturer of cooking appliances, operating with over 3,300 employees across 244,000 m² of production facilities.
FERRE specializes in OEM, ODM, private label, and SKD/CKD manufacturing, producing built-in ovens, hobs, cooker hoods, freestanding cookers, and compact appliances. All products are engineered in line with regional standards, market expectations, and everyday cooking habits.
Backed by strong in-house R&D and engineering teams, FERRE delivers configurable solutions in terms of dimensions, energy types, technical features, design, branding, and packaging.
With its high-capacity and flexible manufacturing structure, competitive price–performance balance, and long-term, trust-based partnerships, FERRE supports distributors, retailers, and brand owners in building sustainable and scalable product portfolios.
From Europe to the Middle East, Africa, CIS, and American markets, FERRE works closely with its business partners to develop strong and future-ready product ranges","Household Appliance Manufacturing","1,001-5,000 employees","Privately Held","İstanbul",,"ferre.com.tr","https://www.linkedin.com/company/femas-metal-sanayi-ve-ticaret-a-s"
,"Artel Electronics","Artel Electronics LLC (Artel) is the largest home appliance and electronics manufacturer in Central Asia. 

Founded in 2011 with limited product lines, Artel has grown to employ around 10,000 people in all regions of Uzbekistan. 

Artel products are exported to over 20 countries, and the company is the regional partner of Samsung and Viessmann.","Household Appliance Manufacturing","5,001-10,000 employees","Privately Held","Ташкент","Uzbekistan","artelelectronics.com","https://www.linkedin.com/company/artelelectronics"
,"Beko Italia","Beko Europe è tra le aziende di riferimento nel settore degli elettrodomestici. Beko è impegnata a migliorare la vita dei suoi consumatori attraverso una gamma diversificata di prodotti e soluzioni innovative e sostenibili. E' controllata al 75% da Beko B.V. e al 25% da Whirlpool Corporation. 
Come parte di Beko, riconosciuta come ""l'azienda di elettrodomestici numero 1 in Europa""*, Beko Europe detiene un portfolio di 16 marchi  che forniscono elettrodomestici di qualità a milioni di famiglie in tutta Europa. 

In Italia commercializza i marchi Whirlpool*, Hotpoint-Ariston, Beko e Indesit. Forte di 70 anni di innovazione della casa madre, Beko Europe promuove la sostenibilità in casa, utilizzando tecnologie avanzate, risorse umane qualificate e forti capacità produttive  per contribuire ad un futuro migliore. 

Beko Europe progetta soluzioni che integrano funzionalità, sostenibilità e design ponendo al centro le esigenze dei consumatori con una gamma di brand e prodotti diversificati che coprono tutte le fasce di mercato.

*Licenza limitato a determinate giurisdizioni.  
**Fonte  Euromonitor International Limited, Edizione 2025 di Consumer Appliances , Beko Corp. Grandi Elettrodomestici secondo ""Grandi Elettrodomestici"", GBO vendita al dettaglio, dati 2024","Household Appliance Manufacturing","201-500 employees","Public Company","Milan, Lombardy","Italy","beko.com","https://www.linkedin.com/company/beko-italia"
,"Vorwerk Italia","For 140 years, Vorwerk has been the world's leading direct sales company of household appliances of the highest quality, innovative technology and legendary durability.
With a turnover of 3.4 billion euros in 2021, the Vorwerk Group is today present in over 60 countries, with a sales force of over 100,000 appointees worldwide.
Present in Italy with Folletto since 1938, Vorwerk Italia today employs over 300 employees in the Milan headquarters and another 380 employees or collaborators in the Bimby and Folletto commercial networks present throughout the national territory.

In Italy, Vorwerk has been present since 1938 and with the two historic and iconic brands, Folletto and Bimby, excellent products that enter thousands of Italian homes every day and are presented with passion and competence by a motivated and passionate sales force.

Direct sales: ancient inspiration, contemporary processes

For millions of Italians Folletto is synonymous with home care. 
For 85 years, the famous Folletto home cleaning system has been distributed exclusively through the door-to-door sales channel: 4,000 agents who contact more than two and a half million families every year.

The iconic Bimby multifunction kitchen robot has been present in Italy since 1978. 
One of the most successful factors of Bimby is a direct sales force made up of competent and passionate professionals. Today in Italy there are 20,000 sales representatives who bring Bimby into customers' homes every day, organizing tasty demonstration moments.

Selling to the customer's home makes it possible to propose and recommend the most suitable solution for specific needs: a philosophy which demonstrates how Vorwerk's attention is focused on the needs of people in their home environments.","Household Appliance Manufacturing","501-1,000 employees","Privately Held","Milano","Italy","vorwerk.it","https://www.linkedin.com/company/vorwerk-italia"
,"Groupe SEB México","Simplificamos la vida de nuestros consumidores en todo el mundo. Creando nuevos productos y servicios que mejoran la vida en el hogar, haciéndola más agradable, armoniosa y satisfactoria. Asimismo, ofrecemos nuevas soluciones que cubren sus necesidades actuales y se anticipan a sus aspiraciones y deseos.","Household Appliance Manufacturing","10,001+ employees","Privately Held",,,"groupeseb.com","https://www.linkedin.com/company/groupe-seb-méxico"
,"Midea India Home Appliances","Midea India brings you an innovative line of home appliances, designed with care to enhance your quality of life, so you can #MakeYourselfAtHome","Household Appliance Manufacturing","201-500 employees","Privately Held",,,"midea.com","https://www.linkedin.com/company/midea-india-home-appliances"
,"Quooker Schweiz AG","Quooker - das Original. Als erster Kochend-Wasser-Hahn überhaupt hat es der Quooker vom kleinen Ort Ridderkerk in den Niederlanden in mittlerweile weitere 13 Länder geschafft. Der Hauptsitz in der Schweiz liegt heute in Kloten.
In den 1970er Jahren hatte Quooker-Erfinder Henri Peteri die geniale Eingebung, einen revolutionären Wasserhahn zu erfinden - und zwar einen, der die damals neumoderne Instantsuppe wirklich instant machen würde. Mit über 100°C heissem Wasser aus dem Wasserhahn ist es mittlerweile jedem möglich, diesen Luxus zu geniessen. Und frisch gebrühten Tee gibt es innerhalb von Sekunden.
Entdeckt mit uns weitere überraschende Verwendungsideen des Quookers und gewinnt exklusive Einblicke in unsere Quooker Fabrik und die Köpfe hinter dem Produkt.","Household Appliance Manufacturing","11-50 employees","Privately Held","Kloten, Zurich","Switzerland","quooker.ch","https://www.linkedin.com/company/quookerschweizag"
,"Briel","Briel is a portuguese brand of small appliances, specialized in espresso coffee machines for home and semi-professional use. The brand is born from the passion of brewing the perfect espresso, and defines itself as a unique blend of traditional craftmanship and modern technology.

We really love what we do. Briel is commited with sustainability, therefore our appliances are 100% repairable. Briel appliances are a lifetime lasting investment!","Household Appliance Manufacturing","51-200 employees","Privately Held","Braga, Braga","Portugal","briel.pt","https://www.linkedin.com/company/brielpt"
,"Beko Nordic","Beko Nordic is a fast-growing company in the home appliance industry, offering a wide range of innovative and sustainable products.
An exciting portfolio of brands including Grundig, Beko, Blomberg, Whirlpool, Hotpoint, Arctic, Ariston, Leisure, Indesit, Bauknecht, Elektrabregenz, Privileg, Flavel, Altus, Ignis and Polar makes us increasingly attractive for consumers across the European and Nordic region. Beko Nordic aims to lead the way in sustainable innovation through advanced technology that motivates households around the world to live healthier and more sustainable lives.

The product range includes a large selection of cooking appliances – ovens, hobs, extractor hoods- as well as a range of refrigerators, dishwashers and washing machines. Beko Nordic also offer small appliances such as personal care, vacuum cleaners, coffee machines and more.

Beko Nordic is a part of Beko Europe, the leading home appliances business in Europe with 16 brands in the portfolio. Beko Europe has 11 production sites across Europe, with a production capacity of approximately 24 million white goods products per year.","Household Appliance Manufacturing","51-200 employees","Public Company","Oslo","Norway","bekoeurope.com","https://www.linkedin.com/company/bekonordics"
,"OUR GREENERY","## Pioneer Award Winner 2024 ##
Now for Tomorrow. Wir schaffen innovative & smarte Design-Lösungen, um jeden zum urbanen Farmer zu machen. 

Frei von Jahreszeiten, Pestiziden & langen Lieferketten.

Unser Sortiment:
 Der Tischgarten ist eine Keramik Schale inklusive Deckel und ermöglicht das Anbauen von Microgreens und weiteren Superfoods.

Ganz ohne Erde oder Gießen.

 Der Raumgarten ist ein vollautomatisiertes Smart Home Gerät. Mit ca. 5 kg Ernte im Monat auf kleinstem Raum haben wir eine der ertragreichsten smarten Indoor Farming Produkte weltweit entwickelt. 

Hunderte Sorten an Salaten, Kräutern & Microgreens können nun direkt zuhause bei euch oder in euren Kantinen, Restaurants oder Büros angebaut werden – mit Our Greenery.

Die nächsten Produkte werden in Richtung Pilze, Heilkräuter & Fermentierung gehen.","Household Appliance Manufacturing","2-10 employees","Public Company","Berlin-Brandenburg, Berlin","Germany","ourgreenery.com","https://www.linkedin.com/company/our-greenery"
,"FreezyBoy AG","FreezyBoy ist ein funktionaler Komposteimer für deine Küche. Die Zuger Innovation macht das Entsorgen von Lebensmittelresten einfach und erzeugt eine angenehme Atmosphäre in Ihrer Küche. 
Durch Kühlung des Bioabfalls auf -5 Grad C sorgt der einzigartige Biofreezer für ein sauberes, frisches und wohlriechendes Umfeld.","Household Appliance Manufacturing","2-10 employees","Public Company","Zug, ZG","Switzerland","freezyboy.com","https://www.linkedin.com/company/freezyboy"
,"Briel","Briel is a portuguese brand of small appliances, specialized in espresso coffee machines for home and semi-professional use. The brand is born from the passion of brewing the perfect espresso, and defines itself as a unique blend of traditional craftmanship and modern technology.

We really love what we do. Briel is commited with sustainability, therefore our appliances are 100% repairable. Briel appliances are a lifetime lasting investment!","Household Appliance Manufacturing","51-200 employees","Privately Held","Braga, Braga","Portugal","briel.pt","https://www.linkedin.com/company/briel"
,"Wiggo","At Wiggo, we provide highly designed and energy friendly kitchen appliances (stoves, freezers, hobs, hoods, ovens).","Household Appliance Manufacturing","11-50 employees","Privately Held","Rotterdam, Laan op Zuid","Netherlands","wiggo.eu","https://www.linkedin.com/company/wiggo-emea-b-v"
,"ZURIGA AG","Wir sind Ingenieurinnen und Designer, wir sind aktive Zuhörerinnen und überzeugte Andersdenker. Wir haben Lust auf guten Kaffee und verantwortungsvolles Business. Seit 2016 entwickeln und produzieren wir hochwertige Espressomaschinen in eigener Manufaktur mitten in Zürich.","Household Appliance Manufacturing","11-50 employees","Public Company","Zürich","Switzerland","zuriga.com","https://www.linkedin.com/company/zuriga-ag"
,"Lavafields Group","Lavafields est le nom de l’entreprise commune créée par le regroupement de
Dalcq, ARB et Cuisidis. 

A date, Lavafields compte plus de 70 collaborateurs en Belgique et en France. 
La mise en commun des forces des trois structures permet d’investir encore plus dans le soutien de nos marques propres, la création de nouveaux produits et le développement de la distribution en Belgique, en France, en Europe et dans le monde ! 

Lavafields a pour objectif d'être le partenaire privilégié pour la distribution de ses marques propres et de distribution offrant des produits de grande qualité, innovants et fiables.","Household Appliance Manufacturing","51-200 employees","Privately Held","Courcelles, Hainaut","Belgium","lavafields.com","https://www.linkedin.com/company/lavafields"
,"HOMA EUROPE","A worldwide leader in manufacturing cooling appliances (Refrigerators and Freezers).
Always and only OEM.
Care, Design and Food Preservation drive us in everything we imagine, develop, and manufacture.
Our dedication to ""POP-exclusivity"" compels us to deliver high-quality, energy-efficient products to a broad audience. 
We believe in making sustainability accessible to all.


Homa Europe is a Representative Office that operates non-transactional activities under the control and authority of Homa Appliances Co., Ltd.","Household Appliance Manufacturing","2-10 employees","Public Company","Milano, Italy","Italy","homaeurope.eu","https://www.linkedin.com/company/homa-europe"
