"Find companies","Name","Description","Primary Industry","Size","Type","Location","Country","Domain","LinkedIn URL"
,"Roft Production Group | گروه تولیدی رُفت","گروه تولیدی رُفت در شهریور 1392 با هدف تولید لوازم و قطعات جانبی جاروبرقی شروع به کار کرد. از آنجایی که تقریبا هیچ برندی به صورت متمرکز در این زمینه فعالیت نداشت، رُفت برای تبدیل شدن به یک برند مطرح که به صورت تخصصی در زمینه تولید انواع قطعات تولیدی و مصرفی جاروبرقی فعالیت کند، با پشتوانهی نیروهای متخصص خود در این مسیر قدم نهاد.

گروه تولیدی رُفت که در زمینه تولید لوازم جانبی جاروبرقی فعالیت میکند، محصولاتی چون لوله خرطومی در سایز و ابعاد و قطر متفاوت، لوله تلسکوپی در مدلهای مختلف، کیسه جاروبرقی برای انواع جاروبرقی خانگی، صنعتی و سطلی، فیلتر جاروبرقی، زانویی جاروبرقی و ... را به تولید رسانده است.
این محصولات با توجه به نیاز مشتریان و شرکتها، در سایز و ابعاد و ویژگیهای خاص قابل تولید است تا عملکرد قابل قبولی را برای مشتریان خود رقم بزنیم.

حال پس از حدود 10 سال فعالیت در این صنعت و تجربه تولید انواع قطعات مورد نیاز، توانستهایم با تکیه بر دانش فنی و استفاده از متریال مرغوب و درجه یک در تولید، مشتریان بزرگ و کوچک زیادی را در این چرخه همراهی کنیم. 

ـــــــــــــــــــــ

Roft Manufacturing Group started its operations in August-September 2013 to produce vacuum cleaner accessories and parts. Since there were almost no concentrated brands in this field, Roft embarked on a journey to become a well-known brand specializing in the production of various vacuum cleaner parts and consumables, with the support of its specialized workforce in this path.

Roft production group, which operates in the field of vacuum cleaner accessories, products such as hose pipes in different sizes and dimensions and diameter, telescopic pipes in different models, vacuum cleaner bags for all types of household, industrial, and bucket vacuum cleaners, vacuum cleaner filter, vacuum cleaner elbow, etc. have produced.

Now, after about 10 years of activity in this industry and the experience of producing all kinds of required parts, we have been able to support many large and small customers in this cycle by relying on technical knowledge and using high and first-class quality.","Household Appliance Manufacturing","2-10 employees","Public Company","Tehran","Iran","roftco.ir","https://www.linkedin.com/company/roft-production-group"
,"Nasaelectric company","Since 2019, Nasa Electric has been a leading brand in home and kitchen appliances, delivering innovative, user-friendly, and high-performance products. With over 300 models in our portfolio, we’re committed to improving everyday life through smart design, advanced engineering, and a strong customer-first philosophy.
Our 24-month warranty and 60-month parts support reflect our dedication to long-term service and customer satisfaction. at Nasa Electric, we believe that true value lies not just in the product itself but in the experience that follows.","Household Appliance Manufacturing","201-500 employees","Self Employed","Tehran","Iran","nasa-electric.com","https://www.linkedin.com/company/nasaelectric-company"
,"Jerdazen","Jerdazen Air Purifier is at the forefront of innovation, developed by a team of expert engineers and environmental specialists committed to reducing carbon emissions and enhancing air quality.

Our goal is to provide fresh air, protect the environment, and inspire a collective effort towards a healthier living environment.

With a focus on sustainable technology and continuous improvement, we aim to redefine industry standards in air purification, striving together for a cleaner and safer future for all.","Household Appliance Manufacturing","51-200 employees","Self Owned","Wilmington, Delaware","United States","jerdazen.com","https://www.linkedin.com/company/jerdazenglobal"
,"KLIMA AC","With rapidly increasing temperatures around the globe, air con systems are becoming a necessary appliance for many households. Ironically, they contribute to environmental problems that increase the need for air cons in the first place. It does not have to be like that. Meet KLIMA.
KLIMA AC is the next-generation, customizable 3D printed air con system that improves performance and reduces energy consumption.
Most air cons on the market are made out of non-recyclable materials. They are costly in production and maintenance, they consume a lot of energy and on top of that, most are noisy and considered a somewhat ugly home appliance.
We re-imagined air con system to achieve overall efficiency and lower the negative impact on the environment.
Klima is manufactured using recycle-able 3D Printed parts, allowing us to create more attractive and personalized designs while reducing the overall production costs and environmental footprint.
The next step is to develop a prototype.
We are looking to partner up with industry experts in the manufacturing industry to turn our vision into a product.
Visit our website https://klima-ac.weebly.com/ and leave your email address if you’re interested in collaborating.
Or reach out to us via email klima-ac@mail.com","Household Appliance Manufacturing","2-10 employees","Privately Held",,,"weebly.com","https://www.linkedin.com/company/klima-ac"
,"Karfo","Karfo was found by a team of 30 years of engineering and design experience in home appliance, who have a simple mission in mind: to create home appliances that were both eco-friendly and practical. 

47% of food waste comes from households, but people are often unsure about how they can help solve the problem. That’s where we come in. We wanted to develop appliances that would help people reduce their waste and energy consumption, while also creating products that were easy to use and enjoyable. Backed by science, we give people the tools and knowledge they need to take action on food waste.

We began with a home composter, designed to turn kitchen scraps into compost quickly and easily. Not only did this reduce landfill waste, but it allowed people to use the compost in their own gardens and green spaces. Our team then decided to take their mission a step further and create a Cold Brew Coffee Maker made from recycled materials. Not only did this help reduce the amount of waste going into landfills, but it provided an enjoyable way to start the day with a delicious drink. 

We're proud to offer our customers products that are both stylish and sustainable, accessible. We hoped to inspire people to create a more sustainable lifestyle, while also providing the convenience and joy of home appliances.","Household Appliance Manufacturing","51-200 employees","Privately Held",,,"ecokarfo.com","https://www.linkedin.com/company/karfo"
,"NBFP Home Appliances Trading LLC",,"Household Appliance Manufacturing","11-50 employees","Partnership",,,"nbfphomes.ae","https://www.linkedin.com/company/nbfp-home-appliances-trading-llc"
,"Electroblaze","An innovative Electric Boiler Keeping pace with  Future","Household Appliance Manufacturing","2-10 employees","Partnership","Genoa, Liguria","Italy",,"https://www.linkedin.com/company/electroblaze"
,"Foshan Santes Technology Co., LTD","We’re Santes Technology which is focusing on Product Design and Export Business, especially about Home Appliance, Kitchen Equipment and Water Purifier. Wide experience in export business for more than 10 years, we can understand the needs of customers from the perspective of oversea customers with different cultural backgrounds, and play a good role in communication between customers and manufacturers, so as to reduce the communication costs of customers.","Household Appliance Manufacturing","2-10 employees","Self Employed","Foshan, Guangdong","China",,"https://www.linkedin.com/company/santes-technology"
,"Greentec Electric Appliance","Zhongshan Greentec Electric Appliance Co.,Ltd is a professional manufacture specialized in highly-quality kitchen appliance in Guangdong, China, our main products include range hood, gas stove, ceramic hob，induction cooker and so on. Why choose us? 
·10-15 days customization time for sample. 
·200+ newly design for every year.
·100% quality checking before shipping. 
·One-to-one VIP customer service to save your time cost. 
·50000pcs monthly capacity and over 200 employees 
·With over 50 patented designs with CE,CB,CETL certifications 
·Main supplier of the top 3 national brand in Southeast Asia market","Household Appliance Manufacturing","201-500 employees","Self Owned","Zhongshan","China","greentec-kitchen.com","https://www.linkedin.com/company/greentec-electric-appliance"
,"انجمن قطعه سازان لوازم خانگی",,"Household Appliance Manufacturing","10,001+ employees","Privately Held",,,,"https://www.linkedin.com/company/انجمن-قطعه-سازان-لوازم-خانگی"
,"TURCA HOME","Exporting home goods, kitchenwares, bathroomwares, carpets, decorative products, lighting, home textile, clothes from Turkey - Turkiye to the world.","Household Appliance Manufacturing","2-10 employees","Partnership","IZMIR, Izmir","Turkey","turcahome.com","https://www.linkedin.com/company/turca-home"
,"TCL CAC Algérie","Distributeur officiel de TCL CAC en Algérie, spécialiste des solutions de climatisation professionnelles.","Household Appliance Manufacturing","51-200 employees","Self Employed",,,"profiwest.com","https://www.linkedin.com/company/tcl-cac-algérie"
,"WINQ ELECTRONICS","Home Appliances","Household Appliance Manufacturing","Self-employed","Self Owned",,,,"https://www.linkedin.com/company/winq-electronics"
,"Ajada","A","Household Appliance Manufacturing","2-10 employees","Self Owned","Sharjah, Sharjah Emirate","United Arab Emirates",,"https://www.linkedin.com/company/ajada"
,"i-gastove","I-gaStove is an emerging company that is currently working on making the most safest and efficient gas stoves that are available in the market at present .","Household Appliance Manufacturing","2-10 employees","Public Company","Jalandhar , Punjab","India",,"https://www.linkedin.com/company/i-gastove-company-linkedin"
,"UniWide Industries Pvt Ltd","About Us!

UniWide is one of the fastest growing company in the Electronic Home Appliances and Fans segment, we, Uniwide Industries, are the pride of new and vibrant India. Having a strong foothold in the Indian market is not our limit, we also have strong presence in the African, Middle Eastern, Asian & American markets. We have earned this popularity by our hard work and focus on maintaining product quality and innovative offerings. 

Our business unit takes on the responsibility of bringing forth Air Coolers, Kitchen Appliances, Fans & cookware etc. All of these are approved as well as certified by internationally leading certification authorities like UL, Soncap, CE, SASO, CB and RoHS. These authorities confirm that our offered range of Electronic Home Appliances are one of the best in the Asian, African, Middle Eastern & American market. 

The offered items are completely safe to be used and render a reliable service to all. Further, our company is a marketing expert, hence, utilizing our talent, we have expanded our business across the globe over the years. 

We are constantly strengthening our position in the market as an exporter and manufacturer by providing high quality appliances, fans along with excellent customer support.","Household Appliance Manufacturing","11-50 employees","Privately Held","Mumbai , Maharastra","India","uniwideindustries.com","https://www.linkedin.com/company/uniwide-industries-pvt-ltd"
,"Arohha Automation","We make your homes, office spaces smart.","Household Appliance Manufacturing","2-10 employees","Partnership","Delhi, Delhi","India","arohha.com","https://www.linkedin.com/company/arohha-automation"
,"Golyo Ice","Golyo Ice hat eine einzigartige Eiswürfelform entwickelt. Welche folgende Eigenschaften in sich vereint: 
- verschliessbar und dicht
- einfach zu befüllen
- Eis ist einfach zu entnehmen
- lageunabhängig im Gefrierfach
- wiederverwendbar","Household Appliance Manufacturing","Self-employed","Public Company","Zürich, Zürich","Switzerland","golyo-ice.ch","https://www.linkedin.com/company/golyo-ice"
,"Xiamen Sunled Electric Appliances Co., Ltd","Company introduction
Xiamen Sunled Electric Appliances Co,. Ltd (belonging to Sunled Group, established in 2006), is located in the beautiful coastal city of Xiamen, which is one of the first China’s Special Economic Zones.
Sunled has a total investment of 70 million RMB and a plant area of more than 50,000 square meters. The company employs more than 350, with over 30% of them being R&D technical management personnel. As a professional home appliance supplier, we have excellent teams dedicated to product development & design, quality control & inspection, and company running. We have passed the ISO9001/IATF16949 quality management system and most of our products have CE/RoHS/FCC/UL certificates. Our product range includes electric kettles, aroma diffusers, air purifiers, ultrasonic cleaners, garment steamers, camping lights, electric heaters, mug warmers, and more. If you have any new ideas or concepts for products, please contact us. We are willing to establish business relations with your firm on the basis of equality, mutual benefit and the exchange of what each party needs.","Household Appliance Manufacturing","201-500 employees","Partnership","Xiamen , Fujian","China","isunled.com","https://www.linkedin.com/company/xiamen-sunled-electric-appliances-co-ltd"
,"TM Borgio","ТМ Borgio - український бренд кухонної та побутової техніки. Ми орієнтуємося на якість за розумну ціну. Наша мета — надавати найкращі продукти та послуги нашим клієнтам. Широкий асортимент продукції задовольнить будь-які очікування та потреби клієнтів.
Ми щодня вдосконалюємося та зростаємо як компанія, завдяки Вам.

TM Borgio is a Ukrainian brand of kitchen and household appliances. We focus on quality at a reasonable price. Our goal is to provide the best products and services to our customers. A wide range of products will satisfy any expectations and needs of customers.
We improve and grow as a company every day, thanks to you.","Household Appliance Manufacturing","51-200 employees","Privately Held",,,"borgio.in.ua","https://www.linkedin.com/company/tm-borgio-appliance"
,"NINGBO EYTRONIC ELECTRIC APPLIANCES CO.,LTD","NINGBO EYTRONIC is an experienced manufacturer and export group mainly on air fryer,sandwich maker,waffle maker,grills,blender etc.We consistently focus on quality,design and develop products line to reach multi-demands of our clients,Eytronic are always to be professional on kitchen electric appliances.Here we have years of experience R&D team,engineering,quality control,sales team in our company.Let's be your partner to get there. 
Contact:Mia,WhatsApp/Wechat:+8615967022187,email:mia@eytronic.com","Household Appliance Manufacturing","501-1,000 employees","Privately Held","Cixi, Zhejing","China",,"https://www.linkedin.com/company/ningbo-eytronic-electric-appliances-co-ltd"
,"ThermoUP","ThermoUp is a Russian manufacturer of innovative glass infrared heaters and towel dryers.
Our unique, patented and certified development has already received recognition from specialists in Russian Federation and abroad.

Our technological possibilities and production comprise the processing of aluminum profiles, the manufacturing of fireproof glass, as well as various window constructions, the manufacturing of triplex and smart glass, and the manufacturing of fire-protection constructions within the framework of aluminum, steel, and wood profiles.

This allows series production of any kind of fire protection-, safety- and other glazing and creates unprecedented production possibilities of this scale. Due to our specialization in the matter of aluminum and glass, it is possible for us to, quickly and effectively, bring our unique products to the market in large quantities. 


ThermoUp brand products possess great export potential. Our products have been successfully exported to Germany, France, Great Britain, Netherlands, Norway, Romania, Czech Republic, Chile, Republic of Kazakhstan.
We are constantly working on expanding and modernizing the current range of ThermoUp infrared heaters, as well as increasing the number of markets and points of sales for our products.","Household Appliance Manufacturing","11-50 employees","Public Company","Moscow, Moscow","Russia","thermo-up.com","https://www.linkedin.com/company/thermoup"
,"Kitchencraft Cookware Private Limited",,"Household Appliance Manufacturing","51-200 employees","Privately Held","Jalandhar, Punjab","India","kitchen-craft.in","https://www.linkedin.com/company/kitchencraft-cookware-private-limited"
,"SOYIRKAS HOLDING",,"Household Appliance Manufacturing","51-200 employees","Partnership","Алматы","Kazakhstan","dauscher.kz","https://www.linkedin.com/company/soyirkas-holding"
,"Dinegear","Dinegear.com is a leading blogging site dedicated to providing comprehensive reviews and recommendations on the best home and kitchen products in the market. Our mission is to assist users in making informed purchasing decisions by offering insightful and trustworthy insights into a wide range of products.

We understand the importance of having high-quality, functional, and reliable products in your home and kitchen. Our team of experts diligently researches and tests various items, ranging from appliances and cookware to utensils and accessories. We strive to present our users with unbiased, detailed, and accurate reviews, ensuring that they have all the necessary information to select the perfect products for their needs.

At Dinegear, we believe that everyone deserves a seamless and enjoyable home and kitchen experience. We go beyond simply reviewing products by providing valuable tips, guides, and tutorials to help our users maximize the use of their purchases and enhance their culinary skills.","Household Appliance Manufacturing","11-50 employees","Privately Held","Dhaka, Dhaka","Bangladesh","dinegear.com","https://www.linkedin.com/company/dinegear"
,"HEYDRY",,"Household Appliance Manufacturing","2-10 employees","Public Company",,,,"https://www.linkedin.com/company/heydry"
,"HANBAO INDUSTRIES INDIA PVT LTD","Established in 2010, ""Hanbao Industries India Private Limited"" has made a well-recognized name as a Manufacturer, Trader, Wholesaler and Exporter of PET Jar, Electric Fan, Plastic Stool, Plastic Cloth Hanger, Stainless Steel Idli Cooker, Plastic Floor Drain, , Plastic Water Bottle and much more. Our professionals work in close coordination to assure a high-quality assortment of products to the customers. We have recruited a team of professionals. In addition to this, to avoid disputes in the workplace, our professionals strive dedicatedly. Owing to our fare policies and the best quality products.","Household Appliance Manufacturing","51-200 employees","Privately Held","Chennai, Tamil Nadu","India","hanbaoindia.in","https://www.linkedin.com/company/hanbao-industries-india-pvt-ltd"
,"ELITE GROUP","""ELITE GROUP"" is a leading manufacturer of high-quality household appliances, dedicated to enhancing everyday living. With a diverse range of products—including semi-auto washing machines, gas stoves, electric ovens, water heaters and refrigerators—we focus on innovation, reliability, and customer satisfaction. Our team of aobut 600 skilled employees works tirelessly across our state-of-the-art factories to ensure that every appliance meets the highest standards of excellence. At ELITE GROUP, we believe that your home deserves the best, and we’re committed to delivering appliances that combine functionality with style.","Household Appliance Manufacturing","501-1,000 employees","Public Company","Samarkand, Urgut","Uzbekistan","elitegroup.uz","https://www.linkedin.com/company/elite-123"
,"Inotek Intelligent","Suzhou Inotek was founded by a group of people who have been in the floor care business over 15 years. 
We are capable of planning, designing and managing various kinds of vacuum cleaner, wet dry cleaner projects, to ensure we deliver market competitive products to our customers from aspects of innovation, supply chain stability, cost efficiency and speed to the market.","Household Appliance Manufacturing","11-50 employees","Privately Held","Suzhou, Jiangsu","China","inotek.cn","https://www.linkedin.com/company/suzhou-inotek"
,"Dyson",,"Household Appliance Manufacturing","10,001+ employees","Privately Held",,,,"https://www.linkedin.com/company/www.dyson.com"
,"KWALA","We believe rest isn’t a luxury, it’s a necessity.

Our mission is to create products that make rest effortless and deeply enjoyable, empowering you to feel restored and show up as your best self, every day.","Household Appliance Manufacturing","11-50 employees","Self Owned","Jakarta, Jakarta","Indonesia",,"https://www.linkedin.com/company/kwalasleep"
,"COOK WARRIORS ","At Cook Warriors, we blend legendary design with functionality to transform your kitchen into a world of adventure and creativity. held by VORVN GROUP
EGGSCALIBUR  is our first product. the Legendary Sword Handle frying pan. 
https://eggscalibur.cookwarriors.com","Household Appliance Manufacturing","2-10 employees","Privately Held",,,"cookwarriors.com","https://www.linkedin.com/company/cookwarriors"
,"Bismaroo Group PTY LTD","Bismaroo was born out of the challenges Australians face with strict plumbing regulations , especially in rental properties , making it difficult to install traditional bidets or bidet sprayers. 

To solve this, we created portable, rechargeable handheld bidet sprayers  that doesn't require any plumbing. Bismaroo helps Australians maintain a higher level of cleanliness, reduces reliance on tissue paper, and protects sensitive skin . Our mission is to provide a convenient solution for personal hygiene, making bidet use accessible for everyone, no matter where they live.","Household Appliance Manufacturing","2-10 employees","Self Owned","Plympton, SA","Australia","bismaroo.com.au","https://www.linkedin.com/company/bismaroo"
,"Revyve",,"Household Appliance Manufacturing","11-50 employees","Privately Held",,,,"https://www.linkedin.com/company/revyve-kitchen-composter"
,"Midwest Blender Company","Founded in 2023, Midwest Blender Company is Chicago's premier blender manufacturer and distributor. ""MBC"" blenders are known for their ability to create jams and genre-blending smoothies. Always hiring.","Household Appliance Manufacturing","2-10 employees","Privately Held",,,"midwestblendercompany.com","https://www.linkedin.com/company/midwest-blender-company"
,"keheal","Guangdong Kexi lntelligent Technology Co., Ltd., established in 2019 and headquartered in Foshan, Guangdong Province, is a national high-tech enterprise specializing in research and development, production, sales, and service.
The company is recognized as a technologically advanced and innovative enterprise.
Through independent research and technological innovation, we have launched a variety of new small household appliances, including air circulation fans, bladeless fans, heaters, humidifiers in the environmental series, and handheld garment steamers, high-speed hair dryers, and hot air straighteners in the personal care series. Notably,its bladeless fan has been recognized as a ""Guangdong Province Famous High-Tech Product.""
The company owns the independent brands ""kehea!"" and ""kexi,"" with products and users spread across the globe including North America, Europe, Vietnam, Malaysia, Thailand, and Indonesia. We have earned a solid reputationboth domestically and internationally.
With extensive experience in domestic and international cooperation, we have a diverse product line and supply chain resources to meet various customer needs. The company supports OEM and ODM cooperation models and strictly adheres to the lS09001 quality management system, ensuring the delivery of consistently high-quality products to its customers.
The following are the company's official website and Tmall store. You can also explore the company's products through the provided links:
Official Website: http://keheal.com/#/
Tmall Store: https://keheal.tmall.com/ 
If you are interested in our products or need more detailed information of products, please feel free to reply to this dynamic state or call this number 19928251538","Household Appliance Manufacturing","51-200 employees","Privately Held","深圳, 深圳市","China","keheal.com","https://www.linkedin.com/company/keheal-company"
