"Find companies","Name","Description","Primary Industry","Size","Type","Location","Country","Domain","LinkedIn URL"
,"Kurlon Enterprise Limited","Established in 1962, Kurlon is one of the oldest mattress companies in India. It offers a wide range of home comfort solutions ranging from mattresses (RC mattress, spring mattress & foam mattress), polyurethane foam, home furniture & furnishing products under the brand name Kurlon.","Mattress and Blinds Manufacturing","1,001-5,000 employees","Privately Held","Bengaluru,, Karnataka","India","kurlon.com","https://www.linkedin.com/company/kurlon-ltd"
,"Coir-On Foam Products","Coir-on Foam Products Private Limited, an ultra premium mattress industry with 36 years of experience is a perfect option for affordable range of bedding products. Our line of products is renowned for the advanced technologies and state-of the art manufacturing and quality control that guarantees support and maximum comfort which help your sleep so you can wake up energetic and rejuvenated.","Mattress and Blinds Manufacturing","201-500 employees","Privately Held","Pollachi, Tamil Nadu","India","coir-on.com","https://www.linkedin.com/company/coir-on-foam-products-private-limited"
,"PLUMATEX COLCHOES IND.","QUEM SOMOS?

A Plumatex colchões é uma empresa que se destaca como a mais moderna e bem estruturada indústria no segmento colchoeiro. Fabricando colchões de espuma, molas, cama box e camas acopladas bem como laminas de espumas industriais.
Nossa logística inclui 5 fabricas instaladas nas cidades de Anápolis (GO), Candeias(BA), Bayeux(PB), Três Rios(RJ) e Imperatriz (MA).
Nossa empresa, ao longe de seus 30 anos sempre foi focada na ética, no respeito ao ser humano e a natureza.

NOSSA POLITICA
1- Atender os requisitos de nossos clientes;
2- Melhoria de nossos processos produtivos;
3- Desenvolver colaboradores, clientes e parceiros.

NOSSA MISSÃO
Buscar continuamente melhoria de nossos produtos, dentro do forte espirito ético, promover o desenvolvimento de nossos colaboradores e parceiros como forma de atender aos requisitos de nossos clientes.","Mattress and Blinds Manufacturing","501-1,000 employees","Privately Held","Anápolis, GO","Brazil","plumatex.com.br","https://www.linkedin.com/company/plumatex-colchoes-ind"
,"Rodrigues Colchões","Iniciamos nossas atividades no dia 2 de abril de 2021 com 16 lojas, 1 CD e uma Fábrica, no decorrer do processo abrimos mais 6 em pontos estratégicos. Com o crescimento nas vendas, atualmente no Amazonas  estamos com 21 lojas, 1 fábrica e 1 CD.  Roraima com 4 lojas e 1 CD. Pará com 42 lojas e 2CDs.","Mattress and Blinds Manufacturing","201-500 employees","Privately Held","Manaus, Amazonas","Brazil","rodriguescolchoes.com.br","https://www.linkedin.com/company/rodrigues-colchões"
,"SPA EL FATH","Depuis 1984, Spa Elfath est votre expert en literie, possédant une expertise de plusieurs années dans la production de matières premières telles que la mousse et la fibre synthétique, ainsi que dans la fabrication de produits finis. Spa Elfath est le leader dans son domaine grâce à sa grande infrastructure et à sa large flotte. Nous offrons une gamme diversifiée de produits pour répondre aux besoins de nos clients et garantir leur satisfaction. Notre engagement à innover et à créer de nouveaux produits avec une amélioration continue a pour but d'offrir à nos clients une vie confortable et agréable.","Mattress and Blinds Manufacturing","1,001-5,000 employees","Privately Held","larbaa, blida","Algeria","spaelfath.dz","https://www.linkedin.com/company/spa-el-fath-unité-larbaa"
,"Ship Shape IMO - Marine/Offshore Compliant Mattresses and Hotel Supplies","Ship Shape IMO is part of Ship Shape World LTD based in the UK, we are International off-shore cabin Equipment and Consumable Suppliers, specialising in IMO, SOLAS Compliant, MED WheelMarked, Source 5 and 7, MLC, MODU Code and USCG Approved products for offshore use. With our production facilities, we produce a comprehensive range of hard and soft furnishing products including Beds, Mattresses, Pillows, Duvets, Sheets, Bedding, Towels, DRY-Mat anti-condensation mattress ventilation underlay, Furniture, Curtains, Shower Curtains, Lockers, Flooring and many more products which meet the stringent safety standards required for an off-shore Vessel/Rig. What is ideal for life at home isn’t always suitable for life at sea nor does it meet the required levels of fire safety. Here at Ship Shape IMO our aim is to supply our customers with fully compliant products to reduce the potential disruptions and unnecessary expense to corporations.

“Surveyors and port officials have the power to fine or block movements of vessels for failure to comply with the required legislation”

Our aim is to make sure this doesn’t happen, we are here to give advice and make sure your heading in the right direction.

We have supplied products to Commercial Cargo Shipping Vessels, Off Shore Energy Rigs, Ferries, Passenger Vessels and Military Vessels. 

Contact us today by phone on +44 (0) 3333 580 233 
or
Send your email enquiries through to Info@shipshapeIMO.co.uk","Mattress and Blinds Manufacturing","11-50 employees","Privately Held","Catfield, England","United Kingdom","shipshapeimo.co.uk","https://www.linkedin.com/company/ship-shape-imo"
,"Sunluxoficial","A Sunlux possui umas das maiores estruturas fabril com sede própria do Sul do Brasil. Fábrica de persianas e as tradicionais cortinas de tecido. Produtos com até 05 anos de garantia. Representante Stobag empresa líder em fabricação de produtos em proteção externa reconhecida mundialmente por tecnologia e qualidade dos produtos.","Mattress and Blinds Manufacturing","11-50 employees","Privately Held","Campo Bom, Rio Grande do Sul","Brazil","sunlux.com.br","https://www.linkedin.com/company/sunluxoficial"
,"SLEEP INNOVATIONS PRIVATE LIMITED","We’re not just a Mattress factory – we are artisans, craftsmen, masters of “The Craft” of mattress making. Through our strategic partnerships and ongoing commitment to comfort, the Sleep & snooze family is dedicated to providing people with the comfortable, durable, and reliable sleep solutions they need to stay rested and refreshed on the road. In fact, our goal is to make a mattress so comfortable that you’ll be dreaming about it and our team will provide your lifetime experience and comfort. Contact our team to get a quote on your mattress today!

We are happy to cater to your needs! Because you deserve the best sleep on a mattress.

We all deserve a good night’s sleep after a tiring day, and nothing can help guarantee it better than a well-chosen mattress specific to your liking. Picking a mattress is a once-in-a-decade activity and a big financial investment, and you want to be sure you have as much information as possible in order to make the right decision.

We take your sleep seriously. Our factories adhere to the strictest quality
and production protocols under international regulations. We test all of the materials several times throughout the production process. And we carefully inspect every single mattress as it leaves the production line to make sure it’s headed to your home ready to provide sleep you’ve only dreamed of.","Mattress and Blinds Manufacturing","51-200 employees","Privately Held","Coimbatore, Tamilnadu","India","sleepandsnooze.in","https://www.linkedin.com/company/sleep-innovations-private-limited"
,"Yuantian Mattress Machinery","Yuantian Company was established in 1982 and is located in Foshan City, China. It covers an area of 200,000 square meters (approximately 300 mu), boasting a garden-style ecological environment, high-standard production workshops, and advanced self-developed production equipment.
As one of the high-tech enterprises specializing in the production of mattress machinery, Yuantian Company is committed to researching and developing, as well as providing professional overall solutions for mattress machinery to global mattress industry users. Its products have been exported to more than 100 countries and regions around the world.","Mattress and Blinds Manufacturing","51-200 employees","Self Employed",,,"yuantian.com","https://www.linkedin.com/company/yuantian-mattress-machinery"
,"ScreenALL Window Fashion LLP","Discover the perfect fusion of style and functionality with ScreenAll Window Fashions. As your premier destination for window covering solutions, we pride ourselves on offering a comprehensive range of blinds, insect screens, shutters, and curtain systems.

Based in Mumbai, we thrive on forging close partnerships with architects, interior designers, and discerning homeowners. Our commitment to personalized service ensures that we cater to your unique needs, whether you're seeking manual or motorized options, for residential, commercial, or institutional spaces, both domestically and internationally.

Crafted with precision using premium components and fabrics sourced from Europe, America, and South East Asia, our custom-made products epitomize quality and durability. We strive to deliver not just products, but experiences, blending beauty, functionality, and reliability seamlessly.

At ScreenAll Window Fashions, we believe in transparency and affordability. Our value-for-money pricing and end to end services ensures that you receive unparalleled quality and exceptional customer service.

Explore our website with confidence, knowing that you'll find the perfect product and the information you need to elevate your space with our exquisite window fashions.","Mattress and Blinds Manufacturing","2-10 employees","Privately Held","Mumbai, Maharashtra","India","screenall.in","https://www.linkedin.com/company/screenallwindowfashionllp"
,"Industrias Florida S.A","Somos una empresa 100% guatemalteca con más de 35 años en el mercado, nos hemos logrado posicionar en la mente de nuestros clientes a nivel nacional y centroamericano, con una expansión en diversos países como en El Salvador, Honduras, Belice y Nicaragua; contando con dos plantas de producción una en Guatemala, Honduras y próximamente en República Dominicana.","Mattress and Blinds Manufacturing","1,001-5,000 employees","Privately Held","Ciudad de Guatemala","Guatemala","camasflorida.com","https://www.linkedin.com/company/industriasflorida"
,"SMARTSHADE","Located in the heart of Dublin, Smartshade offers the most stylish and future-proof smart blinds, where simplicity, safety and energy-efficiency are key to the design. Always finding the right window treatment to fit any space. Together with our reliable dealers, we help our customers every step of the way. 

As a leading innovation brand for the smart shading industry, we love to offer our customers a total solution of fabrics, systems and smart technology. We build and nurture long-term partnerships. Always focusing on delivering the finest quality and providing a first-class service across Ireland and the UK.

Smartshade is an official brand partner of Coulisse, the inspirational window coverings brand from the Netherlands. With a shared vision for smart blinds and a flair for entrepreneurship, we are proud to represent our co-branded Coulisse | Smartshade collections.

Our team of passionate professionals are always happy to help you with any question or query you may have. Please feel free to get in touch. We would love to hear from you.","Mattress and Blinds Manufacturing","11-50 employees","Privately Held","Dublin, Leinster","Ireland","smartshade.ie","https://www.linkedin.com/company/smartshadeireland"
,"The Bed Shop SA","The Bed Shop is South Africa’s largest independent franchise bed retailer.","Mattress and Blinds Manufacturing","1,001-5,000 employees","Public Company","krugersdorp",,"thebedshop.co.za","https://www.linkedin.com/company/the-bed-shop-sa"
,"QINGDAO ROADZEAL TEXTILE CO.,LTD","Qingdao Roadzeal Textile Co., Ltd is one of the most professional Tpe matteress; tpe sheet; tpe pillow,Memory foam pillow and home production manufacturers & suppliers in China, one that always focusing on quality control, market demanding, brand building, value and service, and partner win-win cooperation.
Roadzeal  production have TPE Pillow;TPE Kid Pillow; TPE Flat Pillow,TPE Wave Pillow, Tpe Foam Pillow; TPE Butterly Pillow;  TPE Latex Pillow; TPE cushion; Tpe Site Cushion; Tpe Back Cushion; Composite Pillow,TPE Sheet, TPE Mattress Sheet;  TPE Mattress; Gel Grid mattress,TPE Home Product; TPE Bed Product; Tpe Product; Gel Mattress; Gel Pillow; Memory Foam Pillow;  Memory Foam Cushion; Mattress;  Memory foam knee pillow; Gel memory foam seat cushion; Gel Memory Foam Travel Pillow; Gel Memory Foam Pillow; Memory foam lumaber support Back Custom; Gel Memory Foam Foot Rest Pillow; Memory Foam Baby Pillow; Memory Foam Baby Products; Memory Foam Dog Bed Pad, Memory Foam Cat Bed Pad; Memory foam Refractory material pillow, Fireproof Pillow and other memory foam product; bed product; home product; foam product; PU prdocut, Gel Product; Latex pillow; Latex mattress; Latex U Pillow; Latex Baby Pillow; Latex Baby Bed,Down Pillow; Fiber Pillow; Fiber Product; textile; hotel pillow; hotel bed product; hotel mattress; foam; Silk Pillow; Silk cover sheet pillow; Pillowcase; Massage Pillow; Car Pillow; Car Cushion; Air Mattress; Air Pillow; Outdoor Mattress; Outdoor Mattress; Beach Mattress; Massage Mattress; Etc, Which is in strict accordance with the International standard. PRODUCT have been approved by legalized organization like ISO9001 , BSCI,ROHS, SGS and REACH Certificate.
TPE pillows and mattresses can be customized in color according to customer requirements, including purple; yellow; green; black; white; orange, Etc.We also accept OEM with customer. 
Looking forward to cooperating with partners from all over the world!","Mattress and Blinds Manufacturing","51-200 employees","Privately Held","QINGDAO, SHANDONG","China","roadzeal.com","https://www.linkedin.com/company/qingdao-roadzeal-textile-co-ltd"
,"Karibian Descanso","Karibian Descanso es una marca especializada en la fabricación de sistemas de descanso. Su experiencia en el sector, la posiciona hoy en día como una de las marcas líderes y referentes dentro del exigente mundo del descanso.

Los modelos de descanso de Karibian, combinan la maestría técnica, con el diseño exclusivo y las mejores materias primas. Mediante un proceso de fabricación realizado con gran atención al detalle por profesionales especializados e identificados con el proyecto y la visión de futuro de la marca. Cada modelo de confort, representa lo mejor del diseño “made in Spain” en la industria y constituye una buena muestra del compromiso con la calidad.

En la actualidad, la firma cuenta con gran proyección nacional e internacional. Karibian exporta sus modelos a más de 20 países en diferentes continentes.

Para ello necesitamos disponer de 3 factores.

1. Capital Humano: 120 profesionales y una red comercial compuesta por asesores del descanso.

2. Un sistema de trabajo perfectamente ensamblado y adecuado a las necesidades de nuestros clientes.

3. Unas instalaciones de última generación con 30.000 m2 de tejido industrial, maquinaria avanzada en confección y sobre todo materias primas de primera calidad, que nos garantizan el disfrute de un descanso reparador y aportar nuevas sensaciones, elegancia y confort.","Mattress and Blinds Manufacturing","51-200 employees","Privately Held","Yecla, Murcia","Spain","karibiandescanso.com","https://www.linkedin.com/company/karibian-descanso"
,"Marion Italia","Marion è la fabbrica di materassi in lattice creata per raggiungere 2 importanti obiettivi.

Il primo nasce da un pensiero di Friedrich Nietzsche: “Quando la virtù ha dormito si alza più fresca”.
Estendere i benefici di un buon sonno è l’obiettivo che ha spinto Marion a vendere al pubblico con prezzi da ingrosso. Il lattice è un materiale tanto prezioso quanto raro e proprio queste 2 caratteristiche lo rendono economicamente inaccessibile. 
È per questo che Marion si è dotata di una struttura organizzativa intelligente, che ha fatto a meno di intermediari e rivenditori, per semplificare il rapporto produttore-consumatore, e dare a tutti l’opportunità di possedere un materasso in lattice a prezzi di fabbrica.
Il secondo obiettivo è espresso dal pay off dell’azienda: SOLUZIONI PER DORMIRE. Il sonno è diverso in ognuno di noi: cambia nei modi, nella quantità e nella qualità, da persona a persona. È per questo che Marion offre sistemi di riposo personalizzabili. Grazie alla sua vasta gamma di materassi in lattice, guanciali e reti a doghe, è in grado di assecondare le esigenze di qualsiasi cliente.
Marion nasce nel 1999 col preciso intento di diffondere la cultura del riposo in Italia. È negli ambienti accademici, nei centri di studio e ricerca che Marion muove i primi passi. L’obiettivo è quello di individuare il materiale ideale, quello che più di tutti assicura ergonomicità, igiene e biocompatibilità.
Il lattice registra le migliori performance e nel 1999 prende avvio la produzione del primo materasso in lattice Marion.","Mattress and Blinds Manufacturing","501-1,000 employees","Partnership","Forlì, FC","Italy","marionlatex.com","https://www.linkedin.com/company/marion-italia"
,"Blind Designs","Blind Designs has a selection of window coverings designed to enhance your domestic or commercial space. Hardware systems are designed to be durable, reliable and easy to use. A range of performance fabrics and materials are available to compliment your practical requirements. 

Contact us today for assistance or to learn more about our product ranges and their benefits.","Mattress and Blinds Manufacturing","51-200 employees","Privately Held","Johannesburg, Gauteng","South Africa","blinddesigns.co.za","https://www.linkedin.com/company/blinddesigns"
,"SleepHigh","The official page of Sleep High Egypt - the Arabian Factory for the manufacture of mattresses and foam.
.الصفحة الرسميه لشركة سليب هاي مصر ـ المصنع العربي لصناعة المراتب و الاسفنج","Mattress and Blinds Manufacturing","51-200 employees","Partnership","6 October","Kazakhstan","sleephigh-eg.com","https://www.linkedin.com/company/sleephigh"
,"Grupo Topázio | Colchões, Estofados e Móveis","O Grupo Topázio é referência em qualidade e inovação no setor de colchões, estofados e móveis no Norte e Nordeste do Brasil. Com quase 30 anos de experiência e 8 unidades fabris estrategicamente localizadas, oferecemos produtos que aliam conforto, durabilidade e design moderno. Atendemos grandes varejistas e o consumidor final, sempre com o compromisso de proporcionar as melhores soluções para o descanso e o bem-estar.

Somos pioneiros na aplicação de tecnologias avançadas em nossos colchões e estofados, garantindo produtos com excelência e longa durabilidade. Nossa equipe dedicada e comprometida trabalha incansavelmente para consolidar a liderança da Topázio no mercado.

Localizações: Maranhão / Ceará / Paraíba / Pernambuco / Bahia / Goiás / Pará

Nossa Missão: Levar conforto e qualidade aos lares de nossos clientes, com produtos que combinam tradição, inovação e excelência.

Nossa Visão: Ser reconhecido como o maior e melhor grupo de colchões e estofados das regiões Norte e Nordeste do Brasil.

Nossos Valores: Qualidade, Compromisso, Sustentabilidade e Foco no Cliente.","Mattress and Blinds Manufacturing","501-1,000 employees","Privately Held","Imperatriz, Maranhão","Brazil","grupotopazio.com.br","https://www.linkedin.com/company/grupotopázio"
,"Blind Designs Commercial","Blind Designs has a selection of window coverings designed to enhance the work environment. Hardware systems are designed to be durable, reliable and easy to use. A range of performance fabrics and materials are available to compliment the practical requirements of your commercial spaces - such as offices, hotels, banks restaurants, hotels, retail, medical facilities, and more. 

Contact us today for assistance or to learn more about our product ranges and their benefits.","Mattress and Blinds Manufacturing","51-200 employees","Privately Held","Johannesburg, Gauteng","South Africa","blinddesigns.co.za","https://www.linkedin.com/company/blind-designs-commercial"
,"InDream","InDream is a young and dynamic company based in the north of Portugal, whose main objective is to provide the best rest experience to its customers at fair prices!

We are manufacturers and we want to provide our customers with a wide variety of mattresses and sleep products, because we know that each of us has our own unique way of sleeping.

In this sense, InDream created several brands with resources designed specifically to meet the needs of different types of people.

From foam mattresses to bonnel spring or pocket spring mattresses, you will always find a product that meets your comfort needs.","Mattress and Blinds Manufacturing","2-10 employees","Privately Held","Santa Maria da Feira, Aveiro","Portugal","indreamsleep.com","https://www.linkedin.com/company/indreamsleep"
,"سليب لاينSleepline","Sleepline was established in the Kingdom of Saudi Arabia as a company specialized in manufacturing the finest mattresses based on its selection of types of the best  materials, to ensure the highest levels of quality, fits the customer’s needs, and provide the highest means of Comfortable and healthy sleep.","Mattress and Blinds Manufacturing","201-500 employees","Partnership","jeddah, jeddah","Saudi Arabia","sleepline.com.sa","https://www.linkedin.com/company/سليب-لاينsleepline"
,"INDIGO HOME MATTRESS","Priya Creations Indigo Home Mattress We deal in Mattress, mattress protector, mattress cover, mattress comforter,
Free Delivery -  All GURUGARAM And DELHI - NCR
1. Memory foam Mattress
2. Latex Mattress
3. Orthopedic mattress
4. Pillow top mattress
5. Queen size mattress
6. Pillow top mattress
7. High Resilience Foam Mattress
8. Single, Double, Queen, king & size mattress","Mattress and Blinds Manufacturing","2-10 employees","Privately Held","Gurgaon, Haryana","India","indigohome.co.in","https://www.linkedin.com/company/priya-creations"
,"DOREMI","DOREMI est synonyme de systèmes des matelas intelligents en qualité haut de gamme. Un grand savoir-faire en utilisant des technologies les plus avancées et des matières révolutionnaires .
Ils apportent ainsi une réponse individuelle à toutes les exigences. Fonctionnels, confortables et artisanale, pour offrir à toutes les morphologies un sommeil parfait.","Mattress and Blinds Manufacturing","51-200 employees","Self Employed","Tanger","Morocco","doremi.ma","https://www.linkedin.com/company/doremimaroc"
,"Jaluz.mmc","həğr/zaman/keyfiyyətimizlə/müştərilərimizin xidmətindəyik/qiymətlərimiz 
[whatsapp];051 512 36 66","Mattress and Blinds Manufacturing","11-50 employees","Self Owned","Bakı","Azerbaijan",,"https://www.linkedin.com/company/bystore-barentin"
,"Sleep High","إنطلقت سليب هاي منذ حوالي نصف قرن بحصولها على أول ترخيص صناعي لصناعة مراتب السست عام 1963 وما زالت تواصل مسيرة إنجازاتها وجهودها الحثيثة نحو التطور والإزدهار حتى إستطاعت بفضل الله ثم جهود عامليها أن تقدم للسوق المحلي والعربي منتجات ذات جودة عالمية وإعتمادية تلبي إحتياجات مختلف شرائح المجتمع تحت علامتها التجارية (سليب هاي)","Mattress and Blinds Manufacturing","51-200 employees","Privately Held","Al Faisaliyah District, Makkah","Saudi Arabia","sleephigh.com","https://www.linkedin.com/company/sleephighmena"
,"Shree Venkateshwara Foams LLP","Shree Venkateshwara Foams LLP is a new retail venture of Sree Trio Poly Tech which is established in 2010 to give a perfect and comfortable Spine while sleeping. 

Sleepkare is the registered brand of Shree Venkateshwara Foams LLP for our range of Mattresses and products. We are specialized in Pure Foam filler-less mattresses catering to international standards.

We have a production facility at Chandanvelle IALA where all our products are manufactured. All the products comply with BIS standards and follow stringent RoHS & REACH norms. Our Retail products range from High Density and Orthopaedic mattresses, pillows, and cushions. We cater to industrial supplies for their order-based specialty foams and packaging foams.","Mattress and Blinds Manufacturing","11-50 employees","Partnership","Hyderabad, Telangana","India","sleepkare.com","https://www.linkedin.com/company/shree-venkateshwara-foams-llp"
,"Hästens Madrid","Creamos sueños excepcionales desde 1852. Cada colchón es una obra de arte hecha a mano con materiales 100% naturales, diseñados para ofrecer el descanso más lujoso y reparador.","Mattress and Blinds Manufacturing","51-200 employees","Privately Held","Madrid, Community of Madrid","Spain","hastens.com","https://www.linkedin.com/company/hastensmadrid"
