"Find companies","Name","Description","Primary Industry","Size","Type","Location","Country","Domain","LinkedIn URL"
,"American Life Mattress","American Life Mattress
India’s No.1 Mattress Manufacturing Company

Based in the heart of Navi Mumbai, American Life Mattress stands as India’s leading name in premium mattress manufacturing. Renowned for our commitment to comfort, durability, and innovation, we specialize in custom-sized beds and 100% natural latex mattresses tailored to fit every individual’s needs.

Whether you're looking for a luxurious sleep experience, ergonomic support, or a non-standard bed size, our expert craftsmanship and high-quality materials ensure you get nothing but the best. With a strong reputation built on trust, quality, and customer satisfaction, American Life Mattress is redefining sleep for Indian homes.

Sleep Better. Live Better.","Mattress and Blinds Manufacturing","51-200 employees","Partnership","NAVI MUMBAI, Maharashtra","India","almattress.com","https://www.linkedin.com/company/american-life-mattress"
,"Brothers Mattress","We are manufacturer of top quality mattress, Now you can buy mattress of your own choice from us directly at factory rates. We are manufacturing all kind of mattresses with no quality compromise.","Mattress and Blinds Manufacturing","51-200 employees","Partnership",,,,"https://www.linkedin.com/company/brothers-mattress"
,"ASIA GREEN FOAM PVT LTD",,"Mattress and Blinds Manufacturing","11-50 employees","Partnership",,,,"https://www.linkedin.com/company/asia-green-foam-pvt-ltd"
,"Colchones Y Espumas Dormilandia S A S","Dormilandia es una empresa colombiana especializada en productos para el descanso y el hogar. Su catálogo incluye colchones, colchonetas, almohadas, ropa de cama, bases de cama y muebles, todos fabricados en Colombia. La empresa se enfoca en ofrecer productos de alta calidad para garantizar un sueño reparador. 
COLCHONESDORMILANDIA.CO

Además de su tienda en línea, Dormilandia comercializa sus productos a través de plataformas como Homecenter. 
HOMECENTER.COM.CO
 y Falabella 
FALABELLA.COM.CO
, facilitando el acceso a sus productos en todo el país.

La empresa también cuenta con una tienda oficial en Mercado Libre, donde ofrece una variedad de productos para el descanso y el hogar. 
MERCADOLIBRE.COM.CO

Dormilandia se destaca por su compromiso con la calidad y el confort, buscando mejorar la experiencia de descanso de sus clientes a través de una amplia gama de productos diseñados para satisfacer diversas necesidades y preferencias.","Mattress and Blinds Manufacturing","11-50 employees","Partnership","BOGOTA,D.C","Colombia","colchonesdormilandia.co","https://www.linkedin.com/company/colchones-y-espumas-dormilandia-s-a-s"
,"مفارش كواليتي رينغز","الحساب الرسمي لمفارش كواليتي رينغز للمراتب والمفارش وتجهيز الفنادق","Mattress and Blinds Manufacturing","11-50 employees","Privately Held","jeddah","Saudi Arabia","qualityrings.sa","https://www.linkedin.com/company/qualityringssa"
,"Sleep Fitt Mattress","Sleep fitt proudly introduces a wide range of mattresses to the hospitality industry. The double tempered alloy springs are used for durability and elasticity. We use flex layers to reduce static electricity which is the main reason behind headaches and back pains.","Mattress and Blinds Manufacturing","11-50 employees","Public Company","Noida, Uttar Pradesh","India","sleepfitt.com","https://www.linkedin.com/company/sleep-fitt-mattress"
,"Brentaflex","Since 1968 Brentaflex produces artisanal and customized sleep solutions. 

Our collection 100% made in Italy combines: innovation, high quality materials and essential design. Mattress selection offers different products mainly pocket springs, bonnell springs, foam, memory foam and latex. 
Moreover to maximise the experience of a good sleep we offer a wide range of metal and wood frames, hand-made upholstered beds and other accessories.

The offer consists of two main segments Home and Hotel that differ for type of materials and features to ensure the perfect result for its use.","Mattress and Blinds Manufacturing","11-50 employees","Privately Held","Cittadella, Veneto","Italy","brentaflex.com","https://www.linkedin.com/company/brentaflex"
,"Dormio Sleep Quality","BOXSPRINGS - MATRASSEN - MADE in BELGIUM
LAGE PRIJS - HOGE KWALITEIT

GRATIS keuze uit 300 kleuren

GRATIS keuze uit hoogkwalitatieve PU-leder of Stof

GRATIS keuze uit 45 verschillende hoofdborden

GRATIS aanpassing hoogte / breedte hoofdbord 

GRATIS 10 Jaar garantie

Leveringstermijn 1-2 weken of later naar wens

Handgemaakt in België","Mattress and Blinds Manufacturing","2-10 employees","Self Owned","Ranst, Vlaanderen","Belgium","dormiosleeping.com","https://www.linkedin.com/company/dormio-sleep-quality-ranst"
,"Simmons Italia","Simmons è il primo marchio al mondo nel segmento del dormire: produttore internazionale attivo in 101 paesi del globo distribuiti in tutti i continenti, il suo brand è unanimemente riconosciuto come sinonimo di qualità ed è presente negli alberghi più importanti e prestigiosi. Ogni passaggio operativo, dalla selezione delle materie prime alla loro lavorazione e assemblaggio, è realizzato direttamente all’interno degli stabilimenti Simmons in Italia.","Mattress and Blinds Manufacturing","51-200 employees","Partnership","Bovisio Masciago, Lombardy","Italy","simmons.it","https://www.linkedin.com/company/simmons-italia"
,"SleepyHug Mattress","Sleepyhug is a brand of Prime Comfort Products Pvt. Ltd. It is an ISO 9001:2015 certified manufacturer of high-quality flexible polyester and polyether PU Foam. It has set up a world-class manufacturing facility at Greater Noida (Uttar Pradesh) Unit 1 spread over 30,000 sq. mt. to serve the north and Ahmedabad (Gujarat) Unit 2 spread over 34,000 sq. mt. to help the west and very soon going to start Unit 3 to do the south.","Mattress and Blinds Manufacturing","51-200 employees","Privately Held","Greater Noida, UP","India","sleepyhug.in","https://www.linkedin.com/company/sleepyhugindia"
,"Colchões Newflex","Quem Somos: A Newflex e a História por Trás da Nossa Marca

Bem-vindo à Newflex, uma empresa que nasceu do compromisso em proporcionar o melhor sono possível para todos os que acreditaram e confiaram na marca. Somos uma empresa que faz parte do respeitado Grupo Icea, cuja jornada começou em 1998 na região metropolitana de Curitiba, no Paraná, com a fabricação própria de estofados.

A Icea, ao longo dos anos, cresceu e se consolidou como uma das maiores referências no estado do Paraná, atendendo tanto em suas próprias lojas quanto fornecendo sofás para centenas de lojistas em todo o Brasil. Essa trajetória de sucesso foi construída com dedicação, qualidade e compromisso com os clientes.

A marca Newflex é uma extensão da paixão por proporcionar conforto e bem-estar. Ela reflete o desejo de concentrar todos os esforços em aprimorar ainda mais a qualidade de seu sono. Esse compromisso aparece em cada detalhe de nossos produtos, desde a seleção criteriosa dos materiais até a variedade de modelos cuidadosamente projetados para atender a todas as necessidades.

Quando você escolhe um colchão Newflex, está escolhendo o resultado de anos de experiência e dedicação à excelência.

Agradecemos por sua confiança em nossa marca e estamos comprometidos em continuar aprimorando nossos produtos e serviços para garantir que você tenha as melhores noites de sono possíveis.

Sinta-se à vontade para explorar nossa linha de colchões e descubra o que torna a Newflex a escolha ideal para o seu conforto e bem-estar. Estamos aqui para ajudá-lo a dormir melhor, porque acreditamos que todos merecem acordar revigorados e prontos para enfrentar o dia.

Bem-vindo à Newflex, onde a qualidade do sono é a nossa paixão e a sua satisfação é a nossa prioridade.","Mattress and Blinds Manufacturing","51-200 employees","Privately Held","Araucária, Paraná","Brazil","newflex.com.br","https://www.linkedin.com/company/colchoesnewflex"
,"Snuuzu","Coming soon..","Mattress and Blinds Manufacturing","2-10 employees","Privately Held",,,"snuuzu.com","https://www.linkedin.com/company/snuuzu"
,"VIMA Solutions Sagl","Il buon Riposo migliora la qualità della Vita. Noi di VIMA vogliamo far riposare meglio le persone. Pertanto offriamo solo prodotti sartoriali, fatti su misura e sulle esigenze specifiche di ognuno. Curiamo tutti dettagli offrendo materiali di massima qualità e tecnologici sempre nel rispetto ecologico. Il nostro AirGum, il materiale principe per il buon riposo, poi lino, seta, cotone, e il nostro fiocco d'oca, termofresco, il faggio multistrato e altro ancora. I nostri prodotti permettono un sistema completo per il corretto e migliore riposo, essenziali per migliorare la qualità della vita e ridurre nel tempo la possibilità di alcune patologie. Esempio dormire su materassi di vecchia concezione comporta un serie di seri problemi che nel tempo si manifestano. Visitate il nostro sito per maggiori informazioni. Offriamo: Materassi sartoriali e ortopedici, guanciali, reti e doghe , reti elettriche e con massaggi integrati, sistemi letto, cuscini, piumini e accessori per il benessere del riposo.","Mattress and Blinds Manufacturing","11-50 employees","Privately Held","Lugano, Ticino","Switzerland","vimasolutions.ch","https://www.linkedin.com/company/vima-solutions-sagl"
,"Rollxpert AG","Willkommen bei der Rollxpert AG – Ihr Experte für Rollladen, Markisen und Beschattungssysteme
Bei der Rollxpert AG dreht sich alles um Ihren Komfort und Ihre Zufriedenheit. Ob Sichtschutz, Sonnenschutz oder zuverlässige Reparaturen an Rollladen , Markisen und anderen Beschattungssysteme – wir stehen Ihnen mit unserer langjährigen Erfahrung und Leidenschaft zur Seite.
Unser Ziel ist es, Ihnen den besten Service zu bieten: schnell, zuverlässig und professionell. Mit einem engagierten Team aus Fachleuten stehen wir Ihnen jederzeit zur Verfügung – sei es für Reparaturen, Wartungen oder individuelle Beratungen. Wir hören zu, verstehen Ihre Bedürfnisse und entwickeln Lösungen, die genau zu Ihnen passen.
Wir verstehen, wie wichtig funktionierende Rollladen und Stores für Ihren Alltag sind – sei es, um Ihr Zuhause vor Sonne, Hitze oder neugierigen Blicken zu schützen, oder um die Atmosphäre in Ihren Räumen zu verbessern. Unser Fokus liegt auf Qualität, Präzision und einer individuellen Betreuung, um sicherzustellen, dass Ihre Systeme nicht nur perfekt funktionieren, sondern auch Ihren ästhetischen Ansprüchen gerecht werden.
 Warum Rollxpert AG?
•	Zuverlässigkeit: Wir halten, was wir versprechen – pünktlich, kompetent und verbindlich.
•	Erfahrung: Unser Team bringt langjährige Expertise in der Reparatur und Wartung von Rollladen, Markisen und Beschattungssystemen mit.
•	Innovation: Wir setzen auf moderne Techniken und Lösungen, um Ihre Anforderungen optimal zu erfüllen.
•	Kundennähe: Ihre Zufriedenheit ist unser Maßstab. Wir sind erst zufrieden, wenn Sie es sind.
Egal, ob es um die Reparatur eines beschädigten Rollladens, die Wartung Ihrer Markisen oder die Planung eines neuen Beschattungssystems geht – wir sind Ihr zuverlässiger Partner.
Vertrauen Sie auf die Rollxpert AG – Ihr Experte für Sichtschutz, Sonnenschutz und Überwachungssysteme. Lassen Sie uns gemeinsam dafür sorgen, dass alles rundläuft. Kontaktieren Sie uns und erleben Sie Service auf höchstem Niveau!","Mattress and Blinds Manufacturing","2-10 employees","Public Company","Schlieren, Zürich","Switzerland","rollxpert.ch","https://www.linkedin.com/company/rollxpert-ag"
,"DRD Furnishing","Welcome to DRD furnishing! We are a premier provider of high-quality hospital equipment and furnishings, dedicated to creating safe and comfortable environments for patients and healthcare professionals alike.

Established in 2019, our company has quickly become a trusted name in the healthcare industry. We specialize in a wide range of hospital products and services, including hospital curtain track systems, window roller blinds, IV hangers, wall guards, corner guards, hospital furniture, and much more. 

DRD Furnishing, a renowned manufacturer of hospital curtain and track systems, offers a wide range of top-quality products at highly competitive prices. With our state-of-the-art manufacturing unit dedicated to curtain production, we ensure exceptional craftsmanship and durability. Our commitment to timely delivery has earned us a strong reputation in the industry. Presently, we cater to clients across India and also export to neighboring countries, expanding our global presence.

At DRD Furnishing, we are committed to providing the best possible solutions for our clients. We understand that each healthcare facility has unique needs, and we work closely with our clients to design and install custom solutions that meet their specific requirements. 

Our team of experienced engineers and installers are dedicated to delivering exceptional customer service. We take pride in our attention to detail, and we are always available to answer any questions or concerns our clients may have. 
We believe that our hospital equipment and furnishings can make a significant difference in the lives of patients and healthcare professionals. That's why we only work with the highest quality materials and manufacturers, ensuring that our solutions are durable and safe. 

Thank you for considering DRD Furnishing for your hospital equipment and furnishings needs. We are confident that we can provide the solutions you need to create a safe and comfortable healthcare environment.","Mattress and Blinds Manufacturing","2-10 employees","Self Employed","Ghaziabad, Uttar Pradesh","India",,"https://www.linkedin.com/company/drdfurnishing"
,"The Blinds Experience","Quality blinds at a price you can afford | We Help You Create the Perfect Home:Blinds that Reflect Your Style and Transform Your Living Space  |

The Blinds Experience is the result of four individuals wanting to create a values-based company that has a real point of difference for its customers, and operates ethically and with integrity in our community.

Our background brings together over 10 years of combined customer relationship and blinds industry operational experience. 

You may be thinking,
“How can I get some independent advice on ideas and concepts to make my home or workplace look better, versus a salesperson promoting only their products?” 

Unique to The Blinds Experience is the option for you to have that independent advice. 
Through our Independent Interior Design Consultation option, you have the choice of a home visit and truly personalized interior design consultation.

This will be around 60-90 minutes for a $150 NZD fee*. One of our Independent Professional Interior Designers will meet with you in your home to provide independent, genuine, and personalized options on creating the look and home experience you want – whilst working with your budget. 

* Should you proceed to purchase blinds from The Blinds Experience the design consultation fee will be reimbursed

Total Care Package.
We want your new blinds to be a memorable experience. That is why you will have our support not only during the selection process of buying your new blinds, but after you are already enjoying them.

With this in mind, we are excited to give our customers a special after-sales care  package that includes 3 calls/visits to take care of your blinds and keep them working as new, so that you can always feel proud of your home!

On top of all, we are committed to helping our New Zealand vulnerable communities. We have chosen two New Zealand charities to support, and will donate 5% of the value of your purchase (excluding gst).

Contact us today to get your free quote.","Mattress and Blinds Manufacturing","2-10 employees","Privately Held","Auckland","New Zealand","theblindsexperience.com","https://www.linkedin.com/company/the-blinds-experience"
,"Marbea SK","Predaj kvalitných slovenský matracov vyrobených z klasickej peny alebo studenej peny s možnosťou pridania pamäťovej peny. Predaj detských matracov.","Mattress and Blinds Manufacturing","2-10 employees","Self Employed",,,"marbea.sk","https://www.linkedin.com/company/marbea-sk"
,"Arab Foam Factories Company",,"Mattress and Blinds Manufacturing","51-200 employees","Privately Held",,,"arabfoam.com","https://www.linkedin.com/company/arab-foam-factories-company"
,"Scorpion Blinds","Persianas y Cortinas, Modernas y Vanguardistas, Ofreciendo la Máxima Calidad. Persianas Tipo: Enrollables, Sheer Elegance, Sistemas Día y Noche, Panel Japones, Romanas, Domos Romanizados, Motorización y Automatización. Contamos con una gran colección de telas con diferentes estilos y diseños; Telas Black Out, Mallas de Control Solar Screen, Traslucidas, Sheer Elegance y Shan Gri-la
 
Contactame y Solicita Nuestros Atractivos Descuentos 

ING. DAVID MELENDEZ SANCHEZ 
CELULAR: 55 6462 2511 
CORREO dmelendezscorpionblinds@gmail.com","Mattress and Blinds Manufacturing","11-50 employees","Self Owned","CDMX, TACUBA","Mexico","scorpionblinds.com.mx","https://www.linkedin.com/company/scorpion-blinds"
,"US Bedding, Inc.","Located in the heart of Fall River, MA, which is also known as ""Spindle City"" for its rich heritage in the textile industry. Established in 2000 on the foundation of delivering American made, high quality product that is reasonably priced and delivered on time with highly personalized service.  Today, US Bedding remains a family-owned and operating under the same principles.  

We are proud of the highly skilled and dedicated professionals whose craftmanship is at the forefront of our best-in-class product.  From an opening price point mattress and foundation to a luxury sleep system; mattress toppers, sleeping pillows; our 300,000 SQ FT factory has the capacity to support all your bedding needs.","Mattress and Blinds Manufacturing","51-200 employees","Privately Held","Fall River, Massachusetts","United States","usbeddingonline.com","https://www.linkedin.com/company/us-bedding-inc."
,"Erol Perde ve Perde Sistemleri A.Ş.","Kaliteli hizmet anlayışıyla 1982 yılında kurulan Erol Şirketler grubu bünyesinde yer alan Erol Perde ve Sistemleri İth. İhr. A.Ş ‘’ LORE'S PERDE’’ markasıyla mekanizmalı perdeler, kumaş ve perde aksesuarları alanlarındaki tüm ihtiyaçlarınızı karşılamak üzere zengin bir koleksiyonla yurtiçi ve yurtdışı müşterilerine hizmet vermekte olup ürün gruplarının kendi içerisindeki çeşitliliği, alternatifleri ve neredeyse sınırsız model, desen, renk seçenekleriyle hayalinizdeki mekanı oluşturmada kolaylık sağlamaktadır.

Bugün perde ve sistemleri alanında geniş bir ürün yelpazesine sahip olan LORE'S PERDE; yurtiçi ve yurtdışı showroomlarında yüzlerce tasarım sergilemekte, müşterilerinin projeleriyle birlikte bir çok mekanda ürünleri ile boy göstermektedir. Grup olarak 41 yıla ulaşan deneyim ve bilgi birikiminin ürünü olan koleksiyonlarımızı, gelişmiş bayi ağımızla Türkiye ve dünyada farklı noktalara ulaştırırken, yaşam alanlarına renk katıp, yaşam kalitesini artırmak hedefiyle çalışmalarımızı artırarak sürdürmekteyiz. Bize güç veren, üretimin her safhasındaki kaybolmayan heyecan ve kalite tutkusu ile tüm bunların ötesinde ürünlerimize duyduğumuz güvendir.","Mattress and Blinds Manufacturing","51-200 employees","Privately Held","Kocaeli, Kocaeli","Turkey","loresperde.com","https://www.linkedin.com/company/lores-perde"
,"Blinds.mu Ltd","Blinds.mu Ltd | We Shape a Shade Better
Based in Dagotière, Mauritius since 2009, we specialize in the design, manufacturing, and installation of custom-made blinds tailored to all types of spaces: interiors, exteriors, corner windows, sliding doors, and large glass façades. Our range includes roller, venetian, vertical, wooden blinds. 
Our strength lies in combining technical expertise, high-quality installation, and a refined sense of design  from orientation and color selection to premium accessories.

Our goals: to collaborate with businesses, homeowners, architects, interior professionals, hotels, and retail spaces and to attract talent driven by service and innovation.","Mattress and Blinds Manufacturing","2-10 employees","Privately Held",,,"blinds.mu","https://www.linkedin.com/company/blindsmu"
,"Superblind Decorações","A Superblind está em constante modernização e desenvolve diversos modelos de cortinas e persianas e também atua na distribuição de papéis de parede e tecidos para cortinas, sempre prezando pela qualidade, elegância e ótimo acabamento.
 
O nosso principal compromisso é com a satisfação dos nossos clientes e parceiros. Por isso a Superblind está sempre se aprimorando e modernizando, para oferecer o que há de melhor em cortinas, persianas, papéis de parede e tecidos.","Mattress and Blinds Manufacturing","11-50 employees","Privately Held","Porto Alegre, RS","Brazil","superblind.com.br","https://www.linkedin.com/company/superblind-decoracoes"
,"Bettersleep Solutions llp","Bettersleep Solutions LLP – is a totally dedicated manufacturing facility for spring mattresses for exports only. With over 20 years of manufacturing experience in mattress industry, Bettersleep provides best and latest technologies to produce high end spring mattresses.

Our mattresses are 100% CFR 1632 & CFR 1633 passed by SGS-China and are well accepted in USA market. We at Bettersleep are skilled to manufacture any type of construction in spring mattress like TightTop, EuroTop, PillowTop or BoxTop and in any height ranging from 8inches to 16inches in a compressed Roll & Fold box packing.

With over 90,000 units sold in USA market in Year 2021, Bettersleep is No.1 mattress exporting company of India and growing..","Mattress and Blinds Manufacturing","201-500 employees","Partnership",,,"bettersleep.co.in","https://www.linkedin.com/company/bettersleep-solutions-llp"
,"Silent Sleep","Silent Sleep Mattress is dedicated to revolutionizing your sleep experience with cutting-edge design and premium materials. Our mattresses are crafted to provide unparalleled comfort, superior back support, and lasting durability. From high-resiliency foam to memory foam and pocketed spring options, each mattress is thoughtfully designed to cater to diverse sleep preferences.

We prioritize health and sustainability with hypoallergenic, non-toxic, and OEKO-TEX certified materials, ensuring a safe and restful sleep environment. With features like motion isolation, pressure relief, and moisture-lock fabrics, Silent Sleep mattresses are tailored for peaceful, uninterrupted nights.

Backed by years of expertise and a commitment to quality, Silent Sleep Mattress transforms your nights and energizes your days. Choose Silent Sleep for luxury, support, and the ultimate sleep experience.","Mattress and Blinds Manufacturing","11-50 employees","Privately Held",,,"silentsleep.in","https://www.linkedin.com/company/silent-sleep-india"
,"Furnari Tendaggi","Siamo un'azienda leader nella vendita di tende da interno, esterno, pergole e finiture d'interni. 
Dal 1970 siamo un punto di riferimento per privati e aziende sul Lago di Garda e tutta la provincia di Brescia.","Mattress and Blinds Manufacturing","2-10 employees","Self Owned","Vobarno, Bs","Italy","furnaritendaggi.it","https://www.linkedin.com/company/furnari-tendaggi"
,"Simtex","Wij zijn een familiebedrijf met meer dan 20 jaar ervaring in de beddenbranche. Een matras op maat is onze specialiteit en de mogelijkheden zijn eindeloos. We maken onze matrassen zelf in onze fabriek gelegen op bedrijventerrein Arnestein te Middelburg. Daarbij gebruiken wij alleen materialen van Nederlandse, Duitse en Belgische oorsprong, zo kunnen we constant de kwaliteit bewaken. Bekijk ons assortiment of neem gerust contact met ons op per mail of per whatsapp. Wij helpen u graag persoonlijk verder. Uiteraard is het ook mogelijk om langs te komen bij onze fabriek, hier kunnen we dan samen de ideale matras voor u opstellen.","Mattress and Blinds Manufacturing","2-10 employees","Public Company","Middelburg, Zeeland","Netherlands","simtexvof.nl","https://www.linkedin.com/company/simtexmatras"
,"Alkhair Foam",,"Mattress and Blinds Manufacturing","11-50 employees","Privately Held",,,"alkhairfoam.com","https://www.linkedin.com/company/alkhair-foam"
,"HOUSE OF BLINDS LIMITED","HOUSE OF BLINDS LIMITED is a window blind company based out of UNIT 10, BONNYBRIDGE INDUSTRIAL ESTATE, MURNIN ROAD, BONNYBRIDGE, STIRLINGSHIRE, United Kingdom. Established in 1985 operating 3 showrooms.","Mattress and Blinds Manufacturing","11-50 employees","Privately Held","Stirling, Scotland","United Kingdom","houseofblinds.co.uk","https://www.linkedin.com/company/house-of-blinds-limited"
,"SOFA MOUSSE","SOFA MOUSSE est un fabricant marocain de matelas qui vous garantit une qualité unique, dans le respect du confort et de l’environnement.
Tous nos matelas sont fabriqués dans nos ateliers situés à Berrechid.","Mattress and Blinds Manufacturing","11-50 employees","Privately Held","Berrechid","Morocco","sofamousse.com","https://www.linkedin.com/company/sofa-mousse"
,"Endurance Sleepers",,"Mattress and Blinds Manufacturing","Self-employed","Self Employed",,,,"https://www.linkedin.com/company/endurance-sleepers"
,"Jochebed","mattress fabric sale","Mattress and Blinds Manufacturing","11-50 employees","Privately Held","yazd","Iran","jochebedtex.com","https://www.linkedin.com/company/jochebed"
,"Simmons South Africa",,"Mattress and Blinds Manufacturing","51-200 employees","Privately Held",,,"simmons.co.za","https://www.linkedin.com/company/simmons-beds-za"
