"Find companies","Name","Description","Primary Industry","Size","Type","Location","Country","Domain","LinkedIn URL"
,"Bedding US",,"Mattress and Blinds Manufacturing","11-50 employees","Privately Held","Ft Lauderdale , Florida","United States","beddingus.com","https://www.linkedin.com/company/bedding-us"
,"Cortinas Bresser","Somos uma empresa com mais de 20 anos de história, focados em deixar seu lar ainda mais bonito e aconchegante. 
Trabalhamos com cortinas de ilhós a pronta entrega e sob medida e de trilho apenas sob medida. Alta variedade de tecidos e pregas, com entrega rápida e bom atendimento. 
Venha conhecer nossos produtos e fazer parte da nossa história.","Mattress and Blinds Manufacturing","2-10 employees","Privately Held","São Paulo, SP","Brazil",,"https://www.linkedin.com/company/cortinasbresser"
,"The Shades Experts","The Shades Experts is a company specializing in custom window coverings, offering residential and commercial services with a wide selection of high-end solutions. They prioritize understanding clients' needs to provide top-quality and affordable window treatments that also protect furniture and art. Child-proof options are available, and they offer free consultations to find the design that best suits clients. With a commitment to providing stylish and modern spaces, The Shades Experts have expertise in fabric selection and have completed numerous projects over their years of experience.","Mattress and Blinds Manufacturing","2-10 employees","Self Owned","SAINT PETERSBURG, FL","United States","shadesexperts.com","https://www.linkedin.com/company/the-shade-expert"
,"lila Vitalkonzepte GmbH","Ergonomische Matratzen
Maßgefertigt und individuell angepasst für höchsten Liegekomfort, ausgestattet mit innovativen Materialien wie Celliant, Tencel, Carbon und Silber.

Premium-Kopfkissen
Orthopädisch geformt und ergonomisch optimiert – für perfekte Unterstützung von Kopf und Nacken.

Komplette Schlafsysteme
Eine harmonische Kombination aus Matratze, Kissen und optionalem Lattenrost für ganzheitlichen Schlafkomfort.

Zubehör für besseren Schlaf
Hygienische Matratzenschoner, atmungsaktive Bezüge und vieles mehr für ein gesundes Schlafumfeld.","Mattress and Blinds Manufacturing","2-10 employees","Public Company","Berlin, Berlin","Germany","lila-premium.de","https://www.linkedin.com/company/lila-vitalkonzepte-gmbh"
,"Nubba Sleep","At Nubba Sleep, we don’t just sell mattresses. We engineer them for real sleep. Designed with advanced support zones and premium materials, our factory-direct models deliver the comfort your body needs and the quality your back will thank you for.","Mattress and Blinds Manufacturing","2-10 employees","Privately Held",,,"nubbasleep.com","https://www.linkedin.com/company/nubba-sleep"
,"RollXShades","Luxury Within Reach","Mattress and Blinds Manufacturing","2-10 employees","Privately Held","Hollywood, FL","United States","rollxshades.com","https://www.linkedin.com/company/rollxshades"
,"European Sky, Lda.","A European Sky é uma empresa, sediada no concelho de Paços de Ferreira, que se dedica à produção de colchões e outros artigos para cama.
A forte aposta no B2B garante o forte desenvolvimento e expansão da nossa marca, com um suporte sólido na excelente qualidade dos nossos artigos, aliada aos esforços de todos os parceiros e colaboradores.","Mattress and Blinds Manufacturing","11-50 employees","Partnership","Carvalhosa, Porto","Portugal","europeansky.pt","https://www.linkedin.com/company/european-sky-lda"
,"Kissen- Sistemas Ortomagnéticos",,"Mattress and Blinds Manufacturing","11-50 employees","Partnership",,,"kissen.mx","https://www.linkedin.com/company/kissen-sistemas-ortomagnéticos"
,"the mattresshub.in","""A good laugh and a long sleep are the best cures in the doctor's book.""","Mattress and Blinds Manufacturing","11-50 employees","Self Employed","Coimbatore, tamilnadu","India","themattresshub.in","https://www.linkedin.com/company/the-mattresshub-in"
,"Mattress BD","Here you will get imported mattress, All types of bangladeshi mattress at your preferable bed size.Also Bedding Items.","Mattress and Blinds Manufacturing","11-50 employees","Partnership","Dhaka, Dhaka","Bangladesh","mattressbd.com","https://www.linkedin.com/company/mattressbd"
,"van de Ven zonwering Vianen","Zonwering - raamdecoratie - horren  -  Advies aan huis  -  Kwaliteit voor een eerlijke prijs","Mattress and Blinds Manufacturing","2-10 employees","Partnership","Vianen, Utrecht","Netherlands","vandevenzonwering.nl","https://www.linkedin.com/company/van-de-ven-zonwering-vianen"
,"Bedway Co.,Ltd.",,"Mattress and Blinds Manufacturing","11-50 employees","Privately Held",,,"bedway.co.th","https://www.linkedin.com/company/bedway-co-ltd"
,"Bluebellmattress.ae",,"Mattress and Blinds Manufacturing","11-50 employees","Partnership",,,"bluebellmattress.ae","https://www.linkedin.com/company/bluebellmattress-ae"
,"Trendysol Zonwering & Rolluiken","Trendysol Zonwering & Rolluiken","Mattress and Blinds Manufacturing","Self-employed","Self Employed","Gendt","Netherlands","trendysol.nl","https://www.linkedin.com/company/trendysol-zonwering-&-rolluiken"
,"Welldom.collection","Colchones viscoelásticos técnicos, innovación al servicio del descanso. Especialistas en descanso para deportistas y dolencias musculares y articulares.","Mattress and Blinds Manufacturing","11-50 employees","Self Owned","Alberic, Valencia","Spain","welldom.es","https://www.linkedin.com/company/welldom-collection"
,"MS SLEEP","At Ms Sleep, our mission is to redefine the way people in Asia experience rest. By combining advanced sleep technology with the expertise of Russian engineers, we are committed to delivering mattresses that go beyond comfort – products that improve health, well-being, and quality of life.

We envision a future where every family has access to world-class sleep solutions, starting with mattresses and expanding into pillows, toppers, and bedding. Our purpose is simple yet profound: to make healthy, restorative sleep accessible to millions across Asia.


Ms Sleep kompaniyasining maqsadi – Osiyo xalqlariga uyqu madaniyatini yangicha darajada taqdim etishdir. Biz zamonaviy uyqu texnologiyalarini rus muhandislari tajribasi bilan uyg‘unlashtirib, nafaqat qulaylik, balki inson salomatligi va hayot sifatini yaxshilashga xizmat qiladigan mahsulotlarni yaratamiz.

Bizning orzuimiz – har bir oilaga jahon darajasidagi uyqu mahsulotlarini yetkazish. Bugun matrasdan boshlaymiz, ertaga esa yostiq, topper va choyshablar bilan uyquni to‘liq ekotizimga aylantiramiz. Bizning asl vazifamiz – millionlab insonlarga sog‘lom va tinch uyquni ulashishdir.","Mattress and Blinds Manufacturing","11-50 employees","Privately Held","Namangan, Fergana valley","Uzbekistan",,"https://www.linkedin.com/company/ms-sleep"
,"Madina Foam",".","Mattress and Blinds Manufacturing","201-500 employees","Public Company",,,"madinafoam.com","https://www.linkedin.com/company/madina-foam"
,"zzz.kiwi","Witaj w zzz.kiwi, Twoim eksperckim źródle komfortowego snu z siedzibą w Polsce. Jesteśmy renomowanym producentem **materaców wysokiej jakości**, które łączą innowacyjne technologie z tradycyjnym rzemiosłem, dostarczając niezrównanego komfortu i wsparcia ortopedycznego. Nasza misja to ułatwienie Ci znalezienia idealnego materaca, który poprawi jakość Twojego snu i samopoczucie.

Zapraszamy na naszą oficjalną stronę pl.zzz.kiwi, gdzie nie tylko odkryjesz naszą szeroką ofertę materaców, ale także skorzystasz z profesjonalnych porad i bogatej wiedzy naszego zespołu ekspertów. Z zzz.kiwi, zdrowy i komfortowy sen jest teraz na wyciągnięcie ręki!","Mattress and Blinds Manufacturing","2-10 employees","Privately Held",,,"zzz.kiwi","https://www.linkedin.com/company/zzz-kiwi"
,"Correntes Merini",,"Mattress and Blinds Manufacturing","11-50 employees","Privately Held",,,,"https://www.linkedin.com/company/correntes-merini-metallic-decor"
,"HJT Home",,"Mattress and Blinds Manufacturing","2-10 employees","Partnership",,,,"https://www.linkedin.com/company/hjt-home"
,"SunBlinds GP",,"Mattress and Blinds Manufacturing","2-10 employees","Privately Held",,,"sunblindsgp.com","https://www.linkedin.com/company/sunblindsgp"
,"Sleeping Puppy",,"Mattress and Blinds Manufacturing","2-10 employees","Privately Held",,,"sleepingpuppy.com.au","https://www.linkedin.com/company/sleeping-puppy"
,"St Andrews Screens, Doors & Blinds",,"Mattress and Blinds Manufacturing","2-10 employees","Privately Held",,,"standrewsscreens.com.au","https://www.linkedin.com/company/st-andrews-screens-doors-blinds"
,"ZEN Mattress","Explore our collection of elegant and minimalist mattresses, bedsheets, pillows, toppers, and other items designed for the discerning tastes of our Cambodian customers","Mattress and Blinds Manufacturing","2-10 employees","Partnership","Phnom Penh, Khan Sen Sok","Cambodia","zenmattress.co","https://www.linkedin.com/company/zen-mattress"
,"Mahestan Mattress","Established in 2014, Mahestan Co. found its way into textiles industry by producing mattresses branded as ""My Sleep"". The company was rebranded to Mahestan Co. in 2019 and expanded its production line to include Pillows and Blankets too.
With great performance and agility to fulfill the national and international demands, the company is eager to reach new markets and welcomes any cooperation.","Mattress and Blinds Manufacturing","11-50 employees","Privately Held","Khomeini Shahr, Isfahan","Iran","mahestan.com","https://www.linkedin.com/company/mahestan"
,"Decorazon Ambientes",,"Mattress and Blinds Manufacturing","11-50 employees","Privately Held",,,"decorazon.com.br","https://www.linkedin.com/company/decorazon-ambientes"
,"MHD Shutters & Blinds","MHD Shutters and Blinds and Unique Blinds Plus offers a wide selection of high-quality window coverings at competitive prices with superior customer experiences.","Mattress and Blinds Manufacturing","2-10 employees","Public Company","Eastvale, CA","United States","mhdshutter.com","https://www.linkedin.com/company/mhd-shutters"
,"Nidra",,"Mattress and Blinds Manufacturing","Self-employed","Privately Held",,,"nidra.ae","https://www.linkedin.com/company/nidraae"
,"Spine Align Inc","Mattress Micro Factory.  Manufacture home, boat and RV mattresses onsite.  Over 100 years of family experience.","Mattress and Blinds Manufacturing","2-10 employees","Privately Held","Holland, MI","United States","spinealignmattress.com","https://www.linkedin.com/company/spine-align-inc"
,"Lady Plast","Lady Plast è un’azienda con sede a Misterbianco specializzata nel settore della realizzazione di prodotti in PVC: box doccia, avvolgibili e porte a soffietto. L’azienda produce anche zanzariere e avvolgibili in alluminio.
Sorta nel 2004, ma con una solida esperienza nel settore, Lady Plast garantisce ai propri clienti un servizio di alta qualità e relazioni fondate sul reciproco rispetto, professionalità e dedizione. Sono queste le linee-guida che hanno permesso la costruzione di un gruppo attento al dettaglio nella realizzazione dei progetti e capace di offrire al cliente un servizio personalizzato.","Mattress and Blinds Manufacturing","2-10 employees","Privately Held","Misterbianco, Sicily","Italy","ladyplast.it","https://www.linkedin.com/company/ladyplast."
,"De Nieuwe Grote Beer","Wij zijn al meer dan 60 jaar uw betrouwbare partner voor uw kwalitatieve nachtrust. Onze deskundigheid komt zowel tot zijn recht bij de aankleding van een slaapkamer als bij de aankoop van een boxspring of matras.

Onze slogan luidt dan ook ""Beresterk in uw nachtrust!""","Mattress and Blinds Manufacturing","2-10 employees","Privately Held","Blankenberge, Flemish Region","Belgium","denieuwegrotebeer.be","https://www.linkedin.com/company/de-nieuwe-grote-beer"
,"Auckland Blind Specialists","Custom made blinds to add value to your home. We do it all from measuring, manufacturing , delivering, installing and after service with repairs and we assist with more. 

Our secret is, We manufacture our own blinds so you get high quality product at the fraction of what you would normally pay.","Mattress and Blinds Manufacturing","2-10 employees","Public Company","Auckland, AUK","New Zealand","aucklandblindspecialists.co.nz","https://www.linkedin.com/company/auckland-blind-specialists"
,"Canin Blinds","Canin Blinds are your Go to Experts when it comes to all things Blinds or Shades in Ontario! Founded by Mr. Salim Noorudeeen, Canin Blinds offers an amazing range of Window Blinds and Interior Solutions for both residential and commercial establishments.","Mattress and Blinds Manufacturing","2-10 employees","Self Owned","London Ontario, London Ontario","Canada","caninblinds.ca","https://www.linkedin.com/company/caninblindsca"
,"TheUltimateInstall","The Floating Header is designed to give you the added support needed to hang your heavy and wide window treatments where you haven’t been able to before. Here are some of the great applications for The Floating Header: 
Arched windows
Transom windows
Garden and Vinyl windows
Narrow Casements
Aluminum Windows
Avoid voiding warranties by mounting into the wall instead of the window frame
Divide over-sized skylight openings
False Ceilings
Applications where flammability is a concern
Impact Resistant Windows
Anywhere else center support is required!
The Floating Header is easy to install requiring only 1 person and a power drill. Treatments can be mounted to the front, bottom, or both. Arched blinds can also be installed on the top of the header.
The Floating Header is made of tubular steel powder coated in a satin white finish. The header is secured to two brackets which side-mount to either side of the window.
Each Floating Header is custom made for a precise fit for your unique application. Choose from: Medium Duty, Heavy Duty or the Super Duty system, depending on the strength you need. The Medium Duty has a cross section of 1-1/4” by 1-1/4”. The Heavy and Super Duty systems have a cross section of 2” by 1”. 
Your treatments can be attached to the steel header with the provided self-tapping, self drilling screws; no pilot holes necessary!","Mattress and Blinds Manufacturing","2-10 employees","Self Owned","Tucker, GA","United States","wpcomstaging.com","https://www.linkedin.com/company/theultimateinstall"
,"Luasa","Experts in Window Treatments & Custom Shades, Blinds and Drapery. 𝙎𝙘𝙝𝙚𝙙𝙪𝙡𝙚 𝙖 𝙁𝙧𝙚𝙚 𝘾𝙤𝙣𝙨𝙪𝙡𝙩𝙖𝙩𝙞𝙤𝙣 𝙖𝙩 website 𝙩𝙤𝙙𝙖𝙮!","Mattress and Blinds Manufacturing","2-10 employees","Privately Held","Orlando, FL","United States","empirestdecor.com","https://www.linkedin.com/company/luasabr"
,"Winlor","At Winlor, we are a trusted manufacturer and supplier of premium window coverings based in Mississauga, proudly serving residential, commercial, and trade clients across the Greater Toronto Area and beyond.

We offer a wide range of custom blinds, shades, shutters, and drapery designed for style, durability, and performance. As both a manufacturer and direct supplier, we ensure our clients receive top-quality products at highly competitive prices.

In addition to serving end customers, we are actively expanding our dealer network across Ontario and Canada. Our dealers enjoy exclusive access to high-quality window coverings at some of the lowest wholesale prices in the industry, along with fast turnaround times, product training, and dedicated support.

Whether you're looking to enhance your own space or grow your business with a reliable supplier, [Your Business Name] is your partner in exceptional window covering solutions.","Mattress and Blinds Manufacturing","2-10 employees","Privately Held","Mississauga, ON","Canada","winlor.ca","https://www.linkedin.com/company/winlor"
,"Espumax - Soluções em Espumas","Laminação e Corte de Espumas sob Medida;
Espumas para Tapeçaria;
Flocos de Espumas para enchimento por KG.","Mattress and Blinds Manufacturing","11-50 employees","Privately Held","Rua Patativa Chorona 572, Paraná","Brazil",,"https://www.linkedin.com/company/espumax-soluções-em-espumas"
,"Mail Order Blinds","Mail Order Blinds was founded in January 2024 following the successful retail of blinds in the local area and on eBay. We have decided to move our expertise to our own ecommerce store.","Mattress and Blinds Manufacturing","2-10 employees","Privately Held","Stockton-On-Tees, England","United Kingdom","mailorderblinds.com","https://www.linkedin.com/company/mail-order-blinds"
,"Incorporated Blind Solutions Ltd",,"Mattress and Blinds Manufacturing","2-10 employees","Privately Held",,,"ibsolutions.co.uk","https://www.linkedin.com/company/incorporatedblindsolutionsltd"
,"Fleet Mattress",,"Mattress and Blinds Manufacturing","11-50 employees","Self Owned",,,"fleetmattress.com","https://www.linkedin.com/company/fleet-mattress"
,"The House of Shades","Welcome to The House of Shades, where we believe that a window covering is much more than just a piece of fabric—it's the finishing touch that controls your light, guarantees your privacy, and defines your interior's mood.

We specialize in an unparalleled selection of curtains, blinds, and shades, meticulously curated to meet the needs of every space. Whether you're designing a cozy home, a sleek corporate office, a bustling commercial department, or a specialized institutional facility, we have a solution that fits your exact requirements.

Our Expertise
Unmatched Variety: Explore thousands of options in every color, texture, and pattern. From elegant sheer curtains and robust blackout drapes to modern motorized roller blinds and timeless wooden shutters, our inventory is designed for choice.

Precision Sizing: We understand that ""standard"" doesn't work for every window. We offer products in a vast range of sizes and are experts in finding the perfect fit for even the most challenging openings.

Function Meets Style: We help you master light control and energy efficiency without ever compromising on aesthetics. Our shades offer the ideal balance of functionality and sophistication.

Ready to transform your space with the perfect window treatment? The House of Shades is your partner in design and light management.","Mattress and Blinds Manufacturing","2-10 employees","Public Company",,,,"https://www.linkedin.com/company/the-house-of-shades"
,"The Smart Mattress",,"Mattress and Blinds Manufacturing","Self-employed","Public Company",,,,"https://www.linkedin.com/company/thesmartmattress"
,"Gotcha Covered of Williamson County",,"Mattress and Blinds Manufacturing","2-10 employees","Self Employed",,,"gotchacovered.com","https://www.linkedin.com/company/gotcha-covered-of-williamson-county"
,"The Swan Dream Team","SleepM where we sale sleep!

Using our scientifically proven Biocrystal technology.
Our Sleep Products uses the highest quality materials that no other competitors can compete with. We want to ensure that our customers can have the best sleeping experience when they lie on our mattresses","Mattress and Blinds Manufacturing","2-10 employees","Public Company","Lehi, Utah","United States","theswandreamteam.com","https://www.linkedin.com/company/the-swan-dream-team"
,"Sparsh Mattress","At Sparsh Mattress, we believe restful sleep is the foundation of a healthy, fulfilling life. Powered by innovation, craftsmanship, and a commitment to quality, we design mattresses that support your body, refresh your senses, and recharge your dreams. Backed by Supreme Petrofoam Pvt. Ltd., an ISO 9001:2008 certified company, Sparsh blends science and comfort to create sleep solutions for today’s fast-paced world.
Sleep better. Dream bigger. Live fully—with Sparsh.","Mattress and Blinds Manufacturing","11-50 employees","Privately Held",,,"sparshmattress.com","https://www.linkedin.com/company/sparshmattress"
,"Comfort Gallery - Mattress dealers in Kaloor","Comfort Gallery - Mattress dealers in Kaloor
64/3831, Azad Rd, Kathrikadavu, Kaloor, Kochi, Ernakulam, Kerala 682017
79940 96534
https://maps.app.goo.gl/hiZjW15k3sahcH7d6","Mattress and Blinds Manufacturing","2-10 employees","Self Employed","Ernakulam, Kerala","India","comfortgallery-mattressdealersinkaloor.store","https://www.linkedin.com/company/comfortgallerymattress-dealers-in-kaloor"
,"JASRAAJ TRADE LINK",,"Mattress and Blinds Manufacturing","Self-employed","Privately Held",,,"rcaghatkopar.com","https://www.linkedin.com/company/jasraaj-trade-link"
,"Hale-lux Industria e Comercio de Persiana Ltda","Com sede em SAO JOSE DO RIO PRETO, SP, possui 25 anos, 6 meses e 23 dias e foi fundada em 27/06/2000. A sua situação cadastral é BAIXADO.","Mattress and Blinds Manufacturing","11-50 employees","Privately Held","São José do Rio Preto, São Paulo","Brazil",,"https://www.linkedin.com/company/hale-lux-industria-e-comercio-de-persiana-ltda"
,"Renorma Colchões e Estofados",,"Mattress and Blinds Manufacturing","2-10 employees","Privately Held",,,,"https://www.linkedin.com/company/renorma-colchões-e-estofados"
,"BestView Blinds","Ottawa’s Top-Rated Window Treatment Company. Achieve the perfect style and fit for your dream window treatments with BestView Blinds. We are dedicated to bringing you the latest innovations in window coverings at an affordable price. Founded in Ottawa, we are committed to delivering a high-quality customer experience, giving you full control from design to installation and service. You design, we install, all backed by Ottawa’s #1 service","Mattress and Blinds Manufacturing","2-10 employees","Privately Held","Manotick, Ontario","Canada","bestviewblinds.ca","https://www.linkedin.com/company/bestview-blinds"
,"Budget Blinds SV",,"Mattress and Blinds Manufacturing","2-10 employees","Public Company",,,"budgetblinds.com","https://www.linkedin.com/company/budget-blinds-sv"
,"Family Care - The Luxury Suite","Family Care - The Luxury Suite was established in 2011. During the past 10 years, Family Care - The Luxury Suite has always accompanied the world's leading brands such as SEALY, SANTAS, SHERIDAN ... we exclusively distribute the products. bedroom furniture brand with a chain of high-class showrooms displaying products about blankets, sheets, pillows, mattresses...

Besides satisfying the sleep health of each family, Family Care - The Luxury Suite also provides products for hotel and resort chains with projects that focus on quality and elegance.

Family Care - The Luxury Suite is committed to creating perfect values to contribute and improve sleep for Vietnamese families with world-class quality.","Mattress and Blinds Manufacturing","11-50 employees","Public Company",,,"familycareasia.com","https://www.linkedin.com/company/family-care-the-luxury-suite"
,"Flamingo Shades","Professional Blinds Custom-Made and Installed for You.","Mattress and Blinds Manufacturing","Self-employed","Privately Held",,,"flamingoshades.com","https://www.linkedin.com/company/flamingo-shades"
,"themattresshub.in",,"Mattress and Blinds Manufacturing","11-50 employees","Privately Held",,,,"https://www.linkedin.com/company/themattresshub-in"
,"Colchões Inlatex","""A essência do bem dormir está em acordar disposto e viver bem."" Essas foram as palavras que nortearam nossa decisão de que as pessoas precisam ser felizes e superar momentos de ansiedade e estresse.

 

Durante a pandemia de 2020, as pessoas começaram a valorizar mais o conforto dentro de suas casas. Foi quando percebemos uma necessidade urgente: colchões que proporcionassem não apenas conforto, mas também qualidade de sono, durabilidade e responsabilidade com o bem-estar.

 

Com isso em mente, a INLATEX se dedicou a compreender o mercado brasileiro e descobriu uma carência de conhecimento sobre a escolha do colchão ideal. A partir daí, surgiu a ideia de buscar o melhor material, trabalhar com o melhor acabamento e comprovar sua eficiência para os consumidores.

Em 2021, a INLATEX foi fundada com o slogan: ""Quando dormir é natural.""

 

""Tínhamos em nossas mãos a matéria-prima que trazia todas as qualidades e benefícios que buscávamos. Nosso conteúdo não empurrava um produto, mas ajudava o cliente a identificar o ideal para seu perfil de consumo, biotipo e conforto.""

 

Localizada em Santa Catarina, no Vale do Itajaí, a região europeia do Brasil, unimos a força brasileira, o perfil sistemático dos europeus e a tecnologia americana do látex para desenvolver o melhor colchão confeccionado e desenvolvido no Brasil.","Mattress and Blinds Manufacturing","2-10 employees","Privately Held",,,"inlatex.com.br","https://www.linkedin.com/company/colchões-inlatex"
,"Sleep High Corp",,"Mattress and Blinds Manufacturing","201-500 employees","Public Company",,,,"https://www.linkedin.com/company/sleephighcorp"
,"Liza for Mattresses Beddings",,"Mattress and Blinds Manufacturing","11-50 employees","Public Company",,,"liza-mattresses-egy.com","https://www.linkedin.com/company/liza-for-mattresses-beddings"
,"Weifang Mingchen Sunshade Technology",,"Mattress and Blinds Manufacturing","11-50 employees","Privately Held",,,,"https://www.linkedin.com/company/weifang-mingchen-sunshade-technology"
,"Materace48","Zajmujemy się produkcją wysokiej jakości materacy piankowych, sprężynowych, kieszeniowych oraz lateksowych. W ofercie posiadamy również poduszki, a także różnego rodzaju toppery. Realizujemy zamówienia
produkcji seryjnej oraz wykonujemy materace pod indywidualne zamówienie.

Naszym priorytetem jest Twój komfortowy sen.","Mattress and Blinds Manufacturing","11-50 employees","Privately Held",,,"materace48.pl","https://www.linkedin.com/company/materace48"
