"Find companies","Name","Description","Primary Industry","Size","Type","Location","Country","Domain","LinkedIn URL"
,"Desired Blinds","Indoor and Outdoor Blinds

About Us:
At Desired Blinds, we take pride in being your local experts in providing top-quality indoor and outdoor blinds. Leveraging our local presence, we offer a personalized touch, ensuring that every customer enjoys a seamless and tailored experience. Our mission is to enhance your living and working spaces with stylish and functional window treatments, all while delivering unmatched customer service.

Mission Statement:
At Desired Blinds, our mission is to enhance your spaces with exceptional window coverings while leveraging our local expertise for your advantage. We are committed to delivering fast, reliable, and top-quality service to all our customers, ensuring their utmost satisfaction.

Indoor Blinds: Roller Shades, Zebra Blinds, Horizontal Faux Wood Blinds

Outdoor Coverings: Retractable Awnings, Outdoor Motorized Roller Screens


Local Expertise: Being a local company, we understand the unique needs of our community and provide personalized services.
Speed: We are fast and efficient, ensuring timely delivery and installation.
Customer Service: Our commitment to the highest customer service sets us apart, ensuring a positive experience from start to finish.

Company Values:
Honesty: We believe in transparent dealings and always tell the truth, ensuring trust and integrity in all our interactions.
Affordability: We offer competitive pricing without compromising on quality, making premium window treatments accessible to everyone.
Customer-Centric: We are dedicated to meeting our customers' needs and exceeding their expectations, with a focus on honesty and reliability.

Achievements:
We have been privileged to work on numerous high-end projects, earning the trust of prestigious clients. Our stellar reputation on Google and the quality of our work have been instrumental in securing these opportunities.

Contact Us:
Telephone (Text/Calls): (813) 796-0059
Email: info@desiredblinds.com","Mattress and Blinds Manufacturing","2-10 employees","Self Owned","Wesley Chapel","United States",,"https://www.linkedin.com/company/desired-blinds"
,"SUTA Smart Technology","SUTA Smart Technology is a promising company which manufactures Adjustable bed and Smart mattresses.","Mattress and Blinds Manufacturing","51-200 employees","Privately Held",,,"sutabedding.com","https://www.linkedin.com/company/suta-smart-technology"
,"Neoespumas Flexibles S.A. de C.V.",,"Mattress and Blinds Manufacturing","11-50 employees","Self Owned","Santa Catarina, Nuevo León","Mexico","neoespumas.com","https://www.linkedin.com/company/neoespumas-flexibles-s-a-de-c-v"
,"Shutters Inc Buitenluiken","Shutters Inc. Buitenluiken is een raamluiken groothandel voor bedrijven, utiliteitsbouw en ondersteunend ook voor particulieren. Shutters Inc. Buitenluiken levert aluminium, houten en kunststof PVC raamluiken door Europa. 

Wilt u meer informatie over onze producten en diensten? Neem dan contact met ons op, en plan een afspraak in met een van onze adviseurs.","Mattress and Blinds Manufacturing","2-10 employees","Privately Held","Haaksbergen, Overijssel","Netherlands","shuttersinc.nl","https://www.linkedin.com/company/shutters-inc-b-v"
,"MarQi Blinds","MarQi Blinds is an American window covering manufacturer located in Elk Grove Village, IL. We are a wholesaler that has been in the window covering business for over 30 years, internationally.

We produce only the highest quality roller shades, zebra shades, and some very unique hybrid, sheer horizontal blinds that you will simply not find anywhere else.

The fastest turnaround times, highest quality materials and components (including Somfy motorization), a unique product line, and unexpectedly low pricing. That’s what MarQi will confidently deliver.","Mattress and Blinds Manufacturing","51-200 employees","Privately Held","Elk Grove Village, Illinois","United States","marqiblinds.com","https://www.linkedin.com/company/marqi-blinds"
,"Sleepplay",,"Mattress and Blinds Manufacturing","11-50 employees","Self Owned","Dubai, Dubai","United Arab Emirates",,"https://www.linkedin.com/company/sleepplay"
,"AMIGO RUSSIA","AMIGO today is the alliance of experts. We are united by high standards of service and product quality. The company name uncovers our ideology - our works is based on the mutually beneficial partnership principles that ensure stable development for over 20 years. AMIGO range of products includes everything you need to manufacture professional sun protection systems: all types of equipment, components and materials.
1 200 materials from AMIGO collections are available in the warehouses of our branch offices in 39 regions in Russia.
Every year we issue 28 000 catalogues for the convenient work of our partners.
16 000 products are manufactured daily using AMIGO components and materials..
Hence, new AMIGO blinds are being installed every 6 seconds.

AND WHAT IS MORE:
The only Russia's corporate institute for sun protection systems
The most current and demanded collections
Incoming quality control service
The largest stock of components and materials
State-of-the-art production equipped with advanced high-tech equipment
Quality control of ready-made products upon release from production
Uniform corporate standards of service and maintenance

AMIGO range of products includes everything you need to manufacture professional sun protection systems: blinds, roller blinds, curtains etc.","Mattress and Blinds Manufacturing","201-500 employees","Privately Held","Moscow, Moscow City","Russia","amigo.ru","https://www.linkedin.com/company/amigorussia"
,"Accu Sleep Manufacturer","Accu Sleep is a renowned and trusted mattress factory that has mastered the art of combining innovation and Turkish techniques to deliver unparalleled comfort and exceptional quality sleep solutions. With our unwavering commitment to excellence, we have established ourselves as a leader in the industry, providing our customers with the ultimate sleep experience.

At Accu Sleep, we take pride in our state-of-the-art manufacturing facilities, equipped with cutting-edge technology and operated by skilled craftsmen. Every mattress we produce undergoes a meticulous process, from the selection of the finest materials to the application of advanced techniques, ensuring that each product meets the highest standards of comfort, support, and durability.

Our team of experts is dedicated to meeting the unique needs and preferences of our customers. We understand that a good night's sleep is crucial for overall well-being, and that's why we go above and beyond to create mattresses that offer the perfect balance of comfort and support. Whether you prefer a firm or plush mattress, we have a wide range of options to cater to your individual needs.

What sets Accu Sleep apart is our unwavering focus on customer satisfaction. We believe that a mattress is more than just a place to sleep—it's an investment in your health and well-being. That's why we provide personalized assistance throughout the buying process, ensuring that you find the perfect mattress that suits your preferences and budget.

Experience the comfort of excellence with Accu Sleep. Transform your nights and wake up refreshed, rejuvenated, and ready to take on the day. Invest in quality sleep and discover the difference it can make in your life. Join the countless individuals who have already made Accu Sleep their choice for superior sleep solutions.","Mattress and Blinds Manufacturing","51-200 employees","Partnership","Istanbul, Istanbul","Turkey",,"https://www.linkedin.com/company/accu-sleep"
,"Almero Mattress","Almero Mattress - a brand with a complete sleeping assortment.

The factory complex, which has the most modern equipment for the production of mattresses, boxes, Openable boxes, pillows, beds and sleeping accessories,","Mattress and Blinds Manufacturing","51-200 employees","Privately Held","Gostivar, Polog","Macedonia","almero.com.mk","https://www.linkedin.com/company/almero-mattress"
,"Romroll shades","Redefining Spaces, Elevating Lives
At Romroll Shade, we are more than just a window treatment company; we are your partners in transforming spaces. Based in Los Angeles, we specialize in crafting and installing high-quality Roman Shades, Roller Shades, Curtains, and Blinds. Our mission is to bring elegance, functionality, and innovation into every home. With professional installation, motorization, and automation services, we ensure that each product is tailored to your unique needs. Customer satisfaction is our top priority, backed by a 5 Years guarantee for complete peace of mind.","Mattress and Blinds Manufacturing","2-10 employees","Public Company","CALIFORNIA","United States","romrollshade.com","https://www.linkedin.com/company/romrollshades"
,"Neonest","Mattress manufacturers","Mattress and Blinds Manufacturing","2-10 employees","Self Owned","Lucknow, 221011","India","neonest.com","https://www.linkedin.com/company/neonestinterio"
,"Relaxia Srl","Produzione di materassi artigianali made in Italy nel cuore della Brianza. Ci trovate in Via Albert Einstein 15, a Meda (MB).","Mattress and Blinds Manufacturing","2-10 employees","Self Employed","Meda, Lombardy","Italy","relaxiasrl.com","https://www.linkedin.com/company/relaxia-srl"
,"Blackout curtainsDubai","We offer you Customized 100 % Blackout Curtains and Blinds in Dubai, We are number 1 curtains shop in Dubai for affordable modern design and quality curtains fabric in 10000 colors and designs available with 3 days guaranteed delivery.","Mattress and Blinds Manufacturing","51-200 employees","Self Owned","Dubai","United Arab Emirates","blackoutcurtains.ae","https://www.linkedin.com/company/blackout-curtainsdubai"
,"Harbor Springs Mattress Co","Harbor Springs Mattress Co. is a purveyor of the finest sleep on handmade beds and box springs because we hand-tuft, use all-natural fibers, and craft with passion.

We are proud and maybe even a bit stubborn about quality over quantity.

To make an exceptional mattress we build with artisan hand-tufting to innersprings because it provides the most enduring support.  We are one of the few companies left in the United States that still hand-tuft.  

We know it is unusual, but we want you to love your mattress for decades. This guides everything we do.","Mattress and Blinds Manufacturing","11-50 employees","Privately Held","Harbor Springs, Michigan","United States","harborspringsmattress.com","https://www.linkedin.com/company/harbor-springs-mattress"
,"Almatros GmbH & Co. KG",,"Mattress and Blinds Manufacturing","11-50 employees","Partnership","Papendorf, Mecklenburg-West Pomerania","Germany","almatros.de","https://www.linkedin.com/company/almatros-gmbh-co-kg"
,"ETD Textile","2001 Yılında faliyete geçen teknolojiyi modern çizgiler ile bütünleştiren firmamız sektöründe öncü bir konum sahibidir. Türkiye'nin en önemli sanayi merkezlerinden olan Bursa'da 12.000 metre karelik alanda bulunan fabrikamız jakarlı dokuma yapmaktadır. Zebra, stor tül, baskılı zebra, fonluk, armül dokuma kumuşı üretiminde bulunan fabrikamız yıllık 3.000.000 metre kapasitesinde üretim yapmaktadır. Makina parkurumuz son teknolojiyle donatılmış olan 60 adet jakarlı ve 10 adet brode tezgahtan ibarettir.

Sürekli yatırımı hedefleyen, gelişen ve makine parkını yenileyen ve geliştiren, teknolojiye yatırım yapan firmamız ayrıca inşaat ve petrol işletmeciliğiyle de ülkemize hizmet vermekte olup istihdama imkan sağlamaktadır.
ETD Tekstil çevreye duyarlı üretim anlayışı ile araştırma geliştirmeye önem vererek kalitesini sürekli artırmaktadır. Teknolojisini aynı zamanda sektöründeki diğer firmalarla da paylaşmakta ve hizmet vermektedir. Gören Şirketler Grubu bünyesinde faaliyetini sürdüren E.T.D Tekstil iç piyasaya hizmet ettiği gibi ürettiği ürünleri orta Doğu ve Avrupa'da çeşitli ülkelere ihraç etmektedir. Firmamız ilke olarak daima ürünlerin kaliteli olmasını, müşteri memnuniyetini ön planda tutmuş, müşteri odaklı ve kalite politikasına önem veren bir anlayış benimsemiştir. Ar-Ge faaliyetlerine önem veren firmamız genç ve dinamik bir yönetim kadrosuyla faaliyetini sürdürmektedir.","Mattress and Blinds Manufacturing","11-50 employees","Privately Held","bursa","Turkey","etdtekstil.com","https://www.linkedin.com/company/etd-textile"
,"UmbraTec","Vlastní výroba, prodej, servis a montáž venkovních žaluzií, předokenních rolet a markýz.","Mattress and Blinds Manufacturing","2-10 employees","Public Company","Kladno","Czechia","umbratec.cz","https://www.linkedin.com/company/czumbratec"
,"Ideal Sleep Industries","We at FabNap provide sleep related solutions including but not limited to mattresses, pillows, cushions, bedsheets, rollaway beds, towels etc. 
We have excelled in the art of manufacturing mattresses and selling it across the globe. Many of the big hotel giants are our key customer to whom we provide spring as well as foam mattress. 
The vision is to provide the bed and fabulous sleep with the most comfy and adaptive material so that one can sleep like a baby.","Mattress and Blinds Manufacturing","11-50 employees","Partnership","jabalpur","India","fabnap.in","https://www.linkedin.com/company/ideal-sleep-industries"
,"HomeWorx Australia","Welcome to Homeworx Australia, your one-stop shop for all your window covering needs in Sydney. We are passionate about transforming your indoor and outdoor spaces into comfortable and stylish havens that you'll love.

We specialize in custom-made blinds and awnings, designed to cater to your unique preferences and needs. Our skilled craftsmen use modern technology and the highest-quality materials to create products that are not only durable but also aesthetically pleasing.

Our services include:

Motorised outdoor blinds
Motorised outdoor awnings
Dual Roller blind System
Retractable blinds and awnings
Window awnings
PVC plastic outdoor blinds
Straight drop awnings
Outdoor window awnings
Roll up & crank blinds
Outdoor blinds for pergola
Track-guided outdoor blinds
Gazebo outdoor blinds
Drop awnings or crank blinds
Shade weave track guided blinds
Professional blinds for commercial restaurants, cafes and bistros
Premium balcony blinds
Outdoor patio blinds
Ziptrak outdoor blinds","Mattress and Blinds Manufacturing","11-50 employees","Partnership","Eastern Creek, New South Wales","Australia","homeworxaustralia.com.au","https://www.linkedin.com/company/homeworx-australia"
,"Ceccato Materassi","Să renaști din criză prin unirea forțelor, cu inovația și creativitatea ca baze solide: acesta este motivul de viață al organizației noastre.
CECCATO MATERASSI a luat naștere din experiența CIGNUS, o companie cu 50 de ani de experiență în sectorul sistemelor de dormit, menținându-și expertiza în proiectare și expertiză de fabricație în crearea de produse.
Mai mult, rămâne neschimbată dorința de a propune sisteme (saltele, baze de pat și perne) tehnologic din ce în ce mai avansate și perfect aderente la dorința de a satisface gusturile și nevoile utilizatorului, menite să răspundă exact principalelor probleme posturale.
Sistemele de pat CECCATO MATERASSI maximizeaza personalizarea datorita tehnologiilor si materialelor cu care sunt produse.
Dorința de a produce nu doar simple saltele, ci și instrumente care să răspundă nevoilor multiple ale utilizatorului final este primordială;
de la preferințele de rigiditate a suportului până la posibilitatea de a alcătui o saltea dublă pentru cupluri de dimensiuni diferite sau pur și simplu pentru a ajuta la probleme care sunt din ce în ce mai frecvente astăzi precum alergiile.","Mattress and Blinds Manufacturing","11-50 employees","Privately Held","Chișinău","Moldova","dinotte.shop","https://www.linkedin.com/company/ceccato-materassi"
,"Window Covering Network","Window covering network is made up of a group of industry professionals, each with their own specialties and decades of experience. 

Together, we bring a new mix of window covering manufacturers that provide high quality and affordable window covering products for our network partners.

As a window covering business owner, you are constantly bothered by the challenge of finding high-quality products that meet the diverse needs of your customers. This struggle not only impacts your ability to deliver exceptional service but also hinders your business growth and customer satisfaction.

Imagine being able to offer a wide range of stylish and functional window coverings that exceed your customers' expectations. By providing them with the perfect combination of aesthetic appeal, durability, and customization options, you can create spaces that truly reflect their unique style and enhance their overall satisfaction with your services.","Mattress and Blinds Manufacturing","2-10 employees","Partnership","Los Angeles, CA","United States","windowcoveringnetwork.com","https://www.linkedin.com/company/window-covering-network"
,"Opal Arabia","Opal Arabia is Crafting Exquisite Custom made Curtains, Blinds & more in Saudi Arabia.
#curtains #blinds #homedecor #somfy #opal_arabia
#الستائر","Mattress and Blinds Manufacturing","11-50 employees","Public Company","Riyadh","Saudi Arabia","opalarabia.com","https://www.linkedin.com/company/opalarabia"
,"Wimeta Projectzonwering","Wimeta projectzonwering verhoogt werk- en wooncomfort.
Buitenzonwering die wij leveren hebben uitstekende warmte en lichtwerende kwaliteiten. Binnenzonwering leent zich bij uitstek als lichtregulering (b.v. reflectie op beeldschermen) en raamdecoratie. De warmtewerende kwaliteiten zijn beduidend minder t.o.v. buitenzonwering.","Mattress and Blinds Manufacturing","11-50 employees","Privately Held","Geldermalsen, Gelderland","Netherlands","wimeta.nl","https://www.linkedin.com/company/wimeta-projectzonwering"
,"Industrias Humbert","Somos fabricantes de productos y comercializamos equipos para la elaboración de colchones. Prestamos servicios de acolchado, de alta calidad para telas aplicadas en colchonería y ofrecemos mantenimiento técnico a sus equipos. Nuestro propósito es darle tranquilidad, respaldo e innovación a su negocio teniendo presente la comodidad y satisfacción de los usuarios finales.","Mattress and Blinds Manufacturing","51-200 employees","Self Owned","Itagüi","Colombia","industriashumbert.co","https://www.linkedin.com/company/industrias-humbert"
,"MATTRESS GROUP","Somos fabricantes de los colchones de mayor calidad en el mercado Centro Americano. Nuestra esencia es la Integridad. Tenemos  el firme objetivo de ser la empresa de confianza  y que en cada segmento y categoría, nuestros clientes  nos elijan a ojo cerrado.","Mattress and Blinds Manufacturing","51-200 employees","Self Employed",,,"mattressgroup-inc.com","https://www.linkedin.com/company/mattress-group-inc"
,"FlipMattress","Geniet van ultiem comfort in de zomer én winter met ons keerbare matras. Fris in de zomer en warm in de winter.

Aan de ene kant zorgt ademende HR-schuimlaag ervoor dat warmte snel wordt afgevoerd, zodat je koel blijft tijdens warme nachten. Draai je het matras om, dan geniet je van de zachte zijde die warmte vasthoudt ideaal voor koude nachten. Zo creëer jij het ideale slaapklimaat, het hele jaar door.

Een goede nachtrust hoeft niet duur te zijn. Daarom gebruiken we duurzame materialen en produceren we al onze matrassen 100% in Nederland, in onze eigen fabriek in Gelderland. Door direct online te verkopen zonder winkels of tussenpersonen bieden we topkwaliteit voor een eerlijke prijs.","Mattress and Blinds Manufacturing","2-10 employees","Privately Held","Boven Leeuwen","Netherlands","flipmattress.nl","https://www.linkedin.com/company/flipmattress"
,"VEXONE","Vexone is at the forefront of sleep innovation, designing luxurious mattresses that combine cutting-edge technology with premium materials to revolutionize your rest. Our mission is to enhance well-being through better sleep, ensuring every Vexone mattress not only meets but exceeds your expectations for comfort and quality. Join us as we redefine what it means to sleep well, transforming nights into a foundation for energized, productive days. Experience the difference with Vexone—where sleep becomes a transformative journey.","Mattress and Blinds Manufacturing","11-50 employees","Privately Held",,,"vexone.in","https://www.linkedin.com/company/vexone"
,"Call A Mattress","We are committed to providing close out and premium mattresses to our clients and customers. We spend time carefully cleaning and sanitizing all of our mattresses to guarantee ultimate sleeping comfort to our customers.

Nothing beats comfortable and relaxing sleep on a clean and sanitized mattress. We aim to continuously provide sleep comfort and a cozy sleeping sanctuary for everyone.","Mattress and Blinds Manufacturing","11-50 employees","Privately Held","Jacksonville, Florida","United States","callamattressfl.com","https://www.linkedin.com/company/callamattresshop"
,"Deal Direct Blinds","We supplied to commercial, domestic and trade. 
We offer a 5 star service with over 650 5 star reviews, we pride ourselves on self on outstanding customer service. 
We are located in Gateshead but cover the whole of the country","Mattress and Blinds Manufacturing","11-50 employees","Public Company","Gateshead, England","United Kingdom","dealdirectblinds.co.uk","https://www.linkedin.com/company/deal-direct-blind"
,"China Shutter Factory","Welcome to China Shutter Factory ! 
Our mission is simple, to provide a great range of premium quality, inexpensive wholesale window .with total investment of $ 10 million with 1100 staff members and two branch company , which are located in Guangdong and Zhejiang .Guangdong branch product faux wood shutter ,wooden shutter and venetian blind and Zhejiang branch factory product aluminum shutter and wooden shutter .
Our company has all kinds of modern automatic production line equipment and a large number of production machines,including aluminum alloy plate of the lacquer , bake paint powder electrostatic coating and wood automatic spray paint and other large-scale production line . the main production: Venetian blind (wood, aluminum and faux wood ) ,vertical blind ,shutter (aluminum ,wooden and faux wood ) etc all kinds of curtain and hardware.","Mattress and Blinds Manufacturing","51-200 employees","Self Employed","东莞市, 广东省","China","chinashutterfactory.com","https://www.linkedin.com/company/china-shutter-factory"
,"Crystal Blinds","Founded by Mahmoud Abbas, A innovative startup Company specialist in tailoring All Curtain Types, printing, and Installation, the overriding aim focuses on obeys Quality and Precision. Every pleat, every track, every installation is executed with an unyielding commitment to quality. and we will not rest until every window reflects the perfection we strive for.

We understand that windows are not mere apertures; they are gateways to light, views, and inspiration. We approach Each customer order with the understanding that we don't just meet his expectations; we redefine them.","Mattress and Blinds Manufacturing","2-10 employees","Self Employed","Bahtīm, Al Qalyubiyah","Egypt",,"https://www.linkedin.com/company/crystal-for-blinds"
,"Hotel Bed","Hotel Bed for Mattress and Blinds Manufacturing","Mattress and Blinds Manufacturing","51-200 employees","Public Company","Cairo, Cairo","Egypt","hotelbedegypt.com","https://www.linkedin.com/company/hotelbedegypt"
,"Wanadream","Chez Wanadream, nous croyons qu'une bonne nuit de sommeil est la clé d'une journée réussie. C'est pourquoi nous vous proposons une collection sélectionnée de matelas, d'oreillers et de linge de lit haut de gamme conçus pour vous offrir un confort et un soutien ultimes. Notre gamme supérieure combine des technologies innovantes, des matériaux luxueux et un savoir-faire expert pour créer une expérience de sommeil incomparable.

Avec Wanadream, vous pouvez transformer votre chambre en un havre de détente et de rajeunissement. Nos matelas sont minutieusement conçus pour s'adapter aux contours de votre corps, soulager les points de pression et favoriser un alignement correct de la colonne vertébrale. Choisissez parmi une variété de niveaux de fermeté et de tailles pour trouver l'ajustement parfait selon vos préférences individuelles.

En complément de nos matelas exceptionnels, nos oreillers offrent un soutien personnalisé et une douceur inégalée. Fabriqués avec des matériaux hypoallergéniques et respirants, ils assurent un environnement de sommeil hygiénique et frais, vous permettant de vous réveiller revitalisé et prêt à affronter la journée.

Complétez votre sanctuaire de sommeil avec notre superbe linge de lit. Fabriqué à partir de tissus de qualité, il est non seulement somptueusement doux, mais aussi durable, garantissant des nuits confortables et reposantes pendant des années. Choisissez parmi une gamme de designs et de couleurs élégantes pour créer une esthétique de chambre qui reflète votre goût personnel.

Chez Wanadream, nous comprenons que le sommeil de qualité devrait être accessible à tous. C'est pourquoi nous vous proposons notre gamme supérieure aux meilleurs prix, afin que vous puissiez vous offrir le luxe sans vous ruiner. Découvrez la différence d'un","Mattress and Blinds Manufacturing","2-10 employees","Self Owned","Anderlecht, Brussels","Belgium","wanadream.be","https://www.linkedin.com/company/wanadream"
