"Find companies","Name","Description","Primary Industry","Size","Type","Location","Country","Domain","LinkedIn URL"
,"Detran-SP Oficial","O maior departamento de trânsito da América Latina é responsável por uma frota de 35,7 milhões de veículos e 26 milhões de condutores no estado de São Paulo. Desde 2011, vem promovendo uma ampla reestruturação com o objetivo de reduzir a burocracia dos serviços e melhorar a qualidade e a estrutura de atendimento aos cidadãos. 

O que o DetranSP faz: Presta serviços relacionados à Carteira Nacional de Habilitação (CNH), veículos e infrações, promove ações de educação para o trânsito e credencia as autoescolas, médicos e psicólogos para serviços de trânsito.

O que o DetranSP não faz: operação de radares, aplicação de multas por estacionamento em local proibido, gerenciamento da sinalização das ruas (semáforos e o transporte público dos municípios). *Essas são atribuições das prefeituras.","Public Assistance Programs","5,001-10,000 employees","Government Agency","São Paulo, SP","Brazil","detran.sp.gov.br","https://www.linkedin.com/company/detransp-oficial"
,"SDR Recruiting Co","Inspired by the impactful role of Virtual Assistants (VAs) in outreach, Spinwheel Assist was founded to extend and amplify their effectiveness. Through rigorous VA training and strategic partnerships with industry experts, Spinwheel Assist now offers multiple VA teams, catering to businesses in need of exceptional virtual support. Graduates from Spinwheel Academy emerge not just as proficient VAs, but also equipped to enhance business operations. Explore our comprehensive support structure and let Spinwheel Assist elevate your business today! ","Public Assistance Programs","2-10 employees","Self Owned",,,"spinwheelsales.com","https://www.linkedin.com/company/sdr-recruiting-co"
,"Opholdssteder","Opholdssteder.dk er de samlede stabsfunktioner, for en række specialiserede sociale tilbud til udsatte børn, unge og voksne. 
Målgruppen for tilbuddene er børn, unge og voksne med forskelligartede komplekse problemstillinger, hvilket også afspejles i de enkelte tilbud. 
Tilbuddene omfatter børne- og ungehjem, 1-1 projekter, skoletilbud, feriekoloni. 

Stabsfunktionerne på Opholdssteder.dk støtter med:
Visitation og kontakt med kommunale samarbejdspartnere. Bogholderi, HR-funktion. Psykologbistand, misbrugsbehandling, kvalitetssikring af det pædagogiske arbejde. Ledersparring. Derudover har vi et hold pedeller, som støtter i større vedligeholdelses opgaver. Projekter på tværs af tilbuddene.

For information om de enkelte tilbud henvises til deres hjemmesider:
Aktiv Weekend www.aktivweekend.dk
Alpha www.alpha-dk.dk
Fuglen www.fuglemosevej.dk
Hesselagergård www.hesselagergård.dk
Odamsgård www.odamsgård.dk
Stations Nord www.stationnord.dk
Stenbjerg feriekoloni www.feriekolonien.dk
Hørby STU kontakt tlf. 8681 7376
Specialskolen www.special-skolen.dk
Styrket Efterværn/Livline B, kontakt christine@opholdssteder.dk
1-1	Projekter, kontakt tlf. 8681 7376
Bo selv, kontakt tlf. 8681 7376","Public Assistance Programs","51-200 employees","Non Profit","Silkeborg, Jylland","Denmark","opholdssteder.dk","https://www.linkedin.com/company/opholdssteder"
,"Uzbekistan Art and Culture Development Foundation","Art and Culture Development Foundation under the Cabinet of Ministers of the Republic of Uzbekistan fosters international cooperation and promotes the culture of Uzbekistan on the international arena. The Foundation spreads the national heritage through developing and supporting initiatives in the areas of fine arts and architecture, literature, theatre, music, and dance. Our mission is to create an inclusive and accessible environment in the country's cultural institutions, contribute to renovation of museums, and to develop cultural patronage and professional training for the arts and culture sector.
The Foundation has also initiated a number of large-scale architectural projects in Uzbekistan: the reconstruction of the State Museum of Arts, the establishment of the Center for Contemporary Arts in Tashkent, the reconstruction of the State Children's Library, as well as the reconstruction of the residence of the Grand Duke Romanov.","Public Assistance Programs","51-200 employees","Government Agency","Tashkent","Uzbekistan","acdf.uz","https://www.linkedin.com/company/artandculturefdn"
,"Global Startup Center (GSC)","https://www.startup-korea.com/

The official Startup Hub, operated by the Ministry of SMEs and Startups (MSS) and the Korea Institute for Startup and Entrepreneurship Development (KISED), is tailored for foreigners interested in launching a tech startup or working at a startup in Korea. The GSC(Global Startup Center) will open in Gangnam this coming July.

For inquiries 

Please contact 
program_lead@startup-korea.com","Public Assistance Programs","201-500 employees","Government Agency","Séoul","South Korea","startup-korea.com","https://www.linkedin.com/company/gsc-kised"
,"WBIF - Western Balkans Investment Framework","The Western Balkans Investment Framework (WBIF) is a joint initiative of the EU, financial organisations, bilateral donors and beneficiaries, aimed at enhancing harmonisation and cooperation in investments for the socio-economic development of the region and contributing to the European perspective of the Western Balkans. 
Due to its collaborative nature in line with the ‘Team Europe’ approach, the WBIF is the main vehicle for implementation of the EU’s ambitious Economic and Investment Plan for the Western Balkans.","Public Assistance Programs","11-50 employees","Public Company","Skopje","Macedonia","wbif.eu","https://www.linkedin.com/company/wbif-western-balkans-investment-framework"
,"HelloLilly","Välkommen till HelloLilly!

HelloLilly är ett matchningsbolag som jobbar stenhårt med att matcha arbetssökande till jobb eller studier. Vi tror på att sätta enkla och tydliga mål och att jobba digitalt för att effektivisera matchningsprocessen.

Vårt mål är att hjälpa dig som söker jobb eller utbildning, på ett enkelt och tydligt sätt. Vi har lång erfarenhet av att matcha arbetssökande med arbetsgivare.

HelloLilly startades under Corona-krisen, då ett stort antal människor förlorade sina arbeten och arbetslösheten i Sverige växte. Arbetslöshetskurvorna pekade brant uppåt, samtidigt som många arbetsgivare fortfarande sökte personal.

Vi såg en enorm kompetensbank som behövde matchas till jobb eller studier och kände att det behövs effektivare och vassare matchning för att ta i tu med detta, för att hjälpa arbetssökande personer, arbetsgivare och samhället.

Teamet bakom HelloLilly har lång erfarenhet av rekrytering och headhunting, och erfarenhet av försäljning och digitalisering.","Public Assistance Programs","11-50 employees","Privately Held","Solna","Sweden","hellolilly.se","https://www.linkedin.com/company/hellolilly"
,"In3pid","In3pid er en konsulentvirksomhed, der på både strategisk og udførende niveau løser opgaver relateret til kriminalitet.
Det kan være vredeshåndtering, generel rådgivning om problematikker inden for det kriminologiske felt, temadage, supervision eller lignende.
Det faglige afsæt er 19 års erfaring som socialrådgiver, leder og konsulent i det offentlige. 
Det teoretiske afsæt er fra en socialrådgiveruddannelse, en kandidat i socialt arbejde og en diplom i kriminologi. 
Hands-on erfaringen er primært med voksne mænd involveret i organiseret eller/og grupperelateret kriminalitet og facilitering af deres proces ud af miljøet og tilbage til samfundet.","Public Assistance Programs","2-10 employees","Self Employed","Køge","Denmark","in3pid.dk","https://www.linkedin.com/company/in3pid"
,"Ministério da Juventude e Desporto","Youth e developments","Public Assistance Programs","51-200 employees","Government Agency",,,"seje.gov.mz","https://www.linkedin.com/company/seje-secretaria-de-estado-da-juventude-e-emprego"
,"IMPO Badalona","Impuls Municipal de Promoció de l'Ocupació (IMPO) és un servei de l'Ajuntament de Badalona dedicat a promoure l'ocupació, la formació i el desenvolupament econòmic al municipi. Amb el suport d'institucions supramunicipals com la Generalitat de Catalunya (Servei d’Ocupació de Catalunya), la Diputació de Barcelona (Xarxa de Municipis), la Unió Europea (Fons Social Europeu) i el Consell Comarcal (Pacte Territorial per a la Promoció Econòmica i l’Ocupació del Barcelonès Nord), l'IMPO treballa per impulsar una Badalona més activa i inclusiva.

La nostra missió és dissenyar, gestionar i implementar recursos que millorin l’ocupabilitat de la ciutadania i fomentin el creixement econòmic local. Per aconseguir-ho, oferim una àmplia gamma de serveis:
- Assessorament i orientació laboral per a persones en recerca activa de feina.
- Formació professional per adquirir noves competències i millorar la qualificació laboral.
- Suport a emprenedors i projectes empresarials per impulsar noves iniciatives.
- Anàlisi del mercat laboral a través de l'Observatori d'Ocupació, que estudia i publica dades sobre l'evolució del mercat laboral a Badalona.

A l’IMPO, treballem amb la mirada posada en la innovació, la inclusió social i la sostenibilitat per construir un futur amb més oportunitats per a tothom.","Public Assistance Programs","51-200 employees","Public Company","Badalona, Barcelona","Spain","badalona.cat","https://www.linkedin.com/company/impobdn"
,"Allguruji Astrologers","All Guruji is the India and most trusted online platform for Hindu puja service, Vedic Rituals, Religious Ceremonies and Astrology Services. We provide the India’s well-known, highly qualified and experienced Shastries and Pandits for you who will come to your house and do the puja. Our services also include online Puja Samagri or Puja Items.
All Guruji covers major rituals that include the Hawan, Shanti Vidhi, Shubh Vivah – Wedding Ceremony, Satyanarayan Katha, Griha pravesh , Namkaran Sanskar or Naming Ceremony, Nava Graha Shanti, Vangnischaya or Sakharpude or Engagement, Laxmi Puja, Thread Ceremony or Maunji Bandhan, Ganesh Puja, Annaprashan, Ramayan Paath, Mundan Sanskar, Bhagwat katha, Vastu Shanti, Sundarkand Puja etc.
You will also find lots of knowledge and details on Hindu rituals on this website. So if you are looking for Online Pandit ji or want to have puja at your place then book your puja now!!","Public Assistance Programs","2-10 employees","Partnership","Gurugram, Haryana","India","allguruji.com","https://www.linkedin.com/company/allguruji"
,"Digitalzh","Digitalzh is de European Digital Innovation hub voor Zuid-Holland. Digitalzh helpt alle bedrijven die sneller, goedkoper, duurzamer of hoogwaardiger willen produceren dankzij digitalisering. Ook verbindt Digitalzh het Zuid-Hollandse ecosysteem rond AI, data & digitalisering.","Public Assistance Programs","2-10 employees","Non Profit","The Hague, South Holland","Netherlands","digitalzh.nl","https://www.linkedin.com/company/digitalzh"
,"The Circular City Centre – C3","The Circular City Centre - C3 is a competence and resource centre within the European Investment Bank, which supports EU cities in their circular economy transition.  C3 has been established in cooperation with the European Commission, in the framework of the Circular Cities and Regions Initiative, under co-funding from the EU.

Recognising the role of cities as cradles and catalysts of circular action and change, C3 helps cities to make circular progress and to identify and prepare sound circular projects for financing.

C3 can help cities address many of the linear problems they struggle with today, to become more resilient, resourceful, clean and liveable for residents and businesses.

C3 supports cities in four different ways:
- By mobilising EU cities through awareness raising activities on the benefits of the circular economy
- By offering guidance documents and tools to help cities take circular action
- By delivering Circular City Advisory (CCA) programmes for cities to develop circular economy strategies and projects
- By helping cities to prepare circular projects and improve their access to financing via Circular Project Advisory (CPA) support

Visit the C3 web page to learn more and get support.","Public Assistance Programs","2-10 employees","Non Profit","Luxembourg","Luxembourg","eib.org","https://www.linkedin.com/company/circular-city-centre-c3"
,"Programa Integra","El Programa INTEGRA busca reducir las vulnerabilidades de las personas migrantes y refugiadas procedentes de Venezuela, así como las de las comunidades de acogida. Todo ello para favorecer la integración y la inclusión social, permitiendo aumentar la resiliencia y superar la crisis económica y social provocada por la pandemia en Ecuador.","Public Assistance Programs","2-10 employees","Non Profit","Quito","Ecuador","programaintegra.org","https://www.linkedin.com/company/programa-integra"
,"ASP DOTNET Core Clean Architecture","Loosely-Coupled and Inverted-Dependency Architecture in ASP.NET Core 5 WebApi Template with good design patterns and practices for enterprise application, so that you can get started in no time.","Public Assistance Programs","Self-employed","Self Employed","Tehran","Iran",,"https://www.linkedin.com/company/asp-dotnet-core-clean-architecture"
,"Forêts et Développement Rural (FODER)","Notre mission consiste à créer un cadre propice au développement durable à travers des actions visant à garantir la justice et l’équité, les droits et la démocratie, la gestion transparente, participative et durable des ressources naturelles, la préservation de la diversité biologique et l’amélioration de la qualité de la vie et de l’environnement.","Public Assistance Programs","51-200 employees","Non Profit","Yaoundé, Centre","Cameroon","forest4dev.org","https://www.linkedin.com/company/forêts-et-développement-rural-foder"
,"Sociala Insatser Sverige","Social Insatser Sverige har som mål att placera barn/ungdomar i kompetenta, erfarna, utredda och trygga familjehem där barnens bästa är i fokus. Vi arbetar med vård och genomförandeplaner individuellt anpassade till klientens behov och utifrån uppdragets beskrivning. 

Sociala insatser Sverige erbjuder förutom ovanståendes även vår särskilda insats: Förstärkta Familjehem.
Denna insats är primärt riktad mot de barn och ungdomar som befunnit sig i miljöer som präglats av kriminalitet och missbruk och har ett  behov av extra stöd. Insatserna har ett gediget behandlingsupplägg och ungdomen tilldelas förutom familjehemmet två coacher som man träffar utanför familjehemmet. Coacherna har lång erfarenhet av arbete med den aktuella målgruppen","Public Assistance Programs","2-10 employees","Public Company","Örebro, Örebro County","Sweden","socialainsatser.nu","https://www.linkedin.com/company/socialainsatser"
,"JASPERS partnership","JASPERS, run by the EIB and co-funded by the European Commission, helps cities and regions to deliver high quality projects. 

Our experts advice on strategies, programmes and projects in investments supported by European grant funds. 

JASPERS assistance is free of charge for local authorities and promoters and our support is available to the majority of EU and pre-accession countries.","Public Assistance Programs","51-200 employees","Partnership","Luxembourg","Luxembourg","eib.org","https://www.linkedin.com/company/jaspers-partnership"
,"Stand by You Schweiz","«Stand by You Schweiz» ist der Dachverband der Angehörigen und Vertrauten von Menschen mit psychischen Erkrankungen. Er möchte die Solidaritätsnetzwerke unter den Angehörigen stärken, die Unterstützungsangebote für Angehörige und Vertraute erweitern und dazu beitragen, dass die psychiatrische und sozialpsychiatrische Versorgung in der Schweiz wirksamer, nachhaltiger und menschlicher wird.","Public Assistance Programs","2-10 employees","Non Profit",,,"stand-by-you.ch","https://www.linkedin.com/company/stand-by-you-schweiz"
,"PILARES CDMX","Somos puntos de encuentro de y
para la ciudadanía, en los cuales encontrarás:
ciberescuelas, disciplinas artísticas, actividades deportivas, talleres de emprendimiento y capacitación para el empleo.","Public Assistance Programs","1,001-5,000 employees","Educational","Álvaro Obregón, Ciudad de México","Mexico","cdmx.gob.mx","https://www.linkedin.com/company/pilares-cdmx"
,"Nationaal Programma Den Haag Zuidwest","Het Nationaal Programma Den Haag Zuidwest (NPZW) wil perspectief terugbrengen in de wijken Moerwijk, Morgenstond, Bouwlust en Vrederust, en in het leven van de bewoners. Het doel is dat de bewoners in 2040 dezelfde kansen hebben als andere inwoners van Den Haag.","Public Assistance Programs","2-10 employees","Non Profit",,,"npzw.nl","https://www.linkedin.com/company/nationaal-programma-zuidwest"
,"Coopera4development","We bring our clients' institutional performance to its full potential, delivering unbeatable results

We are a consulting firm with more than 10 years of experience in public policies and international cooperation for development that focuses on empowering institutions to increase their performance and to make a positive impact on people and their environment, helping populations to thrive, not just survive.

COOPERA4DEVELOPMENT is located in Spain and Mexico, so it can work with partners and clients in Europe, Latin America and the Caribbean to help them improve the well-being of vulnerable populations through institutional strengthening..

Since the interests and capacities of our clients are diverse, we offer different forms of collaboration that adapt to their needs and priorities. Our goal is to facilitate successful collaboration at all levels and take advantage of every opportunity to create a positive impact on people’s lives, helping them to thrive, not just to survive.

COOPERA4DEVELOPMENT delivers practical and realistic solutions to specific social challenges, considering local needs and capacities. Our team has been recognized for its ability to bring realistic, innovative, well-defined, and sustainable solutions, while maximizing the use of resources

Our clients primarily include multilateral development organizations, international organizations, universities, governments, diplomatic institutions, local stakeholders and private sector companies committed to increasing the well-being of vulnerable populations.","Public Assistance Programs","2-10 employees","Public Company","Ciudad de México, México, Ciudad de México","Mexico","coopera4development.com","https://www.linkedin.com/company/coopera4development"
,"Goal 17 Ltd","Our Mission and Vision:

Goal 17 deliver mentoring programs that help break down barriers in society. On behalf of public and private sector clients, we identify, vet, and train an army of volunteer mentors and match them with disadvantaged young people, UK-wide. We are transforming thousands of young lives and using our entrepreneurial approach to create a sustainable income that does not rely on charitable donations or grants.

However, we are more than a mentoring program and a beacon of hope for young people. We are also a catalyst for transformative change. We are using our business to help inform people of the challenges others face, giving them the skills and channels to become agents of change.

Our success lies in our innovative abilities to cultivate thriving communities of dedicated volunteers, academic partnerships to ensure the highest training standards, leverage our networks to bring opportunities to young participants, and harness technology to safeguard everyone involved.


Our Clients:

We have had the pleasure of working with local authorities across the UK and are supporting the Mayor of London in his ambition to ensure 100,000 disadvantaged young people have access to a mentor.

Goal 17 also work alongside many corporate clients designing and delivering bespoke mentoring programmes to help them meet their internal Inclusion Strategies and external Social Value requirements as part of procurement and contract strategies.


Our Awards and Accolades:

We are most publicly know for our work developing Care Leaver Mentoring Programmes (see www.careleavermentoring.co.uk) and have trained over 1000 volunteer mentors. For our work we have been featured in the national press, in Forbes, on the BBC News and in many other media outlets. We are honoured to have also received multiple awards for our work including the National Mentoring Award and the Best Mentoring Programme in Greater London.","Public Assistance Programs","2-10 employees","Privately Held","London, England","United Kingdom","goal17.global","https://www.linkedin.com/company/goal17global"
,"Ung 24","Innehar IVO-tillstånd för att bedriva  öppenvårdsinsatser samt jour- och familjehem för barn och unga. Verksamheten är särskilt inriktade mot ungdomar som lever i kriminalitet samt förstärkta familjehem.","Public Assistance Programs","11-50 employees","Privately Held","Stockholm","Sweden","ung24.se","https://www.linkedin.com/company/ung24"
,"Rioprevidência","O Rioprevidência é uma autarquia pública vinculada ao Governo do Estado do Rio de Janeiro, criada pela Lei nº 3189, de 22 de fevereiro de 1999, com a finalidade de gerir os ativos financeiros destinados ao custeio dos benefícios previdenciários dos servidores públicos estaduais e seus dependentes.

Responsável pela administração, habilitação e pagamento de proventos, pensões e outros benefícios previstos no Regime Próprio de Previdência Social (RPPS), o Rioprevidência atua com base em princípios como transparência, governança e responsabilidade social. Sua missão é garantir a excelência na prestação de serviços aos segurados, assegurando o cumprimento das obrigações previdenciárias atuais e futuras, com eficiência e credibilidade.

O objetivo do Rioprevidência é consolidar-se como referência nacional na gestão de regimes próprios de previdência, promovendo a satisfação dos segurados, a boa administração de ativos e passivos, e a conformidade com as melhores práticas de governança.","Public Assistance Programs","5,001-10,000 employees","Government Agency","Rio de Janeiro","Brazil",,"https://www.linkedin.com/company/rioprevidência"
,"Herprogrammeer De Overheid","Herprogrammeer de Overheid brengt de kennis en kunde van de tech industrie naar Den Haag. Wij helpen de politiek bij besluitvorming en helpen de overheid met digitalisering. Omdat wij van Nederland de beste digitale overheid ter wereld willen maken.","Public Assistance Programs","2-10 employees","Non Profit",,,"herprogrammeerdeoverheid.nl","https://www.linkedin.com/company/herprogrammeer-de-overheid"
,"ProAzul - Fundo de Desenvolvimento da Economia Azul, FP","O Fundo de Desenvolvimento da Economia Azul, FP - ProAzul, é um mecanismo financeiro do Governo que trabalha em parceria com os diferentes sectores do Estado, sector privado e a sociedade civil para que recursos estratégicos e financeiros sejam alinhados com iniciativas efectivas de exploração sustentável das águas interiores, mar e linha costeira criado pelo decreto 91/2019 de 27 de Novembro.

Entre as principais actividades que realiza o Fundo estão a gestão financeira e estratégica de projectos, o desenho de mecanismos financeiros e estudos de novas fontes de recursos, além da assistência técnica ao Governo de Moçambique no desenvolvimento da Economia Azul e o cumprimento dos Objectivos de Desenvolvimento Sustentável, em especial o objectivo 14.

O ProAzul irá operacionalizar uma Plataforma que funcione como porta de entrada e articulação entre ofertantes e demandantes – Governo, Parceiros de Cooperação, Sector Privado, ONGs e Academia – assegurando a triagem, repasse e acompanhamento a todos eles, de informação sobre as necessidade de financiamento de projectos destinados ao desenvolvimento da economia azul, em especial aos sectores de portos e infraestrutura, recursos minerais e hidrocarbonetos, pesca e aquacultura, cultura, turismo e desporto, transporte marítimo e indústria naval, energia e pesquisa e desenvolvimento.","Public Assistance Programs","51-200 employees","Government Agency","Maputo, Maputo","Mozambique","proazul.gov.mz","https://www.linkedin.com/company/proazul-fundo-de-desenvolvimento-da-economia-azul-fp"
,"Rushing 2 Your Needs LLC","At Rushing 2 Your Needs, we are dedicated to providing compassionate and reliable errand services for Veterans and Seniors. Founded in 2022 by Heidi Rushing, our mission is to enhance the quality of life for these communities by offering personalized support and fostering a sense of unity.
Join us today and experience the reliable support you deserve!","Public Assistance Programs","Self-employed","Self Employed","North Carolina","United States","rushing2yourneeds.net","https://www.linkedin.com/company/rushing-2-your-needs-llc"
,"Red de Mentores de Madrid Emprende","Conectamos el talento innovador con más de 200 mentores de primer nivel para acelerar el desarrollo de proyectos emprendedores en Madrid.
Somos una pieza clave en el ecosistema emprendedor madrileño, una iniciativa estratégica de Madrid Emprende para fortalecer la ciudad como hub de innovación y emprendimiento líder en Europa.

Nuestra red ofrece:
-Sistema estructurado y personalizado de mentoría 100% gratuito.
- Mentores seleccionados por su trayectoria y experiencia profesional comprobada.
- Especialización en múltiples sectores estratégicos

Conoce más de nuestra red y únete!","Public Assistance Programs","2-10 employees","Public Company","Madrid, Madrid","Spain","madridemprende.es","https://www.linkedin.com/company/red-de-mentores-de-madrid-emprende"
