"Find companies","Name","Description","Primary Industry","Size","Type","Location","Country","Domain","LinkedIn URL"
,"ÉVI·LAB","Le laboratoire d’évaluations et d’interventions fondées sur les données probantes (EVI·LAB) est une organisation pour l’instant encore informelle qui constitue une déclinaison opérationnelle du comité de pilotage des pratiques professionnelles fondées sur les données probantes de l’association Groupe SOS Jeunesse. Cette organisation aspire à devenir un centre de la preuve (à l’instar du modèle des « What works centres » britanniques), un centre « ressources » adossé aux acquis de la recherche scientifique, un centre qui propose en matière de développement psycho social des personnes :
- l’information scientifique aux professionnels,
- l’accompagnement des bénéficiaires par le biais de pratiques professionnelles validées scientifiquement ou prometteuses sur le plan scientifique,
- la formation des professionnels à des pratiques professionnelles validées
scientifiquement ou prometteuses sur le plan scientifique.
Cette organisation propose le déploiement d’évaluations et d’interventions fondées sur les données probantes, autrement dit sur les données acquises de la recherche scientifique. La structure se réunit ponctuellement au gré des opportunités et vise le développement psychosocial des personnes qu’elles soient mineures, majeures, connues des institutions ou non. A ce titre, elle inscrit son action aussi bien dans la prévention primaire (universelle) et secondaire (sélective) que dans la prévention tertiaire (indiquée). La spécificité d’ÉVI·LAB constitue le recours à des pratiques professionnelles validées scientifiquement ou prometteuses du point de vue scientifique.","Public Assistance Programs","2-10 employees","Non Profit",,,,"https://www.linkedin.com/company/évi·lab"
,"Veras Trygga Hem AB","På Veras Trygga Hem arbetar vi för att skapa en trygg och omsorgsfull miljö för individer i behov av skyddat boende. Vi är dedikerade till att stötta människor som befinner sig i utsatta situationer, med fokus på säkerhet, integritet och respekt.

Vi erbjuder:

Skyddat boende: En säker plats där du kan känna dig trygg.
Stöd och rådgivning: Skräddarsydd hjälp för att hantera svåra livssituationer.
Omsorg och värme: Ett team av engagerade och erfarna medarbetare som bryr sig om dig.
Med vår erfarenhet och vår passion för att hjälpa andra är vårt mål att skapa en plats där du kan känna dig säker och få stöd när du behöver det som mest.

 Veras Trygga Hem – Där trygghet börjar.","Public Assistance Programs","2-10 employees","Public Company","Jönköping","Sweden","verastryggahem.se","https://www.linkedin.com/company/veras-trygga-hem"
,"Ogólnopolska Federacja na rzecz Rozwiązywania Problemu Bezdomności",,"Public Assistance Programs","2-10 employees","Non Profit","Zabrze","Poland","bezdomnosc.pl","https://www.linkedin.com/company/ofrpbpoland"
,"Association Piste Libre","Notre raison d’être est de promouvoir un sport sain et sécurisé.

En tant que pratiquant de sports de glisse, vous vous sentez harcelé, abusé, maltraité ou discriminé ? Nous sommes à votre écoute pour vous aider et vous conseiller dans les démarches à entreprendre grâce à notre cercle de professionnels de confiance.","Public Assistance Programs","2-10 employees","Self Employed",,,"piste-libre.com","https://www.linkedin.com/company/association-piste-libre"
,"National Solidarity Fund","The National Solidarity Fund (FNS) is a public institution in Luxembourg that plays a key role in the field of social solidarity.
Its mission is to support individuals and households facing financial difficulties and to prevent social exclusion. The FNS manages and pays several statutory social benefits, including the Social Inclusion Income (REVIS), the allowance for the severly disabled (RPGH), the cost-of-living benefit/energy allowance/financial assistance for seniors (AVC), the advance on and recovery of maintenance payments, trhe child-raise pension and the supplement for seniors
The Fund is responsible for assessing eligibility conditions, processing applications, and ensuring the lawful, efficient, and fair payment of benefits.
It operates on behalf of the Luxembourg State and under the supervision of the Ministry of Family Affairs, Solidarity, Living Together and Reception of Refugees.","Public Assistance Programs","51-200 employees","Government Agency","Luxembourg,  Luxembourg","Luxembourg","public.lu","https://www.linkedin.com/company/fonds-national-de-solidarité"
,"Programa Nacional Justicia Juvenil Restaurativa - Arequipa","𝐏𝐫𝐨𝐠𝐫𝐚𝐦𝐚 𝐍𝐚𝐜𝐢𝐨𝐧𝐚𝐥 𝐝𝐞 𝐉𝐮𝐬𝐭𝐢𝐜𝐢𝐚 𝐉𝐮𝐯𝐞𝐧𝐢𝐥 𝐑𝐞𝐬𝐭𝐚𝐮𝐫𝐚𝐭𝐢𝐯𝐚 𝐝𝐞𝐥 𝐌𝐢𝐧𝐢𝐬𝐭𝐞𝐫𝐢𝐨 𝐏ú𝐛𝐥𝐢𝐜𝐨 - 𝐃𝐢𝐬𝐭𝐫𝐢𝐭𝐨 𝐅𝐢𝐬𝐜𝐚𝐥 𝐀𝐫𝐞𝐪𝐮𝐢𝐩𝐚
Programa que coadyuva en la administración de justicia penal juvenil, con una atención oportuna y especializada en la defensa y protección de los derechos de los adolescentes en conflicto con la ley penal. 
Busca resolver a nivel prejudicial, el conflicto jurídico penal, a través de la aplicación de la Remisión Fiscal bajo el enfoque restaurativo, promoviendo su efectiva reinserción social; así como, la reparación del daño ocasionado a la víctima y a la comunidad.","Public Assistance Programs","2-10 employees","Government Agency","Arequipa, Arequipa","Peru",,"https://www.linkedin.com/company/pjjr-aqp"
,"Fondation Assalam pour le développement social section Moulay Rachid","Qui sommes-nous :
L'Association Al Salam pour le Développement Social, branche de la préfecture des provinces de Moulay Rachid, est une association caritative marocaine indépendante et non gouvernementale, spécialisée dans l'assistance aux orphelins, fondée en 2002.

Notre vision :
La dignité humaine et le développement de la société.

Notre mission :
Améliorer et enrichir la vie des individus et des familles en difficulté pour préserver leur dignité humaine à travers des programmes de développement durable, avec des contrats clairs et une main-d'œuvre qualifiée, basés sur les valeurs de miséricorde et de solidarité, conformément aux normes de qualité et de professionnalisme, dans le but d'atteindre l'excellence et le leadership.

Numéro de téléphone de l'association : 0522711939
Pour toute communication et demande d'information : 0636826061","Public Assistance Programs","2-10 employees","Non Profit","casablanca, moulay rachid","Morocco",,"https://www.linkedin.com/company/fondation-assalam-pour-le-développement-social-section-moulay-rachid"
,"Kurdele","Kurdele kanser hastası çocukların sosyalleşebilmesi ve motive olmasını amaçlayan bir kuruluştur. 

İster etkinliklere katılabilir isterse Discord'da sadece sohbet edebilir.

Etkinlikler için takipte kalın <3","Public Assistance Programs","Self-employed","Non Profit",,,,"https://www.linkedin.com/company/kurdele"
,"AJA - Programa Agente Jovem Ambiental","O Agente Jovem Ambiental (AJA) é um programa do Governo do Estado do Maranhão que objetiva promover a inclusão social e ambiental de jovens maranhenses por meio do estímulo à participação em projetos socioambientais sustentáveis, visando contribuir para a preservação e conservação do meio ambiente, estimular o protagonismo juvenil e o desenvolvimento de competências e habilidades que proporcionem a construção de uma cidadania ambiental, além de ampliar as oportunidades de geração de renda e melhoria da qualidade de vida.","Public Assistance Programs","1,001-5,000 employees","Government Agency","São Luís, Maranhão","Brazil","sema.ma.gov.br","https://www.linkedin.com/company/programa-agente-jovem-ambiental"
,"Les Passeurs d'Avenir","Les Passeurs d’Avenir ont pour mission d’accompagner les jeunes majeurs sortis de l’Aide Sociale à l’Enfance vers l’autonomie, les études et un avenir serein. Nous offrons logement, mentorat personnalisé, soutien administratif et formation à la vie quotidienne pour qu’aucun jeune ne soit laissé seul après ses 18 ans. Un toit, des soutiens, un avenir.","Public Assistance Programs","2-10 employees","Non Profit",,,"lespasseursdavenir.org","https://www.linkedin.com/company/les-passeurs-d-avenir"
,"Dakar Assistance","Dakar Assistance vous assiste pour vos #remorquages, vos #rappatriementsdecorps, pour une #assistancevoyage et ceci à l'échelle #international","Public Assistance Programs","2-10 employees","Public Company","Dakar","Senegal","dakarassistance.international","https://www.linkedin.com/company/dakar-assistance"
,"Christian Women Leadership Program",,"Public Assistance Programs","2-10 employees","Educational",,,,"https://www.linkedin.com/company/christian-women-leadership-program"
,"Rotary Club Abidjan Riviera","Club n°17151 affilié au Rotary International, le Rotary Club Abidjan Riviera est membre du district 9101","Public Assistance Programs","11-50 employees","Non Profit","Abidjan","Ivory Coast",,"https://www.linkedin.com/company/rotary-club-abidjan-riviera"
,"Rzeszowskie Centrum Integracji","Rzeszowskie Centrum Integracji (RCI) działa na rzecz integracji migrantów i uchodźców w Polsce. RCI współpracuje z Międzynarodowej Organizacji do spraw Migracji (IOM) i ma na celu wspieranie integracji społecznej migrantów i uchodźców w Polsce.

RCI oferuje szeroki zakres działań, w tym m.in. kursy języka polskiego oraz angielskiego, doradztwo biznesowe oraz zawodowe, wsparcie w znalezieniu pracy oraz zapewnienie opieki w czasie trwania zajęć. RCI angażuje również lokalne społeczności w swoje działania, aby promować wzajemne zrozumienie i tolerancję między kulturami. Dzięki swojej pracy na rzecz integracji migrantów i uchodźców w Polsce, Rzeszowskie Centrum Integracji stało się ważnym ośrodkiem wsparcia dla wielu osób, które zdecydowały się na życie w Polsce.","Public Assistance Programs","2-10 employees","Non Profit","Rzeszów, Podkarpackie","Poland","germanitas.pl","https://www.linkedin.com/company/rzeszowskie-centrum-integracji"
,"Element Disability Services","Element Disability Services is a registered NDIS provider. We can help you to: Understand and implement your NDIS plan, Assess support options, Connect with services & Manage your NDIS plan.","Public Assistance Programs","Self-employed","Self Owned","Frankston, VIC","Australia","elementdisability.com.au","https://www.linkedin.com/company/element-disability-services"
,"Welcome Néovie","Welcome Néovie accompagne les personnes atteintes de néophobie alimentaire et leurs proches à mieux comprendre ce trouble, à progresser sans pression et à trouver des solutions adaptées à leur quotidien.

Notre mission :
 Sensibiliser à la néophobie et casser les idées reçues
 Apporter des conseils concrets et bienveillants
 Créer une communauté de partage et de soutien
 Encourager chacun à avancer à son rythme

Parce que manger ne devrait jamais être une source de stress, Welcome Néovie t’aide à reprendre confiance, sans culpabilité ni contrainte.

 Rejoins-nous pour échanger, apprendre et avancer ensemble.","Public Assistance Programs","Self-employed","Self Employed","Toulouse","France",,"https://www.linkedin.com/company/welcome-neovie"
,"Non-governmental organization ""Ukrainian Monolitnisty""""","The team of the NGO Ukrainian Monolitnisty is actively engaged in the support and reconstruction of Chernihiv Oblast and Ukraine as a whole. The team implements projects in many directions: humanitarian response, educational projects, psychological assistance, organization of charity events, artistic direction. We are constantly looking for support for our activities and will be glad to consider cooperation options with you!","Public Assistance Programs","2-10 employees","Non Profit","Чернігів","Ukraine",,"https://www.linkedin.com/company/ngo-um"
,"Stichting BOVEN","BOVEN is in 2020 opgericht als uitvloeisel van een bestuurlijk symposium over veiligheid in de energietransitie, georganiseerd door het ministerie van Economische Zaken en Klimaat (EZK). Geconstateerd werd dat de lokaal bestuurlijke besluitvorming over een veilige energietransitie in Nederland gebaat kon zijn bij het delen van inzichten en ervaringen door collega-bestuurders.","Public Assistance Programs","2-10 employees","Non Profit",,,"werkgroep-boven.nl","https://www.linkedin.com/company/stichting-boven"
,"7 KITA NEFES İNSANİ YARDIM DERNEĞİ","7 KITA NEFES İNSANİ Yardım derneği İzmit'te kurulmuş bir dernektir. Amacımız, dünyanın tüm coğrafyalarında zor durumlardaki insanlara maddi manevi el uzatmak,zorlukları beraber aşmak, umut olmak. İnanıyoruz ki dünyayı ele daha güzel bir yer yapabiliriz.","Public Assistance Programs","11-50 employees","Non Profit","BAŞİSKELE/KOCAELİ, SERDAR MAH. YAVUZ CAD. 7/13","Turkey","7kitanefes.org","https://www.linkedin.com/company/7-kita-nefes-derneği̇"
,"Aidoff","Personal assistant","Public Assistance Programs","51-200 employees","Self Employed",,,"aidoff.com","https://www.linkedin.com/company/aidoff"
,"PARIIS Niger",,"Public Assistance Programs","201-500 employees","Government Agency",,,"pariis-niger.org","https://www.linkedin.com/company/pariis-niger"
,"EastAid","Wir unterstützen die Menschen in Kambodscha.","Public Assistance Programs","Self-employed","Non Profit","Zürich, Zürich","Switzerland","eastaid.ch","https://www.linkedin.com/company/www.eastaid.ch"
,"Compassion Soul Winners Outreach International","Compassion Soul Winners Outreach International (CSWOI) is a nonprofit   making organization with the registration number (116-480) recognized by the Department of Social Development Pretoria South Africa and Public Benefit Organization registered with SARS with Reference number (930072959). We are also registered with  Central Supply Databased with reference number (MAAA1184645) as Supplier of Various  services and Products.
We are also UN Special Consultative None Governmental Organization that got the acre dictation from Ghana, whiles Operating in United Nation System as an  international   None Governmental Organization.
It started in Ghana as  None-governmental  Organization by Mr.  Francis Asomaning and his team,  the president of CSWOI since 2008 in Ghana and still Operating in Ghana  as  NGO. The Organization extended its feathers to South Africa in 2012 and registered in South Africa in 2013 as Non for profit Organization. since then it has   been operating both in Ghana and South Africa till date.","Public Assistance Programs","2-10 employees","Non Profit","Johannesburg","South Africa","compsoulw.net","https://www.linkedin.com/company/cswoi"
,"EAU PROPRE D'AFRIQUE-TOGO",,"Public Assistance Programs","2-10 employees","Self Employed",,,"eau-propre.org","https://www.linkedin.com/company/eaupropretogo"
,"Under3","By November 2023, we will provide a tool for users to document abuse, and assess their quality of life and relationships. We will also provide educational resources and build a community for individuals experiencing similar circumstances.","Public Assistance Programs","2-10 employees","Privately Held",,,"under3.ca","https://www.linkedin.com/company/under3-app"
,"Regionaal Programma Jongeren","Regionaal Programma Jongeren, is een regionaal programma 2026 – 2029 in het kader van het wetsvoorstel ‘Van school naar duurzaam werk’. Deze wet legt nieuwe taken op aan scholen, gemeenten, Doorstroompunten en Arbeidsmarktregio's om jongeren te helpen en te begeleiden richting school of duurzaam werk. 

Het doel is om te voorkomen dat jongeren (tot 27 jaar) stoppen met school zonder startkwalificatie en om hen actief te helpen bij de overgang naar de arbeidsmarkt.","Public Assistance Programs","2-10 employees","Government Agency",,,,"https://www.linkedin.com/company/regionaal-programma-jongeren"
,"Secretaria Municipal de Educação de Matriz de Camaragibe",,"Public Assistance Programs","501-1,000 employees","Government Agency","Matriz de Camaragibe, Alagoas","Brazil","matrizdecamaragibe.al.gov.br","https://www.linkedin.com/company/secretaria-municipal-de-educação-de-matriz-de-camaragibe"
,"Alabama Department of Child Abuse & Neglect Prevention",,"Public Assistance Programs","11-50 employees","Government Agency",,,"alabama.gov","https://www.linkedin.com/company/alabama-department-of-child-abuse-neglect-prevention"
,"Enhancing Resilience in Kyrgyzstan","Цель проекта - оказание поддержки Правительству Кыргызской Республики в повышении потенциала в области управления рисками стихийных бедствий.
Компоненты проекта:  
 Улучшение систем готовности и реагирования на стихийные бедствия;  
 Улучшение безопасности и функциональности школьной инфраструктуры;  
 Совершенствование финансовой защиты и страхования против рисков природных стихийных бедствий;  
 Реагирование на непредвиденные ЧС.","Public Assistance Programs","11-50 employees","Public Company","Bishkek, Чуй","Kyrgyzstan",,"https://www.linkedin.com/company/enhancing-resilience-in-kyrgyzstan"
,"fundacja Harambee-Polska","Od 2013 roku docieramy z pomocą w najdalsze i najuboższe regiony tej części Afryki. Nasi wolontariusze wspierają działania edukacyjne i medyczne, a także angażują się w budowę szkół i kościołów.","Public Assistance Programs","2-10 employees","Non Profit",,,"harambee-polska.org","https://www.linkedin.com/company/fundacja-harambee-polska"
,"Bibliothèque Sonore de Bastia Borgo - Association des donneurs de voix","Créée en 1986 par le Lions Club féminin et sa Présidente, Louise Colombani, la Bibliothèque Sonore de Bastia a évolué 
avec les techniques récentes d'enregistrement pour proposer à ces audio-lecteurs des livres de bonne qualité dans tous les 
genres littéraires. Elle s'installe désormais à Borgo","Public Assistance Programs","2-10 employees","Non Profit","BORGO","France","lesbibliothequessonores.org","https://www.linkedin.com/company/bibliothèque-sonore-de-bastia-association-des-donneurs-de-voix"
,"Böyük Addımlarla Təhsilə Xidmət və Cəmiyyətinin Maariflənməsinə Dayaq İctimai Birliyi",,"Public Assistance Programs","2-10 employees","Public Company",,,,"https://www.linkedin.com/company/böyük-dayaq-i̇ctimai-birliyi"
,"MonsterBug","MonsterBug are a breaking-edge non-profit dedicated to transforming lives through the power of assistive technology, and individual service. 
Thanks to our partnership with Microsoft Founders Hub our projects will provide access to Microsofts state-of-the-art Cognitive Services tools, packaged in a way that works for the child, financial status, and their support systems; whether that means at home, from a caregiver, or an institution. 

We believe that everyone, regardless of their abilities, deserves the opportunity to live a fulfilling and independent life. Our mission is to bridge the gap between disability and possibility, enabling individuals to overcome barriers and unleash their true potential. 

Children need help, whether it's through Assistive Tech; or actually utilizing that tech; the need is there.","Public Assistance Programs","Self-employed","Non Profit","Sacramento, California","United States","monsterbug.net","https://www.linkedin.com/company/monsterbug"
,"Rotary Club de Haguenau District 1680","notre slogan servir d'abord.

vous pouvez nous trouver lors de nos déjeuner statutaire tous les lundi sauf jours fériés à 12h00 à notre siège le repère des sorcières 79 route de Bischwiller à Haguenau.","Public Assistance Programs","11-50 employees","Non Profit","Haguenau, Grand Est","France",,"https://www.linkedin.com/company/rc-haguenau"
,"Comité d'Entraide Internationale CEI","Le Comité d'Entraide Internationale, bras diaconal de l'Église Évangélique au Maroc, a pour mission de témoigner l'amour de Dieu en accompagnant notre prochain étranger au Maroc.

Nous voulons participer au règne de Dieu sur terre :
-en manifestant son amour à tous ;
-en luttant pour que tout être humain jouisse pleinement de sa dignité ;
-en agissant pour que l'équité socio-économique soit le partage de tous.","Public Assistance Programs","11-50 employees","Privately Held",,,"egliseevangeliqueaumaroc.fr","https://www.linkedin.com/company/comité-d-entraide-internationale-cei"
,"Life Robots Ukraine","Life Robots Ukraine is the wildest project to reclaim Ukrainian land temporarily occupied by Russia.

We’re raising funds to supply the Ukrainian army with demining and logistics robots — machines that can save lives, protect soldiers, and help bring victory closer.

Our goals:
 • Deploy 500 demining robots to clear 12,000 square kilometres of land.
 • Fund urgent requests from front-line brigades for logistics robots worth $130,000 — machines that can evacuate the wounded, deliver supplies, and prevent encirclement.

Total fundraising goal: $12,500,000.

It’s bold. It’s massive. And it’s about saving lives, metre by metre.

Join us.","Public Assistance Programs","201-500 employees","Public Company","Kyiv","Ukraine","liferobots.com.ua","https://www.linkedin.com/company/life-robots-ukraine"
,"Nasipten Nasibe","The Nasipten Nasibe Platform is a social platform that has striven to truly fulfill volunteering since 2016, and this principle includes its ""volunteer"" members.

We will share with you, as much as we can, the activities of this volunteer community, which aspires to be instrumental in delivering God's blessings, prioritizing the best interest of not harming anyone. Perhaps you and we can benefit from this as well.","Public Assistance Programs","501-1,000 employees","Non Profit","Fatih, Istanbul","Turkey",,"https://www.linkedin.com/company/nasiptennasibe"
,"Links For Israel",,"Public Assistance Programs","11-50 employees","Non Profit",,,"linksforisrael.com","https://www.linkedin.com/company/links-for-israel"
,"GCSMS AQUEDUC","Le GCSMS Aqueduc réunit quatre acteurs majeurs du sanitaire et du médico-social : Les associations La Bourguette et ARI ainsi que les Centres hospitaliers Valvert et Montperrin ; engagés pour proposer des accompagnements adaptés aux personnes autistes et à leurs familles.

Ensemble, nous construisons des parcours de vie coordonnés, sécurisés et inclusifs, portés par la coopération et la complémentarité des professionnels.","Public Assistance Programs","11-50 employees","Non Profit","Marseille, Provence-Alpes-Côte d'Azur","France","gcsms-aqueduc.fr","https://www.linkedin.com/company/gcsms-aqueduc"
,"IMPULSARED","Impulsared es un programa para la transformación social y el desarrollo económico que se lleva a cabo en Ventanilla, Santa Rosa, Ancón, Aucallama y Chancay que nace de la mano de Repsol.","Public Assistance Programs","51-200 employees","Non Profit","Lima, Lima","Peru","impulsaredperu.com","https://www.linkedin.com/company/impulsared"
,"Dewsbury Neighbourhood Board","We are a dedicated group of community leaders, businesses, and local representatives working together to transform Dewsbury. 

Join us in our mission to make Dewsbury a thriving, modern town with a successful economy and vibrant cultural scene. Together, we can make a difference.","Public Assistance Programs","11-50 employees","Non Profit","Dewsbury","United Kingdom","dewsburytownboard.co.uk","https://www.linkedin.com/company/dewsburyneighbourhoodboard"
,"IPEME","O Instituto para a Promoção das Pequenas e Médias Empresas (IPEME) é a instituição pública moçambicana que tem como missão incentivar a implantação, a consolidação e o desenvolvimento de empreendimentos de pequeno porte em Moçambique. O IPEME foi criado em 2008, vinculado ao Ministério da Indústria e Comércio, mas é dotado de autonomia administrativa e financeira.

* Consultoria empresarial
* Formação empresarial
* Facilitação do financiamento empresarial
* Criação de novas empresas
* Promoção do empreendedorismo","Public Assistance Programs","501-1,000 employees","Government Agency","Maputo, Maputo","Mozambique","ipeme.org","https://www.linkedin.com/company/ipememocambique"
,"Association Le Lieu",""" Le Lieu ou l'art d'être présent dans l'absence ""
Travailler avec les jeunes en errance, aller à leur rencontre, là où ils sont : l'aller vers.","Public Assistance Programs","11-50 employees","Non Profit","Mulhouse, Grand Est","France","assolelieu.org","https://www.linkedin.com/company/associationlelieu"
,"Digital Step","Digital Step is a flexible, adaptable, and secure AI tool that complements existing record-keeping systems for healthcare and social care providers. Imagine having your own assistant to help you structure, enhance, and quality-assure your documentation — all while you maintain full control over the content.","Public Assistance Programs","2-10 employees","Public Company","Malmö, Skåne län","Sweden","digitalstep.se","https://www.linkedin.com/company/digital-step-ab"
