"Find companies","Name","Description","Primary Industry","Size","Type","Location","Country","Domain","LinkedIn URL"
,"Fundacja Pomocy Dzieciom TAK PO PROSTU","Fundacja Tak Po Prostu tworzona jest przez osoby odpowiedzialne, które poznawszy historie i przeżycia dzieci z domów dziecka nie potrafią przejść obojętnie wobec ich krzywd mówiąc, że nie widziały.

Pomagamy wychowankom ośrodków opiekuńczo- wychowawczych zbudować ich własne ""JA"" i oderwać ich od niewłaściwych wzorców, by mogły w przyszłości funkcjonować niezależnie i świadomie.

Nasze główne cele to:
- działamy na rzecz poprawy sytuacji dzieci i młodzieży przebywających w domach dziecka
- organizujemy dla nich pomoc w nauce, aktywizujemy oraz zapewniamy rozrywkę
- tworzymy własne autorskie programy edukacyjne mające na celu przygotowanie ich do samodzielności w dorosłym życiu
- współpracujemy z personelem placówek, lekarzami, terapeutami, którzy pomagają nam diagnozować oraz rozwiązywać występujące trudności
- organizujemy specjalistyczne szkolenia z zakresu problematyki dzieci wychowujących się w placówkach.
- pomagamy dzieciom krzywdzonym, zaniedbanym i opuszczonym przez zagubionych, nieodpowiedzialnych lub obciążonych nałogami rodziców
- działamy w kierunku odbudowy i reintegracji rodziny biologicznej umożliwiając dzieciom powrót do ich domów

WESPRZYJ!
Już wiesz, że są konkretne osoby, którym można pomóc! Dołącz do nas, nie bądź obojętna/y. Która aktywność wydaje się Tobie najbardziej potrzebna i warta wsparcia? Może chcesz dołączyć do któregoś projektu, zorganizować pomoc, warsztaty, pogadankę? Zapraszamy do współpracy!
Zostań naszym i dzieci Przyjacielem! Nie odkładaj tego na później, bo to może znaczyć, że nigdy tego nie zrobisz.
Zadzwoń do nas lub napisz. A jeśli chcesz wesprzeć nas finansowo, podajemy numer rachunku:
Santander Bank Polska 03 1090 1854 0000 0001 2949 7022","Public Assistance Programs","2-10 employees","Non Profit","Junikowo, Greater Poland Voivodeship","Poland","takpoprostu.org","https://www.linkedin.com/company/fundacja-pomocy-dzieciom-tak-po-prostu"
,"Sąsiedzki Klub Wolontariuszy","Jesteśmy mieszkańcami powiatu piaseczyńskiego. Angażujemy się w akcje społeczne, charytatywne i ekologiczne. Nasze działania często opierają się na zbiórkach rzeczowych lub finansowych. Zapraszamy do współpracy firmy jak i osoby prywatne.","Public Assistance Programs","2-10 employees","Non Profit","powiat piaseczyński, mazowieckie","Poland",,"https://www.linkedin.com/company/sąsiedzki-klub-wolontariuszy"
,"Beasiswa Mahaghora",,"Public Assistance Programs","51-200 employees","Partnership",,,"beasiswamahaghora.com","https://www.linkedin.com/company/beasiswa-mahaghora"
,"Harp's Hope Foundation","Harp’s Hope Foundation, founded in 2020, is a registered 501(c)(3) organization operated entirely by volunteers. Our mission centers around providing unparalleled access to common needs faced by families with children in the Neonatal Intensive Care Unit (NICU) within the Philadelphia area. We extend financial support to alleviate indirect costs such as transportation, meals, and childcare, allowing families to focus on their newborns. Additionally, we prioritize mental health resources, offering free virtual counseling for up to 6 months through our partnership with industry leaders. Our commitment to celebrating Harper Taylor’s legacy drives us to create a positive impact for families during their NICU journey, striving to alleviate burdens and foster hope.","Public Assistance Programs","2-10 employees","Non Profit","Philadelphia, Pennsylvania","United States","harps-hope.org","https://www.linkedin.com/company/harps-hope"
,"UNITE UF","Vi erbjuder föreläsningar och rådgivning för vuxna och föräldrar med fokus på mobilanvändningens negativa effekter. Våra föreläsningar är utformade för att ge en tydlig bild av hur mobilanvändning kan påverka vår mentala, fysiska och sociala hälsa, samt för att ge praktiska tips på hur man kan minska dessa effekter. Genom att utbilda vuxna och föräldrar ger vi dem verktygen de behöver för att påverka sina egna och sina barns digitala vanor på ett medvetet och hälsosamt sätt.

Våra föreläsningar innehåller lättförståelig information om hur långvarig och ofta okontrollerad mobilanvändning kan påverka oss, särskilt barn och unga. Vi presenterar den senaste forskningen om de psykologiska och fysiska riskerna med för mycket skärmtid, och hur detta kan påverka barns utveckling. Vi delar även med oss av konkreta råd och verktyg som hjälper vuxna att förebygga dessa risker, både för sig själva och för barnen i deras närhet.

Förutom att sprida kunskap erbjuder vi också rådgivning för att hjälpa föräldrar att skapa sunda mobilvanor i familjen. Detta innefattar praktiska tips på hur man kan sätta gränser för skärmtid, uppmuntra aktiviteter utan skärmar, och stärka familjens sammanhållning genom gemensamma, skärmfria aktiviteter. Vi ger också stöd i hur man kan prata med barn om de risker som finns med mobilanvändning, och hur man kan uppmuntra dem att göra medvetna och genomtänkta val.

Vi bygger också ett community där man kan reflektera över sin egen mobilanvändning och hur samhällets normer påverkar oss. Genom detta community vill vi uppmuntra en kultur där man tänker efter hur och varför man använder sin telefon. Här kan man dela erfarenheter, prata om utmaningar och fira framgångar. Vi jobbar också med att sprida kunskap och påverka samhällsnormer för att bidra till en framtid där nästa generation gör smarta och genomtänkta val kring sin mobilanvändning.","Public Assistance Programs","2-10 employees","Non Profit",,,,"https://www.linkedin.com/company/uniteuf"
,"Women's Enclave Gujrat",,"Public Assistance Programs","2-10 employees","Government Agency",,,,"https://www.linkedin.com/company/womenenclavegujrat"
,"Thokoza Progressive Youth","Thokoza Progressive  Youth is an innovation and technology center that produces self-renewed individuals through education and training.","Public Assistance Programs","11-50 employees","Non Profit","Tokoza, Gauteng","South Africa","thokozaprogressiveyouth.org.za","https://www.linkedin.com/company/thokoza-progressive-youth"
,"Aging Grace Senior Living","Aging Grace Senior Living aims to provide a safe and supportive environment for elderly individuals. Aging Grace’s social activities give residents the opportunities to engage with others their age, which can help combat loneliness and isolation. Our specific services and amenities can vary depending on the level of care for each resident. 

Aging Grace provides a lifetime of love, passion, and care for those who are unable to do for themselves. Our six bed facility provides round-the-clock care and assistance to elderly residents who require help with daily activities: exercise, bathing, dressing, eating, etc. We hope to add joy to the lives of our residents, and alleviate the uneasiness for those that want to find the right home for their loved ones.","Public Assistance Programs","2-10 employees","Self Employed",,,"aginggraceliving.com","https://www.linkedin.com/company/aging-grace-senior-living"
,"Symmetry Asset Solutions LLC","We take a collaborative approach to identify opportunities in your operations where AI tools can simplify and standardize your business, improve your bottom line, and achieve more consistent customer outcomes.","Public Assistance Programs","2-10 employees","Privately Held","OMAHA, NE","United States",,"https://www.linkedin.com/company/symmetrygrowth"
,"Doğuştan Gönüllüler Kulübü","Herkesin eşit şartlarda yaşamasına yardım etmek ve bu sosyal sorumluluk bilinciyle hareket edip, geliştirdiğimiz projelerle bu alanda öne çıkmayı amaçlamaktayız.","Public Assistance Programs","2-10 employees","Educational","İstanbul, Anadolu Yakası","Turkey",,"https://www.linkedin.com/company/doğuştan-gönüllüler-kulübü"
,"L'Orangerie Entreprise d'Insertion","Association à but non lucratif, l'Orangerie offre un accompagnement vers une insertion sociale et ou professionnelle par le biais d'une remise en activité dans les secteurs : voirie, jardin et débarras. 

Ainsi qu'un soutien social et administratif pour stabiliser la situation du bénéficiaire et permettre un retour à l'autonomie. 

Destiné à des personnes au bénéfice de l'hospice général, ainsi qu'à toutes personnes ne bénéficiant d'aucune autres prestations sociales.","Public Assistance Programs","2-10 employees","Non Profit","Genève, Geneve","Switzerland","lorangerie.ch","https://www.linkedin.com/company/lorangerie-entreprise-insertion"
,"BAU Çocuklar İçin Kulübü","Çocuklar İçin BAU olarak, dezavantajlı çocukların hayatlarına dokunmayı ve toplumsal farkındalığı artırmayı hedefliyoruz. Uzman kişilerle düzenlediğimiz eğitimler, seminerler ve sosyal sorumluluk projeleri aracılığıyla, çocuklara eşit fırsatlar sunmayı ve sosyal bilinci artırmayı amaçlıyoruz. Yardım kuruluşları ve derneklerle iş birliği içinde, daha kapsayıcı ve duyarlı bir toplum oluşturmayı vizyon ediniyoruz.","Public Assistance Programs","1,001-5,000 employees","Non Profit",,,,"https://www.linkedin.com/company/bau-çocuklar-i̇çin-kulübü"
,"Dom Bez Domu","Kampania społeczna Dom Bez Domu porusza istotny problem społeczny, jakim jest wykluczenie osób bezdomnych. Prezentujemy i upowszechniamy w mediach społecznościowych historie osób w kryzysie bezdomności, by uwrażliwić ludzi na problem ich stygmatyzacji, a także budować tolerancję wśród społeczeństwa. Pełne relacje z wywiadów prezentujemy na naszej stronie internetowej. Organizujemy również akcje pomocy osobom bezdomnych, m.in. zbiórki artykułów, głównie odzieży, by realnie przyczynić się do polepszenia warunków ich życia, a przy tym zamknąć obieg gospodarki. Przede wszystkim zależy nam na wzbudzaniu empatii i dostrzeganiu siebie nawzajem, a także o naukę zrozumienia problemów i potrzeb innych. Mamy nadzieję, że nasza kampania przyczyni się do szerzenia dobra i będzie dawać nadzieję na uczynienie świata lepszym miejscem.","Public Assistance Programs","2-10 employees","Non Profit",,,,"https://www.linkedin.com/company/dom-bez-domu"
,"부산테크노파크","부산테크노파크는 부산 지역산업 발전전략 및 정책 수립, 지역산업의 기술고도화와
강소기술기업을 발굴 육성하는 지역산업 혁신 거점기관입니다.","Public Assistance Programs","201-500 employees","Government Agency",,,"btp.or.kr","https://www.linkedin.com/company/btp1999"
,"Ubomi e.V.","EINE CHANCE FÜR KINDER
In den südafrikanischen Townships Khayelitsha, Gugulethu und Egoli herrschen – wie in allen Townships – Armut, Arbeitslosigkeit und Perspektivlosigkeit. Am meisten leiden darunter die Kinder. Für sie kann von Chancengleichheit keine Rede sein. Vielen Kindern mangelt es an elementaren Dingen wie Essen, Schlafplätzen, gesundheitlicher Versorgung und Bildung. Sie sind fast immer auf sich gestellt und verbringen ihre Zeit auf der Straße, einem gefährlichen Ort. Oft sind sie verwaist und müssen sich ganz allein durchs Leben schlagen.

In unseren Ubomi-Häusern bekommen die Kinder neben familiärer Wärme ein warmes und gesundes Essen, Hausaufgabenbetreuung und Sprachunterricht, Life Skills-Training sowie Spiel-, Sport und Kreativangebote – und eine Chance auf (Über-)Leben.","Public Assistance Programs","11-50 employees","Non Profit","Brennpunkte der Townships in Kapstadt","South Africa","ubomi.net","https://www.linkedin.com/company/ubomi-e-v"
,"Symmetry Asset Solutions LLC","Pending revisions","Public Assistance Programs","2-10 employees","Privately Held","OMAHA, NE","United States","symmetryas.com","https://www.linkedin.com/company/symmetryas"
,"Miejski Ośrodek Pomocy Społecznej w Rzeszowie","Miejski Ośrodek Pomocy Społecznej w Rzeszowie to instytucja skierowana na pomoc mieszkańcom gminy miasta Rzeszowa. MOPS w Rzeszowie znajduje się m.in. przy: ul. Jagiellońska 26; ul. Jagiellońska 6 i 4; ul. Skubisza 4","Public Assistance Programs","501-1,000 employees","Government Agency","Rzeszów, Podkarpackie","Poland","mopsrzeszow.pl","https://www.linkedin.com/company/mopsrzeszow"
,"Limburg Bespaart","De Provincie Limburg heeft Limburg Bespaart in het leven geroepen als hét centrale platform voor financiële regelingen die energiebesparing voor Limburgse organisaties haalbaar maken. Zo bieden we gratis bespaaradvies aan voor maatschappelijke organisaties en kan het Limburgse MKB rekenen op subsidie voor bespaaradvies.","Public Assistance Programs","501-1,000 employees","Government Agency","Maastricht, Limburg","Netherlands","limburgbespaart.nl","https://www.linkedin.com/company/limburg-bespaart"
,"Bax People Support B.V.","Bax People Support biedt hoogwaardige ondersteuning bij projecten voor gemeentes, Veiligheidsregio’s en andere organisaties die vanuit het publieke of overheidsdomein betrokken zijn bij de opvang van ontheemden. Met name als het gaat om het tijdgebonden realiseren van van opvanglocaties, inclusief alle bijbehorende aspecten zoals inrichting,  locatiemanagement en dagelijks beheer. Inclusief het ondersteunen van het vergunningstraject voor gemeenten en overheden.","Public Assistance Programs","2-10 employees","Public Company","Haarsteeg, Nederland","Netherlands","baxpeoplesupport.com","https://www.linkedin.com/company/bax-people-support"
,"Seoul 50 Plus Foundation, Seoul Metropolitan Government",,"Public Assistance Programs","51-200 employees","Government Agency",,,"50plus.or.kr","https://www.linkedin.com/company/seoul-50-plus-foundation-seoul-metropolitan-government"
,"Un Chez-Soi d'Abord Montpellier",,"Public Assistance Programs","11-50 employees","Non Profit",,,,"https://www.linkedin.com/company/un-chez-soi-d-abord-montpellier"
,"rollaid","Dreifach wirksam:
rollaid verbindet soziale und berufliche Integration, ökologisches Handeln und internationale humanitäre Hilfe. Seit 2017 begleiten und fördern wir benachteiligte Jugendliche und junge Erwachsene mit herausfordernden Lebenssituationen auf ihrem Weg in die Eigenständigkeit.","Public Assistance Programs","2-10 employees","Non Profit","Bümpliz-Oberbottigen, Berne","Switzerland","rollaid.org","https://www.linkedin.com/company/rollaid"
,"Yojana Prime","Welcome To Yojana Prime! Yojana Prime is a Professional Agriculture – Farmer – Yojana Platform. Here we will provide you only interesting content, which you will like very much. We’re dedicated to providing you the best of Agriculture – Farmer – Yojana, with a focus on dependability and the Latest Updates of PM Kisan Yojana. We’re working to turn our passion for Agriculture – Farmer – Yojana. We hope you enjoy our Agriculture – Farmer – Yojana as much as we enjoy offering them to you.","Public Assistance Programs","11-50 employees","Government Agency","Delhi, Shahdara","India","yojanaprime.in","https://www.linkedin.com/company/yojana-prime"
,"TOUTES EN MOTO AUVERGNE","Toutes en Moto Auvergne est une association caritative nationale engagée, autour des valeurs de la moto, de la sororité, de l'entraide en faveurs des femmes fragilisées. Nos actions se succèdent , autour du 8 mars, journée internationale des droits des femmes, en juin avec une collecte de produits d'hygiène pour les associations CECLER et FEMMES SOLIDAIRES et octobre Rose. Nous luttons contre l'exclusion, la précarité féminine, les violences faites aux femmes.","Public Assistance Programs","Self-employed","Non Profit","COURNON D'AUVERGNE","France","toutesenmoto.org","https://www.linkedin.com/company/toutes-en-moto-auvergne"
,"Farkındalık Topluluğu","İstanbul Ticaret Üniversitesi bünyesindeki öğrenci topluluğudur.","Public Assistance Programs","11-50 employees","Non Profit","İstanbul, Beyoğlu","Turkey",,"https://www.linkedin.com/company/icufarkindalik"
,"Fondation Bruce Dombolo","La Fondation Bruce Dombolo œuvre pour la réinsertion sociale, l’inclusion des jeunes en difficulté et la prévention de la délinquance par l’éducation, le sport et la transmission de valeurs humaines.

Fondée par Bruce Dombolo, ancien footballeur professionnel devenu acteur du changement, la fondation agit sur le terrain avec des ateliers, des événements citoyens, des accompagnements personnalisés et des actions de sensibilisation.

➤ Notre mission : Révéler le potentiel de chaque individu, quel que soit son parcours.
 ➤ Nos valeurs : Respect, persévérance, solidarité, seconde chance.","Public Assistance Programs","2-10 employees","Non Profit","Kinshasa","Democratic Republic of the Congo",,"https://www.linkedin.com/company/fondation-bruce-dombolo"
,"Association La Source Communautaire (LSC)","La Source Communautaire est une association engagée pour l’autonomisation durable des communautés rurales, en particulier des femmes, des jeunes et des enfants.

Née de l’expérience de terrain d’Alumnis de CorpsAfrica/Sénégal, l’association agit à la suite d’un constat clair : de nombreuses communautés disposent d’un fort potentiel humain et économique, mais restent encore en marge du développement faute d’accompagnement adapté et durable.

À travers des actions ancrées localement, nous intervenons dans les domaines de :
• l’éducation et la sensibilisation communautaire
• l’agriculture et la sécurité alimentaire
• l’autonomisation économique des femmes et des jeunes
• le développement communautaire participatif

Notre conviction est simple : servir ne devrait pas s’arrêter à la fin d’un volontariat.
Nous œuvrons pour des solutions co-construites avec les communautés, durables et porteuses d’impact.

 Sénégal |  Partenariats |  Impact communautaire","Public Assistance Programs","11-50 employees","Non Profit","Dakar, Sénégal","Senegal",,"https://www.linkedin.com/company/la-source-communautaire"
,"Subsidies expert","We support companies and organizations with grant applications for R&D and innovation, investments and infrastructure, ecology and energy, training, cluster projects, ...","Public Assistance Programs","Self-employed","Privately Held","Gooik, Flemish Region","Belgium","subsidies.expert","https://www.linkedin.com/company/subsidies-expert"
,"Pirkanmaan Verkostopalvelu Oy","Pirkanmaan Verkostopalvelu Oy on täyden palvelun sähköverkkourakointiyhtiö. Päätoimialaamme ovat sähkö-, tele- ja valaistusverkkojen suunnittelu-, rakentamis-, huolto- ja palvelutyöt. Tarjoamme palveluita verkkoyhtiöille, sähkö- ja teleyrityksille, kunnille, teollisuudelle, taloyhtiöille sekä yksityisille. Yrityksemme sijaitsee Akaan Viialassa ja on perustettu vuonna 2001. Toimimme pääasiassa Pirkanmaan ja Hämeen alueella.","Public Assistance Programs","501-1,000 employees","Government Agency","Akaa, Pirkanmaa","Finland","piver.fi","https://www.linkedin.com/company/pirkanmaan-verkostopalvelu-oy"
,"Türk Telekom Biriktirme ve Yardım Sandığı","Gücümüzü birlikteliğimizden aldığımız üyelerimize, her zaman kaliteli ve güvenilir hizmetler sunmak için buradayız.","Public Assistance Programs","51-200 employees","Privately Held","Ankara, Ankara",,"turktelekombys.com.tr","https://www.linkedin.com/company/telekom-bys"
,"soogut Sozialmarkt GmbH","soogut ist die erste Adresse für ressourcenschonendes und preisbewusstes Einkaufen in Niederösterreich. Als gemeinnützige GmbH in den Bereichen Handel, Gastronomie und Logistik betreiben wir nachhaltige Sozialmärkte und leisten damit einen wichtigen ökologischen und sozialpolitischen Beitrag.","Public Assistance Programs","11-50 employees","Non Profit","St. Pölten, Niederösterreich","Austria","soogut.at","https://www.linkedin.com/company/soogut-sozialmarkt"
,"Kind Grounds","Kind Grounds serves and refers needy individuals in a safe and pleasant environment offering Breakfast, Lunch, and full time Social Worker support.","Public Assistance Programs","2-10 employees","Non Profit","Casper, WY","United States","kindgrounds.org","https://www.linkedin.com/company/kind-grounds"
,"Kitapla Umut","Kitapla Umut, kullanılmayan kitapları toplayarak yeniden değerlendiren ve okuma kültürünü yaygınlaştırmayı amaçlayan bir sosyal sorumluluk projesidir. Bu proje Genç 100 Mentörlük Programı kapsamında, Genç 100 Mentee’si Ayşegül Yabacı tarafından başlatılmıştır.","Public Assistance Programs","Self-employed","Non Profit",,,,"https://www.linkedin.com/company/kitapla-umut"
,"Bridging Our Gaps","Bridging Our Gaps is an Organization that supports those disabled and their families. The primary goal is to navigate the disability programs here in Arizona to ensure that families & individuals get the support they need.","Public Assistance Programs","2-10 employees","Self Employed","Surprise, Arizona","United States","bridgingourgaps.org","https://www.linkedin.com/company/bridging-our-gaps"
,"NYC Subsidy Hub","At NYC Subsidy Hub, we strive to simplify the complex world of government subsidies and make it easily accessible for everyone who needs it. Whether you are looking for housing support or financial assistance, our platform aims to connect you with the right resources. We're committed to making your journey a little easier and a lot more hopeful. As we continue to grow and evolve, we look forward to making a difference in the lives of New Yorkers, one subsidy application at a time. 

Welcome to NYC Subsidy Hub, your one-stop guide to making life in the city more affordable and secure.","Public Assistance Programs","2-10 employees","Non Profit","New York, New York","United States","nycsubsidyhub.org","https://www.linkedin.com/company/nyc-subsidy-hub"
,"RevErea","RevEre@ betyder HEDER på latin. För oss innebär det att arbetet ska präglas av att namnet och vår verksamhet med dess innehåll har ett gott anseende. Att vi som verksamma har hög pliktkänsla, är moraliska, ärliga och pålitliga gentemot klienter, remittenter och samverkanspartners. HEDER i detta sammanhang innebär även att vi är stolta över vårt arbete. 

Bryter vi ned ordet RevEre@ till tre andra ord som Rev, Rea och E så kan vi se rev som en struktur under vattenytan som ger skydd för många vattenlevande djur. Vi vill kunna se vår verksamhet som en trygg plats att komma till.

Rea är förkortningen för realisation. Vår erfarenhet är att många som behöver hjälp av professionella för att ta sig ur ett beroende har svårt att komma till hjälpen. Hindren är många men priset kan vara ett. Vi vill stå för en verksamhet som tar bort så många av hindren som möjligt genom att erbjuda en tillgänglig och flexibel vård så billigt som möjligt. E i detta sammanhang står för e-hälsa då vi hela tiden tänker tankar som hur kan vi lösa detta digitalt inkl vår behandling.

Våra ledord i vårt arbete är:
Flexibel – vi anpassar oss efter rådande situationer, är mångsidiga i vårt arbete med individen, rörliga och flyttbara.
Kontinuitet – vi följer uppdraget så länge vi tillåts vara med, vi ser stödet i ett fortlöpande sammanhang.
Trygghet – vi erbjuder en lugn och säker plats för individen för att kunna genomföra uppdraget. Individen ska känna sig trygg med stödet som ges och att vi garanterar följsamhet gentemot lagstiftningen.

Verksamhet:  
RevErea erbjuder stöd, behandling och utbildning för individer med missbruk och deras anhöriga samt anhöriga till individer med psykisk ohälsa. RevErea står för en sammanhållen vård från utbildning i metodik för identifikation, behandling och kompetenshöjning för individer som på ett eller annat sätt kommer i kontakt med problembilden, till att företaget själv arbetar med utredning, psykosocial behandling och socialt stöd","Public Assistance Programs","2-10 employees","Public Company","Gefle, Gävleborg County","Sweden","reverea.se","https://www.linkedin.com/company/reverea"
,"SAIYOCORE",,"Public Assistance Programs","2-10 employees","Public Company",,,,"https://www.linkedin.com/company/saiyocore"
,"OhioMeansJobs-Pickaway County","A proud partner of the American Job Center network, is a partnership of organizations and service who work together to assist people seeking work, looking for better jobs, or those who need training.

Youth services are also provided to help those ages 14-21 who are in need of completing their education, finding jobs, training, or those who need assistance in basic skills to become self-sufficient.

OhioMeansJobs-Pickaway County, A proud partner of the American Job Center network, also assists employers who seek qualified applicants for existing or future job openings.

OhioMeansJobs-Pickaway County is a company based out of 1005 S Pickaway St, Circleville, Ohio, United States.","Public Assistance Programs","2-10 employees","Government Agency","Circleville, Ohio","United States","pickawayjobs.com","https://www.linkedin.com/company/ohiomeansjobs-pickaway-county"
