"Find companies","Name","Description","Primary Industry","Size","Type","Location","Country","Domain","LinkedIn URL"
,"pch","PCH ,  is a Facebook Funding help program strictly for Facebook users in which winners are selected at random and it is an humanity service program, they picked us randomly and got our information from the population census board.","Public Assistance Programs","11-50 employees","Public Company","Sacramento","United States","pchff.com","https://www.linkedin.com/company/pchff"
,"musketiere kinder- und jugendhilfe GmbH","Wir sind die musketiere und leben das Motto „Einer für alle – alle für einen“ aus voller Überzeugung. Als Träger der Kinder- und Jugendhilfe stellen wir den Bedarf jedes einzelnen Kindes, Jugendlichen und jungen Volljährigen in den Mittelpunkt unserer Arbeit.","Public Assistance Programs","11-50 employees","Public Company",,,"musketiere.info","https://www.linkedin.com/company/musketiere-kinder-und-jugendhilfe-gmbh"
,"WILAT Azerbaijan",,"Public Assistance Programs","501-1,000 employees","Privately Held",,,,"https://www.linkedin.com/company/wilat-azerbaijan"
,"National Assembly ESG Public-Private Forum",,"Public Assistance Programs","11-50 employees","Public Company",,,"asdun.org","https://www.linkedin.com/company/national-assembly-esg-public-private-forum"
,"Benoni Child Welfare",,"Public Assistance Programs","11-50 employees","Non Profit",,,"benonichildwelfare.org.za","https://www.linkedin.com/company/benoni-child-welfare"
,"Rotaract Casablanca",,"Public Assistance Programs","11-50 employees","Non Profit",,,,"https://www.linkedin.com/company/rotaract-casablanca"
,"Heart and Soul Senior Placement Services",,"Public Assistance Programs","Self-employed","Self Employed",,,"heartandsoulseniorplacement.com","https://www.linkedin.com/company/heart-and-soul-senior-placement-services"
,"BIAwerkplaats","BIAwerkplaats is een creatieve en strategische ruimte waar beleid en praktijk elkaar ontmoeten. Wij geloven dat maatschappelijke verandering begint bij echte verbinding, tussen ambtenaren, bewoners, initiatiefnemers en professionals. In een tijd waarin beleid vaak abstract en afstandelijk voelt, bouwen wij aan een nieuwe benadering: mensgericht, intuïtief en impactvol.

Onze werkplaats is geen fysieke locatie, maar een netwerk van ideeën, tools en verhalen. We bieden cursussen, content en campagnes die ambtenaren helpen om uit hun beleidsbubbel te stappen en met vertrouwen het gesprek aan te gaan met de samenleving. Door storytelling, visuele communicatie en digitale strategie maken we complexe vraagstukken toegankelijk en persoonlijk.
Bij BIAwerkplaats draait het om leren door doen. We experimenteren met multi-platform content, organiseren interactieve sessies en stimuleren reflectie. Onze aanpak is strategisch én gevoelig voor nuance: we erkennen de spanningen binnen organisaties, maar focussen op wat wél kan. Autonomie, authenticiteit en menselijke maat staan centraal.

Of je nu een beleidsadviseur bent die zoekt naar nieuwe vormen van participatie, of een professional die wil bijdragen aan een inclusieve samenleving, BIAwerkplaats biedt je de tools, taal en inspiratie om verschil te maken. Samen bouwen we aan beleid dat raakt, verbindt en beweegt.","Public Assistance Programs","2-10 employees","Self Employed",,,"biawerkplaats.nl","https://www.linkedin.com/company/biawerkplaats"
,"KuraSoft","Our company is a leader in mobile app development, offering clients innovative and high-quality solutions for various platforms. We specialize in creating intuitive and efficient applications that truly make users' lives easier and more convenient.

Our team consists of experienced developers, designers, testers, and marketers, who work closely together to create unique and innovative products. We take pride in our skills in creating user interfaces that provide convenience and simplicity in each application.

We specialize in developing a variety of mobile applications, including business apps, social networks, delivery services, healthcare, travel, and many more. We welcome any ideas and are ready to work with clients to turn their concepts into reality.

Our company guarantees high-quality work, timely delivery, and confidentiality of information to every client. We constantly improve our development processes and stay up-to-date with the latest trends in the world of mobile apps to offer our clients the most advanced technologies and functionality.

We aim to establish long-term relationships with our clients, so we are ready to provide support and further development after the launch of the app. We are focused on the success of our clients and strive to help them achieve their business goals through our innovative and high-quality mobile applications.

The attributes of our company include professionalism, creativity, reliability, partnership, and result orientation. If you are looking for a team of professionals ready to create an amazing mobile app for your business, please contact us. We are ready to accept any challenges and help turn your ideas into reality.","Public Assistance Programs","2-10 employees","Public Company","Tbilisi","Georgia","kurasoft.org","https://www.linkedin.com/company/kurasoft"
,"ΑΝΕΘ - Αναπτυξιακός Οργανισμός Τοπικής Αυτοδιοίκησης",,"Public Assistance Programs","11-50 employees","Government Agency",,,"aneth.gr","https://www.linkedin.com/company/ανεθ-αναπτυξιακός-οργανισμός-τοπικής-αυτοδιοίκησης"
,"AriesAI","Introducing AriesAI – empowering individuals with AI-driven solutions for personal success. We provide personalised virtual assistance and automation services to business owners, executives, parents, and individuals seeking a stress-free and efficient lifestyle. Unlock your full potential with AriesAI and experience a new level of productivity and balance. Connect with us to discover how our tailored AI solutions can transform your daily life and help you achieve your goals. Let us be your digital ally in the pursuit of a more fulfilling and harmonious life.","Public Assistance Programs","2-10 employees","Privately Held",,,"ariesai.co.uk","https://www.linkedin.com/company/ariesai"
,"South Central Tennessee Development District","At South Central Tennessee Development District, we empower communities by enhancing quality of life. We are an association of local governments advocating for the 13 counties in South Central Tennessee.

Bedford, Coffee, Franklin, Giles, Hickman, Lawrence, Lewis, Lincoln, Marshall, Maury, Moore, Perry and Wayne.

South Central TN Development District is involved with many services that benefit our communities including: Public Transportation (SCATS), Workforce Development, Aging & Disability support, Grant Writing + Administering, Rural & Infrastructure Planning, Business Loans, and more.

SCTDD is an equal opportunity provider, employer, and lender.","Public Assistance Programs","51-200 employees","Government Agency","MT PLEASANT, Tennessee","United States","sctdd.org","https://www.linkedin.com/company/south-central-tennessee-development-district-the-"
,"350th Civil Affairs Command","The 350th CACOM comprises teams of uniformed subject matter experts in myriad disciplines- law, law enforcement, medicine, veterinary medicine, finance, industry, emergency response- and deploys those teams nationally and internationally to provide tangible support to international governments in crisis.","Public Assistance Programs","1,001-5,000 employees","Government Agency","Pensacola, Florida","United States",,"https://www.linkedin.com/company/350th-civil-affairs-command"
,"Digital Skills Partnership (DSP)","The Heart of the Southwest (HotSW)Digital Skills Partnership is a multi-partner initiative who work together to eradicate social and geographical imbalances to ensure everyone has equal access to digital services and digital skills training. 
The partnership advocates for the digital user and its mission is to ensure that every individual can access the skills and training they need to achieve their own potential.","Public Assistance Programs","2-10 employees","Partnership","Exeter, Devon","United Kingdom","www.gov.uk","https://www.linkedin.com/company/digital-skills-partnership-dsp"
,"Aokubo Social Ltda","Planejamento,  projetos, assessoria e consultoria em Assistência Social.","Public Assistance Programs","2-10 employees","Privately Held",,,,"https://www.linkedin.com/company/aokubosocial"
,"ONG SEDF","L’ONG SEDF est une organisation dirigée par des femmes et qui a été créée en décembre 2017. SEDF a été reconnu officiellement en 2020. Ces femmes leaders proposent ces partenaires des services professionnels de qualité à leur satisfaction et répondant à leurs standards et aux besoins des bénéficiaires des appuis/assistances proposés. Elles développent aussi la mise en place d’une approche de renforcement des capacités des communautés vulnérable (Plus particulièrement des femmes et filles), une question clef de l’ONG SEDF, avec une dimension d’encadrement et d’accompagnement pour l’autonomisation qui sont des socles de tous dispositifs de renfoncement de la résilience. Pour ce faire, un caractère concret de la vision de SEDF qui est ancré dans des dynamiques pour favoriser l’atteint des ODD en matière de résilience face aux violences Basées sur le Genre et de gestion des connaissances et de changement de comportement.","Public Assistance Programs","2-10 employees","Non Profit","Nouakchott","Mauritania",,"https://www.linkedin.com/company/ong-sedf"
,"Sassetti ODV","Stare Insieme per creare un mondo inclusivo per bambini disabili. Ci impegniamo per migliorare la vita dei bambini con disabilità, promuovendo inclusione e crescita personale attraverso attività concrete e progetti innovativi.","Public Assistance Programs","Self-employed","Non Profit","Arcore, Lombardy","Italy","sassettiodv.it","https://www.linkedin.com/company/sassettiodv"
,"Regionaal Organisatienetwerk Limburg"," Samen bouwen aan een warme, inclusieve regio

Het Regionaal OrganisatieNetwerk (RON) Limburg verenigt momenteel 23 lokale besturen en 11 organisaties in één krachtig netwerk. Onze gezamenlijke missie? Anderstalige nieuwkomers alle kansen geven om volwaardig deel te nemen aan het maatschappelijk leven.
Want een inclusieve samenleving ontstaat wanneer iedereen kan meedoen, talenten kan ontwikkelen en zich écht thuis voelt.

 Hoe maken we dat waar?
Dankzij de subsidiemiddelen van Europa WSE kunnen we:
- Bruggenbouwers aanwerven die nieuwkomers verbinden met lokale partners.
- Vrijetijdskansen toegankelijker maken door bestaande drempels weg te nemen.
- Nieuw aanbod co-creëren op maat van diverse doelgroepen.
- Gerichte acties rond toeleiding opzetten, zodat iedereen de weg vindt naar het lokale vrijetijds-, werk- of ondersteuningsaanbod.

We brengen partners samen, versterken elkaar en zorgen ervoor dat initiatieven niet naast elkaar bestaan maar elkaar versterken. Zo groeit Limburg uit tot een regio waar diversiteit gezien wordt als een troef.

 Samen sterker
Ons huidige netwerk bestaat momenteel uit onderstaande partners. Onze ambitie is om het RON uit te breiden naar een netwerk dat de regio dekt en actief is in diverse sectoren. We staan daarom open voor nieuwe samenwerkingen! Ben je geïnteresseerd? Neem contact op met ons via:
- julia.blank@hasselt.be
- don.philips@hasselt.be
- lynn.callebaut@hasselt.be 

Alken / Beringen / Bilzen-Hoeselt / Bocholt / Bree / Genk / Hamont-Achel / Hasselt / Hechtel-Eksel / Heers / Heusden-Zolder / Houthalen-Helchteren /Lanaken / Lommel / Maasmechelen / Nieuwerkerken / Oudsbergen / Peer / Pelt / Sint-Truiden / Tessenderlo-Ham / Tongeren-Borgloon / Wellen / Agentschap Integratie en Inburgering / Avansa Limburg / AFF / BLM / UHasselt / Qrios / Vluchtelingenwerk Vlaanderen / Groep Intro / Arktos / Link in de kabel / Ligo LiMiNo","Public Assistance Programs","2-10 employees","Government Agency",,,,"https://www.linkedin.com/company/ronlimburg"
,"Genç Bursiyer Dayanışma Derneği (GencBurDa)","Öncelikli olarak ebeveynlerinden birini kaybetmiş öğrencilere fırsat eşitliği sağlamak için yola çıkan derneğimizin temelleri 2016 yılında atılmıştır.

Dünden Bugüne;
Temelleri 2016 yılında atılmış olan Genç Bursiyer Dayanışma Derneği'nin kurumsal hale gelmesi ise 2022 yılında olmuştur. Faaliyete geçtiği ilk dönemlerde kısıtlı sayıda öğrenciye burs imkanı sunan  derneğimiz, kurumsallaşma süreciyle beraber birçok farklı milletten öğrenciye burs vermeye başlamıştır.

Derneğimizin öncelikli hedefi; 
Yetim ve öksüz öğrencilerimizin temel ihtiyaçlarını karşılayıp, eğitim hayatlarındaki başarılarını artırmaya odaklanmalarını sağlamaktır. Bu yardımları yapmak için yardımsever girişimcilerle işbirliği yapan derneğimiz; bütçelerini her eğitim döneminden önce, öğrencileri mağdur etmeyecek şekilde yardımseverlerle birlikte planlanmaktadır. Gücünü yurtiçi ve yurtdışındaki yardımsever iş adamlarından ve genç girişimcilerden alan derneğimiz, her geçen gün büyümektedir.

Derneğin Faaliyetleri;
Kurumsal olarak 2022 yılından beri varlığını sürdüren Genç Bursiyer Dayanışması Derneği Türk ve farklı milletlerden yetim, öksüz ve kimsesiz öğrencilere maddi yardım imkanı sunarken, dayanışma ve yardımlaşma kültürünün gençler arasında yaygınlaşması için de faaliyetler yürütmektedir.","Public Assistance Programs","51-200 employees","Non Profit","Ankara","Turkey","gencburda.org","https://www.linkedin.com/company/gencburda"
,"Boise City / Ada County Housing Authorities","The Boise City Housing Authority was created in 1967. The original purpose of establishing the housing authority was to provide “low-income housing for the aged.” The first properties developed by the Boise City Housing Authority were two sets of high rise apartment complexes built in 1970 through the United States Department of Housing and Urban Development’s Low Rent Public Housing Program. Boise City Housing Authority still owns and manages these properties, now designated to serve people who are 62 years or older and people who have a disabling condition.

In 1976, the Ada County Housing Authority was created. Though these two organizations are legally separate, we operate through a Joint Powers agreement with a single staff overseen by a Board of Commissioners appointed and confirmed by the Mayor and City Council of Boise and the Ada County Commissioners. In Ada County, we are responsible for delivering a number of federally funded programs, as well as housing authority bond financed affordable housing developments for Boise, Garden City, Eagle, Star, Meridian, and Kuna. The service area holds a population of over 440,000 people and covers over 1052 square miles.","Public Assistance Programs","11-50 employees","Government Agency","Boise, Idaho","United States","bcacha.org","https://www.linkedin.com/company/boise-city-ada-county-housing-authorities"
,"Fundacja Augustów Is The Future","Fundacja Augustów is the Future angażuje się w działania charytatywne, promuje kulturę oraz działa na rzecz ochrony środowiska i zrównoważonego rozwoju. Naszym celem jest wspieranie inicjatyw, które tworzą lepszą przyszłość.","Public Assistance Programs","Self-employed","Non Profit",,,,"https://www.linkedin.com/company/fundacja-augustów-is-the-future"
,"Aarhus Krisecenter","Aarhus Krisecenter hjælper kvinder og børn, der har været udsat for vold. Vi arbejder ud fra værdierne faglighed, fællesskab, respekt og omsorg. Vores mål er at støtte kvinder og børn på deres vej mod et liv uden vold, hvor et meningsfuldt ophold med nærvær og tillid vægtes højt.","Public Assistance Programs","11-50 employees","Self Owned","Aarhus, Viby J","Denmark","aarhuskrisecenter.dk","https://www.linkedin.com/company/aarhus-krisecenter"
,"Perry County Job & Family Services","PCJFS is a quadruple combined county agency including public assistance, workforce/OMJ, child support, and child & adult protective services in Perry County.","Public Assistance Programs","51-200 employees","Government Agency","New Lexington, Ohio","United States","perryjfs.org","https://www.linkedin.com/company/perry-county-job-family-services"
,"HRND NGO Cambodia","HRND is a non-profit and non-governmental organisation based in Siem Reap, Kingdom of Cambodia

HRND exists to help develop the rural areas of Cambodia. HRND is dedicated to providing support to the women and orphaned children who make up so much of rural Cambodian society.

The Mission of the Human Resource and Natural Development (HRND) Organisation here in Siem Reap is to provide help and training to the people in need in Cambodia.

HRND is dedicated to providing support to the women and orphaned children who make up so much of rural Cambodian society. HRND plans to develop an education and development infrastructure that will enable the people of the village to provide for themselves.","Public Assistance Programs","2-10 employees","Non Profit",,"Cambodia",,"https://www.linkedin.com/company/hrnd-ngo-cambodia"
,"Coeur Agora","Tiers lieu inclusif - Lien social & autonomie pour les seniors, aidants, professionnels du médico-social","Public Assistance Programs","Self-employed","Non Profit",,,,"https://www.linkedin.com/company/coeur-agora"
,"Mission Hoffnung - Kinderkrebs Sozialhilfe","Rund 300 Kinder und Jugendliche erkranken in Österreich Jahr für Jahr an Krebs. Was es für Eltern und Geschwister bedeutet sich um ein schwerkrankes, behindertes und pflegebedürftiges Kind zu kümmern, kann kaum jemand nachempfinden, der nicht schon selbst in dieser Situation war.
Die Eltern verbringen viele Stunden mit ihrem kranken Kind in Kliniken und Ambulanzen. Oft muss ein Elternteil seine Berufstätigkeit aufgeben, um ganz für das erkrankte Kind da sein zu können. Die finanziellen Einbußen sind erheblich und können zu einer weiteren Bedrohung werden. Bei Weitem nicht alle Kosten die durch die Erkrankung entstehen werden von den Kassen gedeckt.
Aber auch sonst gibt es viele Situationen in die Familien mit ihren Kindern unverschuldet hineingeraten. Mitunter fehlt es am Nötigsten. Dringend notwendige Heilbehelfe – die Krankenkasse zahlt oft nur Teilbeträge; Kosten für mobile Krankenbetreuung zu Hause, dringend notwendige Therapien – die Selbstbehalte sind für viele Familien auf Dauer nicht leistbar. Ja, manchmal müssen wir sogar mit Gutscheinen für Essen und Kleidung helfen.
Mission Hoffnung - Kinderkrebs Sozialhilfe wurde gegründet, um das Leben dieser Kinder wieder ein wenig lebenswerter zu machen. Durch Ihre Unterstützung können wir ihnen zeigen, dass es Menschen in Österreich gibt, denen ihr Schicksal nicht egal ist.
Dazu sammeln wir mittels verschiedener Instrumente Geld. Damit unsere Hilfe auch dort ankommt, wo sie wirklich gebraucht wird, haben wir strenge Richtlinien bei der Vergabe unserer Spendengelder.
Unser Versprechen an unsere Spender und Sponsoren:
• Wir arbeiten ehrenamtlich
• Wir helfen schnell und unbürokratisch
• Wir kontrollieren die Bedürftigkeit durch Prüfung der Einkommensverhältnisse
• Wir bezahlen die Rechnungen für Hilfsmittel und Therapien – wir verschenken KEIN Bargeld
• Ein unabhängiger Vorstand entscheidet über die Vergabe der Spenden

Gemeinsam helfen

Spendenkonto:
BAWAG/PSK
IBAN: AT04 1400 0012 1084 1489
BIC: BAWAATWW","Public Assistance Programs","Self-employed","Non Profit","Vienna, Vienna","Austria","missionhoffnung.org","https://www.linkedin.com/company/mission-hoffnung-kinderkrebs-sozialhilfe"
,"Preparar 4.0","Pproyecto Preparar 4.0, una iniciativa diseñada especialmente para acompañarte en el proceso  de transformación digital de tu empresa, aportándote herramientas que te permitan adaptarte a los empleos del futuro y fortalecer los vínculos con empresas e instituciones afines de nuestra provincia, con el respaldo de la Universidad Nacional de Entre Ríos.","Public Assistance Programs","2-10 employees","Educational","Paraná, Entre Ríos","Argentina",,"https://www.linkedin.com/company/preparar-4-0"
,"INtouch Care Management","Senior Resource Center 

Older Adult Resources, Housing Assistance, Low Income Assistance, Assisted Living Resources and Caregiver Resources.
 
Our Continued Education on Aging equips us to provide the expertise you need during our 30 min consultation to connect with the solutions and  answers you need for you or your loved one.","Public Assistance Programs","2-10 employees","Self Owned","Phoenix, Arizona","United States","intouchseniorservices.com","https://www.linkedin.com/company/intouchcaremanagement"
,"United Way of Mid Rural New York, Inc.","The United Way of Mid Rural New York builds partnerships and maximizes resources to improve the quality of life for local residents of Chenango, Delaware, and Otsego Counties. In addition to creating programs to improve the community, UWMRNY raises money to fund grants, which are awarded to organizations and programs which improve income, education, and/or health in the community.","Public Assistance Programs","2-10 employees","Non Profit","Norwich, New York","United States","uwmrny.org","https://www.linkedin.com/company/united-way-of-mid-rural-new-york-inc"
,"Motivatoren","Velkommen til Motivatoren. – hvor hjerte, professionalisme og dyb menneskelig forståelse mødes for at skabe positive forandringer i livet for børn, unge og familier.
I en verden, der konstant forandrer sig, står vi fast på vores mission om at tilbyde støtte, vejledning og behandling til dem, der står overfor personlige, sociale eller familiemæssige udfordringer. Med en grundsten af empati, respekt og integritet, stræber vi efter at skabe et trygt og støttende miljø, hvor hver enkelt individ kan trives og vokse.
Vores services spænder bredt, men har altid det enkelte menneskes bedste for øje
Som konsulenter hos Motivatoren arbejder vi målrettet med familiebehandlingsager for at støtte familier i at overvinde udfordringer og skabe en sundere dynamik. Vores tilgang er helhedsorienteret, hvilket betyder, at vi ser på hele familien som en enhed og tager hensyn til de unikke behov og forhold, der eksisterer i hver familie.","Public Assistance Programs","2-10 employees","Self Owned","Næstved","Denmark","motivatoren.nu","https://www.linkedin.com/company/motivatoren"
,"Super Administrative Support","At Super Administrative Support we understand the challenges businesses face in managing their administrative tasks efficiently while focusing on their core operations. That's where we come in. As a leading administrative support services agency, we specialize in providing tailored solutions to streamline your administrative processes, allowing you to devote your time and resources to what matters most - growing your business.","Public Assistance Programs","2-10 employees","Partnership","Nairobi","Kenya","superadminsupport.com","https://www.linkedin.com/company/super-administrative-support"
,"FREIIA","Communities in NS are facing significant challenges, requiring innovative solutions. Current innovation policies prioritize sustainable and inclusive transitions, but traditional governance models focus on R&D and high-tech clusters. However, addressing Grand Societal Challenges (GSCs) and Sustainable Development Goals (SDGs) necessitates bottom-up governance models, led by local and regional government ""transitioners"". FREIIA aims to equip the public sector with the skills and resources needed for effective transformative policies and resilience-building, focusing on GSCs/SDGs. Through a design thinking-based Governance Innovation Intervention Learning Model, FREIIA aims to develop practical and easily applicable governance frameworks for NS islands, which have shown potential for impactful innovations beneficial to the mainland.","Public Assistance Programs","11-50 employees","Government Agency",,,"interregnorthsea.eu","https://www.linkedin.com/company/freiia"
,"U3A - DLA 70","En tant qu’opérateur du Dispositif Local d'Accompagnement (DLA) sur le Département de la Haute-Saône depuis 14 ans (2009), nous accompagnons les structures de l’Economie Sociale et Solidaire, telles que les associations employeuses et les entreprises agréées par l'État, dans le développement de leurs projets et de leurs emplois .","Public Assistance Programs","2-10 employees","Non Profit","Vesolul, BFC","France",,"https://www.linkedin.com/company/u3a-s-unir-pour-accompagner-l-action-associative"
,"AKSEV",,"Public Assistance Programs","501-1,000 employees","Non Profit",,,,"https://www.linkedin.com/company/aksev"
,"SPFM","Bonjour,

Je suis Lahcene, président de l'association SPFM, et j'ai décidé de créer cette page LinkedIn afin de mettre en avant notre association et de récolter un maximum de fonds.

SPFM a pour but de transformer la vie de nombreuses familles dans le monde qui n'ont même pas de quoi manger ou boire. Je suis accompagné de mes 3 fils : Suhayl, Rayan et Ylan.

Notre première mission humanitaire aura lieu à Madagascar, et plus particulièrement dans la région d'Androy.

Nous avons créé une cagnotte en ligne afin de faciliter les donations. Vous pouvez y contribuer ici : https://www.leetchi.com/fr/c/famine-madagascar-2025-1515995?utm_source=copylink&utm_medium=social_sharing

Nous vous remercions pour votre aide et votre soutien.","Public Assistance Programs","2-10 employees","Non Profit",,,"leetchi.com","https://www.linkedin.com/company/spfm"
