"Find companies","Name","Description","Primary Industry","Size","Type","Location","Country","Domain","LinkedIn URL"
,"Tone Lab","With over 10 years of experience in retail and distribution of musical instruments, we constantly strive to provide opportunities to experience premium products that meet high standards from reputable brands worldwide. 
Proudly standing as one of the most well-known establishments in Vietnam, each product we offer is not just a musical instrument but also a source of inspiration for music lovers. 
The Tone Lab team is always ready to support, bringing you quality products and exciting experiences!","Retail Musical Instruments","2-10 employees","Public Company","Ho Chi Minh, HCMC","Vietnam","tonelab.vn","https://www.linkedin.com/company/tone-lab"
,"Jack's Guitarcheology","Jack's Guitarcheology is a Nashville, TN area purveyor of weirdo and specialty guitars, vintage to modern. My name is Jack and I am a guitarcheologist with an affinity for all things funky and drenched in mojo.","Retail Musical Instruments","2-10 employees","Self Owned","Lebanon, Tennessee","United States","jacksguitarcheology.com","https://www.linkedin.com/company/jack's-guitarcheology"
,"PRO-AUDIO KENYA ( AUDIO GEAR ZONE LIMITED)","Kenya’s Leading Online Audio Visual .Equipment Store. Music Production Equipment .Professional Audio Equipment, Musical Instruments & Accessories","Retail Musical Instruments","2-10 employees","Privately Held","Nairobi, Nairobi","Kenya","proaudiokenya.com","https://www.linkedin.com/company/pro-audio-kenya-audio-gear-zone-limited"
,"ALLTON","Herstellung und Vertrieb von Musikinstrumenten und Klangmöbeln für Therapie und Pflege","Retail Musical Instruments","2-10 employees","Partnership","Bad Zwesten, Hessen","Germany","allton.de","https://www.linkedin.com/company/allton-musik"
,"Omnitone Inc.",,"Retail Musical Instruments","2-10 employees","Self Employed",,,"omnitone.ca","https://www.linkedin.com/company/omnitone"
,"Piano Max by Kawai","Piano Max by Kawai - The South Australian leaders in pianos since 1977","Retail Musical Instruments","2-10 employees","Public Company","Adelaide, South Australia","Australia","pianomax.com.au","https://www.linkedin.com/company/piano-max-by-kawai"
,"ZFX Industries"," ZFX - FX for all | Boutique guitar pedals and amplifiers | Supporting local talent & artist collaborations | Proudly Made in Malaysia ","Retail Musical Instruments","2-10 employees","Self Owned","Shah Alam","Malaysia",,"https://www.linkedin.com/company/tapsnap-photo-booth-malaysia"
,"Infuzick","6+ years of crafting soundscapes, The name Infuzick stands for – Infinity, Fusion and Music
We invite you to explore our range of premium instruments and pro audio gear, expert guitar classes and visionary music production services. Rated 4.8+, always in your reach and nearby because we’re delivering most of our services online also. Elevate your sonic journey world where passion meets precision, creativity resonates, where each chord and beat is a testament to inventive artistry.
Our vision is to shape a lasting legacy of unparalleled sonic brilliance.","Retail Musical Instruments","2-10 employees","Self Owned","New Delhi, Delhi","India","infuzick.com","https://www.linkedin.com/company/infuzick"
,"MotoMusic","Based in the heart of Cardiff. Our relaxed showroom offers an interesting mix of guitars and amps. Step inside for a new experience when it comes to buying your next guitar.

Our services include sales, repairs, consignment sales, purchasing, storage, restoration and valuations.

Our workshop's convenient city center location makes it ideal for commuters to call in and get the repairs needed. 

We provide premium goods and services for the discerning guitar enthusiast.

Our mission is to exceed your expectations.  If you are looking for expert advice and outstanding professional service, call Motomusic.","Retail Musical Instruments","2-10 employees","Privately Held","Cardiff","United Kingdom","motomusic.co","https://www.linkedin.com/company/motomusic"
,"Centro Musicale Della Noce",,"Retail Musical Instruments","Self-employed","Self Owned",,,"dellanoce.it","https://www.linkedin.com/company/centro-musicale-della-noce"
,"Studio 49 Musikinstrumentenbau GmbH","Studio 49 Musikinstrumentenbau GmbH is a company based out of 2 Lochhamer Schlag, Gräfelfing, Bavaria, Germany.","Retail Musical Instruments","11-50 employees","Privately Held","Gräfelfing, Bavaria","Germany","studio49.de","https://www.linkedin.com/company/studio-49-musikinstrumentenbau"
,"Mandalia-Music","Ce que nous avons à cœur de transmettre, c'est une expérience approfondie de la sonothérapie et des instruments intuitifs.

Un lieu adapté pour se rencontrer soi-même, pour y développer ses dons, la confiance en soi, des compétences en avance sur leur temps, tout en étant accompagné par des formateurs experts, et d'autres êtres humains eux aussi en quête !

Vous apprendrez les bases théoriques et techniques de pratique des instruments. 
Vous développerez votre ressenti vibratoire et votre intuition.

Vous aurez tous les outils pour développer ce fabuleux outil de guérison : le son.","Retail Musical Instruments","2-10 employees","Partnership","Clisson, Pays de la Loire","France","mandalia-music.com","https://www.linkedin.com/company/mandalia-music"
,"KISSBASS",,"Retail Musical Instruments","Self-employed","Privately Held",,,"kissbass.rocks","https://www.linkedin.com/company/kissbass"
,"Cyber-Tone Electronic Pitch Pipes","The most technologically advanced Pitch Pipe in the world!

The Cyber-Tone is simple to use, switch it on and press the correct pitch, release to stop.  You can disable all sounds with the switch at the top.

Featuring a two-octave adjustable range, a Perfect Pitch Metronome capable of playing in any key from 10 to 255 BPM, a Sticky Tones mode for hands-free playing or tuning an instrument, a Micro Tuning feature for those that want something different than equal temperament tuning allowing adjustment of each pitch up or down from 0 to 100 steps between each half step, tactile aids for playing in dark environments, and a rechargeable battery.  We've also included a performance mode that will allow you to disable pitches you don't need on stage increasing your confidence.","Retail Musical Instruments","2-10 employees","Privately Held",,,"cyber-tone.com","https://www.linkedin.com/company/cyber-tone"
,"Atlanta Strings","Your locally owned source for renting or buying high quality violins, violas, cellos and basses. Conveniently located in Downtown Lawrenceville, we have a full range of products and instruments for all ability levels. Come check out our friendly staff, all of whom have degrees in music or were former orchestra teachers in the public schools.","Retail Musical Instruments","2-10 employees","Self Owned","Lawrenceville, Georgia","United States","atlantastringsshop.com","https://www.linkedin.com/company/atlanta-strings"
,"Angel Drums","Most drummers battle with de-tuning drums and unwanted overtones, Angel Hoops offer high-quality hoops that not only cut out overtones, but are also easier to tune, stay longer in tune, and add a unique look to your drums. Spend your time drumming, not tuning.","Retail Musical Instruments","2-10 employees","Public Company","Budapest","Hungary","angeldrum.com","https://www.linkedin.com/company/angeldrums"
,"KROSSBIRD MUSICALS","Krossbird is a repair facility that specializes in fixing and repairing stringed instruments like electric/acoustic guitars, bass guitars, violin, mandolin etc. We customize guitars and also provide all necessary accessories. From simple set-up to major issues, our shop is adept to all phases of instruments. We revive the music!","Retail Musical Instruments","2-10 employees","Self Owned","Pune, Maharashtra","India",,"https://www.linkedin.com/company/krossbird-musicals"
,"MIke Audio (Pvt) Ltd","At Mike Audio, we're passionate about bringing the world of music to Sri Lankan consumers with a promise of unparalleled quality and accessibility. As pioneers in the industry, we specialize in making global music product brands readily available at fair prices, ensuring every music enthusiast can embark on their sonic journey without breaking the bank. Our commitment goes beyond transactions; we pride ourselves on delivering stellar before and after-sales service, guaranteeing a seamless experience from selection to enjoyment. Join us in harmonizing lifestyles and fostering a vibrant music culture across Sri Lanka. Let's amplify your passion for music together","Retail Musical Instruments","11-50 employees","Privately Held",,,"welovemusic.lk","https://www.linkedin.com/company/mike-audio-pvt-ltd"
,"Soundventure Ltd","Experience a new type of freedom in the handpan world,
and a standalone digital instrument for studio quality music","Retail Musical Instruments","2-10 employees","Public Company","Budapest","Hungary","digitalhandpan.com","https://www.linkedin.com/company/soundventure"
,"Groove Street 98 Limited Partnership","Groove Street 98 is the original Brussels guitar shop.
Easy to reach, easy to park, ... and located in the beautiful Royal Quarter inside the Brussels Pentagon. Close to the EU Institutions.
In the Capitol of Europe.","Retail Musical Instruments","2-10 employees","Partnership","Brussels, Brussels Region","Belgium","groovestreet98.com","https://www.linkedin.com/company/groove-street-98-limited-partnership"
,"Mozart Pianos","Mozart is a consumer electronics musical instruments manufacturer.

Featuring the Mozart Piano, the newest innovation in digital pianos. A 32-inch HD touch display, an industry-leading Italian graded hammer keyboard action, and a software ecosystem designed for all musicians. Coming soon to the US and around the world.

This was an exploratory project that was in development between December 2020 and December 2024. The project is no longer active. It features an all-in-one touch display console digital piano with an ecosystem of software apps dedicated for music groups -- create, teach, learn, record, and more.","Retail Musical Instruments","2-10 employees","Privately Held","Vancouver, British Columbia","Canada","mozartpianos.com","https://www.linkedin.com/company/mozartpiano"
,"Glarry","Glarry is a musical instrument brand from China, where you can find your favorite musical instruments at a good price. Contact us: sc@glarrymusic.com","Retail Musical Instruments","51-200 employees","Self Employed","Dayton, NJ","United States","glarrymusic.com","https://www.linkedin.com/company/glarry"
,"Music Fingers","Music Fingers is a wearable that turns your fingers into music. It’s small, wireless and intuitive. You tap, and it responds. No cables, no setup, no barriers.

It was created for people who feel rhythm, who play without calling it music, and who never saw themselves as musicians. For those who want to create freely, without pressure or rules, and without needing a studio or traditional instruments.

We’re not here to replace what already exists, but to open up new ways of making music and broaden who gets to be part of it. Music Fingers is not just a product, it’s an entry point. A playful and accessible tool that connects movement with sound in the most natural way.

Whether you're a beginner, a curious mind, or someone who simply enjoys exploring creativity through sound, Music Fingers invites you to make music on your own terms.","Retail Musical Instruments","2-10 employees","Privately Held","Madrid, Community of Madrid","Spain","music-fingers.com","https://www.linkedin.com/company/music-fingers"
,"Guitarmetrics","Welcome to Guitarmetrics, where the world of guitars comes to life! Our platform is more than just a destination for unique and innovative guitar accessories—it’s a thriving blog and community for guitar enthusiasts around the globe.

At Guitarmetrics, we take pride in curating creative guitar products like our Guitarcamz Guitar Headstock Camera Mount and the one-of-a-kind guitar pick punch. But what truly sets us apart is our dedication to the art of storytelling and knowledge-sharing through our blog. Here, you’ll find expert advice, in-depth reviews, and inspiring stories about the guitar world.

We’re passionate about fostering a global community of musicians and writers. That’s why we actively welcome contributors from all over the world to share their insights, experiences, and ideas on Guitarmetrics.
At Guitarmetrics, we're not just another online store selling the same old guitar accessories and gifts. Our team is dedicated to curating unique and innovative products that you won't find anywhere else. From our Guitarcamz Guitar Headstock Camera Mount to our one-of-a-kind guitar pick punch, we're all about bringing creativity and originality to your guitar playing.
But we're not just about products! We're also a thriving guitar blog, where you can find expert advice, in-depth reviews, and inspiring stories about the world of guitar. Whether you're looking to improve your technique, discover new gear, or just want to connect with a community of passionate guitar enthusiasts, Guitarmetrics has got you covered.
So come join us on this exciting journey, and let us help you explore the endless possibilities of the guitar. Whether you're a beginner, an intermediate player, or a seasoned pro, Guitarmetrics is your go-to destination for everything guitar-related. Shop with us, read our blog, and connect with a community of like-minded guitar lovers. Welcome to Guitarmetrics, where we live and breathe all things guitar!","Retail Musical Instruments","2-10 employees","Self Owned","City of Industry, California","United States","guitarmetrics.com","https://www.linkedin.com/company/guitarmetrics"
,"Solid Electronics","Solid Electronics es una empresa que funciona como Distribuidor Autorizado de marcas increíbles como Rupert Neve, Burl Audio, Sequential, RME, Ferrofish, Roland, Austrian Audio, Soyuz, AEA, Flock Audio, Elysia, BAE, Empirical Labs.

Misión:
Brindarte la mejor tecnología para producción musical, grabación, mezca y mastering  del mundo..","Retail Musical Instruments","2-10 employees","Partnership","Mexico City, DF","Mexico","solidelectronics.mx","https://www.linkedin.com/company/solid-electronics"
,"Funky Junk","Funky Junk Ltd is a pro audio company based in North London specializing in high-end vintage and new recording equipment.","Retail Musical Instruments","11-50 employees","Partnership","London","United Kingdom","funky-junk.com","https://www.linkedin.com/company/funky-junk-group"
,"DISANTOMUSICA","DisantoMusica da oltre trent'anni specializzata nella vendita dei strumenti musicali, pianoforti e installazioni audio. Due punti vendita in Pozzuoli Via G. Pergolesi NA. Vendita online in tutta Italia, consegna in 24h.","Retail Musical Instruments","2-10 employees","Privately Held",,,"disantomusica.it","https://www.linkedin.com/company/disantomusica"
,"Haworth Guitars","Haworth Guitars are a family owned and operated musical instrument retail business specialising in guitars, drums, keyboards, amplifiers, accessories and all things guitar related. Haworth Guitars started from very humble beginnings in the late 1990's with Phil Haworth leaving his full time teaching job to start his own business building and repairing guitars. Nowadays, Haworth Guitars operates from Albion Park Rail in the Illawarra, specialising in a wide range of acoustic and electric guitars including Fender, Gibson, Ibanez, Cole Clark, Gretsch, second hand guitars and much more. Haworth Guitars also offers skilled guitar repairs. As well as the opportunity to learn have music lessons from experts in guitars, drums, keyboard and more.","Retail Musical Instruments","2-10 employees","Privately Held","Albion Park Rail, New South Wales","Australia","haworthguitars.com.au","https://www.linkedin.com/company/haworthguitars"
,"Tunes Trading and Services LLC","Tunes Oman was established since 1991. We are currently the largest music retailer in Oman for musical instruments and professional Audio. We have an events management and specialized Audio Visual rental productions.  Our 2 music schools were established in 2007 and the second in 2015 , we are the representatives for London College of Music and Trinity College of London.","Retail Musical Instruments","11-50 employees","Partnership",,,"tunesoman.com","https://www.linkedin.com/company/tunes-trading-and-services-llc"
,"Sound Scientific Inc.","Sound Scientific has developed the world's first soundwave embodiment, the Rezacore. Visit our website at www.rezacore.ca for further information.","Retail Musical Instruments","2-10 employees","Self Employed","Airdrie","Canada","rezacore.ca","https://www.linkedin.com/company/rezacore"
,"Áudio Poa","Somos a empresa Áudio Poa,especializada em áudio, vídeo e iluminação cênica para projetos. Atuamos neste mercado desde 2008, possuindo vasto conhecimento para cuidar de todas as etapas, desde a indicação e fornecimento dos equipamentos até a implantação de cabeamento, set-up e start-up, juntamente com a orientação de uso de cada equipamento.
Possuímos ampla experiência, em diferentes ambientes como pubs, casas noturnas, restaurantes, escritórios, auditórios, teatros e igrejas. A Áudio Poa está preparada para atender às necessidades específicas da sua empresa. Temos por certo que a combinação de equipamentos de alta qualidade e a excelência técnica são fundamentais para garantir o sucesso de qualquer projeto.","Retail Musical Instruments","11-50 employees","Privately Held","Porto Alegre, Rio Grande do Sul","Brazil","audiopoa.com","https://www.linkedin.com/company/audiopoa"
,"Nicola Brand Strings","Nicola Brand Strings is a family owned and operated acoustic strings company in Belmont California","Retail Musical Instruments","2-10 employees","Self Owned","Belmont, California","United States","nicolastrings.com","https://www.linkedin.com/company/nicola-brand-strings"
,"PT. Sincere Music","Sincere Music merupakan bagian dari Sincere Group yang sudah berdiri sejak tahun 1967 dibawah kepemimpinan Bapak Hendra Saputera dengan memulai kesuksesannya menjual Alat Musik, Sound System, Peralatan Olahraga, dan Peralatan Elektronik.

Pada tahun 1981, Sincere Group mulai mengembangkan usahanya menjadi Dealer Resmi Yamaha Music Indonesia, yang meliputi Penjualan Alat Musik (Yamaha Music Square) dan Sekolah Musik (Yamaha Music Schools) yang bersertifikasi taraf Internasional. 

Selain menjual Produk Bermerek Yamaha, Sincere Music juga menjual berbagai macam Jenis dan Merek  Alat Musik dan Sound System lain, Seperti : Cort, Roland, Korg, Casio, Fender, Marshall, Laney, Behringer, Shure, JBL, AKG, BOSE dan semua merek Alat Musik dan Sound System lainnya.

Dalam perkembangannya, kini Sincere Music telah memilik 8 Cabang Toko dan Counter Sekolah Musik yang tersebar di wilayah Jakarta, Bogor, Depok, Tangerang dan Bekasi.","Retail Musical Instruments","51-200 employees","Privately Held","Jakarta Pusat, DKI Jakarta","Indonesia","sinceremusic.co.id","https://www.linkedin.com/company/ptsinceremusic"
,"InstaShred","InstaShred is a tech company based in the Innovation Campus facility in Wollongong, Australia. The company’s goal is to revolutionise how people learn to play musical instruments through the use of modern interactive technologies.

Website: https://www.instashred.com.au/

iAccelerate Page: http://www.iaccelerate.com.au/iaccelerate-centre/residents/786-instashred.html","Retail Musical Instruments","2-10 employees","Privately Held","NORTH WOLLONGONG, NSW","Australia","instashred.com.au","https://www.linkedin.com/company/instashredptyltd"
,"Acoustic Yard","At Acoustic Yard, we're passionate about guitars! As a leading online and physical music store specializing in guitars, Used and New, we offer an extensive selection of acoustic, electric, and bass guitars from top brands. Whether you're a beginner or a seasoned pro, our knowledgeable staff is here to help you find the perfect guitar to meet your needs. We're committed to providing our customers with exceptional service and competitive prices. Shop with confidence at Acoustic Yard, the ultimate destination for guitar enthusiasts! We also buy your used instrument

Our mission is to provide the highest quality Music Instruments and accessories to our customers at competitive prices. We take great pride in our products and strive to offer a wide selection of new and used guitars from some of the most reputable brands in the industry.

At Acoustic Yard, we also buy used guitars, ensuring that they get a fair price for their instruments while also giving others the opportunity to own a quality guitar at a reduced price.","Retail Musical Instruments","2-10 employees","Self Owned","Dbayeh","Lebanon","acousticyard.com","https://www.linkedin.com/company/acousticyard"
,"Gongs Unlimited","Gongs Unlimited is a company based out of 4930 N 57th St, Lincoln, Nebraska, United States.","Retail Musical Instruments","11-50 employees","Privately Held","Lincoln, Nebraska","United States","gongs-unlimited.com","https://www.linkedin.com/company/gongs-unlimited"
,"Pianos Parisot","Pianos Parisot vous propose différents services parmi lesquelles l'accordage, le réglage, la restauration ainsi que la réparation de vos pianos mais également la location et la vente de piano de concert, droit et numérique.","Retail Musical Instruments","2-10 employees","Privately Held","Ramonville-Saint-Agne, Occitanie","France","pianosparisot.com","https://www.linkedin.com/company/pianos-parisot"
,"Soundbeam","Soundbeam is a multi award-winning, 'touch-free' assistive music technology device that turns physical movements into sounds and music. Using cutting-edge sensor technology for over 35 years, Soundbeam translates any physical gestures into musical notes, enabling people of all abilities to create music. We are passionate about everyone having a meaningful expressive musical experience.","Retail Musical Instruments","2-10 employees","Public Company","BRISTOL, Bristol","United Kingdom","soundbeam.co.uk","https://www.linkedin.com/company/the-soundbeam-project"
,"3dTone",,"Retail Musical Instruments","Self-employed","Self Employed",,,"3dtone.com","https://www.linkedin.com/company/3dtone"
,"Graves Piano",,"Retail Musical Instruments","2-10 employees","Privately Held","Columbus, Ohio","United States","gravespianos.com","https://www.linkedin.com/company/graves-piano"
,"West Coast Drum Shop","West Coast Drum Shop is a company based out of 1659 133rd Pl NE, Bellevue, Washington, United States.

We are the greater Seattle area's locally owned, stand-alone, expertly staffed drum shop and music school featuring a full roster of experienced teachers for drums, guitar, ukulele, voice, and piano. Our shop carries all major brands of drums, cymbals and hardware, stocks a vast selection of used drum gear, and takes trades regularly. We feature both high profile drummers and local legends in our drum clinics, and regularly host events for our drumming community. Because of our relationships with our vendors, we can fully stock your local school or business with percussion instruments for educational and team building purposes. Our website is fully-featured with a gigantic online store where you can browse our inventory and ship worldwide. We regularly provide In-house repair, drum tuning, in-home service, drum technicians, practice rooms (monthly and hourly rental), you name it. Our product selection includes acoustic and electronic kits by DW, Roland, Tama, Ludwig, Yamaha, EFNote, Dunnett, Keplinger, Zildjian, Paiste, Sabian, Istanbul, Bosphorus, Meinl, Sonor, Gretsch, Pearl, British Drum Co., George Way, Savage Custom Drums, A&F, and more. We carry drums, cymbals, a large snare drum selection, hardware, accessories, parts, apparel, sticks, heads, and pretty much everything else you could think of. We are here for you!","Retail Musical Instruments","2-10 employees","Privately Held","Bellevue, Washington","United States","wcdrumshop.com","https://www.linkedin.com/company/west-coast-drum-shop"
,"Malaga8","Tenemos todos los instrumentos y accesorios que un músico, profesional o amateur, puede necesitar.","Retail Musical Instruments","11-50 employees","Self Owned","Madrid, Community of Madrid","Spain","malaga8.com","https://www.linkedin.com/company/malaga8"
,"PWM INSTRUMENTS","We've always been passionate about the musicality of technology. Anything that makes noise is a very 

special thing indeed, but we as a company come from a musical background. We like making stuff we can play, have fun with and get inspired by. Otherwise, for us, there really is no point.","Retail Musical Instruments","2-10 employees","Privately Held",,,"1pwm.com","https://www.linkedin.com/company/pwm-instruments"
,"Xu Strings Guitar and Bass Repair","Xu Strings (pronounced 'shü) is a boutique, full-service repair shop in Rockville, Maryland. We specialize in guitar electronics and fretwork. We take great pride in our attention to detail and customer service. We are DIY-friendly and love projects just as much as you do, so even if you get stuck on yours, we are here to help.","Retail Musical Instruments","2-10 employees","Self Owned","Rockville, Maryland","United States","xustrings.com","https://www.linkedin.com/company/xustrings"
,"Reese-Tech Custom Guitars","We take your dream instrument vision, spec it out, and bring it to life for you.   Down to the tiniest detail, your dream becomes a reality.","Retail Musical Instruments","Self-employed","Self Owned","Meridian, Idaho","United States","reese-tech.com","https://www.linkedin.com/company/reese-tech"
