"Find companies","Name","Description","Primary Industry","Size","Type","Location","Country","Domain","LinkedIn URL"
,"Violins And Pianos","Introducing Violins And Pianos, Plano, Texas' premier destination for musical excellence, where Kelin Zhang's passion for craftsmanship extends beyond violins to encompass pianos as well. As the visionary behind this musical haven, Kelin brings his expertise honed at The Violin Making School of America to every instrument that graces our showroom.

Since our establishment in 1985, Kelin has poured his heart into crafting instruments that resonate with the soul of music itself. From violins to pianos, each piece embodies his unwavering dedication to quality and artistry. As a Luthier Member of the Violin Society of America, Kelin stands among the elite in his field, ensuring that every violin and piano meets the highest standards of excellence.

But what truly sets Violins And Pianos apart is our commitment to fostering a connection between musicians and their instruments. Whether you're a budding virtuoso or a seasoned professional, Kelin takes pride in providing instruments that become an extension of your voice, carrying your dreams and aspirations with every chord and melody.

Among our esteemed clientele are figures like Ronald Hudson, Assistant Concertmaster of the Dallas Symphony Orchestra, and Laura Boseert, whose talents have graced prestigious stages worldwide. Their choice of Violins And Pianos speaks volumes about the quality and craftsmanship we offer.

At Violins And Pianos, music isn't just a passion—it's our lifeblood. We invite you to experience the beauty and power of music with instruments meticulously crafted by Kelin Zhang, where every note resonates with the dreams of those who play them.","Retail Musical Instruments","2-10 employees","Privately Held","Plano, Texas","United States",,"https://www.linkedin.com/company/violins-and-pianos"
,"ArtSom Pianos e Música","Estamos há 3 gerações inspirando e oferecendo
as melhores marcas de instrumentos, com um
atendimento reconhecidamente personalizado,
proporcionamos a satisfação dos nossos clientes,
fornecendo todas as informações, com muita
troca de conhecimento, e auxiliando na melhor
escolha, dependendo do objetivo de cada um.
Possuímos uma variedade de pianos e
instrumentos musicais que atendem músicos
em todas as fases, desde o iniciante até o
profissional. Temos orgulho da nossa credibilidade
no mercado e continuamos nos posicionando
como parceiros dos nossos clientes, como sempre.","Retail Musical Instruments","11-50 employees","Privately Held","Rio de Janeuro, RJ","Brazil","linkme.bio","https://www.linkedin.com/company/artsompianosemúsica"
,"Plugin World",,"Retail Musical Instruments","2-10 employees","Privately Held",,,"mypluginworld.com","https://www.linkedin.com/company/plugin-world"
,"Valley Violins","Valley Violins has been serving Arizona by providing the highest quality violins, violas and cellos for rent or purchase. With an affordable rental program, an excellent rent-to-buy credit system and a variety of instruments in a range of sizes and budgets, we pride ourselves on providing the best renting and purchasing experience for musicians of all levels.","Retail Musical Instruments","2-10 employees","Partnership","SCOTTSDALE, Arizona","United States","valleyviolinsaz.com","https://www.linkedin.com/company/valley-violins"
,"JR Guitar Garage",,"Retail Musical Instruments","Self-employed","Self Owned",,,"jrguitargarage.com","https://www.linkedin.com/company/jr-guitar-garage"
,"Tuinstrumento.com",,"Retail Musical Instruments","2-10 employees","Privately Held",,,"tuinstrumento.com.co","https://www.linkedin.com/company/tuinstrumento-com"
,"JMP Instrument Company, Inc.","At JMP Instruments, we focus on Piano servicing and handcrafting instruments.","Retail Musical Instruments","2-10 employees","Privately Held","Bakersfield, California","United States","jmpinstruments.com","https://www.linkedin.com/company/jmp-instrument-company-inc"
,"Tuner Music","Somos a loja de instrumentos musicais que mais cresce! Porque toda a nossa equipe está preocupada com os resultados dos nossos clientes!","Retail Musical Instruments","2-10 employees","Privately Held",,,"tunermusic.com.br","https://www.linkedin.com/company/tunermusic"
,"BAS Tube Amp Repair",,"Retail Musical Instruments","Self-employed","Self Employed","NIEUWEGEIN, Utrecht","Netherlands","bastubeamprepair.nl","https://www.linkedin.com/company/bastubeamprepair"
,"radhakrishna",,"Retail Musical Instruments","11-50 employees","Public Company",,,,"https://www.linkedin.com/company/radhakrishna"
,"Weaver Pickups","Boutique pickups wound the way you want them.","Retail Musical Instruments","2-10 employees","Self Employed",,,"weaverpickups.ca","https://www.linkedin.com/company/weaver-pickups"
,"B. Corbin Clarinet Products","As a team of professional clarinetists and educators, we understand the bond between a musician and their instruments. Our passion is matching musicians with the tools they need to express themselves in the most natural and exciting ways, helping them share their unique voices with the world. All B. Corbin products are meticulously hand-crafted here in the USA using precision machining techniques, hand-selected exotic wood, and tested by Brian, Lilly, and our team of professional clarinetists. Our new and used instruments, no matter the brand, are all set up to perform at the highest level right out of the box. We combine artisan craftsmanship and artistry to help you along your musical journey, wherever the path leads you.

We also serve as the North American distributor for several world class brands, including Royal Global clarinets and Reed & Squeak cases.","Retail Musical Instruments","2-10 employees","Privately Held","Norfolk, Virginia","United States","corbinclarinetproducts.com","https://www.linkedin.com/company/bcorbinclarinetproducts"
,"Patoma Music","Patoma Music – The Pick With The Strongest Grip! Established in 2023, Patoma Music is a proudly American manufacturer dedicated to revolutionizing the way guitarists play. Our flagship Patoma Pick is engineered for unmatched control, precision, and durability—crafted with a patented non-slip diamond-plated grip that ensures your pick stays securely in hand, no matter how hard you play. Each Patoma Pick features nearly one carat of real, natural diamond, providing an unrivaled grip, effortless playability, and long-lasting performance. Whether you're a beginner or a seasoned pro, Patoma Picks give you the confidence to play better and longer. Designed, handcrafted, and made in the U.S.A. Experience the strongest grip in the game!","Retail Musical Instruments","2-10 employees","Privately Held","River Vale, New Jersey","United States","patomamusic.com","https://www.linkedin.com/company/patomamusic"
,"Backstage Equipamentos de Palco",,"Retail Musical Instruments","11-50 employees","Privately Held","Novo Hamburgo, Rio Grande do Sul","Brazil","lojasbackstage.com.br","https://www.linkedin.com/company/backstage-equipamentos-de-palco"
,"Frets Music","We are a new musical instrument retail store with a passion for supporting our local music and art community. We sell musical instruments and accessories, as well as provide lessons, practice spaces and audio recording services for local up and coming artists.","Retail Musical Instruments","2-10 employees","Partnership",,,"fretsmusic.com","https://www.linkedin.com/company/frets-music"
,"PETERSIK Instruments","Uns bei PETERSIK Instruments verbindet die gemeinsame Passion für die (Blechblas-)Musik. Diese teilen wir auch mit unserem breiten Kundenstamm, der vom Musikschüler bis zum renommierten Profimusiker reicht. Wir denken unser Berufsbild neu und haben uns in unserer Werkstatt am Stadtrand von Berlin ein hochmodernes Arbeitsumfeld geschaffen, das sich durch schlanke Strukturen & digitale Prozesse auszeichnet. Gemeinsam tragen wir unsere Branche in die Zukunft – werde auch Du Teil unseres Teams!","Retail Musical Instruments","2-10 employees","Privately Held","Schöneiche bei Berlin","Germany","petersik-instruments.com","https://www.linkedin.com/company/petersik-instruments"
,"Canned Monsters","I am dedicated to the meticulous craft of producing handcrafted bass guitar effects that exemplify both artistic excellence and sonic innovation. I meticulously assemble circuits using a blend of modern, high-quality components and carefully selected vintage NOS transistors, employing the point-to-point soldering method. As a result, you will experience unparalleled tone and a profound connection between musician and instrument. As you explore our offerings, we invite you to immerse yourself in the world of handcrafted bass guitar effects and experience the unparalleled craftsmanship and innovation that define our brand.","Retail Musical Instruments","Self-employed","Self Employed",,,"cannedmonsters.com","https://www.linkedin.com/company/canned-monsters"
,"Musik Hammerschmidt GmbH","Verkauf von Musikinstrumenten.
Erzeugung von Klarinetten.
Meisterwerkstätten für Holzblasinstrumente, Blechblasinstrumente und elektronische Instrumente.","Retail Musical Instruments","11-50 employees","Public Company","Wattens, Tyrol","Austria","musikhaus-hammerschmidt.at","https://www.linkedin.com/company/musikhammerschmidt"
,"American Violin Shop",,"Retail Musical Instruments","2-10 employees","Privately Held",,,"americanviolinshop.com","https://www.linkedin.com/company/american-violin-shop"
,"StudioDesk","StudioDesk designs and builds premium studio workstations trusted by musicians, producers, and creators in over 60,000 studios worldwide. Born from a personal need for a better creative workspace, StudioDesk quickly evolved into one of the most recognized brands in music production furniture.

We combine smart functionality with elegant design, helping artists—from home studio hobbyists to Grammy-winning professionals—stay organized, inspired, and productive. Every desk is crafted with the modern studio in mind, offering cable management, rack space, and ergonomic layouts that elevate both performance and aesthetics.

With a community-driven approach and over 12 years of product innovation, StudioDesk is redefining the way studios are built—one workstation at a time.","Retail Musical Instruments","11-50 employees","Privately Held","Delaware","United States","studiodesk.net","https://www.linkedin.com/company/studio-desk1"
,"Philth Industries","Guitar and bass customization. Custom builds, amp and cabinet enclosures. Cnc and laser engraving services. Musical instrument repair and more!","Retail Musical Instruments","2-10 employees","Self Employed","Algonquin, il","United States",,"https://www.linkedin.com/company/philth-industries"
,"Sarah's Pancase",,"Retail Musical Instruments","2-10 employees","Self Owned","San Juan","Puerto Rico",,"https://www.linkedin.com/company/sarah-s-pancase"
,"AVITRIX LIMITED","Focusing on connecting musicians who are selling, buying, and offering music services.
Maintaining balance between meeting stated business goals while maintaining user and customer satisfaction .
Enhancing music discovery.","Retail Musical Instruments","2-10 employees","Privately Held","NAIROBI","Kenya",,"https://www.linkedin.com/company/avitrix-limited"
,"Lowlander",,"Retail Musical Instruments","2-10 employees","Self Owned",,,"lowlander.eu","https://www.linkedin.com/company/lowlander-brand-for-musicians"
,"Khemmusic",,"Retail Musical Instruments","2-10 employees","Self Owned",,,,"https://www.linkedin.com/company/khemmusic"
,"Sarg's Guitars",,"Retail Musical Instruments","Self-employed","Self Employed",,,"sargsguitars.com","https://www.linkedin.com/company/sarg-s-guitars"
,"JLH Technologies, LLC dba AxeTrak",,"Retail Musical Instruments","2-10 employees","Self Employed",,,"axetrak.com","https://www.linkedin.com/company/jlh-technologies-llc-dba-axetrak"
,"LunaDrums",,"Retail Musical Instruments","2-10 employees","Privately Held","Gmina Piekoszów, Świętokrzyskie","Poland",,"https://www.linkedin.com/company/lunadrums"
,"Dries' Amp Service",,"Retail Musical Instruments","Self-employed","Self Owned",,,"driesampservice.be","https://www.linkedin.com/company/dries-amp-service"
,"Nicolas Démarais luthier","Expert en violons altos et violoncelles. Vente, entretien, réparation. Location d'instruments pour débutants.","Retail Musical Instruments","Self-employed","Privately Held","Saint-Aupre","France","demarais.fr","https://www.linkedin.com/company/nicolas-démarais-luthier"
,"Hammonds Violins","Maker of fine violins and violas.","Retail Musical Instruments","Self-employed","Self Owned",,,"hammondsviolins.com","https://www.linkedin.com/company/hammonds-violins"
,"Hertzmann","Groupe de musique","Retail Musical Instruments","2-10 employees","Self Employed",,,,"https://www.linkedin.com/company/hertzmannband"
,"The Guitar Plug","Start-up based out of Glasgow, Scotland. 
Aiming to provide high quality musical goods at budget friendly prices.","Retail Musical Instruments","2-10 employees","Partnership","Glasgow","United Kingdom",,"https://www.linkedin.com/company/the-guitar-plug"
,"harmonypad",,"Retail Musical Instruments","Self-employed","Privately Held",,,"harmonypad.app","https://www.linkedin.com/company/harmonypad"
,"Kfive Designs",,"Retail Musical Instruments","Self-employed","Self Employed",,,,"https://www.linkedin.com/company/kfive-designs"
,"Africa Music Store","At Africa Music Store, we’re building Africa’s #1 destination for musical instruments, sound gear, and stage solutions blending accessibility, affordability, and excellence across the continent and beyond.

We serve both beginner and professional musicians by offering:

- New & Used Musical Instruments
- Drop-Shipping Solutions
- Sound & Stage Installations
- Custom Drum Isolation Booths
- UK-to-UK Resale for African Musicians Abroad

Our mission is simple: Empower Africa’s sound.
Whether it’s a church, concert, studio, or solo gig, we supply the tools to elevate performance and unlock potential.

 Nationwide delivery in Nigeria
 Expanding our footprint into the UK
 Trusted by churches, schools, artists, and music lovers

 Let’s partner, equip your setup, or bring your sound dream to life.","Retail Musical Instruments","2-10 employees","Privately Held",,,,"https://www.linkedin.com/company/africa-music-store"
,"Simme Musikkhús","Simme Musikkhús er elsti tónleikahandil í Føroyum, frá 1959. Hóast ymiskir eigarar hava verið, síðani Simme Jacobsen setti handilin á stovn, hevur endamálið altíð verið tað sama - at veita dygdargóð ljóðføri til føroyingar fyri ein sámuligan prís.","Retail Musical Instruments","2-10 employees","Privately Held","Tórshavn","Faroe Islands","simme.fo","https://www.linkedin.com/company/simme-musikkhús"
,"Muzforte.by",,"Retail Musical Instruments","2-10 employees","Partnership",,,"muzforte.by","https://www.linkedin.com/company/muzforte-by"
,"Huaihua XINPU Musical instrument Co., ltd.","Founded in 2008, Huaihua Xinpu Music Instrument Co. Ltd. (previously Huaihua Yueshida Musical Instrument Component Factory) has grown to become one of the largest professional manufacturers of music instruments in China. Xinpu's factory covers an area of 10, 000 m³ , with around 50 skilled and experienced workers and a monthly capacity of about 20, 000 units. We specialize in metronomes, tuners, music stands, guitar capos and other musical instrument accessories. We have passed ISO9001 and ISO14001 environmental management certification, assuring a superior quality of goods supplied to you.

Xinpu has built a strong reputation for quality and service. We continually invest in R&D, production technologies and marketing in order to maintain our position as the leading creative and responsible company in our field. We have obtained several design patents and Utility Model patents.

We regularly attend international musical instrument fairs as an exhibitor in China every year. Our own brands ""Yueshida"", ""Artsilva"" and ""Yinda"" have become commonly recognized in China, as well as in markets overseas. With successful markets established, we opened a brand new showroom in October 2015, which is located in the Huaihua Advertising and Creative Industrial Centre. The close proximity between the factory and the sales department (who moved into the new office) allows both sales and production departments to keep in close touch. This guarantees efficient communications between these two important departments. Additionally, the showroom offers a more pleasant environment, with extensive and complete product lines on display to our visiting customers.

Focusing on feedback from our customers, we will keep on developing high-quality products and services. And we are looking forward to more co-operation opportunities with overseas customers based on mutual benefits.

Our philosophy: Quality first, Reputation first, Management based, Service sincere!","Retail Musical Instruments","11-50 employees","Privately Held","Huaihua","China","leshidayueqi.com","https://www.linkedin.com/company/huaihua-xinpu-musical-instrument-co.-ltd."
,"Hyperflute",,"Retail Musical Instruments","Self-employed","Self Owned","Vienna","Austria","alessandrobaticci.com","https://www.linkedin.com/company/hyperflute"
,"Low Price Music",,"Retail Musical Instruments","2-10 employees","Privately Held",,,,"https://www.linkedin.com/company/low-price-music"
,"KINGDOM SERVICE MUSIC",,"Retail Musical Instruments","2-10 employees","Self Owned",,,,"https://www.linkedin.com/company/kingdom-service-music"
,"AChord Shop",,"Retail Musical Instruments","2-10 employees","Public Company",,,"achordshop.com","https://www.linkedin.com/company/achord-shop"
,"Disk Tarra",,"Retail Musical Instruments","501-1,000 employees","Privately Held",,,"disktarra.com","https://www.linkedin.com/company/disk-tarra"
,"Tomasz Pietraszek Luthier",,"Retail Musical Instruments","Self-employed","Self Employed",,,,"https://www.linkedin.com/company/tomasz-pietraszek-luthier"
,"Pilson Guitars",,"Retail Musical Instruments","Self-employed","Self Owned",,,"pilsonguitars.com","https://www.linkedin.com/company/pilson-guitars"
,"Arth Musical",,"Retail Musical Instruments","11-50 employees","Privately Held",,,,"https://www.linkedin.com/company/arth-musical"
,"The PickClip",,"Retail Musical Instruments","Self-employed","Privately Held",,,,"https://www.linkedin.com/company/thepickclip"
,"Perth Harp Centre",,"Retail Musical Instruments","2-10 employees","Self Owned",,,"perthharpcentre.com.au","https://www.linkedin.com/company/perth-harp-centre"
,"Exodus Music","Exodus Music equips musicians and educators with the tools, instruction, and inspiration they need to thrive.

Based in Nampa, Idaho, we provide private lessons, homeschool and alternative school ensemble programs, professional coaching, and personalized music education resources. We support everyone from beginning students to advanced performers through high-quality instruction and accessible programming.

We also offer a curated selection of instruments, print materials, accessories, and exclusive compositions—sourced and created with the needs of band directors, studio teachers, homeschool families, and gigging musicians in mind.

Our services include:

-Private and group instruction
-Homeschool and alternative education ensembles
-Music engraving, arranging, and score reconstruction
-Educational consulting and professional development
-Jazz camps, festivals, and community events
-Instrument and print sales with educator-friendly pricing

Exodus Music is also home to the Gem State Jazz Camp, a transformative summer experience for middle and high school musicians to grow through small groups, clinics, and live performance with top regional artists.

Whether you're a parent looking for lessons, a school needing reliable resources, or a musician seeking inspiration and growth, Exodus Music exists to guide your next steps forward.

Learn more at www.exodusmusic.com","Retail Musical Instruments","2-10 employees","Self Owned",,,"exodusmusic.com","https://www.linkedin.com/company/exodusmusic"
,"Body Synths","Electronic instruments designed and built in Berlin","Retail Musical Instruments","Self-employed","Self Employed",,,"bodysynths.com","https://www.linkedin.com/company/bodysynths"
,"Vodeq","Vodeq is an synthesizer and audio equipment retailer and designer based in Indiana, with a focus on do-it-yourself solutions. Our vertical integration allows us to bring industry-leading products to our customers at compelling prices, all while delivering an unparalleled customer experience.","Retail Musical Instruments","2-10 employees","Partnership","Fort Wayne","United States","vodeq.com","https://www.linkedin.com/company/vodeq"
,"Zangschool Amstelveen",,"Retail Musical Instruments","2-10 employees","Self Employed",,,"zangschoolamstelveen.nl","https://www.linkedin.com/company/zangschool-amstelveen"
,"Rogue Rehousing",,"Retail Musical Instruments","Self-employed","Self Owned",,,"roguerehousing.com","https://www.linkedin.com/company/roguerehousing"
,"ErgoSonic Drums","ErgoSonic is changing the shape of 21st century percussion. Ou patented, one-of-a-kind angled shell drums are ergonomically designed to provide exceptional playing, tuning, tonal and movement capabilities which far surpass conventional drums.","Retail Musical Instruments","2-10 employees","Privately Held",,,"ergosonicdrums.com","https://www.linkedin.com/company/ergosonic-drums"
,"EXOTIC GUITARS SAS","Exotic Guitars se fundó en el año 2024, con una misión, ser el Taller de venta y reparación de guitarras de más alta calidad en Colombia. Nuestra pasión por la excelencia es lo que nos inspiró a montar nuestro negocio, y continúa impulsándonos hasta hoy.","Retail Musical Instruments","2-10 employees","Self Owned",,,,"https://www.linkedin.com/company/exotic-guitars-sas"
,"Ivory Sound",,"Retail Musical Instruments","Self-employed","Self Owned",,,"theivorysound.com","https://www.linkedin.com/company/ivory-sound"
,"Lefkovics Luthier","Lefkovics Luthier es un taller boutique especializado en la construcción de guitarras e instrumentos latinoamericanos de alta gama. Cada pieza nace de un equilibrio entre técnicas tradicionales y un enfoque moderno, con énfasis en resonancia, proyección cálida y personalidad única.

Nuestros servicios

Construcción de instrumentos personalizados / boutique.

Restauración, mantenimiento y reparación integral de instrumentos de cuerda.

Asesoramiento profesional e insumos de calidad.

Rental & retail para grabaciones y producciones musicales.

Nuestra misión
Ser el puente entre el músico y su instrumento, fomentando la excelencia sonora, la expresión artística y la emoción en cada nota.

Valores que nos guían

Excelencia artesanal

Personalización

Compromiso con la calidad sonora

Conexión artística

Te invitamos
Si estás buscando un instrumento que hable, que inspire, que te acompañe toda la vida, aqui estamos para materializar ese sueño.","Retail Musical Instruments","Self-employed","Self Employed",,,"lefkoluthier.com","https://www.linkedin.com/company/lefkovics-luthier"
,"Marco Carolà",,"Retail Musical Instruments","2-10 employees","Self Owned",,,,"https://www.linkedin.com/company/marco-carolà"
,"WOWHolistic Music",,"Retail Musical Instruments","2-10 employees","Self Owned",,,,"https://www.linkedin.com/company/wowholistic-music"
,"TurtleTone","Guitar amp specialists for speakers and upgrades. Get your tone sorted where it counts!","Retail Musical Instruments","2-10 employees","Privately Held","Singapore","Singapore","turtletone.sg","https://www.linkedin.com/company/turtletone"
,"Plugin.com.vn","Cửa Hàng Plugin & VST Lớn Nhất Việt Nam","Retail Musical Instruments","2-10 employees","Public Company","Hanoi","Vietnam","plugin.com.vn","https://www.linkedin.com/company/plugin-com-vn"
,"TLR.Guitars",,"Retail Musical Instruments","Self-employed","Privately Held","台北市","Taiwan",,"https://www.linkedin.com/company/tlr-guitars"
,"Coldcraft Audio & Effects",,"Retail Musical Instruments","Self-employed","Privately Held",,,,"https://www.linkedin.com/company/coldcraft-audio-effects"
,"Petiga Music Merchandise Store","Fulfilling your emotional and physical needs in music.","Retail Musical Instruments","Self-employed","Self Employed",,,,"https://www.linkedin.com/company/petigamusic"
,"yarasaz","Yarasaz is a specialized platform for buying musical instruments online and learning music. We provide expert guidance, educational content, and a curated selection of high-quality instruments to support musicians at every stage of their journey.

یاراساز یک پلتفرم تخصصی برای خرید آنلاین سازهای موسیقی و یادگیری هنر موسیقی است. ما با ارائه مشاوره، محتوای آموزشی، و مجموعهای از سازهای باکیفیت تلاش میکنیم مسیر یادگیری و انتخاب ساز را برای علاقهمندان سادهتر و حرفهایتر کنیم.","Retail Musical Instruments","2-10 employees","Privately Held",,,"yarasaz.com","https://www.linkedin.com/company/yarasaz"
,"VIRGIESOUND","VIRGIESOUND adalah perusahaan yang menyediakan berbagai alat musik dan jasa sewa sound system profesional. Dengan pengalaman bertahun-tahun di industri musik dan audio, kami berkomitmen untuk menjadi partner terpercaya dalam menciptakan harmoni dan menghadirkan suara yang berkualitas untuk setiap momen penting Anda","Retail Musical Instruments","2-10 employees","Self Owned",,,,"https://www.linkedin.com/company/virgiesound"
,"JER-Holistic Music",,"Retail Musical Instruments","2-10 employees","Self Owned",,,,"https://www.linkedin.com/company/jer-holistic-music"
,"Ground FX",,"Retail Musical Instruments","Self-employed","Self Owned",,,"ground-fx.net","https://www.linkedin.com/company/groundfx"
