"Find companies","Name","Description","Primary Industry","Size","Type","Location","Country","Domain","LinkedIn URL"
,"Asea Aviation College","Welcome to the website of ASEA Aviation College.
ASEA Aviation College was established in 1993 for the purpose of producing the country's top-tier technicians in the aviation industry. Since then, it has produced a large number of highly qualified technicians who have played a central role in the development of the country's aviation industry.
In line with the founder's vision, ASEA does its best to cultivate top-notch aviation technicians boasting of both abundant competence and upright moral character.
As part of such efforts, ASEA opened a foreign language institute on campus for the first time among local technical colleges and established the ASEA Future Talent Development Center devoted to moral and character education. As always, ASEA will continue to lead aviation-related vocational education in Korea by introducing the most advanced technology training facilities and curricula.
The aviation industry has kept growing at a fast pace in Korea amid the increasingly higher youth unemployment rate coupled with the lackluster performance of the country's key driving forces for growth. The industry is estimated to record even faster growth down the road given the impressive overall economic growth in Northeast Asia.
Against such backdrop, ASEA has focused on aviation occupational education and produced over 19,000 graduates for the local aviation industry for more than 20 years. ASEA spares no efforts to help each and every one of its students realize their dreams through hard work and integrity.
Today, professional skills count more than one's academic background.
Take on challenges and realize your dreams.
ASEA will help you spread your wings and fly high.
Thank you.

""The prospect of the aviation industry is bright. Choose ASEA, and your future will become even brighter.""","School and Employee Bus Services","51-200 employees","Educational","Yongsan-Gu, Seoul","South Korea","asea.or.kr","https://www.linkedin.com/company/asea-aviation-college"
,"Shri Mahaveer International School","SMIS is known for the diversified culture of excellence, extraordinary care, best infra-structural facilities, high-tech labs, Wide and Wi-Fi enabled campus for holistic development of your child.","School and Employee Bus Services","11-50 employees","Educational","Renwal, Rajasthan","India",,"https://www.linkedin.com/company/shri-mahaveer-international-school"
,"Tito Togo","Tito est une société de transport qui fournit des solutions de transport pratiques, abordables et sécurisées pour répondre aux besoins de tous.","School and Employee Bus Services","51-200 employees","Self Employed",,,,"https://www.linkedin.com/company/tito-togo"
,"Al Fajr Early Childhood Center",,"School and Employee Bus Services","11-50 employees","Educational","Al Barsha 2, Dubai","United Arab Emirates","gmail.com","https://www.linkedin.com/company/al-fajr-early-childhood-center"
,"GD Goenka Jamnagar","We at G.D. Goenka Public School Jamnagar strongly believe in and respect the individuality and multiple intelligences possessed by different children. We believe that every child is special and needs all, that will make him a unique holistic and socially contributing individual. We with the promise to provide best of infrastructural facilities, high-tech labs, well-stocked library, and adequately equipped medical room, vast playgrounds, cafeteria, etc. ensure that this process is augmented and each child is nurtured well.","School and Employee Bus Services","11-50 employees","Educational","Jamnagar, Gujarat","India","gdgoenkajamnagar.com","https://www.linkedin.com/company/gd-goenka-jamnagar"
,"Les Autobus Brunet inc.",,"School and Employee Bus Services","51-200 employees","Privately Held",,,"webnode.fr","https://www.linkedin.com/company/les-autobus-brunet-inc"
,"Lexington Local Schools",,"School and Employee Bus Services","51-200 employees","Educational",,,"lexington.k12.oh.us","https://www.linkedin.com/company/lexington-local-schools"
,"The Maurya School","The Maurya School functions on the prime principle of nurturing students on every important facet of life including moral values, problem solving and critical thinking to name a few. The sincere endeavour to strengthen the mentoring of not only students but also facilitators toward innovation and independence of thought is one among the many highlights of the school. In addition to the vision, ideology, etc. this website portrays all the features of the school, unfolding the dynamic learning environment it offers to students.

The Maurya School is an institution having firm faith in its guiding principles of discipline, honour, integrity and social responsibility. We instil these principles as the bedrock of character in the children entrusted to our care. The Maurya School emphasises on empowering students to discover their own learning styles and becoming proactive learners. The school believes in encouraging initiative and creativity in its students so that they grow up to be self confident, thinking individuals.","School and Employee Bus Services","51-200 employees","Educational","Gurugram, Haryana","India","themauryaschool.com","https://www.linkedin.com/company/themauryaschoolgurgaon"
,"Samdad","An Innovative Solution for School Transportation.","School and Employee Bus Services","2-10 employees","Privately Held","Mashhad, Khorasan Razavi","Iran","samdadapp.ir","https://www.linkedin.com/company/samdad"
,"ECP MEKNES",,"School and Employee Bus Services","11-50 employees","Privately Held",,,"ecpmeknes.ma","https://www.linkedin.com/company/ecp-meknes"
,"Ontario High School (CA)",,"School and Employee Bus Services","51-200 employees","Educational",,,"cjuhsd.net","https://www.linkedin.com/company/ontario-high-school-ca"
,"XFive Transportation","XFive Transportation stands out as a leading and trusted non-medical school transport provider for children, with over two years of service. Based in Bridgewater, Massachusetts, our focus on safety and reliability is the foundation of our operations, positioning us as the first choice for parents and guardians.

Our journey begins in Bridgewater, and our reach extends across the diverse communities of Massachusetts. From urban hubs to tranquil rural areas, XFive Transportation provides families with a secure and dependable transportation choice for their children.

Dedicated to delivering top-tier non-medical school transportation services, prioritizing safety, reliability, and the well-being of the children we transport. We commit to upholding the highest standards in every aspect of our operation.

Our well-maintained fleet, equipped with the latest safety features, ensures a secure journey for every child. Behind the wheel, our expertly trained team, with years of experience and extensive training, goes beyond the ordinary. We emphasize professionalism, creating a positive experience for both parents and students.

More than a transportation service, XFive Transportation positions itself as an active participant in the educational journey of the children we serve. We understand the importance of punctuality in day-to-day activities, and our consistent performance history reflects our dedication to the confidence placed in us.

Our Services:

School Van Transportation
Non-Medical Transport
Ambulatory Transport
Wheelchair Transport

As an active participant in the educational journey of the children we serve, XFive Transportation is more than just a transportation service, we consider ourselves a partner in ensuring a reliable and secure daily routine for families and schools.

Visit our website at www.xfivetransportation.com for details and don't hesitate to reach out to us at Xfivetransportation@gmail.com for inquiries or to get started.","School and Employee Bus Services","11-50 employees","Privately Held","Bridgewater, Massachusetts","United States","xfivetransportation.com","https://www.linkedin.com/company/xfive-transportation"
,"Anand Bal Vidhya Mandir Senior Secondary School, Sheoganj","The school is for better education and all over growth of your child.........","School and Employee Bus Services","11-50 employees","Public Company","sheoganj, Rajasthan","India","abvmssss.com","https://www.linkedin.com/company/anand-bal-vidhya-mandir-senior-secondary-school-sheoganj"
,"N Mahalingam & Company","M/s. N. MAHALINGAM & COMPANY is a part of Sakthi & ABT Group of Companies which was established in the year 1954 by opening a Petrol Pump outlet in jail road, Coimbatore. There after the company has grown by diversifying in other business activities.","School and Employee Bus Services","11-50 employees","Partnership","COIMBATORE, TAMILNADU","India","nmandco.com","https://www.linkedin.com/company/n-mahalingam-company"
,"TOURISM AND SERVICES","Busunternehmen","School and Employee Bus Services","2-10 employees","Privately Held","Aachen, North Rhine-Westphalia","Germany","tourism-and-services.eu","https://www.linkedin.com/company/tourism-and-services"
,"Shri Krishna Group Of Institutions","Shri Krishna Sr. Sec. School, Mahendergarh, offers a complete learning solution to its students. The school has established itself as one of the top CBSE schools in Mahendergarh by following micro-scheduling that enables every student to prepare according to the integrated CBSE syllabus. Shri Krishna Sr. Sec. School is one of the best Co-Ed Day Boarding Schools that follows the best teaching methodologies that help students reach their ultimate goal. Over the years, the students of one of the best CBSE schools have performed well in JEE, NEET, and other national-level examinations.","School and Employee Bus Services","501-1,000 employees","Educational","mahendergarh, Haryana","India","sks.edu.in","https://www.linkedin.com/company/shri-krishna-group-of-institutions"
,"Junior University School Karachi","Junior University school Gulshan e iqbal block 11 karachi
Sir Basheer","School and Employee Bus Services","11-50 employees","Educational","karachi, Sindh","Pakistan",,"https://www.linkedin.com/company/junior-university-school-karachi"
,"The Unleashed Collective RTO 45480","Delivering training nationally in the areas of; 
BSB30120 Certificate III in Business
BSB40120 Certificate IV in Business 
BSB50120 Diploma of Business
BSB30220 Certificate III in Entrepreneurship and New Business 
BSB40320 Certificate IV in Entrepreneurship and New Business
BSB40420 Certificate IV in Human Resources 
BSB40520 Certificate IV in Leadership and Management
BSB50420 Diploma of Leadership and Management
CHC32015 Certificate III in Community Services +
CHC41015 Certificate IV in Celebrancy","School and Employee Bus Services","2-10 employees","Public Company",,,"theunleashedcollective.com","https://www.linkedin.com/company/the-unleashed-collective"
,"RL International School 82","R L International School, Sector 82, Gurugram was founded on the vision of spreading Value Based Education to every corner of INDIA. With the glorified history , RL international school has become the most significant link in the chain of education. RL international school has consistently been ranked among the top 5 schools in the country, speaking volumes of its excellence in multifarious disciplines.","School and Employee Bus Services","51-200 employees","Educational",,,"rlinternationalschool.org","https://www.linkedin.com/company/rl-international-school-82"
,"Bus Master Lebanon","نظام ذكي لتنظيم قطاع النقل المدرسي 
خدمات متكاملة تنظم آلية التواصل بين المدرسة و السائقين و الاهل و الطلاب.
من اجل سلامة أبنائكم و راحة بالكم","School and Employee Bus Services","1,001-5,000 employees","Self Owned",,,,"https://www.linkedin.com/company/bus-master-lebanon"
,"Southwinds Transportation","Southwinds Transportation is a fully insured school bus company located in the San Fernando Valley.

We specialize in providing safe and reliable transportation to School Districts, Private Schools, and Private parties.

We currently service the Los Angeles, Ventura, and surrounding counties. Our team of drivers are California Highway Patrol School bus certified, friendly, courteous, and professional.","School and Employee Bus Services","11-50 employees","Privately Held","Sun Valley, California","United States","swbuses.com","https://www.linkedin.com/company/southwindstransportation"
,"Wilmary Christian Learning Centre","Wilmary Christian Learning Centre (WCLC) is an organization registered with the Directorate of South African Non-Profit Organization in terms of Nonprofit Organization act, 1997. The registration Certificate number: 055-519- NPO was allocated to the organization on 22 June 2007 by the Directorate. WCLC was formed by the founder members in 2001 that contributed funds and registered a Close Corporation for the purpose of developing infrastructure, carrying and implementing the vision of the organization. WCLC met the requirements of Non-Profit Organisation in 2007 when the name of the organization was entered in the register of NPO and certificate issued on the 22 of June 2007 to that effect.

Our Curriculum
The school offers National Curriculum and Assessment Statement Policy (CAPS), a single, comprehensive and clear policy document introduced by the Republic of South Africa Department of Basic Education for all subjects listed in the National Curriculum Statement Grade R -12. It guides teachers on what the teachers should teach and assess.","School and Employee Bus Services","51-200 employees","Educational","886 Midoroni Village, Hakutama, R522 Vivo road (Louis Trichardt), Limpopo","South Africa","wilmaryclc.co.za","https://www.linkedin.com/company/wilmary-christian-learning-centre"
,"Goldfish Media BI",,"School and Employee Bus Services","201-500 employees","Public Company",,,,"https://www.linkedin.com/company/goldfish-media-bi"
,"Galahitiyawa Central College","Galahitiyawa Central College (GCC) (Sinhala: ගලහිටියාව මධ්ය මහා විද්යාලය) is an educational institution in Ganemulla, Gampaha District, Sri Lanka belonging to the category of Central Colleges of Sri Lanka. It was established in May 1944. It is one of the original 54 Central Schools established by Dr. C.W.W.Kannangara, the then Minister of Education, in the implementation of his free education scheme.","School and Employee Bus Services","201-500 employees","Educational","Gampaha District, Western Province","Sri Lanka","galahitiyawacc.com","https://www.linkedin.com/company/ガラヒチヤーワ国立高校"
,"Mount Castle International School","Mount Castle International School is a company based out of At Post Dattawadi Nere, Sr. No. 5, near Hinjawadi, Pune, Maharashtra, India.","School and Employee Bus Services","2-10 employees","Educational","Pune, Maharashtra","India","mountcastleinternationalschool.com","https://www.linkedin.com/company/mount-castle-international-school"
,"TRANSPORTS VOYAGES MOBILITÉ ADAPTÉE","Chez TVMA, nous nous consacrons à rendre la mobilité accessible à tous. Spécialisés dans le transport de personnes à mobilité réduite et la location de véhicules adaptés, nous mettons un point d'honneur à offrir des solutions de transport sûres, confortables et fiables. En tant qu'entreprise familiale, nous plaçons la qualité et la sécurité au cœur de nos services, en nous engageant à fournir une assistance personnalisée et un accompagnement chaleureux à chaque trajet.","School and Employee Bus Services","51-200 employees","Self Owned",,,"tvma.fr","https://www.linkedin.com/company/tvmafr"
,"easyeno",,"School and Employee Bus Services","11-50 employees","Educational",,,"easyeno.com","https://www.linkedin.com/company/easyeno"
,"HCT Bus- & Eventlogistik GmbH",,"School and Employee Bus Services","11-50 employees","Public Company",,,"hct-bus.de","https://www.linkedin.com/company/hct-bus-eventlogistik-gmbh"
,"Made4Students Agency",,"School and Employee Bus Services","2-10 employees","Privately Held","Maputo, None","Mozambique",,"https://www.linkedin.com/company/made4students-agency"
,"TRANSPORTS SLEMBROUCK VÉHICULES LÉGERS SAS","Depuis plus de 90 ans, Transports Slembrouck VL offre des services de transport de personnes en véhicules légers, adaptés aux besoins des entreprises, des structures spécialisées, des maisons de retraite, et des particuliers. Située à Fleurbaix, notre entreprise familiale se distingue par son engagement envers la sécurité, le confort et l’éco-responsabilité. Nos chauffeurs formés et notre flotte moderne, incluant des véhicules équipés pour les personnes à mobilité réduite, garantissent des trajets fiables et ponctuels. Contactez-nous pour découvrir nos services de transport adaptés à vos besoins spécifiques.","School and Employee Bus Services","51-200 employees","Privately Held","La Chapelle-d’Armentières, Hauts-de-France","France",,"https://www.linkedin.com/company/slembrouckvl"
,"Expresso Táxi Tonelli","Empresa especializada em transporte executivo de pessoas, visando qualidade, segurança, ética e transparência.","School and Employee Bus Services","11-50 employees","Privately Held","São Paulo, São Paulo","Brazil",,"https://www.linkedin.com/company/expresso-táxi-tonelli"
,"Bright Beginning Public Higher Secondary School Daharki Supported by SEF","Bright Beginning Public Higher Secondary School is Sindh Education Foundation Assisted School. Mr. Abdul Hakeem Mahar, who is philanthropist and educationists, founded this school with vision to impart the quality education. Today it is best school in the town.","School and Employee Bus Services","51-200 employees","Educational","Daharki , Sindh","Pakistan",,"https://www.linkedin.com/company/bright-beginning-public-higher-secondary-school-daharki-supported-by-sef"
,"CHEESE BUS, INC.","Welcome to Cheese Bus Inc., where safety and reliability have been our top priorities for over 25 years. We take pride in being a trusted provider of transportation services for students. With years of experience in the industry, we have established ourselves as a trending name in school bus transportation.

Every child deserves a positive and enjoyable ride to and from school. Therefore, we strive to create a friendly and welcoming environment on our buses. Our drivers prioritize the well-being of students and promote respectful behavior and cooperation among passengers.

Beyond safety and reliability, we are committed to providing exceptional customer service. Our dedicated staff is available to address any concerns or inquiries promptly. We value open communication and work closely with school administration and parent groups to ensure a seamless transportation experience for students.

As a company, we embrace innovation and continuously invest in modern technology to enhance our operations. From GPS tracking systems for real-time monitoring to efficient routing software, we leverage the latest advancements to improve efficiency, punctuality, and overall service quality.","School and Employee Bus Services","51-200 employees","Privately Held","New York","United States","cheesebusinc.com","https://www.linkedin.com/company/cheese-bus-inc"
,"Transfreitas","Somos na medida do seu caminho, porque sabemos que cada caminho é único. E é por isso que o nosso serviço também é. Sob medida. No tempo certo. Do jeito certo. Na medida do seu caminho.","School and Employee Bus Services","51-200 employees","Privately Held",,,"transfreitas.com.br","https://www.linkedin.com/company/transfreitas"
,"TRANSTUR LOCADORA E TURISMO LTDA",,"School and Employee Bus Services","11-50 employees","Privately Held","Biguaçu, Santa Catarina","Brazil","escalatransportes.com.br","https://www.linkedin.com/company/transtur-locadora-e-turismo-ltda"
,"Valor Academy High School",,"School and Employee Bus Services","11-50 employees","Educational",,,,"https://www.linkedin.com/company/valor-academy-high-school"
,"BGT Talent Event",,"School and Employee Bus Services","Self-employed","Non Profit",,,,"https://www.linkedin.com/company/bgt-talent-event"
,"Leesel Transportation","Leesel Transportation Corp. is a leading school bus transportation service to all the Boroughs of NYC. Servicing Pre-K, Special Needs, and Private Schools. We're dedicated to providing the highest quality, most compassionate care to students and families.","School and Employee Bus Services","1,001-5,000 employees","Privately Held","Bronx, New York","United States","leeseltransportation.com","https://www.linkedin.com/company/leesel-transportation"
,"Autobus Transco Inc","Autobus Transco Inc is a company based out of Quebec, Canada.","School and Employee Bus Services","5,001-10,000 employees","Privately Held","pointe-claire",,"autobustransco.ca","https://www.linkedin.com/company/autobus-transco-inc"
,"Frederica Academy","Frederica Academy’s mission is to maximize the potential of each student and to prepare every student for college and adult life through the development of mind, body, and spirit.

 

Frederica Academy is an independent, coeducational, non-sectarian, college preparatory day school with an enrollment of approximately 450 students in pre-kindergarten through twelfth grade. The school was founded in 1969 and is governed by an Honor Code.","School and Employee Bus Services","51-200 employees","Educational","Saint Simons Island, Georgia","United States","fredericaacademy.org","https://www.linkedin.com/company/frederica-academy-86"
,"Labuan Matriculation College","Pendidikan di Malaysia adalah suatu usaha berterusan ke arah memperkembangkan lagi potensi individu secara menyeluruh dan bersepadu untuk mewujudkan insan yang seimbang dan harmoni dari segi intelek, rohani, emosi dan jasmani berdasarkan kepercayaan kepada tuhan.  Usaha ini adalah bagi melahirkan rakyat Malaysia berilmu pengetahuan, berketrampilan, berakhlak mulia, bertanggungjawab dan berkeupayaan mencapai kesejahteraan diri serta memberi sumbangan terhadap keharmonian dan kemakmuran masyarakat dan Negara.","School and Employee Bus Services","201-500 employees","Educational","Labuan","Malaysia","matrik.edu.my","https://www.linkedin.com/company/labuan-matriculation-colleges"
,"Marvão Serviços","Fundada em 2019, a Marvão Transporte Escolar é uma empresa dedicada a oferecer serviços de transporte escolar de alta qualidade em todo o estado do Piauí, com foco especial nas regiões Norte e Sul. Atendemos grandes parceiros institucionais como o Governo do Estado do Piauí e a Secretaria Municipal de Educação, garantindo que milhares de alunos cheguem à escola com segurança, pontualidade e conforto todos os dias.","School and Employee Bus Services","201-500 employees","Partnership","Teresina, Piauí","Brazil","marvao.com.br","https://www.linkedin.com/company/marvão-serviços"
,"Jyothy Kendriya Vidyalaya School (JKV)","This school is run by JYOTHY CHARITABLE TRUST. It was being run with the selfless and dedicated efforts of Late Dr B.N.V. Subrahmanya. He was the Managing Trustee of the trust and the founder president of JYOTHY KENDRIYA VIDYALAYA.

Location-

Yelachenahally, 556, Kanakapura Rd, behind Kanakapura Metro Station, Kanakapura, Basavanagudi, Bengaluru, Karnataka 560078, India.","School and Employee Bus Services","201-500 employees","Educational","Bengaluru South, Karnataka","India","jyothyvidyalaya.org","https://www.linkedin.com/company/jyothy-kendriya-vidyalaya-india"
,"XCL American School of Bangkok, Sukhumvit","Welcome to XCL American School of Bangkok, Sukhumvit, providing future-focused American curriculum for Pre-Kindergarten to High School students with over 40 years of trust and inspiration.","School and Employee Bus Services","51-200 employees","Educational","Wattana, Bangkok","Thailand","asbsk.ac.th","https://www.linkedin.com/company/xclasbsukhumvit"
,"Northline Transportation","Northline Transportation is dedicated to excellent transportation services for the school districts that we serve.  We specialize in Type III (van) transportation for the students K-12. The transportation needs vary from Special Ed, Medical Needs and Homeless/Highly Mobile Students. Due to the nature of our operation, our drivers aren't arriving to the pick up location in a bus, but they instead drive a minivan or passenger van to fulfill the call for service. The needs, requirements and locations of our students change constantly. At Northline we have the skills, staff and tools to quickly pivot in order to fulfill the request of the ever changing needs of our customer.","School and Employee Bus Services","51-200 employees","Privately Held","St Paul, Minnesota","United States","nltmn.com","https://www.linkedin.com/company/northline-transportation"
,"Jnana Sweekar PU College (DJS)","Deeksha Integrated Jnana Sweekar P.U College.","School and Employee Bus Services","51-200 employees","Educational","Bengaluru, Karnataka","India",,"https://www.linkedin.com/company/jnana-sweekar-pu-college-djs"
,"Family Cabs","Family Cabs brings over 5 years of experience serving families.
Every day, we provide safe, reliable, and reassuring transportation for your children, thanks to our team of carefully selected drivers.","School and Employee Bus Services","2-10 employees","Privately Held","Brussels, Brussels Region","Belgium","familycabs.be","https://www.linkedin.com/company/familycabs"
,"TIB RETAIL PRIVATE LIMITED","Hello, I'm under the water gulu gulu gulu.","School and Employee Bus Services","Self-employed","Self Employed","DELHI, Delhi","India",,"https://www.linkedin.com/company/tib-retail-private-limited"
