"Find companies","Name","Description","Primary Industry","Size","Type","Location","Country","Domain","LinkedIn URL"
,"Baruch Transportation","Baruch Transportation has been serving the Howard County community since 2006. It was the dream of Garfield, who had worked as a school bus driver for more than 10 years in both Baltimore and Howard counties. He has a unique wisdom as a contractor because he was a committed and conscientious driver that genuinely loved what he did. He started out with one bus for 5 years until he secured a second bus, where his wife, Dona, left her corporate job to help build the business. As the business was blessed and grew, the entire Clapperton family has joined in different capacities.

Our philosophy is our name, Baruch (pronounced buh-roook), which means “Bless” in Hebrew. We have been blessed and want to be a blessing to others, including our team, their families, and the community we serve.","School and Employee Bus Services","11-50 employees","Self Owned","Columbia, Maryland","United States","baruchtransportation.com","https://www.linkedin.com/company/baruch-transportation"
,"Santa Paulina Transporte e Turismo","Transporte de passageiros empresariais e escolares.","School and Employee Bus Services","11-50 employees","Privately Held","Bento Gonçalves, Rio Grande do Sul","Brazil",,"https://www.linkedin.com/company/santa-paulina-transporte-e-turismo"
,"Chester Elite Trans LLC","Leading transportation company with the capacity and commitment to deliver exceptional service to the families, community and education systems in the Commonwealth of Pennsylvania.","School and Employee Bus Services","11-50 employees","Privately Held",,,"chesterelitetrans.com","https://www.linkedin.com/company/chester-elite-trans-llc"
,"Omni University","Omni University is a digital university","School and Employee Bus Services","2-10 employees","Educational","Mbaise, Imo State","Nigeria",,"https://www.linkedin.com/company/college-of-sciences-and-arts-de-comrade-world"
,"Panda Ride","At Panda Ride, we're on a mission to revolutionize the daily lives of busy working parents, ensuring a smoother, stress-free experience for both you and your children.We understand the challenges that come with managing your little ones' transportation needs while juggling your own busy schedule. 

Have you ever found yourself torn between the demands of your workplace and your role as a parent, where ensuring your children's safe and timely drop-offs at school or after-school activities becomes your top priority? This scenario is all too familiar to many parents.

Our mission is simple: to provide comfort, safety, and reliability transportation. We specialize in planned kids' transportation, even to the tiniest members of your family. Our fleet includes cars and spacious 8+1 microtransits, each equipped with child car seats tailored to various age groups. Safety is paramount, and we make sure your children are securely and comfortably seated during their journey with Panda Ride. 

Did you know that up to 30% of vehicles during the morning rush hour are parents transporting their kids to school? We firmly believe that being a parent should not equate to being a personal driver. Panda Ride is here to give you the freedom to pursue your career and personal endeavors without ever compromising on the safety and well-being of your precious little ones.

Join us on our mission to redefine the way parents manage their children's transportation needs. Panda Ride is your trusted partner in delivering peace of mind and convenience, helping you find the perfect balance between work and family life. Let's make your mornings and afternoons a breeze!","School and Employee Bus Services","11-50 employees","Privately Held","Prague","Czechia","pandaride.cz","https://www.linkedin.com/company/panda-ridecz"
,"Costasur Bus, s.l.","Empresa dedicada al Transporte de Viajeros por Carretera. 
Autocares, Microbuses y servicio de VTC.","School and Employee Bus Services","11-50 employees","Privately Held","Comares, Malaga","Spain","autobusmalaga.es","https://www.linkedin.com/company/bautistapalomo"
,"VOYAGES CRESPEL","Bienvenue aux Voyages CRESPEL situés à Saint-Aubin-d'Aubigné près de Rennes, en Ille et Vilaine . L'entreprise a été créée en 1968 par Eugène Crespel, puis par Michel Crespel, suivi de Marc-Antoine Crespel, actuellement dirigeant. Notre activité se développe autour des voyages en France et à l'étranger, déplacements scolaires, touristiques et professionnels, le temps d'un séjour, d'un week-end ou d'une semaine. Nous sommes à votre disposition pour vous établir le devis. Nos autocars sont équipés en fonction de vos besoins.","School and Employee Bus Services","11-50 employees","Self Owned","Saint-Aubin-d’Aubigné, Brittany",,"crespel-voyages.fr","https://www.linkedin.com/company/voyages-crespel"
,"West Coast University Panama - WCU Panama","West Coast University (WCU) Panama is a Higher Professional and Research Organization incorporated in the Republic of Panama and Costa Rica Central America with International Coordination Offices in USA and Canada. As a Distant Learning Academic Solution Provider, WCU Panama is academic institution offering Professional & Vocational Trainings and Higher Education through various educational accreditation systems internationally. Through its affiliated Colleges/Centers, WCU Panama offers, teaches and confers Certificates, Diplomas, Associate Degrees, Bachelor Degrees, Master Degrees and Doctorate Degrees to candidates who successfully pursue and qualify for these Credentials/Awards. in Professional & Vocational disciplines WCU has been granted by International Accreditation bodies with full authority to grant Certificates, Diplomas, Associate Degrees, Bachelor Degrees, Master and Doctorate degrees as an Autonomous University.","School and Employee Bus Services","201-500 employees","Educational",,,"westcoastuniversityedu.com","https://www.linkedin.com/company/west-coast-university-panama-wcu-panama"
,"KWIS - Kids World International School","We offer English, Chinese and Khmer programs following UK-Singaporean curriculum.","School and Employee Bus Services","201-500 employees","Educational","Phniom Penh, Phnom Penh","Cambodia",,"https://www.linkedin.com/company/kwis-kids-world-international-school"
,"A Plus Bus USA corp","A Plus Bus is a safe, reliable and affordable school bus company solution to the transportation needs of private,  public and charter schools in Miami dade county","School and Employee Bus Services","2-10 employees","Privately Held","miami","United States","aplusbus.com","https://www.linkedin.com/company/a-plus-bus-usa-corp"
,"iDrive2GO Group B.V.","iDirve2GO Goupe B.V. bestaat uit verschillende rijscholen: iDrive2GO, Jouw-scooterrijbewijs.nl, slaag voor je theorie en scooter-theorie.be","School and Employee Bus Services","11-50 employees","Privately Held","Breda, North Brabant","Netherlands","idrive2go-theorie.nl","https://www.linkedin.com/company/idirve2go-group-b-v"
,"Shri Ram Global School Sector 70 Guruguram","We are set to raise & nurture relentless achievers of tomorrow by championing wisdom, values.","School and Employee Bus Services","11-50 employees","Educational","Gurugram, Haryana","India","srgschool.com","https://www.linkedin.com/company/shri-ram-global-school-sector-70-guruguram"
,"DAV Public School,PGC Biharsharif",,"School and Employee Bus Services","51-200 employees","Privately Held",,,,"https://www.linkedin.com/company/dav-public-school-pgc-biharsharif"
,"GLOBAL ACCESS TRAVEL CONSULT",,"School and Employee Bus Services","2-10 employees","Self Employed",,,,"https://www.linkedin.com/company/global-access-travel-consult"
,"RTY TRANSCO","RTY TRANSCO, vous offre un service de transport scolaire fiable et sécuritaire sur la Rive-Sud de Montréal, en mettant la santé et la sécurité des élèves au cœur de nos priorités. Grâce à une équipe engagée et un service client attentif, nous assurons des trajets ponctuels et adaptés aux besoins des familles. 
Notre mission: offrir une tranquillité d'esprit aux parents et garantir le bien-être des élèves, car votre trajet est notre mission. ","School and Employee Bus Services","11-50 employees","Partnership",,,,"https://www.linkedin.com/company/rty-transco"
,"SMA Santo Yakobus",,"School and Employee Bus Services","51-200 employees","Educational",,,,"https://www.linkedin.com/company/sma-santo-yakobus"
,"MAKOONS PLAY SCHOOL PATEL NAGAR GHAZIABAD","Preparing your li’l ones for a better future through play! Makoons believes in a nurturing, accepting and stimulating learning environment that encourages positive balance for kids. With immense learn and play methodology, our classroom training helps kids develop academic and social skills and boost self-confidence. Each teachable moment helps your child be socially acceptable and understand everything around them","School and Employee Bus Services","11-50 employees","Educational","Ghaziabad, Ghaziabad","Afghanistan","makoons.com","https://www.linkedin.com/company/makoons-play-school-patel-nagar-ghaziabad"
,"Mount Litera Zee School Motihari","Best CBSE Affiliated school In Motihari","School and Employee Bus Services","51-200 employees","Educational","Motihari","India","mlzsmotihari.com","https://www.linkedin.com/company/mlzsmotihari1"
,"Government M. M. College, Jessore","In 1942, during the Second World War, the Allies established a base at the college. At this time the college authorities removed the college to the kanchari house (now fire brigade office) of the zamindar of Hatbaria. And there the class begins. When the war ended in 1945, the college was brought back to its former location. At that time, the first name of the college was changed and the name of the best son of Jessore, the great poet Michael Madhusudan Dutt was changed to Government Michael Madhusudan College or M. M. College, in the name of Jessore.

The contribution of some people in the establishment of the college was especially memorable. They are Vijay Krishnaraya, Sri Neel Ratandhar, Vijay Roy, Khan Bahadur Lutfur, Ed. Abdur Rauf. B. Sarkar, Nagendranath Ghosh, Randa Prasad Saha and the teachers of the college at that time.

After the partition of the country in 1947, most of the Hindus left the country and the college faced a temporary crisis. But in a short time it was possible to overcome the crisis with the help of local enthusiastic people. At that time a new committee was formed to manage the college. They were able to run the college very successfully.

Abdur Rahim Joyaddar took over as the principal of the college in 1949 and made some improvements in the college. The B.Com. (Pass) course was introduced in the college in 1956. In 1956, the college was approved by the Rajshahi University for the honors class in the Department of Geography and Economics, Bangla with B.Sc. (Pass) course. Later in 1971 the history department was started. In 1959, Principal Md. Abdul Hai and Jessore District Magistrate, College Management Committee President M. Through the efforts of Ruhul Quddus, arrangements were made to establish the college on a large scale.","School and Employee Bus Services","201-500 employees","Educational","Jessore, Jessore Sadar","Bangladesh","mmcollege.edu.bd","https://www.linkedin.com/company/governmetn-m-m-college-jessore"
,"Freedom High School (South Riding)",,"School and Employee Bus Services","51-200 employees","Public Company",,,"lcps.org","https://www.linkedin.com/company/freedom-high-school-south-riding"
,"American Kidz",,"School and Employee Bus Services","11-50 employees","Educational",,,,"https://www.linkedin.com/company/american-kidz"
,"Edu Kids School Transport Service","Edu Kids School Transport Services provides safe and reliable transportation of kids to and from school

Contact us 0790055989/0712660586 if you need school transport services for your kids","School and Employee Bus Services","11-50 employees","Partnership","Nairobi , Nairobi","Kenya",,"https://www.linkedin.com/company/edukids-schooltransportservice"
,"National Academy of Statistics, Accounting and Audit","The Academy is a higher educational institution that belongs to the state statistics system of Ukraine.


The Academy trains highly qualified specialists for many state institutions and organizations, also Academy graduates are invited more and more often to work at different companies and organizations of the business sector.","School and Employee Bus Services","51-200 employees","Educational","Kyiv, Kyiv","Ukraine","nasoa.edu.ua","https://www.linkedin.com/company/national-academy-of-statistics-accounting-and-audit"
,"Panolympia S.A","Empowering journeys, one mile at a time. Since 1965, Panolympia has been a trusted leader in luxury coach transportation across Greece and beyond. With a modern fleet of 48 motor coaches, experienced drivers, and a steadfast commitment to safety and excellence, we deliver seamless travel experiences for corporate transfers, group tours, school transportation, and personalized journeys. Choose Panolympia for reliable, high-value transportation that transforms every trip into an exceptional experience.","School and Employee Bus Services","51-200 employees","Privately Held","Athens, Attica","Greece","panolympia.gr","https://www.linkedin.com/company/panolympia-s-a"
,"National American School","Private School in Zahleh, Lebanon.
Lebanese & American Systems.
Fostering creativity, critical thinking, and lifelong learning.  Since -2000-","School and Employee Bus Services","51-200 employees","Educational","zahle","Lebanon","naszahleh.school","https://www.linkedin.com/company/nationalamericanschool"
,"Taveiros Transvip",,"School and Employee Bus Services","2-10 employees","Privately Held",,,,"https://www.linkedin.com/company/taveiros-transvip"
,"KIBERone Bulgaria","KiberOne is an edtech company that provides information technology-based programming courses for children.","School and Employee Bus Services","11-50 employees","Public Company","varna",,"kiberone.eu","https://www.linkedin.com/company/kiberone-bulgaria"
,"BM Concept School",,"School and Employee Bus Services","11-50 employees","Educational",,,"bmcs.in","https://www.linkedin.com/company/bhagwan-mahavir-concept-school."
,"RH Bus Rental in Dubai - Minibus Rental","RH Bus Rental is a trusted staff transport services company in Dubai, headquartered in Dubai Investment Park (DIP), delivering reliable, cost-effective, and scalable transportation solutions for companies across the UAE.

We specialize in staff transport services in Dubai, monthly transport service Dubai, monthly van rental Dubai, and van rental with driver for corporate offices, factories, industrial facilities, construction projects, and business hubs. Our core strength lies in providing monthly staff transport contracts, employee shuttle services, and long-term van rental solutions, including monthly van rental Dubai without deposit and cheapest monthly van rental Dubai with professional drivers.

Our modern fleet includes Toyota Hiace vans, 7–15 seater vans, 20/22 seater Coasters, 30/35/50 seater luxury buses, and labour & construction transport buses, all operated by trained, uniformed, and experienced drivers. We focus on punctuality, safety, route optimization, and compliance to meet corporate and HR transportation standards.

RH Bus Rental proudly serves Dubai Investment Park (DIP), Jebel Ali, Al Quoz, Dubai South, Business Bay, DIFC, JLT, Dubai Marina, Sheikh Zayed Road, and all major Dubai commercial and industrial areas.

Whether you require company staff transport, van rental Dubai with driver, or monthly corporate transportation solutions, we deliver dependable service designed to reduce operational costs and improve workforce mobility.","School and Employee Bus Services","2-10 employees","Privately Held","Dubai, Dubai","United Arab Emirates","busrentalindubaiuae.com","https://www.linkedin.com/company/staff-transport-services-in-dubai"
,"MIAGE de Douala","RAS","School and Employee Bus Services","5,001-10,000 employees","Educational",,,,"https://www.linkedin.com/company/miage-de-douala"
,"SCHARF OHG OMNIBUS & REISEBURO","Seit der Gründung des privaten Familienunternehmens im Jahr 1930 durch Josef Scharf dreht sich bei den Scharfs alles rund ums Reisen und die Mobilität. Und das in ausnahmslos hoher Qualität und stets mit einem verlässlich guten Service.
Denn nicht nur die Leidenschaft zur Mobilität ist eine liebgewonnene Tradition in der Familie und im Verkehrsunternehmen Scharf. Auch die gelebte Verantwortung für eine stets hervorragende Dienstleistung ist bezeichnend für den Namen Scharf – und das bereits in dritter Generation, weit über die Grenzen des Landkreises Erding hinaus – in ganz Oberbayern….

https://scharf-reisen.de/reisebuero-erding/","School and Employee Bus Services","51-200 employees","Partnership","Fraunberg, Bavaria","Germany","scharf-reisen.com","https://www.linkedin.com/company/scharf-ohg-omnibus-&-reiseburo"
,"Visakha School","26  Years of  Excellence 
In mentoring Preschoolers to High Schoolers","School and Employee Bus Services","2-10 employees","Educational","vizag, ap","India","visakhaschool.com","https://www.linkedin.com/company/visakha-school"
,"Shishya Global School","Shishya Global School is committed to its great motto of imparting the best education and giving an","School and Employee Bus Services","201-500 employees","Educational","Rajasthan","India","justdial.com","https://www.linkedin.com/company/shishya-global-school"
,"Erny Memorial Senior Secondary School","The school comes with an uncompromising commitment. It aims to achieve specific, measurable, observable and quantifiable results among all aspirants/students. Because the School has a vision to provide value based education to young minds and provide a dynamic learning environment.
However, the School aegis for every student which strives for excellence through active learning and education. Moreover, the School has the core committed faculty which has come from accomplished backgrounds with vast experience.","School and Employee Bus Services","11-50 employees","Educational","Prayagraj, Uttar Pradesh","India",,"https://www.linkedin.com/company/erny-memorial-senior-secondary-school"
,"Salesforce Admin Group, Ghaziabad, India",,"School and Employee Bus Services","2-10 employees","Educational",,,,"https://www.linkedin.com/company/salesforce-admin-group-ghaziabad-india"
,"RideLanka App","RideLanka is an innovative mobile application designed to revolutionize school and staff transportation in Sri Lanka. Our platform ensures safety and convenience with features like real-time vehicle tracking, nearby service discovery, online payments, and automated attendance systems. With RideLanka, parents can stay informed, staff can find reliable transport, and drivers can manage their services efficiently. Join us in transforming the way we commute!","School and Employee Bus Services","2-10 employees","Partnership",,,,"https://www.linkedin.com/company/ridelanka-app"
,"GoBus Costa Rica","At GoBus, we empower parents with peace of mind through real-time GPS tracking of their child's school bus.  With instant notifications and live updates, parents can effortlessly monitor their child's journey to and from school, ensuring safety and security every step of the way.

Launched at the Founder Institute.","School and Employee Bus Services","2-10 employees","Privately Held","San José","United States","gobus.cr","https://www.linkedin.com/company/gobus-costa-rica"
,"RODIALL Transportes","Soluciones en transporte con más de 30 años de experiencia, excelencia operativa y enfoque en el cliente.","School and Employee Bus Services","11-50 employees","Privately Held","Santa Rosa de Santo Domingo, Heredia","Costa Rica",,"https://www.linkedin.com/company/rodiall-transportes"
,"Ross Bus Sales, LLC.","ROSS BUS SALES LLC, is a 3rd generation, family-owned business that focuses on developing lifelong customer relationships. Our valued customers can not only expect a reliable and safe product, but also, a dedicated partner and trusted advisor who is vested in their long-term success.","School and Employee Bus Services","11-50 employees","Privately Held","Alexandria, Louisiana","United States","rossbus.com","https://www.linkedin.com/company/ross-bus-sales1"
,"Grand Mount International School/GMIS",,"School and Employee Bus Services","201-500 employees","Educational","Phnom Penh, Cambodia","Cambodia","gmis.edu.kh","https://www.linkedin.com/company/grand-mount-international-school-gmis"
,"Viação Lucas",,"School and Employee Bus Services","51-200 employees","Privately Held",,,"viacaolucas.com.br","https://www.linkedin.com/company/viação-lucas-fretamento"
,"Transporte Responsável Escolar Móvel","Que bom ter você por aqui! 

Somos uma startup que está desenvolvendo um aplicativo chamado Trem (Transporte Responsável Escolar Móvel), que tem como objetivo conectar motoristas de transporte escolar com pessoas que utilizam esse meio de transporte.

Ao entrar no aplicativo, você como usuário poderá pesquisar por vans na sua localidade, conversar diretamente com o motorista e ver a localização em tempo real da sua van.

Para os motoristas, o aplicativo fornece a melhor rota para o dia, possibilidade de novos clientes de forma prática e gestão otimizada do seu transporte, clientes e do seu veículo.

Caso queira saber mais informações sobre ou ser um possível parceiro/investidor, entre em contato conosco pelo chat do LinkedIn, email ou Instagram. 

Acesse nosso link e venha ser Trem com a gente! ","School and Employee Bus Services","2-10 employees","Privately Held","Belo Horizonte, MG","Brazil",,"https://www.linkedin.com/company/transporte-responsável-escolar-móvel"
,"NPS West","National Public School WEST - Vishweshwaraiah Layout is the latest addition to the family of NPS Group of Institutions, a co-educational school,coming soon under the guidance of Dr. K. P. Gopalkrishna, Chairman of NPS Group of Institutions, a colossus in education, following the glorious lineage of the elite NPS Group's institutions. Situated in the heart of the residential area of West Bangalore accessible to Sir.M.V. Layout, Nagarabhavi, Annapurneshwarinagar, Magadi road etc, on a wide accessible road, the campus is coming up fast and will start operation from the Academic year 2023-24.

This latest addition to the NPS family, NPS WEST at Kuvempu Road, joins the vibrant, thriving and diverse community of lifelong learners which distinguishes us from the other schools.The school will follow CBSE compliant syllabus.The school is coming up in a modern campus comprising of a well ventilated, spacious class rooms with state-of-the-art facilities. Will have separate designated facilities for computers, art, dance, music and yoga, a spacious conference hall and an Auditorium, sports & other facilities.

We at NPS WEST,believe that every child is a winner and are committed to the wholistic development of every student in a safe, caring, happy& a nurturing environment, providing opportunities for every child to develop their skills, develop reasoning, assimilate information and gain knowledge & wisdom, there by succeed in every walk of life and develop into responsible and happy individuals. The time tested, ever adapting, wide variety of programmes& activities woven around the needs of a student,mastered over the years by the NPS heritagemakes it possible.","School and Employee Bus Services","51-200 employees","Educational","Bangalore, karnataka","India","npswest.com","https://www.linkedin.com/company/npswest"
,"연세대학교 문헌정보학과 Library and Information Science","연세대학교 문헌정보학과 공식 링크드인 페이지입니다. 연세대학교 문헌정보학과는 1957년 3월, 대한민국 최초의 도서관학과로 설립되었으며, 1990년 3월 ‘문헌정보학과’로 명칭을 개칭하여 정보화 시대를 선도하는 학문으로 자리 잡았습니다. 현재 교육부 4단계 BK21+ 사업과 대학도서관발전연구소를 운영하며, 학문적 우수성과 실천적 기여를 통해 문헌정보학의 새로운 기준을 제시하고 있습니다.

특히, 2024년 QS 학문분야별 세계대학순위에서 Library and Information Science 분야 26위를 기록하며, 연세대학교 내에서 3위를 달성하는 쾌거를 이루었습니다. 이는 문헌정보학 연구와 교육의 글로벌 경쟁력을 입증한 결과입니다.

우리 학과는 정보학 중심의 커리큘럼을 통해 인간, 정보자원, 정보기술의 융합적인 상호작용을 이해하고, 이를 기반으로 지식정보 문제를 해결할 수 있는 전문정보인력을 양성하는 데 주력하고 있습니다. 정보의 수집, 조직, 검색, 활용, 전송 등 정보 커뮤니케이션 전반에 대한 심도 있는 연구와 최신 트렌드를 반영한 실무 교육을 통해 혁신적인 정보 전문가를 배출합니다.","School and Employee Bus Services","201-500 employees","Educational","Seoul, 서울 — Seoul","South Korea","yonsei.ac.kr","https://www.linkedin.com/company/연세대학교-문헌정보학과"
,"Torres & Dinis Transporte e Locação","Torres & Dinis Transporte e Locação is a translation and localization company based out of Rod. Eng. Renê Benedito Da Silva, 1100, Itapevi, Sp, Brazil.","School and Employee Bus Services","51-200 employees","Privately Held","Itapevi, Sp","Brazil","torresdinistransporte.com","https://www.linkedin.com/company/torresedinistransporte"
