"Find companies","Name","Description","Primary Industry","Size","Type","Location","Country","Domain","LinkedIn URL"
,"Consórcio Giz e Lápis","O Consórcio Giz & Lápis formado pelas concessionárias Transportes Capellini Ltda. e Santa Cecília Turismo Ltda. (Sancetur), presta serviços diários para mais de 13 mil estudantes. A frota é composta por 247 veículos, dos quais 219 ônibus e 28 microônibus, dotados de ar-condicionado e muita tecnologia embarcada. A frota operacional tem 230 veículos, a maioria zero-quilômetro.

Todos os dias, são realizadas mais de 1.000 viagens para 80 estabelecimentos de ensino municipais e estaduais, creches e unidades de ensino técnico-profissionalizante do Serviço Nacional da Indústria (Senai).

MEIO AMBIENTE X TECNOLOGIA = CONFORTO

O Giz & Lápis mantém em sua frota veículos seguros e menos poluentes. Boa parte da frota está equipada com motores dotados de tecnologia Euro 6 e em conformidade com a legislação ambiental vigente no Brasil.

Todos os veículos contam com validadores embarcados, para controlar o embarque e desembarque dos alunos. É uma solução inovadora para o transporte escolar de Paulínia. 

Com o validador embarcado, não há necessidade de barreiras físicas como, por exemplo, a catraca. Um diferencial que permite aos estudantes terem acesso mais fácil aos veículos. E, quando estão no interior, também garante mais segurança na locomoção com materiais escolares e mochilas.

Além disso, todos os veículos possuem câmeras de monitoramento por vídeo, que captam e registram as imagens em tempo real durante o transporte em todas as viagens.","School and Employee Bus Services","201-500 employees","Privately Held",,,"consorciogizelapis.com.br","https://www.linkedin.com/company/consórcio-giz-e-lápis"
,"Maryland School Bus Contractors Association",,"School and Employee Bus Services","Self-employed","Non Profit","Annapolis, Maryland","United States","mdschoolbus.org","https://www.linkedin.com/company/maryland-school-bus-contractors-association"
,"STSCO",,"School and Employee Bus Services","11-50 employees","Public Company",,,"stsco.ca","https://www.linkedin.com/company/stsco"
,"Shree OBEROI GURUKULA INTERNATIONAL SCHOOL","WELCOME TO श्री Oberoi Gurukula International School’s ( श्री OGIS) programs are centered on the premises of instilling a life-long love of learning in every student and nurturing within every child a sense of self-esteem, personal integrity, and a respectful, caring attitude towards others.

We believe that each of our students is a unique individual with equal potential to make a positive contribution to our school and society.","School and Employee Bus Services","11-50 employees","Educational","Alambagiri, Karnataka","India","ogischool.org.in","https://www.linkedin.com/company/ogischool"
,".beKidZ","We provide an outstanding, Christ-centered learning environment for ages 3-12 years of age. We offer Preschool, Latchkey, Tutoring, and Summer Kamp.  (Drop-ins are always welcome)","School and Employee Bus Services","11-50 employees","Privately Held","Edmond, Oklahoma","United States","bekidz.org","https://www.linkedin.com/company/bekidz"
,"Lamb's International Christian School","Lamb International Christian School is a Christ-centered institution dedicated to fostering excellence in education, character development, and spiritual growth. Our mission is to empower students to reach their full potential through the Accelerated Christian Education (ACE) curriculum, an individualized and self-paced program tailored to meet the unique needs of each learner. We are deeply committed to instilling strong Christian values, nurturing moral integrity, and preparing students to excel academically while becoming compassionate and responsible leaders in their communities. Our experienced and dedicated educators provide a supportive environment where students are encouraged to thrive, not only in academics but also in their faith. We believe in shaping the whole child—mind, body, and spirit—by integrating biblical principles into every aspect of learning. At Lamb International Christian School, we celebrate diversity and aim to inspire global citizenship, equipping our students to make a positive impact in a rapidly changing world. We are more than a school; we are a community where faith and learning come together to build a foundation for lifelong success.","School and Employee Bus Services","201-500 employees","Educational",,,"thelambsinternationalchristianschool.com","https://www.linkedin.com/company/lamb-s-international-christian-school"
,"Unique Travels","Incorporated in 2012, Unique Travels is a leading B2B Transportation company 
based in Uttarakhand. With a specialization in premium transport solutions for Institutions and Corporate Organizations, we have established ourselves as a trusted provider in the industry.","School and Employee Bus Services","11-50 employees","Self Owned","Rudrapur, Uttarakhand","India","uniquetravels.co.in","https://www.linkedin.com/company/uniquetravels"
,"Sunset Montessori Community","Sunset Montessori Community Las Vegas offers a nurturing Montessori education from infancy through 3rd grade, with Spanish immersion, before & after school care, and engaging break & summer camps. Our certified teachers and small class sizes empower each child to reach their full potential in a vibrant and enriching environment. Visit us and experience the magic of Montessori!","School and Employee Bus Services","2-10 employees","Educational","Las Vegas, Nevada","United States","sunsetmontessoricommunity.com","https://www.linkedin.com/company/sunset-montessori"
,"New Hope Academy Mlolongo","New Hope Academy is a Christian School that combines the CBC system and the British curriculum, offering students a comprehensive and values-based education","School and Employee Bus Services","11-50 employees","Privately Held","Machakos, Eastern Province","Kenya","thenewhopeacademy.co.ke","https://www.linkedin.com/company/new-hope-academy-mlolongo"
,"Ο Ανεμόμυλος","Βρεφονηπιακός Σταθμός - Νηπιαγωγείο","School and Employee Bus Services","11-50 employees","Privately Held","Korydallos, Attiki","Greece","oanemomulos.gr","https://www.linkedin.com/company/oanemomulos"
,"Kocabay Tur","Polatlı ve Malıköy Organize Sanayi Bölgeleri içerisinde bulunan fabrikalarınızın personel taşımacılık hizmeti için yeni ve konforlu araçlarımızla hizmetinizdeyiz.","School and Employee Bus Services","11-50 employees","Self Owned","Polatli, Ankara","Turkey","kocabaytur.com.tr","https://www.linkedin.com/company/kocabay-tur"
,"SMPN 199 Jakarta Timur",,"School and Employee Bus Services","501-1,000 employees","Educational",,,,"https://www.linkedin.com/company/smpn-199-jakarta-timur"
,"Ryan International Academy Kanakapura Road","At Ryan International Academy, we proudly offer a holistic learning experience to our students by engaging them in different scholastic and co-scholastic activities. Our inspiring educators use innovative learning pedagogy in a safe and healthy environment to enable our learners to become critical thinkers and compassionate leaders.

We have designed numerous academic programmes and initiatives to positively impact the learning environment of our students and enhance their 21st-century skills. Strong values, the right attitude, respect for traditions, and mastery of skills are the key attributes that we nurture in our students to help them be future-ready and resourcefully tackle the challenges that lie ahead","School and Employee Bus Services","51-200 employees","Educational",,,"ryangroup.org","https://www.linkedin.com/company/ryan-international-academy-kanakapura-road"
,"Nastuptesi.cz","Cestujeme s úsměvem. Vydáme se s vámi za dobrodružstvím a proměníme i obyčejnou jízdu v nezapomenutelný zážitek.","School and Employee Bus Services","2-10 employees","Privately Held","Ostrava, Česká Republika","Czechia","nastuptesi.cz","https://www.linkedin.com/company/nastuptesi-cz"
,"Tri-Board Student Transportation Services","Tri-Board is the student transportation consortium serving the Algonquin and Lakeshore Catholic District School Board, Hastings and Prince Edward District School Board, and the Limestone District School Board","School and Employee Bus Services","11-50 employees","Public Company","Napanee, Ontario","Canada","triboard.ca","https://www.linkedin.com/company/triboardsts"
,"Lagishetty Travels","Lagishetty Travels is one of the top Transport Service Provider in Mumbai. With a Fleet of over 100 vehicles and over 12 years of experience, Lagishetty Travels is one of the most preferred travel based organization by Corporates, BPO’s, IT companies and Private entities for Leisure Travel.","School and Employee Bus Services","51-200 employees","Privately Held","Mumbai  , Maharashtra","India","lagishettytravels.co.in","https://www.linkedin.com/company/lagishetty-travels"
,"Flambeau Forever Foundation","Our mission is to connect our community and Flambeau students by enriching educational experiences through academics, activities, and athletics.","School and Employee Bus Services","Self-employed","Educational","Tony, WI","United States","flambeauforever.org","https://www.linkedin.com/company/flambeau-forever-foundation"
,"CCB Buses",,"School and Employee Bus Services","2-10 employees","Partnership",,,,"https://www.linkedin.com/company/ccb-buses"
,"The Royal International Grammar school",,"School and Employee Bus Services","11-50 employees","Educational",,,,"https://www.linkedin.com/company/the-royal-international-grammar-school"
,"Xecutive Shuttle And Transportation",,"School and Employee Bus Services","2-10 employees","Public Company",,,"xecutiveshuttleandtransport.com","https://www.linkedin.com/company/xecutive-shuttle-and-transportation"
,"Cityvia",,"School and Employee Bus Services","2-10 employees","Partnership",,,,"https://www.linkedin.com/company/cityvia"
,"A.C. EVANGELOU COACHES",,"School and Employee Bus Services","2-10 employees","Public Company",,,"coaches.cy","https://www.linkedin.com/company/a-c-evangelou-coaches"
,"Volunteer Service Club","A student-led organization focused on community service, leadership development, and teamwork. Members participate in school and local events, support community needs, and build skills through coordinated volunteer projects.","School and Employee Bus Services","2-10 employees","Educational","Raleigh","United States",,"https://www.linkedin.com/company/ls-investing"
,"Bangla school","School is the best thing of life","School and Employee Bus Services","501-1,000 employees","Public Company","Dhaka","Bangladesh","sinthializa.com","https://www.linkedin.com/company/banglaschool.com"
,"SUBJETIVA RESILIENCIA EDUCAÇÃO & SAÚDE"," Direção Defensiva: Capacite-se para uma condução segura e defensiva, reduzindo riscos e promovendo um trânsito mais seguro. Certificado reconhecido para aprimorar suas habilidades.

 Atendimento ao Cliente: Aprenda a transformar o atendimento em um diferencial competitivo, proporcionando experiências excepcionais aos seus clientes. Certificado válido, com reconhecimento no setor.

 Reciclagem de CNH Suspensa: Mantenha-se atualizado com as regulamentações, evitando penalidades e garantindo a conformidade legal. Certificado oficial para comprovar sua reciclagem.

 Cursos MOOP (Movimentação Operacional de Produtos): Aperfeiçoe suas práticas de movimentação de carga para melhorar a eficiência e a segurança nos processos logísticos. Certificado reconhecido para impulsionar sua carreira.","School and Employee Bus Services","Self-employed","Self Employed",,,,"https://www.linkedin.com/company/subjetivaresilienciaeducacaoesaude"
,"YÜKSEL DİZAYN OTOMOTİV","1994’ten bugüne otomotiv sektöründe edindiğimiz 30 yıllı aşkın deneyimle, sektörde güvenin simgesiyiz. Bugün, hafif ticari araç dönüşümünde öncü bir marka olarak, Lüleburgaz’da kurduğumuz toplamda 9000 m²’lik modern tesisimizle sektöre yenilikçi çözümler sunmaya devam ediyoruz.

    30 yılı aşkın tecrübemizle hafif ticari araç üst yapı dönüşümünde uzmanlaşarak, sektörde güvenilir bir isim haline geldik. Türkiye’nin önde gelen otomotiv tasarım ve üretim merkezlerinden biri olma hedefiyle, sürekli olarak kendimizi geliştiriyor ve yenilikçi çözümler sunuyoruz.","School and Employee Bus Services","11-50 employees","Privately Held","Lüleburgaz, Kırklareli","Turkey","yukseldizayn.com.tr","https://www.linkedin.com/company/yüksel-di̇zayn-otomoti̇v"
,"Paradise Children Academy & Model College Sarozai",,"School and Employee Bus Services","501-1,000 employees","Educational",,,,"https://www.linkedin.com/company/paradise-children-academy-model-college-sarozai"
,"Cambridge Pre School",,"School and Employee Bus Services","51-200 employees","Privately Held",,,,"https://www.linkedin.com/company/cambridge-pre-school"
,"CITP",,"School and Employee Bus Services","11-50 employees","Partnership",,,"citp.ma","https://www.linkedin.com/company/citpmedicalschool"
,"global sceince school","global science school is  a school  of science and  arts , these location  of gujranwala   city.   these school have two branches. best school of area.","School and Employee Bus Services","11-50 employees","Educational","gujranwala, punjab","Pakistan",,"https://www.linkedin.com/company/global-sceince-school"
,"Toshihiko Hanai, PhD","Quantitative in silico analytical chemistry
1. Quantitative in silico analytical chemistry, Quantitative analysis of molecular interactions from chromatography retention and enzyme selectivity, March 2024, pp.327, 43.5MB 

Recent online communications: Covid-19 transmissibility and designing the binding inhibitors/Biomarkers and medicines
2024-0614 Visualization XXV Biomarker for Kidney disease 3 Creatine Kinase
2024-0604 Visualization XXIV Biomarker for Kidney Disease 2 Guanidino acetic acid N-methyltransferase
2024-0529 Visualization XXIII Biomarker for Kidney Disease 1, Glycine amidinotransferase
2024-0520 Visualization XXII JN.1 S-RBD and ACE-2 interaction inhibitors
2024-0510 Visualization XXI Enantiomers the wonderland
2024-0503 Visualization XX Glycosylation Effective Derivatization	
2024-0430 Visualization XIX Quantitative analysis of enzyme selectivity
2024-0420 Visualization XVIII Possible RNA medicine candidates for kidney disease patients
2024-0404 Visualization XVII Selectivity of inhibitors against variants Delta, BA.2.86, and JN.1
2024-0326 Visualization XVI Quick search for advanced medicines
2024-0320 Visualization XV Advanced medicine, Small or Large molecules?
2024-0305 Visualization XIV Auto-dock is a part of AI. 
2024-0222 Visualization XIII Chemical structure of binding inhibitors 2, Contribution of glycoside
2024-0216 Visualization XII Chemical structure and binding Inhibition 1

COVID-19 related reports
1. 	T. Hanai, Natural polyphenols as inhibitors for the binding of COVID-19 S-RBD with ACE-2, Journal of Human Health Research 2024, 2(1):9-16. https:// doi.org/10.14302/issn.2576-9383.jhhr-24- 4960 
2. 	Aspirin, the feasibility as a binding inhibitor, Med. Discoveries, 2 (2023), 1019. 
3. 	Further quantitative in silico analysis of SARS-CoV-2 S-RBD Omicron BA.4, BA.5, BA.2.75, BQ.1, and BQ.1.1 transmissibility, Talanta, 254 (2023).124127 
Edited 14 books, including 8 English books and 226 scientific publications","School and Employee Bus Services","Self-employed","Educational","YOKOHAMA NAKAKU, kanagawaken","Japan","hanai-toshihiko.net","https://www.linkedin.com/company/quantitative-in-silico-analytical-chemistry"
,"SMPN5",,"School and Employee Bus Services","51-200 employees","Educational",,,,"https://www.linkedin.com/company/smpn5"
,"Manil Pathways","Manil Pathways is a professionally managed transport services company dedicated to delivering safe, timely, and comfortable travel experiences. With a modern fleet of well-maintained buses and a team of experienced drivers, we provide dependable transport solutions for schools and corporate clients.","School and Employee Bus Services","201-500 employees","Partnership","Chhatrapati Sambhajinagar, Maharashtra","India","manilpathways.com","https://www.linkedin.com/company/manil-pathwats"
,"Incandescent Transportation Solutions",,"School and Employee Bus Services","51-200 employees","Privately Held",,,"incandescentts.com","https://www.linkedin.com/company/incandescent-transportation-solutions"
,"V M DE GOIS HORVAT TRANSPORTE ESCOLAR",,"School and Employee Bus Services","2-10 employees","Privately Held",,,,"https://www.linkedin.com/company/v-m-de-gois-horvat-transporte-escolar"
,"GP","Engels","School and Employee Bus Services","Self-employed","Educational","Enschede","Netherlands",,"https://www.linkedin.com/company/gplusp"
,"Stocker Bus Company, Inc.","Stocker Bus Company, a family owned and operated business, has been servicing Northern NJ for over fifty years. Charles W. Stocker, it’s founder started as a substitute driver for a local school bus company, Struble’s Bus Company. He started Stocker Bus Company in 1970 with one bus and one driver servicing the local school district. He then purchased Struble’s Bus Company and proceeded to grow the company. Once Kittatinny and McKeown were established, he had found his identity in the school bus industry and purchased other companies. During his tenure, his wife, three daughters and son in law were employed at the company, but in 1988, he suffered a massive stroke and his youngest daughter and her husband were left to manage the business.

Denise purchased it from her father in 1991. At that time, there were 45 vehicles servicing six local school districts in Sussex and Warren Counties. Currently, the company has 64 vehicles servicing thirteen school districts in Sussex, Warren and Morris Counties.

She was a member, served as secretary, and served as president, of the Sussex County Contractors Association, was a trustee of the New Jersey School Bus Owners Association, and is a member of the New Jersey School Bus Contractors Association.

Denise and her office staff have taken the School Transportation Supervisors Program and received certification.

Stocker Bus Company has provided safe and courteous transportation for the entire community including, schools, churches, camps, non profit organizations and private groups for over fifty years and four generations.

Denise’s son, granddaughter and grandson in law are currently employed with the company with the direction to move the business forward.","School and Employee Bus Services","51-200 employees","Privately Held","Newton, New Jersey","United States","stockerbus.com","https://www.linkedin.com/company/stocker-bus-company-inc"
,"Uganda Dream Nursery and Primary School","We are an all-volunteer Pre-K and Primary School in Uganda. Originally established for AIDS orphans and the children of prisoners in Uganda, the school now serves over 300 needy children in the Kasenge area, providing meals and housing in addition to education.","School and Employee Bus Services","Self-employed","Educational","Kasenge, Kampala","Uganda","ugandadreamschool.org","https://www.linkedin.com/company/uganda-dream-nursery-and-primary-school"
,"Autocares Miguel Ferragud SL",,"School and Employee Bus Services","2-10 employees","Privately Held",,,"autocaresferragud.es","https://www.linkedin.com/company/autocaresferragud"
,"Autobus Prestige inc.",,"School and Employee Bus Services","2-10 employees","Partnership",,,"autobusprestige.ca","https://www.linkedin.com/company/autobus-prestige-inc"
,"SMPS IT Mutiara Duri",,"School and Employee Bus Services","5,001-10,000 employees","Educational",,,"smpitmutiara.sch.id","https://www.linkedin.com/company/smps-it-mutiara-duri"
,"ATARIM TOURS LTD","חברה מנוסה וותיקה המספקת שירותי הסעות עובדים - טיולי אתרים. 
אנחנו מתמחים בכל הקשור למתן שירותי הסעות לעובדים. מאחורינו ניסיון עשיר ורב שנים בהסעת עובדים בכל רחבי בארץ וזאת לצרכים שוטפים וצרכים מיוחדים של חברות, ארגונים, מוסדות, רשויות מקומיות, רשתות, בתי מלון, חברות הייטק ומפעלים מתחומי עיסוק שונים.
הסעות לעובדים ברכבים בטוחים ואמינים
לרשות לקוחותינו עומד צי רכבים חדיש ומאובזר המתאים בגודל ובאיבזור שלו לכל קנה מידה של חברה הצריכה הסעה לעובדים שלה באופן שוטף, החל ב - 10 מקומות ישיבה לרכב ועד 60 מקומות. 

ברכבים מטפל מערך אחזקה שוטף לאור תקני בטיחות ישראליים ובינלאומיים, לרבות תקן בטיחות ISO 9301 ותקן איכות ISO 9001. על הנושא מפקחים שני קציני בטיחות תעבורה מטעמנו אשר מונו על ידי אגף איגוד קציני בטיחות. כמו כן, אנו מעסיקים נהגים אחראיים, מנוסים וזהירים העוברים ימי השתלמות ורענון שוטפים בנושאי בטיחות, תקנות ודרישות חוק עדכניות.

הסעות עובדים לאירועי חברה, טיולי גיבוש של יום או יומיים בארץ של חברות בארץ - אם אתם חברה גדולה שמעסיקה מספר עובדים גדול בין 100 ל 200 עובדים הפתרון הנכון, המתאים והמומלץ ביותר עבורכם הוא להשתמש בשירותי הסעות. להציע לעובדים שלכם שירותי הסעה באוטובוסים או מיניבוסים  (תלוי במספר העובדים שלכם)  שיאספו אותם ממקום העבודה ויחזירו אותם למקום העבודה או הביתה.","School and Employee Bus Services","51-200 employees","Public Company","פתח תקווה, IL","Israel","tiuleatarim.co.il","https://www.linkedin.com/company/atarim-tours-ltd"
,"Az-Al Turizm","1990 yılında bireysel olarak yapmaya başladığımız öğrenci taşımacılığı işini 1996 yılında AZ-AL TURİZM adı ile kurumsallaştırdık.
Her geçen gün kaliteli ve güvenli taşımacılığın adresi olarak adını duyuran firmamız ”Geleceği Taşıyoruz…” sloganımız ile bütünleşti. O yıllarda sadece öğrenci taşımacılığı yaparken 1999 yılından itibaren kapsamını genişletmiş; servis sektöründe personel ve turizm taşımacılığında da faaliyet göstermeye başlamıştır. Kuruluş tarihinden itibaren sektörde, genç ve dinamik yapısı ile adından birçok yerde söz ettiren, servis taşımacılığı alanında her geçen gün yenilenen ve büyüyen araç filosuyla yıllardır sizlere ve sevdiklerinize hizmet vermekteyiz.
Bize emanet edilen geleceğin bilgeleri olan çocuklarımıza AZ-AL Turizmin kaliteli ve güvenli taşımacılığı ile hizmet vermeyi bir yaşam felsefesi olarak benimseyip, memnuniyetinizi kendimize amaç edinmiş bulunmaktayız.
Kaliteli ve güvenli taşıma modeli ile daha uzun yıllar sizlere hizmet vermek dileğiyle…","School and Employee Bus Services","201-500 employees","Privately Held","İstanbul, Kağıthane","Turkey","az-altur.com.tr","https://www.linkedin.com/company/az-alturizm"
,"shohada highschool","مدرسه شهدا در منطقه 5 تهران در اکباتان واقع شده است و این هنرستان غیردولتی میباشد.","School and Employee Bus Services","51-200 employees","Educational",,,"honarestanshohada.com","https://www.linkedin.com/company/shohada-highschool"
,"TRANSPAULINENSE","Transporte Executivo e Corporativo","School and Employee Bus Services","Self-employed","Partnership",,,"transpaulinense.com","https://www.linkedin.com/company/transpaulinense"
,"Kander-Reisen","Ihr Bus , Car und Taxi Dienst in der Region Kandertal.","School and Employee Bus Services","2-10 employees","Self Employed","Frutigen","Switzerland","kander-reisen.ch","https://www.linkedin.com/company/kander-reisen"
,"Immanuel arasar group of institutions",,"School and Employee Bus Services","51-200 employees","Educational",,,"immanuelaraar.org","https://www.linkedin.com/company/immanuelarasargroup"
,"GUPTA TRANSPORT","We work both as a school transporter and travel agent. We are in this profession since 2014. We can proudly say we have grown our client-base because of our services.  We are available 24*7.","School and Employee Bus Services","11-50 employees","Self Employed","BAREILLY, UTTAR PRADESH","India",,"https://www.linkedin.com/company/gupta-transport-9808"
,"Société de Transport des Savanes STS",,"School and Employee Bus Services","11-50 employees","Privately Held",,,,"https://www.linkedin.com/company/société-de-transport-des-savanes-sts"
,"Vikingston Minibus Hire Ltd",,"School and Employee Bus Services","11-50 employees","Public Company",,,"vikingston.co.uk","https://www.linkedin.com/company/vikingston-minibus-hire-ltd"
,"SpotMyBus","Please refer to our website for additional information.","School and Employee Bus Services","2-10 employees","Privately Held","Virginia Beach, Virginia","United States","spotmybus.com","https://www.linkedin.com/company/spotmybus"
,"Bryggens Trafik","Køreskole på Islands Brygge","School and Employee Bus Services","2-10 employees","Self Employed","Copenhagen, Capital Region of Denmark","Denmark","bryggenstrafik.dk","https://www.linkedin.com/company/bryggens-trafik"
