"Find companies","Name","Description","Primary Industry","Size","Type","Location","Country","Domain","LinkedIn URL"
,"UKUR SEPAKAT","UKUR SEPAKAT is a Licensed Land Surveyor Firm fully owned by a Bumiputera. This firm is registered with The Land Surveyors Board in Peninsular Malaysia on the 1st December 2003 and with the Companies Commission of Malaysia on the 19th of September 2016 in order to provide consultation and expertise in the field of land development, ground control points, cadastral and strata digital, engineering survey, hydrography and topography survey, application of GIS and Utility Mapping that used the concept of Geographic Information System (GIS) towards government agencies, private companies and individuals. The firm is also registered with the Ministry of Finance, and the registration number is 465-020003209.

As a professional licensed land surveyor firm, our staffs are highly competent with a wide range of experiences in this field of work. Our surveyors, field surveyors and technical staff are well-trained in accord with their areas of expertise. Apart from that, Ukur Sepakat has acquired advanced and complete equipment that can be used in executing all the job scopes mentioned above.

Based on experiences gained by our principal in the public sector for more than 24 years, along with the commitment given by both the Management and Staff, we strongly believe that our firm is capable of providing the best consultancy services with better quality to our clients.","Subdivision of Land","11-50 employees","Self Owned","SEREMBAN, NEGERI SEMBILAN","Malaysia",,"https://www.linkedin.com/company/ukur-sepakat"
,"Exact Landmeters","Exact Landmeters is een dynamisch landmeterskantoor gespecialiseerd in opmetingen, verkavelingen, maatvoering en prekadastratie van basisaktes. Onze professionele en persoonlijke aanpak is volledig afgestemd op de behoeften van elke klant.
Bij Exact Landmeters kunt u rekenen op betrouwbaarheid, precisie en een totaalpakket aan landmeetkundige diensten. Wij ondersteunen klanten in de provincie Antwerpen met nauwkeurige en efficiënte oplossingen.","Subdivision of Land","Self-employed","Self Employed",,,"exactlandmeters.be","https://www.linkedin.com/company/exact-landmeters"
,"Terra Foundry Partners LLC","For more than 10 years, Terra Foundry Partners' Principals have been developing exclusive investment opportunities in real estate. Their expertise lies in assisting with land acquisition, entitlement, and growth directives. Utilizing extensive research, experience-based analysis, and innovative problem-solving skills, they create profitable solutions that go beyond traditional methods and deliver the most favorable outcomes for their partners.","Subdivision of Land","2-10 employees","Privately Held","Norfolk, VA","United States","terrafoundrypartners.com","https://www.linkedin.com/company/terra-foundry-partners-llc"
,"3J WDG","Notre entreprise a comme activité : la Rénovation, la VEFA, l'aménagement de lotissements de terrains à bâtir ainsi que des commerces et bureaux.","Subdivision of Land","2-10 employees","Privately Held","Champagne-sur-Oise, Île-de-France","France","3j-wdg.com","https://www.linkedin.com/company/3j-wdg"
,"Ecorouge Estates","Ecological Residential Real Estate Development","Subdivision of Land","2-10 employees","Privately Held","Dallas , Texas","United States","ecorouge.org","https://www.linkedin.com/company/ecorouge-inc"
,"Spera Property Group",,"Subdivision of Land","Self-employed","Privately Held",,,,"https://www.linkedin.com/company/spera-property-group"
,"mizan plant","TREE IS LIFE","Subdivision of Land","10,001+ employees","Government Agency","khulna, khalishpur","Bangladesh",,"https://www.linkedin.com/company/mizan-plant"
,"SDMaquiling Surveying Services","SDMaquiling Surveying Services is catering land surveying services in Davao Region most particularly in Davao City, Tagum City, Island Garden of Samal and COMVAL province. Its main objective is executing work efficiently and delivering accurate surveys for clients satisfaction.  It was founded by Engr. Starets Maquiling since year 2016.

Equipped with his 20 years in land surveying: from 5 years experience in mining abroad and 15 years in land surveying, he decided to open his land surveying business catering various land surveying services: Relocation, topographic, subdivision, quarry, subdivision survey.

Engr. Maquiling was exposed in land surveying from his teenage years since his father and majority of his siblings are all geodetic engineers.



SDMaquiling Surveying Services hired staff that are competent in geodetic engineering. It employs updated surveying EQUIPMENT; Total Station systems, RTK  GPS. We use NMAX for our survey programs. This METHODS are aligned with the rules and regulations of the DENR.","Subdivision of Land","2-10 employees","Self Owned",,,,"https://www.linkedin.com/company/sdmaquiling-surveying-services"
,"Lote Grande Urbanizadora","Ampliamos o conceito de loteamento, agregando valor, qualidade e inovação tecnológica na área loteada.

Nossa missão
A missão do grupo é mudar o conceito dos bairros da cidade de Foz do Iguaçu, no Paraná, através de inovação gradual e aprimoramento tecnológico da infraestrutura necessária para quem busca investir ou morar. 

Nossa visão
O grupo visa ser reconhecido como empresa ícone no setor de atuação por sua expertise, inovação, qualidade, excelência na execução de seus serviços e, ainda, contar com os clientes e parceiros mais satisfeitos do mercado.

Nossos valores
A Lote Grande Empreendimentos tem como valores a ética, transparência e segurança no negócio, de forma a proporcionar excelência no bem-estar e desenvolvimento socioeconômico em cada atuação.","Subdivision of Land","11-50 employees","Privately Held","Foz do Iguaçu, Paraná","Brazil","lotegrande.com.br","https://www.linkedin.com/company/lote-grande-urbanizadora"
,"Regeneration Holdings Ltd","Regeneration, land conservationists committed to developing sustainable lifestyle properties.","Subdivision of Land","2-10 employees","Privately Held","Whangarei, Northland","New Zealand","regeneration.nz","https://www.linkedin.com/company/regeneration-holdings-ltd"
,"Landtop Holdings","We are a dynamic and fast-growing Property Development and Investment company headquartered in Sydney CBD, with a strong focus on residential projects and private lending. Guided by a long-term vision and a commitment to excellence, we strive to deliver high-quality, value-driven outcomes for our partners and clients.
Our business covers the full property development cycle – from site acquisition, planning, and design, through to construction management, sales, and project delivery. We pride ourselves on our ability to identify unique development opportunities, navigate complex approval processes, and create projects that add value to both investors and the local community.
At LAND TOP, we value collaboration, innovation, and integrity. Our culture encourages proactive problem-solving, continuous learning, and strong teamwork. We are building a professional, supportive environment where every team member has the opportunity to grow and make a meaningful contribution.
As we continue to expand our portfolio, we are committed to strengthening relationships with stakeholders, embracing new technologies, and maintaining our focus on delivering sustainable, high-quality developments.","Subdivision of Land","2-10 employees","Public Company","Sydney, New South Wales","Australia","land-top.com.au","https://www.linkedin.com/company/landtop-holdings"
,"Level Inc.","Level Inc. specializes in land development with a focus on integrity and expertise. They offer comprehensive services for landowners and builders, including strategic planning, regulatory compliance, community engagement, and project management. Their approach emphasizes sustainability, positive community impact, and efficient site selection and acquisition. Level Inc. collaborates closely with various stakeholders to ensure their projects not only meet current needs but also contribute to a sustainable future.

For more detailed information, please visit their website: workwithlevel.com.","Subdivision of Land","2-10 employees","Privately Held","Loveland, Colorado","United States","workwithlevel.com","https://www.linkedin.com/company/level-inc-development"
,"Buildvisor Projects","Buildvisor Projects","Subdivision of Land","2-10 employees","Privately Held","Auckland, AUK","New Zealand","buildvisor.co.nz","https://www.linkedin.com/company/buildvisornz"
,"Clocktower Land Investments","Clocktower Investments operates with unwavering commitment to ethical land acquisition. Our process begins with meticulous research, ensuring prospective sites align with environmental sustainability and community needs. We engage local stakeholders, valuing their input in the decision-making process. Transparency is paramount as we navigate legal intricacies, securing parcels responsibly. Employing eco-friendly practices, we transform undeveloped land into vibrant, thoughtfully designed neighborhoods. Our dedication extends to fostering multi-family land for companies, catalyzing community growth. Through responsible development, Clocktower Investments pioneers a legacy of integrity, shaping landscapes that harmonize with nature and empower thriving communities.","Subdivision of Land","2-10 employees","Privately Held","Denver, Colorado","United States","clocktowerinvestments.com","https://www.linkedin.com/company/clocktower-land-investments"
,"DALEX Development","Создание жилых массивов
Продажа земельных участков в Алматинской агломерации 
Участки с целевым назначением: ИЖС, ЛПХ, коммерция","Subdivision of Land","51-200 employees","Partnership","Алматы","Kazakhstan","dalexdevelopment.kz","https://www.linkedin.com/company/dalex-development"
,"Green Real Ventures","We offer a variety of services including land surveying, transfer, succession and mutation, title deed acquisition, scheme plan drawing, and architectural designing.
Our main business is selling prime plots around Nakuru City readily available with title deeds.","Subdivision of Land","2-10 employees","Privately Held","Nakuru, Rift Valley","Kenya","greenrealventures.co.ke","https://www.linkedin.com/company/green-real-ventures"
,"Groundwork Ventures","Groundwork is the marketplace for fractional land development investing.
We unlock access to an asset class traditionally reserved for large developers by enabling accredited investors to participate directly in land entitlement or horizontal development projects. Our platform combines proprietary data tools and a streamlined investment process, making it simple to diversify into high-upside real estate opportunities.

Invest alongside seasoned developers, track your portfolio with ease, and be part of shaping the communities of tomorrow.","Subdivision of Land","2-10 employees","Privately Held",,,"groundworkpro.com","https://www.linkedin.com/company/groundworkventures"
,"Kingsdale Development","Kingsdale Development is the leading land developer in Ontario, Canada. With over combined 18 years of experience, specialized in land acquisition, land evaluation, development management, construction project management solutions.

-	Residential: 17,500 Units including Condo, Townhouse and Freehold.
-	Industrial: 10,000,000 SQ. FT.
-	Mix use commercial retail: 500,000 SQ. FT.
-	Build out value: $14.5 Billion.","Subdivision of Land","51-200 employees","Privately Held",,,"kingsdaledevelopment.com","https://www.linkedin.com/company/kingsdale-development-inc"
,"Harrison Developments",,"Subdivision of Land","2-10 employees","Privately Held",,,,"https://www.linkedin.com/company/harrison-developments"
,"Bylo Acres Excavation & Grading","We're a Veteran-owned and family operated small business, offering excavation and grading services, specializing in site prep for new builds, RV pads, and outbuildings. Bylo Acres Is the trusted partner for homeowners and developers seeking to maximize the value and utility of their land.

Our mission is to provide excellence in the work we do. The goal is to leave every job site with the client happy and the project done according to their specifications.

Bylo Acres is a full service excavation & grading company based in Henley, Missouri, providing service from Lake of the Ozarks to Jefferson City and surrounding areas, including but not limited to: 

Eugene
Eldon
Mary's Home
Osage Beach
Lake Ozark
Brazito
New Bloomfield
California
Holts Summit
Fulton
Jefferson City
Wardsville
Taos
Russellville
Camdenton

This is our recommended coverage area.  If you're outside of this area, please contact us for more information.","Subdivision of Land","Self-employed","Partnership","Henley, MO","United States","byloacres.com","https://www.linkedin.com/company/byloacres"
,"Delta Urbanismo",,"Subdivision of Land","2-10 employees","Privately Held",,,,"https://www.linkedin.com/company/delta-urbanismo"
,"KLABIKA [ Y:13 ]","Subversive Momentum Experience","Subdivision of Land","2-10 employees","Privately Held",,,,"https://www.linkedin.com/company/momentumklabika"
,"Q3 Empreendimentos Imobiliários","Há mais de 6 anos a Q3 Empreendimentos Imobiliários atua no setor de desenvolvimento por onde passa. São loteamentos residenciais, comerciais, industriais e beira-rio com infraestrutura completa garantindo qualidade de vida.","Subdivision of Land","11-50 employees","Privately Held","Frutal, MG","Brazil","q3empreendimentos.com.br","https://www.linkedin.com/company/q3-empreendimentosimobiliários"
,"WDG Constructions","Notre entreprise a comme activité : la Rénovation, la VEFA, l'aménagement de lotissements de terrains à bâtir ainsi que des commerces et bureaux.","Subdivision of Land","2-10 employees","Privately Held",,,"wdg-constructions.com","https://www.linkedin.com/company/wdg-constructions"
,"Smiths Falls Property Inc.","Home Construction Regulatory Authority/Tarion 
Licence Number: 47982","Subdivision of Land","2-10 employees","Privately Held","Smiths Falls, Ontario","Canada","sfproperty.ca","https://www.linkedin.com/company/smiths-falls-property-inc"
,"endless horizon geosolutions","Land surveying,GIS and engineering survey solution providers","Subdivision of Land","2-10 employees","Privately Held","Machakos","Kenya",,"https://www.linkedin.com/company/endless-horizon-geosolutions"
,"INVEST Pernambuco","Comercializamos terrenos com condições exclusivas no sertão Pernambucano. Estamos construindo o primeiro condomínio privado da cidade de Sertânia/PE.","Subdivision of Land","2-10 employees","Privately Held","Sertânia, Pernambuco","Brazil",,"https://www.linkedin.com/company/investpernambuco"
,"Lote Grande Empreendimentos","Ampliamos o conceito de loteamento, agregando valor, qualidade e inovação tecnológica na área loteada.

Nossa missão
A missão do grupo é mudar o conceito dos bairros da cidade de Foz do Iguaçu, no Paraná, através de inovação gradual e aprimoramento tecnológico da infraestrutura necessária para quem busca investir ou morar. 

Nossa visão
O grupo visa ser reconhecido como empresa ícone no setor de atuação por sua expertise, inovação, qualidade, excelência na execução de seus serviços e, ainda, contar com os clientes e parceiros mais satisfeitos do mercado.

Nossos valores
A Lote Grande Empreendimentos tem como valores a ética, transparência e segurança no negócio, de forma a proporcionar excelência no bem-estar e desenvolvimento socioeconômico em cada atuação.","Subdivision of Land","11-50 employees","Privately Held","Foz do Iguaçu, Paraná","Brazil","lotegrande.com.br","https://www.linkedin.com/company/lote-grande-empreendimentos"
,"Zadell Development, LLC",,"Subdivision of Land","2-10 employees","Partnership",,,,"https://www.linkedin.com/company/zadell-development-llc"
,"Pathfinder Land Surveying","At Pathfinder Land Surveying, our mission is to provide a superior service to the public. We strive to be the industry's most accurate, efficient, and reliable land surveying company. We work closely with our clients to ensure their needs are met, and their expectations are exceeded.","Subdivision of Land","Self-employed","Partnership","Grantsville, WV","United States","plswv.com","https://www.linkedin.com/company/pathfinder-land-surveying-llc"
,"PRIME One Land Group",,"Subdivision of Land","2-10 employees","Privately Held",,,,"https://www.linkedin.com/company/prime-one-land-group"
,"Next Street Associates","At Next Street Associates, we specialize in acquiring large parcels of land in high-potential regions like Florida and Texas, then making them available to overseas buyers through a streamlined, secure, and transparent process.","Subdivision of Land","11-50 employees","Privately Held","Boca Raton, Florida","United States","nxtstrt.com","https://www.linkedin.com/company/nextstreetassoc"
,"Joom Trading Group MN",,"Subdivision of Land","51-200 employees","Public Company",,,"joom.com","https://www.linkedin.com/company/joom-trading-group-mn"
,"Moreland Land Development",,"Subdivision of Land","2-10 employees","Privately Held",,,,"https://www.linkedin.com/company/moreland-land-development"
,"Imperium Group","At The Imperium Group, we specialise in premium land and property acquisitions, working closely with landowners and homeowners to unlock maximum value through strategic partnerships and smart property deals.

We’re a dynamic team of entrepreneurial professionals who take a fresh, collaborative approach to real estate and property development, partnering with owners to secure results that consistently outperform the market. Through our unique collaboration model, we regularly deliver 20–30% above market value, ensuring our clients achieve outstanding outcomes with minimal stress and maximum support.

Whether you're a landowner with development potential or a homeowner ready to explore off-market opportunities, we’re here to guide you through a seamless, profitable process.

Let’s collaborate, and create value together ","Subdivision of Land","2-10 employees","Privately Held","Gold Coast, QLD","Australia","imperiumgroup.com.au","https://www.linkedin.com/company/imperium-group-developments"
,"FlimDeal","FlimDeal het veilingplatform waar de consument centraal staat. Iedere dag weer een nieuwe veiling die onverslaanbaar goed is.

neem een kijkje en beleef het zelf! 
FlimDeal.nl","Subdivision of Land","2-10 employees","Privately Held","Alphen aan den Rijn, South Holland","Netherlands","flimdeal.nl","https://www.linkedin.com/company/flimdeal"
,"State Contractors","Trusted Land Clearing and Site Development Services. Serving a multi state area.","Subdivision of Land","11-50 employees","Public Company","Panama City, Florida","United States","statecontractors.us","https://www.linkedin.com/company/statecontractorslandclearing"
,"All Marine Land Clearing","At All Marine, we bring military precision and dedication to every land clearing project. Our veteran-powered team is on a mission to revitalize landscapes while providing meaningful employment opportunities for fellow veterans. With a legacy of service, we've transitioned our commitment from the battlefield to your backyard. Let's collaborate to reclaim, renew, and redefine spaces together.","Subdivision of Land","2-10 employees","Partnership",,,"allmarinelandclearing.com","https://www.linkedin.com/company/all-marine-land-clearing"
,"Altios Urbanismo","A Altios Urbanismo é uma empresa especializada no desenvolvimento de loteamentos que oferecem um refúgio da vida urbana, integrando natureza, bem-estar e infraestrutura de alta qualidade. Nosso compromisso é criar espaços planejados que valorizam a experiência dos moradores e o potencial de investimento, sempre respeitando o meio ambiente e as melhores práticas de urbanismo.

Com uma visão inovadora e criteriosa, identificamos oportunidades estratégicas para desenvolver empreendimentos diferenciados, combinando localização privilegiada, sustentabilidade e um conceito que une conforto e exclusividade.

Se você busca investir em um loteamento de alto padrão ou deseja saber mais sobre nossas oportunidades, fale conosco!","Subdivision of Land","2-10 employees","Privately Held",,,"altios.com.br","https://www.linkedin.com/company/altiosurbanismo"
,"jomijog","Bangladesh's trusted platform connecting landowners with verified surveyors. 

 Find & book qualified surveyors
 Learn about land laws & documents
 Secure & transparent transactions","Subdivision of Land","2-10 employees","Self Employed","Rajshahi","Bangladesh","jomijog.com","https://www.linkedin.com/company/jomijog"
,"First Acre","First Acre is a specialist land sourcing agency operating in London and the Home Counties.

We build partnerships by connecting landowners with reputable property developers whilst unlocking potential opportunities for your land and maximising the development value.","Subdivision of Land","2-10 employees","Privately Held","Redhill, England","United Kingdom","first-acre.com","https://www.linkedin.com/company/first-acre"
,"Bert Properties","Land development company, headquartered in Harare, Zimbabwe. 
Offices in Harare and Zvishavane. 

Multi-domestic company with plans of becoming a multinational company. 

Development and subdivision, from surveying to dispensation. We primarily focus on developing roads, water reticulation and sewer reticulation.

3 development sites across the nation.
Lydiate Norton, Siboza Zvishavane, Mtonjeni Zvishavane","Subdivision of Land","11-50 employees","Privately Held",,,,"https://www.linkedin.com/company/bertpropertiesltd"
,"Western Corporate","A Perth based project management and consultancy firm delivering a range of high quality developments that support growth, wellbeing and opportunity within our communities.","Subdivision of Land","2-10 employees","Privately Held","Perth, WA","Australia","westerncorporate.com.au","https://www.linkedin.com/company/western-corporate"
,"Foco Empreendimentos Imobiliários Ltda",,"Subdivision of Land","2-10 employees","Privately Held","Lavras, Minas Gerais","Brazil","focourbanismo.com.br","https://www.linkedin.com/company/foco-empreendimentos-imobiliários-ltda"
,"Scarlati Empreendimentos","A Scarlati Empreendimentos nasceu para unir técnica e experiência na criação de negócios imobiliário sólidos e estratégicos, oferecendo soluções completas para o desenvolviemnto urbano.

Nosso objetivo é transformar sua área em um empreendimentos de sucesso. Atuamos nas etapas:

- Estudo de viabilidade/Master Plan
- Estruturação de Novos Negócios
- Concepção de projeto urbanístico
- Gestão do negócio e
- Consultoria Urbanística

Nosso foco é garantir que cada projeto seja sustentável, funcional e viável.

Atuamos de forma personalizada, criando empreendimentos que valorizam a história de cada terreno e a identidade das comunidades onde nos inserimos.","Subdivision of Land","2-10 employees","Privately Held",,,,"https://www.linkedin.com/company/scarlatiempreendimentos"
,"Grünwand",,"Subdivision of Land","2-10 employees","Self Employed","Wien, Wien","Austria","gruenwand.com","https://www.linkedin.com/company/grünwand"
,"A to Zoning","At A to Zoning, we specialize in guiding residential land development projects across central Ohio. From zoning and permitting to project coordination and regulatory compliance, we handle every detail, so you don’t have to. Whether you’re planning a single home or want to split up your land, our expertise helps turn complex challenges into streamlined solutions. Explore our services and discover how we can bring your project to life.","Subdivision of Land","2-10 employees","Self Owned",,,"atozoningllc.com","https://www.linkedin.com/company/atozoningllc"
,"SentrySix Land Corp","SentrySix Land Corp is a visionary land holding and development company focused on acquiring and developing land in a way that balances sustainability, social responsibility, and economic viability, ultimately delivering high-quality properties for a diverse range of end-use applications.","Subdivision of Land","2-10 employees","Privately Held","Coleman, AB","Canada","sentryridge.ca","https://www.linkedin.com/company/sentrysix-land-corp"
,"Pinacore Development","We classify the lot into urban home sites, subdivision development, or office park. Each category has its unique characteristics that define how the land will be developed. In our process, we determine who among our clients will be interested in the properties we are buying to give our clients the best selection.","Subdivision of Land","Self-employed","Self Owned","Phoenix, Arizona","United States","pinacoredevelopment.com","https://www.linkedin.com/company/pinacoredevelopment"
,"Bairro Jardim Vitória","Bairro Planejado
 Parque das Emas
+ de 20 anos realizando sonhos!
 O seu lar em Lucas do Rio Verde-MT
 Terrenos à partir de 320m²","Subdivision of Land","11-50 employees","Privately Held","Lucas do Rio Verde, Mato Grosso","Brazil","bairrojardimvitoria.com.br","https://www.linkedin.com/company/loteamento-jardim-vit-ria"
,"B2L Land Surveyors","We provide a wide variety of land surveying services included but not limited to Boundary Surveys, Topographic Surveys, Site Plans, ALTA/NSPS Surveys, Elevation Certificates, Construction Layout for new homes and much more.","Subdivision of Land","2-10 employees","Partnership","Joelton, Tennessee","United States","b2llandsurveyors.com","https://www.linkedin.com/company/b2l-land-surveyors"
