"Find companies","Name","Description","Primary Industry","Size","Type","Location","Country","Domain","LinkedIn URL"
,"Jack Atkinson Surveying","Shaping future development throughout Canberra, The Snowy Mountains & NSW South Coast. With more than 15 Years experience, Jack Atkinson Surveying is your go-to expert in all things surveying. We work with Property Developers, Licensed Builders, Councils, Home owner/builders and Infrastructure Corporations.

Are you Buying or Selling a House?

Are you in Property Development and Subdivisions?

Do you have a Boundary Dispute?

Do you require some Aerial Drone Surveying?

Are you in charge of Building Roads and Civil Infrastructure?

Whatever your surveying requirements big or small, reach out to our professional and friendly staff today.

For a full list of services, please peruse our website.","Subdivision of Land","2-10 employees","Privately Held","Cooma, New South Wales","Australia","jasurveying.com.au","https://www.linkedin.com/company/jack-atkinson-surveying"
,"Sealark Pty Limited","Sealark is the operational arm of The Halloran Trust controlling approx 2,760Ha of land in the Shoalhaven and realising the vision of Warren Halloran through its dual-purposes of land conservation and land development.

The land conservation projects include:
* Lake Wollumboola Biodiversity Stewardship site (1,080 ha)
* Tullarwalla Biodiversity Stewardship Site (550ha)
* One Tree Bay West (Biodiversity Stewardship Site 360ha)
* One Tree Bay East Biodiversity Stewardship Site (360 ha)

Land development projects include
* West Culburra mixed-use concept plan (400 dwellings + industrial + commercial)
* Callala Bay Urban Release Area (375 dwellings)","Subdivision of Land","2-10 employees","Privately Held","Sydney, New South Wales","Australia","sealark.com.au","https://www.linkedin.com/company/sealark-pty-limited"
,"Birch","Kevin Birch first established his practice in 1989, following in his father’s footsteps who had earlier established a Surveying business in Pukekohe in 1957. The rapid and sustained development of Birch Surveyors Ltd has not occurred by chance. It is a result of well defined goals and a desire to make a difference in the community. The establishment of branches in Auckland 2014 and Hamilton in 2017 is a result of the recognition of the role that these locations play in the New Zealand economy, and is consistent with Birch Surveyors desire to expand their services into appropriate areas. It also recognizes some key relationships that exist between our staff and family and clients in these areas.","Subdivision of Land","11-50 employees","Privately Held","Pukekohe","New Zealand","birch.nz","https://www.linkedin.com/company/birch-surveyors-limited"
,"Reelvest Properties","Reelvest Properties is a nationwide developer of raw land. Our projects include solar farm projects, land subdivisions, and other various value add projects.","Subdivision of Land","11-50 employees","Privately Held",,,"reelvest.com","https://www.linkedin.com/company/reelvest"
,"Up Acre Ltd","It is hard to discover the possibilities and opportunities your land may have. It is even harder to do this privately and instantaneously. Up Acre was set up in 2021 to display options for Landowners without upsetting neighbours or damaging local communities. With a user-friendly land plotter and specially designed algorithm, Up Acre can value your land and present you with options without anyone knowing, all in under a minute.","Subdivision of Land","2-10 employees","Privately Held","London","United Kingdom","up-acre.co.uk","https://www.linkedin.com/company/up-acre-ltd"
,"Nokz",,"Subdivision of Land","Self-employed","Partnership",,,"nokz.com.br","https://www.linkedin.com/company/nokz"
,"Aelo Minas Gerais","AELO-MG é uma entidade que reúne e representa as empresas e os profissionais do setor de loteamentos.

Nosso objetivo principal é trabalhar no aprimoramento do segmento, melhorando a qualidade dos loteamentos, a imagem das loteadoras e auxiliando a profissionalização da área.

Associe-se:

Vamos juntos para multiplicar","Subdivision of Land","2-10 employees","Privately Held",,,,"https://www.linkedin.com/company/aelo-mg"
,"Resproland","As a Christian, multi-generational family business with over 35 years of combined land development experience, our deep-rooted values and extensive expertise guide us in identifying prime land opportunities, securing entitlements through strong relationships, and preparing lots with top-tier construction companies. 

We offer  Land Identification, Entitlement, and Lot Preparation. We offer unique partnership opportunities to builders and outside investors. Whether you have specific development visions or ROI goals, we align our efforts to meet your objectives.

Reach out to us at 864-420-7475.","Subdivision of Land","2-10 employees","Self Owned","Greenville, South Carolina","United States","resproland.com","https://www.linkedin.com/company/resproland"
,"Urban Initiatives","Urban Initiatives was founded on over 40 years of first-hand development experience, evolving from a legacy of successfully shaping communities. Unlike traditional planning firms, our expertise is built not just on planning principles, but on the real-world complexities of taking projects from concept to completion. We understand what it takes to navigate approvals, align with market conditions, and execute successful developments.

Our strength lies in understanding land and its full potential—assessing opportunities, anticipating challenges, and crafting strategies that bring lasting value to landowners, developers, and municipalities. Whether managing urban infill projects, site plan approvals, or large-scale greenfield developments, we integrate land strategy with development execution to deliver projects that thrive.","Subdivision of Land","11-50 employees",,"Kitchener, Ontario","Canada","urbaninitiatives.ca","https://www.linkedin.com/company/urban-initiatives-ca"
,"WAHDA Topo SARL",".","Subdivision of Land","2-10 employees","Privately Held","Fès, Fès - Meknès","Morocco",,"https://www.linkedin.com/company/wahdatopo"
,"Leeds Holdings Southeast, Inc","Leeds Holdings is a land acquisition and development company specializing in senior living, single-family, multi-family and master planned residential communities.","Subdivision of Land","2-10 employees","Privately Held","Winter Park, Florida","United States","leedsholdings.com","https://www.linkedin.com/company/leedsholdings"
,"Survey Waitaki Ltd","Providing surveying, planning and engineering design services to a wide range of clients across Otago and Canterbury from our Oamaru base.

We take pride in our work and offer a friendly and professional service to suit your needs. Contact us to discuss any aspect of surveying or land development.","Subdivision of Land","2-10 employees","Privately Held","Oamaru","New Zealand","surveywaitaki.co.nz","https://www.linkedin.com/company/survey-waitaki-ltd"
,"Drone Verse","Established in 2021, Droneverse has started to be a pioneer in the field of drone services in Kenya. From our headquarters in Nairobi, Kenya, we have been providing our clients with game-changing data acquired by using the latest drone technology. Our services include drone inspection, survey, agriculture, thermal inspections, and technological solutions.","Subdivision of Land","2-10 employees","Self Owned","Nairobi, Nairobi County","Kenya",,"https://www.linkedin.com/company/droneverse"
,"Synergy Urban Development","Synergy Urban Development – We pride ourselves on our ability to provide a diverse range of solutions and options to our clients under our brand. From completed homes to large developments – you can rely on us to provide you the right solution to your needs in the shortest of delivery timelines.

Our competitive advantage lies in the fact that we are flexible in our methods and try to provide the best possible solutions depending on the needs of our clients.

We are committed to providing the very best and have professionals who are skilled enough to handle all your needs.

Our land development and integrated housing projects have quickly established themselves among the very best and we are continually striving forward to perform well in the strategic areas of our target market.

Our expertise, professional integrity and understanding of the market conditions is what drives us forward and we look forward to building more relationships with clients over the years.","Subdivision of Land","2-10 employees","Partnership","North Adelaide, South Australia","Australia","synergyurbandevelopment.com.au","https://www.linkedin.com/company/synergy-urban-development"
,"Divide Property Group",,"Subdivision of Land","2-10 employees","Privately Held",,,,"https://www.linkedin.com/company/divide-property-group"
,"SLC Global Logistics Center","The Salt Lake City Global Logistics Center (SLC-GLC), located in the northwest quadrant, spans 3,000 acres and specializes in premier Class A industrial facilities, including cross-dock and rear-load buildings. We provide a wide array of options, from spec buildings ready for immediate occupancy to custom build-to-suit solutions tailored to the unique needs of our clients. Our collaborative approach, working closely with contractors, engineers, architects, and industry experts, ensures the successful execution of every project.","Subdivision of Land","2-10 employees","Partnership","Salt Lake City, Utah","United States","slc-glc.com","https://www.linkedin.com/company/slc-glc"
,"Stacey Surveying","Stacey Surveying is a Melbourne-based land surveying firm providing precise, high-quality surveying services across Melbourne Metro and Regional Victoria. We work with developers, architects, town planners, builders, and property owners to deliver reliable, accurate surveys that form the foundation for successful projects.

With a strong focus on cadastral surveying and development support, our expertise covers Feature & Level Surveys, Title Re-Establishment, Subdivisions, Consolidations, Easement Removal, Boundary Disputes, and Large-Scale Development Surveys. We also offer drone-based aerial mapping and advanced site measurement services, giving clients accurate data in less time.

Our approach is guided by three core principles – experience, insight, results. Every project benefits from years of industry knowledge, a detailed understanding of local council and state planning requirements, and the latest surveying technology. This ensures our clients receive survey plans that are not only accurate, but also clear, compliant, and ready for use in design, planning, and construction.

We pride ourselves on building strong, long-term relationships with our clients. By working closely with project teams, we help to identify potential challenges early, streamline approvals, and keep developments moving on time and within budget. From small residential extensions to multi-stage commercial projects, our work is trusted by leading industry professionals who value both precision and proactive communication.

Whether you need to confirm title boundaries, prepare subdivision plans, merge lots to reduce land tax, or meet planning permit conditions, Stacey Surveying delivers dependable surveying solutions tailored to your needs.","Subdivision of Land","11-50 employees","Privately Held","Croydon North, Victoria","Australia","staceysurveying.com.au","https://www.linkedin.com/company/stacey-surveyingmelbourne"
,"Global Terrenos",,"Subdivision of Land","11-50 employees","Self Employed",,,"globalterrenos.cl","https://www.linkedin.com/company/global-terrenos"
,"FGF Group of Companies","FGF Group of Companies is an organization in Negros Occidental and Panay Islands. The members of the group are involved in banking, lending, agriculture, construction and real estate. 
Members under FGF Group of Companies are:
• Marayo Bank, Inc.
• Featherleaf Lending Corporation
• Philippine Diversified Developers Corporation
• Golden Agribusiness Corporation","Subdivision of Land","51-200 employees","Privately Held","Bacolod, Western Visayas","Philippines",,"https://www.linkedin.com/company/fgf-group-of-companies"
,"Evolução Urbanismo"," Bairros estruturados e completos
 Atuação em todo o Estado de SP
 Lotes do tamanho de seus sonhos
Av. Projetada Dois, 580 - Tall Garden G","Subdivision of Land","2-10 employees","Privately Held","Bady Bassitt, São Paulo","Brazil",,"https://www.linkedin.com/company/evolucao-urbanismo"
,"EPM Empreendimentos e Participações LTDA","[Português]
Na EPM Empreendimentos, não seguimos caminhos óbvios — rompemos com a linearidade ao criar loteamentos e empreendimentos residenciais, comerciais e industriais que vão além do convencional. Nosso foco está em desenvolver projetos sólidos, inovadores e bem-sucedidos no interior de São Paulo, projetados não apenas para transformar espaços, mas para construir futuros melhores.

Nosso compromisso vai além dos negócios: guiamos nossas ações pela integridade, transparência e pelo respeito à diversidade, às pessoas e ao meio ambiente. Acreditamos que o sucesso duradouro nasce quando unimos propósito, qualidade e impacto positivo.

Se você busca parcerias estratégicas e soluções visionárias para empreendimentos, estamos prontos para construir juntos.

_

[English]
At EPM Empreendimentos, we do not follow conventional paths — we push boundaries by developing residential, commercial, and industrial land projects that go beyond the ordinary.

Our goal is to create solid, innovative, and successful developments across the interior of São Paulo, designed not only to reshape spaces but to build better futures.

Our commitment extends beyond business. We uphold the principles of integrity, transparency, and respect for diversity, people, and the environment. We firmly believe that true and enduring success comes from aligning purpose, quality, and positive impact.

If you are looking for strategic partnerships and innovative solutions in real estate development, we are ready to build a future of lasting value together.","Subdivision of Land","11-50 employees","Partnership","Salto, São Paulo","Brazil","epmnet.com.br","https://www.linkedin.com/company/epm-empreendimentos-e-participações-ltda"
,"Homeland GP","Homeland, Creating a home land for families
Nervous about your property adventure? Don’t be. Whether you're getting ready to buy or sell, in the middle of it, or just looking for some answers, our top-notch skills ensure you get the best experience possible. It’s what we love to do. We subdivide lands for new homes for families.","Subdivision of Land","2-10 employees","Privately Held","Karana Downs, Queensland","Australia","homelandgp.com.au","https://www.linkedin.com/company/homeland-gp"
,"316 Land Surveying","We are a Land Surveying firm in Houston Texas, offering land surveys for commercial and residential properties with a fast turnaround time in Houston Area.","Subdivision of Land","2-10 employees","Partnership","Houston, Texas","United States","316landsurveys.com","https://www.linkedin.com/company/316-land-survey"
,"GUILLERM AMENAGEMENT","GUILLERM AMENAGEMENT, filiale du Groupe GUILLERM, met à disposition de sa clientèle de construction de maisons individuelles, des terrains de par sa maîtrise foncière sur le secteur du Finistère.","Subdivision of Land","51-200 employees","Partnership",,,"guillerm.fr","https://www.linkedin.com/company/guillerm"
,"KMB Development And Construction LTD.","KMB, your premier land development company in the heart of the GTA. Specializing in subdivisions, townhomes, mid-rise, and high-rise developments, we redefine urban living with a perfect blend of innovation and sustainability. At KMB, we craft vibrant communities that seamlessly integrate modern amenities with natural tranquility. From contemporary townhomes to sophisticated high-rise residences, each development reflects our commitment to excellence and client satisfaction. Welcome to KMB - Where Vision Meets Reality.","Subdivision of Land","2-10 employees","Partnership","Markham, Ontario","Canada","landservicesgroup.ca","https://www.linkedin.com/company/kmb-development-and-construction-ltd"
,"CF Urbanismo","A CF Urbanismo é uma empresa focada no desenvolvimento de empreendimentos imobiliários residenciais e comerciais, concebidos com a visão de urbanismo moderno, planejado, buscando trazer aos seus clientes a oportunidade de viver bem, com qualidade de vida e integração com à natureza, sem abrir mão da mobilidade urbana. Se você tem uma área e quer urbanizá-la, fale conosco! Vamos desenvolver um plano de construção e comercialização de sucesso. Desenvolver, comercializar e construir loteamentos de alta qualidade, dentro dos prazos acordados, com condições de pagamento justas e diferenciadas que permitam ao cliente realizar o sonho da casa própria e um investimento de alta lucratividade.","Subdivision of Land","2-10 employees","Privately Held","Pouso Alegre, Mg","Brazil","cfurbanismo.com","https://www.linkedin.com/company/cf-urbanismo"
,"Rockingham Park Pty Ltd","Rockingham Park Pty Ltd (RPPL) has developed land for over 60 years. The company played a pivotal role in Rockingham’s rapid development as one of the WA Government’s five new regional centres, alongside Joondalup, Midland, Armadale, and Fremantle. 

RPPL developed and sold over 4,000 homesites during the 15 years from 1969 to 1984, as well as selling broadacre land to other housing developers and forming joint ventures to encourage a faster rate of development. In 1971, it started construction of the Rockingham City Shopping Centre, now known as the Rockingham Centre.

New communities followed in Waikiki (Harrington Waters plus the Waikiki Village Shopping Centre), Hibiscus Hammond Park and in Baldivis (Heritage Park, 545 Baldivis, Parkland Heights and Woodlands Baldivis). 

Rockingham Park’s current estates are Parkland Heights and Woodlands Baldivis. 

Waikiki Village Shopping Centre is still owned and managed by RPPL and construction on the new Parkland Heights Shopping Centre will commence soon. 

From this original company, the Summit Homes Group was formed to offer land clients everything they needed to build their new home; construction, finance, settlement and real estate services and the Group is a leader in the Perth construction industry.","Subdivision of Land","11-50 employees","Privately Held",,,,"https://www.linkedin.com/company/rockingham-park-pty-ltd"
,"IBL Group","At IBL Group, we recognize the complexity and importance of professional services in managing, developing, and conserving land resources. Understanding the multifaceted nature of land use, we have established a network of affiliate professionals, each specializing in a critical area of land-related services. This collaborative approach allows us to offer a comprehensive suite of services tailored to meet the diverse needs of our clients, ranging from individual landowners and developers to large corporations and governmental bodies.","Subdivision of Land","11-50 employees","Privately Held","Richmond Hill, Ontario","Canada","ibl.group","https://www.linkedin.com/company/iblgroupcorp"
,"Decarterra Logística","Nós da DECARTERRA LOGISTICA LTDA acreditamos que o sucesso está ligado à credibilidade e para isso assumimos um compromisso imprescindível à cultura de uma Empresa moderna “o compromisso com a ética”. Nossos princípios de conduta manifestam nosso interesse em tratar clientes, colaboradores e fornecedores de forma respeitosa, oferecendo sempre um tratamento profissional e harmonioso.","Subdivision of Land","201-500 employees","Privately Held","BOTUCATU, SÃO PAULO","Brazil",,"https://www.linkedin.com/company/decarterralogistica"
,"TTLD Transportadora e Terraplenagem Leite e Dias LTDA","Empresa voltada para o ramo de terraplenagem, redes pluviais e serviços de base de terreno. Trabalha também com venda de areia, brita, bica, cascalho, além de transportes de maquinários e culturas.","Subdivision of Land","11-50 employees","Privately Held","Machado, Minas Gerais","Brazil",,"https://www.linkedin.com/company/ttld"
,"ECOINVERSIÓN","Somos ECOINVERSIÓN la alternativa para  empresas proveedoras de la minería y público en general. Lotes de 5.000 metros cuadrados para que puedan entregar sus productos y servicios a mineras como Cerro Colorado, Collahuasi y Quebrada Blanca, entre otras.

Ubicados en primera línea carretera principal que conduce a Minera Collahuasi Ruta A-651 a 14.5 km de Pozo Almonte. En un punto estratégico que permite ahorros sustanciales en movilización y logística.

Te invitamos a ser parte de este nuevo proyecto “BARRIO LOS INDUSTRIALES DE POZO ALMONTE”.","Subdivision of Land","2-10 employees","Self Owned","Calama, Loa","Chile","ecoinversion.cl","https://www.linkedin.com/company/ecoinversión-spa"
,"MAP Liberia Land Platform",,"Subdivision of Land","201-500 employees","Non Profit",,,,"https://www.linkedin.com/company/map-liberia-land-platform"
,"QD&Lote Urbanismo",,"Subdivision of Land","11-50 employees","Privately Held",,,,"https://www.linkedin.com/company/qd-lote-urbanismo"
,"Osterley Sports and Wellbeing Centre","Osterley Sports and Wellbeing is a company based out of Tentelow Ln, Southall, United Kingdom.

Hall for rent and 8 acres of land avalible for events/functions. Dm us to find out more.","Subdivision of Land","11-50 employees","Non Profit","Southall","United Kingdom",,"https://www.linkedin.com/company/osterley-sports-and-wellbeing-centre"
,"Oxley + Company","Oxley & Company was formed in 1996 to provide service to the land development industry in the areas of Surveying, Civil Engineering and Statutory/Strategic Planning.  We service private clients, developers, state and local government as well as service authorities.

Our company provides independent advice on all aspects of land development using the collective knowledge and experience gained from many years in the industry.  We keep abreast of current standards, trends and legislative changes and operate throughout North East Victoria.","Subdivision of Land","11-50 employees","Privately Held","Wangaratta, Victoria","Australia",,"https://www.linkedin.com/company/oxley-&-company"
,"Maria Luiza Construções e Empreendimentos Imobiliários","A Empresa MARIA LUIZA CONSTRUÇÕES E EMPREENDIMENTOS IMOBILIÁRIOS LTDA está há mais de 37 anos trabalhando na realização do seu sonho. 
Hoje possui mais de 60 empreendimentos registrados em mais de 20 cidades do interior paulista.
A Maria Luiza procura desenvolver sempre projetos atualizados, buscando qualidade e inovação, que possa valorizar e melhorar cada vez mais a qualidade de vida de nossos clientes. 
E nosso maior objetivo é trazer, sempre, a satisfação a nossos clientes!","Subdivision of Land","51-200 employees","Privately Held","Jaú, São Paulo","Brazil","marialuizaempreendimentos.com.br","https://www.linkedin.com/company/maria-luiza-construções-e-empreendimentos-imobiliários"
,"Terra Nova Land Development","Terra Nova Land Development is a modern land development company that leverages our development experience, capital markets expertise and data/technology to efficiently identify and execute on land development opportunities. We take a hands-on approach across the development and construction process to ensure we have a deep understanding of the opportunities and risks within each project. This approach allows us to focus on delivering finished lots to our home builder partners, while diminishing risk to our investors.
We are committed to serving National and Regional Home Builders and being part of the solution to the national housing shortage crisis.","Subdivision of Land","2-10 employees","Privately Held",,,"terranovald.com","https://www.linkedin.com/company/terra-nova-land-development"
,"Empreendimentos Bom Jesus","Desde 2011 especializada em loteamentos abertos e condomínios de alto padrão

Na Empreendimentos Bom Jesus, qualidade e inovação são as diretrizes orientadoras de cada um dos nossos projetos. Nossos espaços não apenas atendem às demandas do presente, mas também se preparam para um futuro brilhante. 

Insistimos em nossos valores, apaixonando-se por excelência e inovação, e todos os detalhes de cada projeto são planejados com a missão de oferecer um estilo de vida confortável e seguro e moderno.","Subdivision of Land","2-10 employees","Privately Held","Paudalho, Pernambuco","Brazil","empreendimentosebj.com.br","https://www.linkedin.com/company/empreendimentos-bom-jesus"
,"Sky Ridge Retreats","Sky Ridge Retreats - Lots are for sale in the perfect setting for your modern cabin, strategically located between Red River Gorge and Cave Run Lake in Central Kentucky.  A new community for modern cabins, ideal for vacation rentals, located on 21 acres bordering the Daniel Boone National Forest.  All lots have unique features such as scenic cliffs, sunrise views, secluded wooded areas or waterfront property. We provide referrals to builders and property management to make your experience more turn key. Our website helps fill any rentals throughout the year. The HOA protects your investment, while still giving you flexibility and freedom. The amenities are magnetic.","Subdivision of Land","2-10 employees","Partnership","Denniston, Kentucky","United States","skyridgeretreats.com","https://www.linkedin.com/company/sky-ridge-retreats"
