"Find companies","Name","Description","Primary Industry","Size","Type","Location","Country","Domain","LinkedIn URL"
,"Lighthouse Entitlement Professionals","Lighthouse Entitlement Professionals is a local, family owned and operated firm, which specializes in land entitlement, platting and permitting. We have over fifty years of combined knowledge and experience in the South Florida land development industry and are experts in administrative project management, plat processing, permitting, and project administration. 

Our Entitlement Specialists have created and maintained strong relationships with developers, engineers, architects, attorneys, and surveyors, as well as with staff of several South Florida municipalities and Miami Dade County which allows us to effectively streamline the platting and land entitlement processes on our client’s behalf.

We are confident that as members of your team, our level of service, knowledge, and professionalism will be an asset.","Subdivision of Land","2-10 employees","Privately Held","Miami, Florida","United States","lighthouseepi.com","https://www.linkedin.com/company/lighthouseepi"
,"İdalya Assos","Yeryüzü Cenneti: İdalya Assos!
","Subdivision of Land","2-10 employees","Privately Held",,,"idalyaassos.com","https://www.linkedin.com/company/i̇dalya-assos"
,"Philus Land","Land Development Company","Subdivision of Land","2-10 employees","Partnership","Madang, Madang","Papua New Guinea","philusland.com","https://www.linkedin.com/company/philus-land"
,"GVU - Grupo Vitória da União",,"Subdivision of Land","201-500 employees","Privately Held",,,,"https://www.linkedin.com/company/gvu-grupo-vitória-da-união"
,"Parcelas Ecoparque El Encanto","Parcelas de 5.000m2 en la Araucanía (Manchuria - Malalcahuello)","Subdivision of Land","2-10 employees","Privately Held","Collipulli, Araucania Region","Chile","ecoelencanto.cl","https://www.linkedin.com/company/parcelas-ecoparque-el-encanto"
,"Hoficri Groupe Criner Dombes Val de Saône."," De l'achat du terrain à la remise des clés de votre futur chez-vous, nous vous accompagnons à chaque étape.","Subdivision of Land","2-10 employees","Self Employed","Romans","France",,"https://www.linkedin.com/company/hoficri-groupe-criner-dombes-val-de-saône"
,"Winterset Lodge Estate","Winterset offers a serene and country charm, allowing residents to enjoy a peaceful lifestyle. Surrounded by natural beauty, you can embrace a tranquil setting while still being part of a growing community.
By choosing to be a part of the Winterset Lodge Estate you can seize the opportunity to invest in a property within a highly sought-after area experiencing significant growth and value appreciation. Whether you're looking for a place to call home or an investment opportunity, Winterset Lodge Estate presents a compelling option to be a part of Wyndham Vale's flourishing real estate market.","Subdivision of Land","2-10 employees","Privately Held","Wyndham Vale, Victoria","Australia","winterset.com.au","https://www.linkedin.com/company/winterset-lodge-estate"
,"World of Blue","A Vision for Global Change

Discover the World of Blue, one of the world’s largest and most ambitious sustainability and conservation efforts, located along the vibrant Caribbean coast of Panama. Spanning 1,280 hectares (3,000 acres) of untouched rainforest and 10 kilometers (6 miles) of pristine beachfront, this sanctuary is a natural wonder, ready for transformative projects.

We offer unmatched opportunities for investment and collaboration in initiatives that are essential for the health of our planet and our collective future.

Explore our Vision
OUR MISSION
Pioneering Solutions for a Thriving Planet

Amid escalating ecological challenges, geopolitical tensions and a profound need for spiritual renewal, the World of Blue emerges as a beacon of hope and innovation. Our core initiatives — BlueForest, BlueHaven & BlueRetreat — are powered by the revolutionary capabilities of blockchain and tokenization. We are dedicated to addressing critical issues from environmental conservation and self-sufficient, resilient living to spiritual renewal and personal well-being.

Our mission, rooted in the philosophy of ‘think global, act local’, starts with impactful projects in Panama, but is designed to expand to other stunning and stable beachfront regions in the Caribbean.","Subdivision of Land","51-200 employees","Privately Held",,,"worldof.blue","https://www.linkedin.com/company/world-of-blue"
,"Imperial Auto Recycling Consortium","LLC to develop land for Automotive related services with heavy emphasis in auto recycling and related services.","Subdivision of Land","11-50 employees","Partnership","Imperial, California","United States","imperialautoconsortium.com","https://www.linkedin.com/company/imperial-auto-recycling-consortium"
,"Rooster Capital LLC",,"Subdivision of Land","2-10 employees","Privately Held",,,"drew-haney.com","https://www.linkedin.com/company/rooster-capital-llc"
,"TOR DEVELOPMENT HUB","- Rezoning
    (e.g., changing land from residential to business rights)
- Township Establishments
- Subdivision and Consolidation of properties
- Consent Use Applications
    (e.g., for crèches, churches, community halls)
- Permission Applications
    (e.g., for spaza shops and informal businesses)
- Removal of Title Deed Restrictions
- Excision of Land from Agricultural Holdings
- Site Development Plans (SDPs)
- Building Plans
   (submission, circulation and approval)","Subdivision of Land","2-10 employees","Public Company",,,,"https://www.linkedin.com/company/tor-development-hub"
,"Fertile Grounds",,"Subdivision of Land","2-10 employees","Non Profit",,,"fertilegrounds.us","https://www.linkedin.com/company/fertilegrounds"
,"Chávez Topografía","Empresa dedicada al servicio de topografia, tramites legales, diseños y valuos de terrenos y propiedades en El Salvador.","Subdivision of Land","2-10 employees","Self Employed",,,,"https://www.linkedin.com/company/chavez-topografía"
,"IMMOBILIER & NTIC","Immobilier - Lotissement - TIC.","Subdivision of Land","11-50 employees","Privately Held",,,,"https://www.linkedin.com/company/immobilier-ntic"
,"Grupo Aliada","Especialista em inovação que leva a criatividade e a visão como um guia para o sucesso, com mais de 13 anos de experiência no ramo imobiliário e de construção civil, tendo atendido mais de 1.100 clientes, realizando sonhos e projetos de sucesso.

Sua história começou quando o presidente do Grupo Henrique Marcon fundou a Aliada imóveis atendendo uma ampla gama de casas, apartamentos, terrenos e galpões; Posteriormente o presidente migrou para o ramo de loteamentos; loteando com terrenistas parceiros e em terrenos próprios, com o foco em áreas comercias e empresariais; com o sucesso, o então presidente decidiu investir em maquinários e mão de obra especializada para produção e montagem de salas comerciais e galpões pré-moldados, atendendo a demanda de Tubarão e região.

Buscamos sempre os melhores resultados, focamos na eficiência, produtividade e qualidade, comprometidos com clientes, fornecedores e colaboradores, agimos de forma ética e profissional.

Desejamos atender da melhor maneira, moldando nossa forma de como pensamos e agimos, criar e proporcionar uma vida mais tranquila e proveitosa e fortalecer nossas parcerias com fraternidade e
lealdade.","Subdivision of Land","11-50 employees","Privately Held",,,"aliadaurbanismo.com.br","https://www.linkedin.com/company/grupo-aliada"
,"Vale das Palmeiras","O Vale das Palmeiras é um loteamento residencial, situado em uma localização privilegiada que oferece uma experiência única de moradia. Com uma infraestrutura pensada para proporcionar conforto e qualidade de vida, o Vale das Palmeiras destaca-se não apenas como um lugar para se viver, mas como um investimento sólido no mercado imobiliário macaense.","Subdivision of Land","11-50 employees","Partnership",,,"loteamentovaledaspalmeiras.com.br","https://www.linkedin.com/company/residencial-vale-das-palmeiras"
,"Big Springs Village","Nestled in the breathtaking beauty of Island Park, Idaho, Big Springs Village offers exclusive cabin lots designed for families, investors, and outdoor enthusiasts. Located just minutes from Yellowstone National Park, our lots provide the perfect foundation for your dream cabin, rental property, or legacy home. With years of experience in land development, we make investing in your future simple, seamless, and rewarding.","Subdivision of Land","2-10 employees","Partnership","Island Park, ID","United States","bigspringsvillage.info","https://www.linkedin.com/company/big-springs-village"
,"Lotificación El Socorro","""Lotificacion El Socorro"" is a family-owned business founded by my father 10 years ago to bring affordable land ownership in La Libertad, El Salvador. I joined the board to contribute with my management knowledge to help in the continuity, succession, and sustainability of ""Lotificación El Socorro"" for the next 20 years.
201,828 m² / 288,776 v² / 20 hectares / 550 lots","Subdivision of Land","11-50 employees","Privately Held",,,,"https://www.linkedin.com/company/lotificacionelsocorro"
,"McKinney Land Surveying, LLC","We are a land surveying company dedicated to providing all of our clients land surveying needs.","Subdivision of Land","2-10 employees","Privately Held","Keystone, Indiana","United States","mckinneysurveying.com","https://www.linkedin.com/company/mckinney-land-surveying-llc"
,"Smith Land Company",,"Subdivision of Land","2-10 employees","Privately Held","Oklahoma City, OK","United States","landsmith.us","https://www.linkedin.com/company/smithlandco"
,"Geo360 Land Surveyors",,"Subdivision of Land","2-10 employees","Privately Held",,,,"https://www.linkedin.com/company/geo360-land-surveyors"
,"A.G. Land Co.",,"Subdivision of Land","Self-employed","Self Employed",,,,"https://www.linkedin.com/company/a-g-land-co"
,"mcl Contracting Limited","We are a specialist “one stop shop” for developers, lifestyle, residential, and rural property owners providing all the necessary skills, equipment and advice to service your property.

With an extensive portfolio of works completed, we are proud to be able to capably deliver projects for anything you require. With our commercial and subdivision experience, and a great working relationship with local councils, we are the perfect fit for any development.","Subdivision of Land","11-50 employees","Privately Held","West Melton, Canterbury","New Zealand","mclcontracting.co.nz","https://www.linkedin.com/company/mcl-contracting-limited"
,"Its Just Land","Our unique approach focuses on acquiring land without making improvements, allowing us to capitalize on the inherent value of the land itself.

We have mastered the art of identifying hidden gems in the real estate market. By employing expert analysis and market insights, we acquire undervalued properties in areas that are often overlooked or underestimated. Our strategic approach enables us to secure these properties at favorable prices, providing an opportunity for substantial returns on investment.

Our investment strategy revolves around undervalued markets and properties with perceived undesirable characteristics. While others may view these properties as challenges, we see them as hidden opportunities. Through thorough evaluation of zoning regulations, environmental considerations, and access to utilities, we identify creative solutions and potential development avenues.

Investing in our land company offers several advantages. Firstly, it provides a diversified portfolio addition. Land investments historically exhibit low correlation with other asset classes, mitigating risk and enhancing overall portfolio performance. Secondly, our focus on undervalued markets and properties presents an opportunity for significant capital appreciation as these areas experience growth and increased demand over time.

Our streamlined approach ensures efficient operations and cost-effective management. By eliminating the need for improvements, we minimize overhead expenses, allowing us to pass on higher returns to our valued investors.

Looking into the future to keep growing and expanding we will be joining efforts with a higher number of investors that are looking for oppurtinites where cash flow is a priority. The company will be having several open spots for investors that would like to partner up with us allowing the company to keep expanding while making everyone money.","Subdivision of Land","2-10 employees","Privately Held",,,"itsjustlandusa.com","https://www.linkedin.com/company/its-just-land"
,"TinyRoof",,"Subdivision of Land","201-500 employees","Privately Held",,,"tinyroof.com.tr","https://www.linkedin.com/company/tinyroof"
,"blocplus.com.au","Bloc+ is an innovative land sales platform designed to help Property Developers, Builders and Sales agents sell land faster.

Using a transparent sales process and a real-time mapping system, bloc+ connects developers with Sales Agents and Builders and enables them to list new land estates and available lots. Developers can sell lots internally through their own sales teams or collaborate with multiple Real Estate Agents and builders, in real-time!","Subdivision of Land","2-10 employees","Partnership","Geelong, VIC","Australia","blocplus.com.au","https://www.linkedin.com/company/bloc-plus-au"
,"Casper Development","Casper Development is a leading land development and investment firm specializing in creating value from raw land.","Subdivision of Land","2-10 employees","Privately Held",,,"casperdevelop.com","https://www.linkedin.com/company/casper-development"
,"Britto's Biosphere Incorporated","IN THIS COMPANY THERE ARE LOTS OF LIVING BEINGS, SUCH AS ANIMALS AND THERE ARE EVEN NON-LIVING BEINGS, LIKE STONES AND WIND AND THE SUN AND ITS COUNTERPART THE MOON!","Subdivision of Land","10,001+ employees","Public Company",,,,"https://www.linkedin.com/company/britto-biosphere-incorporated"
,"DL.SION SARL","Nous somme une entreprise  d'aménagement de lotissement, vente de parcelle et construction","Subdivision of Land","2-10 employees","Self Owned","Conakry","Guinea",,"https://www.linkedin.com/company/dl-sion-sarl"
,"Groupe Arcival",,"Subdivision of Land","2-10 employees","Privately Held",,,"arcival.com","https://www.linkedin.com/company/groupe-arcival"
,"Adore Mt Barker","At Adore Mt. Barker you’ll enjoy a closeness to everything that will contribute to building a great future in the heart of the Adelaide Hills -- start building a home you'll love and an idyllic life in the largest town in the Adelaide Hills.","Subdivision of Land","2-10 employees","Public Company","Kent Town, South Australia","Australia","adoremtbarker.com.au","https://www.linkedin.com/company/adore-mt-barker"
,"Land Development Academy","Land Development Academy  | Learn how to make 6 figures from planning permission

www.landdevelopmentacademy.co.uk","Subdivision of Land","2-10 employees","Privately Held",,,"landdevelopmentacademy.co.uk","https://www.linkedin.com/company/land-development-academy"
,"Richard Vento Land Surveying, PLLC","As a New York State licensed land surveyor and owner of Richard Vento Land Surveying, PLLC, I specialize in delivering precise, reliable surveying services tailored to meet the unique needs of residential, commercial, and municipal clients. With a strong commitment to accuracy, integrity, and professionalism, my firm provides comprehensive land surveying solutions that support informed decision-making and successful project outcomes.

Whether you require boundary surveys, topographic mapping, construction staking, or subdivision planning, Richard Vento Land Surveying, PLLC offers expert guidance and dependable results backed by extensive experience and state-of-the-art technology. My goal is to build lasting relationships based on trust and exceptional service, helping clients navigate their land development projects with confidence.","Subdivision of Land","2-10 employees","Self Employed","Westbury, 106 Aspinwall St","United States",,"https://www.linkedin.com/company/richard-vento-land-surveying-pllc"
,"Aonikenk Patagonia",,"Subdivision of Land","2-10 employees","Partnership",,,"aonikenkpatagonia.com","https://www.linkedin.com/company/aonikenk-patagonia"
,"Centro Empresarial Bandeirantes","Terrenos para Logística, Indústria e Serviços na Região Metropolitana de Campinas às margens da Rodovia SP 101 Km 15,2, com infraestrutura completa, portaria com controle de acesso, incentivos fiscais, preço justo e amplas facilidade de pagamento, consulte Tel: 19 9 9796 2520","Subdivision of Land","2-10 employees","Privately Held","Monte Mor, SP","Brazil","empresarialbandeirantes.com.br","https://www.linkedin.com/company/centro-empresarial-bandeirantes"
,"PG Surveying & Spatial Engineering Services","Professional Land Survey Services in Davao City.","Subdivision of Land","Self-employed","Self Owned","Davao City","Philippines",,"https://www.linkedin.com/company/pgessdavao"
,"acc-chile","Somos una empresa familiar creada el 2012, que comenzó asesorando a pymes y emprendimientos en finanzas y en administración. 
Desde el año 2018 estamos enfocados en subdividir y lotear terrenos","Subdivision of Land","2-10 employees","Self Owned",,,,"https://www.linkedin.com/company/acc-chile"
,"Monashee Ridge",,"Subdivision of Land","2-10 employees","Partnership",,,"monasheeridge.com","https://www.linkedin.com/company/monasheeridge"
,"NATURB DESENVOLVIMENTO URBANO LTDA",,"Subdivision of Land","2-10 employees","Privately Held",,,"naturb.com.br","https://www.linkedin.com/company/naturb-desenvolvimento-urbano-ltda"
,"Troika Services","Land Development and Subdivisions - Development Partner","Subdivision of Land","2-10 employees","Privately Held",,,"troika.co.nz","https://www.linkedin.com/company/troika-services"
,"Urban Land Management",,"Subdivision of Land","2-10 employees","Privately Held",,,"urbanlandmgmt.com","https://www.linkedin.com/company/urban-land-management-tx"
,"Gran Reserva Los Encinos","Lotes rurales desde 5,000 m² en San Miguel de Allende. Naturaleza, calma y tradición en un rancho con esencia mexicana.","Subdivision of Land","2-10 employees","Self Employed",,,"vivanterg.com","https://www.linkedin.com/company/gran-reserva-los-encinos"
,"LANDEV",,"Subdivision of Land","2-10 employees","Privately Held",,,"landev.au","https://www.linkedin.com/company/landevau"
,"Land Ally","Land Ally is a real estate investment firm specializing in nationwide land acquisitions. We provide a simple, fast, and reliable solution for property owners looking to sell their land without the hassle, fees, and delays of the traditional real estate market.

Our mission is to help landowners navigate complex life situations with ease and confidence. Whether you have inherited a property, are facing financial pressure, going through a divorce, or simply wish to liquidate an unwanted asset, we offer a compassionate and professional alternative.

The Land Ally Advantage: ✓ Sell As-Is: No need for costly repairs or cleanup. ✓ Zero Fees or Commissions: We cover all closing costs. ✓ Fast, Fair Cash Offers: Receive a no-obligation offer in 24 hours and close in as little as 30 days.

We offer flexible solutions tailored to your needs, including immediate cash buyouts, seller financing (""terms""), and development partnerships. By putting transparency and integrity at the forefront of everything we do, we are committed to becoming America's most trusted partner for landowners.

If you're ready for a stress-free way to sell your land, contact us today to learn how we can help.","Subdivision of Land","2-10 employees","Partnership","Greenville, SC","United States","landally.com","https://www.linkedin.com/company/land-ally"
,"AWP Group","We work in the acquisition of land and the processes that go into development of sites up and down the country.","Subdivision of Land","2-10 employees","Privately Held","Chelmsford, England","United Kingdom","awp-group.co.uk","https://www.linkedin.com/company/awp-land-property-group"
,"Twin Cities Land Development","From quaint suburban enclaves to sprawling master-planned communities, each project reflects our unwavering commitment to respecting and optimizing the land while incorporating thoughtful development practices.","Subdivision of Land","2-10 employees","Privately Held","Golden Valley, MN","United States","tclanddev.com","https://www.linkedin.com/company/twin-cities-land-development"
,"marshal melbourne","At marshal, we transform development visions into thriving, commercially successful subdivisions.
Partnering with developers to deliver projects that are strategically planned, expertly managed, and precisely executed.
 
Our strength lies in our integrated, in-house expertise:
 
Town Planning – unlocking development potential with insight and foresight
 
Urban Design – shaping subdivision layout, considering all stakeholder needs
 
Surveying – delivering accuracy from the ground up
 
Civil Engineering – practical, efficient, and future-ready solutions
 
Project Management – keeping every stage on track and on budget
 
With a singular focus on outcomes, we provide clear leadership, decisive problem-solving, and the confidence that your project will progress seamlessly from vision to reality.
We don’t just manage projects — we champion them.
 
On time. On budget. Without compromise.","Subdivision of Land","11-50 employees","Public Company","Melbourne, Victoria","Australia","marshal.melbourne","https://www.linkedin.com/company/marshal-melbourne"
,"Clearland Equipment","Land improvement company.","Subdivision of Land","2-10 employees","Partnership","Fredericksburg, Texas","United States","clearlandequipment.com","https://www.linkedin.com/company/clearlandequipment"
,"Vermessungsbüro Schwindt","Als Öffentlich bestellter Vermessungsingenieur helfe ich aktuellen und potentiellen Grundstückseigentümern in Baden-Württemberg bei Grundstücksverkehr und Sicherung des Eigentums an diesen, indem ich die Katasterleistungen erbringe.","Subdivision of Land","11-50 employees","Privately Held","Calw, Baden-Württemberg","Germany","vermessung.xyz","https://www.linkedin.com/company/schwindt"
,"Bussolaro Empreendimentos","Há 11 anos construindo sonhos e transformando cidades!

A Bussoalro Empreendimentos atua no setor de incorporação imobiliária e está presente em Sinop, Nova Mutum e Guarantã do Norte (MT), contribuindo ativamente para o desenvolvimento urbano dessas regiões.
Nosso propósito é claro: viabilizar a conquista de sonhos, com empreendimentos que unem qualidade, inovação e compromisso com as pessoas.
Nossos valores — coragem, honestidade, agilidade, inovação e cuidado com o próximo — guiam cada decisão, do projeto à entrega. Acreditamos que cada empreendimento é uma oportunidade de impactar positivamente a vida das pessoas e das comunidades onde atuamos.
Contamos com uma equipe experiente, comprometida e sempre em busca de soluções inovadoras que superem expectativas e gerem valor real.

Na Bussolaro, não construímos apenas imóveis. Construímos histórias. Realizamos sonhos.","Subdivision of Land","51-200 employees","Privately Held","Sinop, Mato Grosso","Brazil","bussolaroempreendimentos.com.br","https://www.linkedin.com/company/bussolaroempreendimentos"
,"Tripp Andrews","SURVEYORS | PLANNERS | ENGINEERS – shaping New Zealand since 1921.
Tripp Andrews offers urban and rural subdivision planning, design, and project management throughout Auckland and Waikato. Full-service land development, unrivaled know-how.","Subdivision of Land","11-50 employees","Privately Held","Auckland, AUK","New Zealand","trippandrews.co.nz","https://www.linkedin.com/company/tripp-andrews"
,"PlotsChain","We’re building a tech-first platform to solve some of India’s most critical land challenges, including land fragmentation, illegal occupation, and the absence of centralized and tamper-proof land records.

By leveraging the power of AI, blockchain, and GIS mapping, we're creating a transparent, secure, and accessible system that empowers landowners, prevents disputes, and supports better governance.

We are currently in our MVP stage and actively seeking passionate developers, innovators, and early contributors to join us in this mission-driven journey.","Subdivision of Land","2-10 employees","Privately Held","Bangalore , Karnataka","India",,"https://www.linkedin.com/company/plotschain"
,"AELO – Associação das Empresas de Loteamento e Desenvolvimento Urbano","A AELO – Associação das Empresas de Loteamento e Desenvolvimento Urbano, com sede na cidade de São Paulo, reúne atualmente quase mil empresas associadas de 19 Estados, que atuam na missão de propiciar moradias para milhões de pessoas e aprimorar cidades em todo o Brasil.","Subdivision of Land","2-10 employees","Partnership","São Paulo , SP","Brazil","aelo.com.br","https://www.linkedin.com/company/aelo-associacao-das-empresas-de-loteamento-e-desenvolvimento-urbano"
,"Badan Bank Tanah","Badan Bank Tanah ini dibentuk oleh pemerintah pusat sebagai badan khusus yang diberi kewenangan khusus untuk mengelola tanah. Tanah yang kita kelola tentu harus dimanfaatkan dengan sebaik-baiknya bagi masyarakat dan negara. Kita ingin Bank Tanah ini dapat berkontribusi besar dalam terciptanya ekonomi berkeadilan melalui optimalisasi pengelolaan asset tanah yang kami miliki.","Subdivision of Land","51-200 employees","Government Agency","Jakarta Pusat, DKI Jakarta","Indonesia","banktanah.id","https://www.linkedin.com/company/badan-bank-tanah"
,"ARCH Empreendimentos","Empresa especializada em Loteamentos planejado , buscando sempre por excelência e sustentabilidade em cada projeto.","Subdivision of Land","2-10 employees","Privately Held","Patos de Minas, Minas Gerais","Brazil","onls.link","https://www.linkedin.com/company/archempreendimentos"
