"Find companies","Name","Description","Primary Industry","Size","Type","Location","Country","Domain","LinkedIn URL"
,"Telium Networks","A Telium, criada em 2004 para atender exclusivamente o mercado B2B, atende os segmentos de Telecom e IDC com infraestrutura de padrão internacional, totalmente adequada e otimizada para o tráfego de dados, voz e imagem.

A TELIUM oferece em seu portfólio soluções de Cloud Computing em plataforma 100% nacional, distribuída em 6 IDCs próprios (São Paulo, Porto Alegre, Rio de Janeiro, Santos,  Campinas e Belo Horizonte), soluções de Telefonia Digital como PABX-IP e VoIP e, principalmente, uma ampla rede própria de links dedicados de internet, com dezenas de quilômetros de fibra ótica.
Nossos Datacenters asseguram alto índice de disponibilidade com políticas internas que proporcionam melhor desempenho, segurança e aumento de produtividade com confiabilidade.

Desde 2010 a TELIUM segue as boas práticas ITIL, o que permite contínua melhora na prestação de serviços.","Telecommunications Carriers","201-500 employees","Privately Held","São Paulo, SP","Brazil","telium.com.br","https://www.linkedin.com/company/telium-networks"
,"Groupe iliad","Created in the early 1990s, the iliad Group is the inventor of the world’s first triple-play box and has grown into a major European telecoms player, standing out for its innovative, straightforward and attractive offerings. 

The Group is the parent of Free in France, iliad in Italy and Play in Poland, has over 16,500 employees serving 45.3 million subscribers, and generated €7.6 billion in pro forma revenues in 2021. 

In France, the Group is an integrated Fixed and Mobile Ultra-Fast Broadband operator and had over 21.2 million retail subscribers at September 30, 2022. On March 23, 2021, the iliad Group launched its BtoB business in France under the Free Pro brand.

In Italy – where the Group made its entry in 2018 under the iliad brand, becoming the country’s fourth mobile operator – it had over 9.4 million subscribers at end-September 2022. 

With the acquisition of Polish mobile operator Play in November 2020, which currently has 14 million subscribers, the iliad Group became Europe’s sixth-largest mobile operator by number of subscribers.","Telecommunications Carriers","10,001+ employees","Partnership","Paris","France","iliad.fr","https://www.linkedin.com/company/groupe-iliad"
,"Greenwave Systems Inc - Wavely","Our goal is to connect customers seamlessly to any IoT device, anywhere in the world. To achieve this, we partner with 500 of the world’s leading mobile carriers covering 180 countries and territories.

We are empowering service providers and IoT stakeholders to develop richer networks, smarter services and connected devices with the Wavely Platform.

Greenwave Systems is a privately held, VC-backed company with offices in Irvine, California, Copenhagen, Denmark and Helsinki, Finland.","Telecommunications Carriers","11-50 employees","Privately Held","Irvine, California","United States","wavely.io","https://www.linkedin.com/company/greenwave-systems-inc"
,"Integrated Dawiyat","تأسست شركة ضوئيات المتكاملة للاتصالات و تقنية المعلومات، المملوكة بالكامل للشركة السعودية للكهرباء، في عام 2018 وذلك بهدف الاستثمار الأمثل لموارد الشركة في مجال منظومة الالياف الضوئية واسعة الانتشار التي تملكها الشركة وتغطي أكثر من 100 ألف كيلو متر على مستوى المملكة بما في ذلك القرى والهجر والحدود واستخدامها لتغطية و توفير خدمات اتصالات متكاملة وتحسين جودة وسرعة الانترنت في المملكة بما يحقق رؤية المملكة2030 وبرنامج التحول الوطني 2020 الذي اشتمل على العديد من المبادرات في هذا الجانب ومن ابرزها مبادرة نشر النطاق العريض وايصال الالياف الضوئية للمنازل"".
وادراكا من شركة ضوئيات المتكاملة للاتصالات و تقنية المعلومات لهذه الفرص والتحديات فقد بادرت منذ انشائها بالرفع لهيئة الاتصالات وتقنية المعلومات بطلب عدة تراخيص. وحصلت على تراخيص منها لخدمة تأجير مرافق الاتصالات "" CSP"" واستضافة معدات المعلومات ""DHP""، بالإضافة الى ترخيص مزود خدمات انترنت ""ISP"". وبادرت شركة ضوئيات المتكاملة للاتصالات و تقنية المعلومات بتأجير جزء من 
الالياف الضوئية على عدد من شركات الاتصالات إضافة الى كبار العملاء والشركات الكبرى بالمملكة.","Telecommunications Carriers","11-50 employees","Public Company","ALRIYADH, Riyadh","Saudi Arabia","dawiyat.com.sa","https://www.linkedin.com/company/dawiyat"
,"DTEL TELECOM","Desde 2008, temos o propósito de levar conectividade para famílias e empresas brasileiras, construindo um futuro ainda mais conectado! No LinkedIn, a Dtel conecta talentos à inovação e busca novos profissionais para evoluirmos juntos! Acompanhe nossos projetos, cultura e vagas para fazer parte de um time que transforma vidas com tecnologia!","Telecommunications Carriers","501-1,000 employees","Privately Held","Vitória de Santo Antão, PE","Brazil","dtel.com.br","https://www.linkedin.com/company/dtel-telecom"
,"Net-Connect Group","Net-Connect Group has been a major player in wholesale voice services since the very beginning of the liberalization of the Romanian market in year 2003. Net-Connect was the first telecommunications operator to establish an interconnection with Telekom Romania and the first Romanian operator to establish a presence in Frankfurt for international connectivity.

Net-Connect operates in 14 countries worldwide through locally licensed companies and direct interconnections with local telecommunications operators.

We specialize in wholesale voice and SMS exchange and corporate clients and define our services by high quality and competitive pricing. Having direct national interconnections through an established POP in every country, Net-Connect ensures full stability and flawless connectivity for all of your traffic.

Since 2023, NetConnect also began a series of innovative projects in the A.I. world, through NConnect.AI","Telecommunications Carriers","51-200 employees","Privately Held","Limassol","Cyprus","netconnect.com.cy","https://www.linkedin.com/company/net-connect-group"
,"Parlem","Parlem is the new generation service provider which is really customer centric. Parlem HQ are based in Barcelona from where it offers innovative telecommunication services focusing on Catalan market. Parlem is offering currently Mobile communications to individuals and both mobile, fix and ADSL/FTTH services to enterprise. Parlem offers SIM and cloud based services through its innovative App and allows its customers to enjoy Visual Voice Mail, Virtual lines and VoIP ultimate client solutions","Telecommunications Carriers","51-200 employees","Privately Held","Barcelona","Spain","parlem.com","https://www.linkedin.com/company/parlem"
,"Celcom S.A.","Celcom es una empresa de Marketing Móvil y un integrador de mensajería corta (SMS) que está interconectada directamente con los operadores móviles, Movistar, Entel, Claro, VTR, Virgin, WOM, Telsur y GTel. 

En Celcom facilitamos el acceso de empresas, instituciones, personas, a la base de usuarios celulares de Chile. Esto significa que entregamos un alcance del 100% de la población en Chile, a través de un medio de bajo costo, trazable e interactivo como son los SMS.

En Celcom realizamos campañas de marketing móvil vía SMS y en el área de telefonía móvil, desarrollamos sitios web para móviles, sitios web responsive y aplicaciones para smartphones iOS y Android, entre otros. 

También ofrecemos servicios de televisión interactiva, suscripciones de contenido y mensajería corporativa. Asimismo nuestras soluciones permiten transacciones de micropago utilizando un teléfono móvil.

Nuestro servicio se basa en una estrecha relación con nuestros clientes, ofreciendo múltiples alternativas para responder idealmente de manera personalizada a las necesidades de cada uno y sus exigencias.

Nos adscribimos a los códigos de conducta de la MMA http://mmaglobal.com (Mobile Marketing Association) y somos miembros de la IAB http://iab.cl (Interactive Advertising Bureau), siendo garantes de las mejores prácticas de marketing digital.

Contáctanos!, vamos a estar felices de poder ayudarte.

Equipo Celcom","Telecommunications Carriers","11-50 employees","Privately Held","Santiago","Chile","celcomlatam.com","https://www.linkedin.com/company/celcomlatam"
,"ACMOSS - Agence des communications mobiles opérationnelles de sécurité et de secours","L’agence des communications mobiles opérationnelles de sécurité et de secours (ACMOSS) est un établissement public national à caractère administratif, sous la tutelle du ministre de l’Intérieur. 

Créée par décret le 30 mars 2023, l’ACMOSS est chargée de la mise en œuvre et de l’opération du Réseau Radio du Futur (RRF). 

Le RRF est un réseau de télécommunications numérique ayant vocation à remplacer les réseaux de télécommunications utilisés par les services publics français (polices nationale et municipales, gendarmerie, pompiers, SAMU, douaniers, administrations pénitentiaires, Préfectures ...) à partir d'avril 2025.

Ainsi, le RRF dotera les acteurs de la sécurité et du secours français d’un système de communication commun, prioritaire, sécurisé et haut débit bénéficiant des meilleures technologies numériques et d’un haut niveau de résilience en cas de crise.

L'ACMOSS est présente sur X/Twitter : @ACMOSS_FR","Telecommunications Carriers","51-200 employees","Government Agency","Courbevoie, Île-de-France","France","acmoss.fr","https://www.linkedin.com/company/acmoss"
,"Ycorp","Reimagine mobile services...","Telecommunications Carriers","11-50 employees","Privately Held","London, England","United Kingdom","ycorp.io","https://www.linkedin.com/company/ycorporationlimited"
,"PTCL | UFONE Business Solutions","PTCL | UFONE is the largest integrated Information Communication Technology (ICT) company in Pakistan that offers a variety of plans for Small and Medium Enterprises, including Universal Access Numbers (UAN), Postpaid & Prepaid Golden Numbers and Business & Promotional SMS services. PTCL | Ufone is also a partner of Etisalat Group, which is a leading telecommunication company in the United Arab Emirates. With a wide range of plans and services, PTCL | Ufone is a reliable service provider for SMEs.","Telecommunications Carriers","10,001+ employees","Public Company","Islamabad, Islamabad Capital Territory","Pakistan","ufone.com","https://www.linkedin.com/company/ptcl-ufone-business-solutions"
,"Open Broadband LLC","Open Broadband is an Internet Service Provider, offering a hybrid Fiber and Wireless last-mile broadband service to underserved areas.  We also offer managed Wi-Fi zones for downtowns, parks, campuses, and apartments.  Fast 50 winner 2021, 2022, 2023, InnoVision winner 2023, Blue Diamond Award 2023.

Headquartered just outside Charlotte, NC, we are currently engaged with communities throughout the Carolinas, Virginia, and Florida. We've been ranked in the Charlotte Business Journal Fast 50 growing company list in 2021, 2022, and 2023

We specialize in working with a city/county to form a public-private partnership (PPP) to leverage existing assets such as towers, street lights, and existing fiber. We customize each PPP in one of the following ways:
1.	Open Broadband investment, public facilitation
2.	Open Broadband execution, public funding
3.	Shared investment and risk

Open Broadband offers a unique solution consisting of:
•	Highly experienced data and telecom experts, who have been responsible for community networks, and know how to make them work.
•	Experience in working with local governments.
•	Open and flexible in solutions. We are not tied down to specific product sets.
•	Local service, familiar with all aspects of how to deploy broadband.
•	Open to new public-private partnership models.
•	Exceptional communications skills: being able to speak at the level of all stakeholders.

We are Open to new ideas and new models to provide high-speed broadband services to local communities and help close the digital divide. Large telecom companies are investing in large cities, but they often ignore smaller communities and rural areas. Open Broadband helps fill in the gaps, assisting communities in obtaining greater broadband solutions.

Contact us at info@openbb.net.","Telecommunications Carriers","11-50 employees","Privately Held","Waxhaw, NC","United States","openbb.net","https://www.linkedin.com/company/open-broadband"
,"iconnect S.A.S","Iconnect is a global telecom provider specialising in high-performance voice and messaging solutions. With a presence across multiple continents and a network of trusted interconnections, we enable MNOs, MVNOs, and enterprise companies to communicate seamlessly across borders.
Built on a foundation of precision, trust, and technical excellence, our services are engineered to meet the demands of today’s dynamic telecom landscape. From A-Z voice termination to compliant global SMS delivery, every route we manage is backed by 24/7 support, direct MNO access, and robust quality controls.
At Iconnect, every connection we enable is a commitment to quality, trust, and scale.","Telecommunications Carriers","11-50 employees","Privately Held","Paris","France","iconnect.global","https://www.linkedin.com/company/iconnectglobal"
,"Orient Telecom","شركة مختصة في مجال الاتصالات والانترنت","Telecommunications Carriers","201-500 employees","Self Employed","بغداد, بغداد","Iraq","orient.iq","https://www.linkedin.com/company/orient-tele"
,"Dotgo","Dotgo is a global leader in RCS solutions & services, empowering carriers and aggregators to deploy, manage and monetize Rich Communication Services (RCS). Our platforms - RBM Hub and the Dotgo MaaP handle more than 1 billion RCS traffic globally.

Embracing the paradigm shift to OTT apps for business messaging that is underway, Dotgo is building the technology and services needed in a world where every business must have a presence inside messaging apps, just as they had web sites and smartphone apps.  RCS, Google Maps, iMessage, and WhatsApp are fast becoming the de-facto standards for business messaging for brands, offering exciting possibilities for customer engagement.  Dotgo enables mobile operators to make RCS business messaging a reality, and enables brands and developers to incorporate OTT business messaging into their DNA.  

Our innovations include the Dotgo Bot Store, the patent pending RichOTP, RBM Managed Services, and chatbots.  For more information, visit www.dotgo.com.

Dotgo, Bot Store, and RichOTP are registered trademarks of Dotgo Systems Inc. in USA and other jurisdictions.","Telecommunications Carriers","51-200 employees","Privately Held","Berkeley Heights, New Jersey","United States","dotgo.com","https://www.linkedin.com/company/dotgo"
,"Groupe Action Télécom","Architecte du numérique depuis 2004, le Groupe Action Télécom accompagne les entreprises dans la conception, l’évolution et la sécurisation de leurs environnements numériques.

Implantés en Nouvelle-Aquitaine et Occitanie, nous plaçons la proximité, la rigueur et la qualité d’exécution au cœur de chaque projet.

𝐍𝐨𝐭𝐫𝐞 𝐦𝐞́𝐭𝐢𝐞𝐫 :
Connecter, Communiquer, Collaborer, Héberger, Sécuriser et Administrer les systèmes d’information de nos clients, avec une approche claire, utile et durable.

Plus de 20 ans d’expertise, 5 agences, 40 collaborateurs et 800 entreprises accompagnées.

Nous ne vendons pas des technologies. Nous architecturons des environnements numériques pensés pour durer.","Telecommunications Carriers","51-200 employees","Self Owned","Roquefort, Nouvelle-Aquitaine","France","actiontelecom.fr","https://www.linkedin.com/company/groupeactiontelecom"
,"Groupe Action Télécom"," Le Groupe AT c'est 19 ans d’expérience au service des TPE/ PME en Nouvelle Aquitaine et Occitanie. Spécialiste des télécoms, des réseaux et des infrastructures informatiques, la diversification du Groupe nous emmène à intervenir sur les problématiques voix, data et image de nos clients.

 Nous sommes opérateurs télecom avec plus de 400 clients connectés depuis 2017. 
Nous proposons notre hébergement privé depuis 2020.

 Nous réfléchissons à vos enjeux économiques, au bon niveau de performance et nous vous poussons les nouvelles technologies en apportant les usages de demain.

NOS DOMAINES D'INTERVENTION :
 Opérateur
 Téléphonie
 Data ( Cloud privé, public, Cybersécurité, Infogérance)
 Formation
 Visioconférence

Visitez notre site : www.actiontelecom.fr/ 
Suivez-nous sur Facebook : https://www.facebook.com/actiontelecomagen/
Suivez-nous sur Twitter : https://twitter.com/ctionTelecom 

","Telecommunications Carriers","51-200 employees","Self Owned","Roquefort, Nouvelle-Aquitaine","France","actiontelecom.fr","https://www.linkedin.com/company/groupeat-actiontelecom-visiolib"
,"SOLIS","Somos uma Operadora Privada Móvel de LTE 4G NB-IoT e MVNO dedicada ao Agronegócio para Prestação de Serviços de Conectividade, associada a ConectarAgro e regulamentada pela Anatel.

Nossa missão é impulsionar a Agricultura 4.0 a partir de uma cadeia de fornecimento verticalizada nos modelos de negócios OPEX que inclui ""Infraestrutura, Licenciamentos e Conectividade com Operação 24x7"" para a as empresas agrícolas vencer o grande desafio de desenvolvimento no campo através dos recursos tecnológicos e digitais mais atuais existentes hoje e já disponível!","Telecommunications Carriers","51-200 employees","Privately Held","Goiânia, Goiás","Brazil","solistower.com","https://www.linkedin.com/company/solisconnect"
,"DATACENTER BOGOTA","Datacenter Bogotá es una empresa con experiencia, dedicada a impulsar el éxito de su compañía mediante soluciones virtuales innovadoras. Nuestro modelo de teletrabajo nos permite ofrecer servicios eficientes y personalizados que se adaptan a las necesidades específicas de su negocio.

Creemos en la sinergia entre tecnología y talento humano para optimizar procesos y elevar la calidad del servicio. Nuestros altos estándares de calidad garantizan que superaremos sus expectativas de apoyo empresarial, generando ahorros significativos y aumentando la eficiencia de su personal.

Nos especializamos en desarrollar y procesar de manera eficaz bases de datos relacionadas con sus bienes, productos, servicios y clientes, contribuyendo al crecimiento y consolidación de su empresa en el mercado.","Telecommunications Carriers","51-200 employees","Privately Held","Bogota","Colombia","datacenterco.net","https://www.linkedin.com/company/datacenterco"
,"Hanab Telecom Infra","Telecom infra verbindt mensen en bedrijven door de aanleg en beheer van ondergrondse netwerken, met focus op kwaliteit, veiligheid en langdurige samenwerking.","Telecommunications Carriers","501-1,000 employees","Public Company","Nieuwegein, Utrecht","Netherlands","hanab.nl","https://www.linkedin.com/company/hanab-telecom-infra"
,"Stalwart Enterprises","We are a sales organization specialized in transportation and Logistics. Stalwart Enterprises is a leading transportation and logistics agency that offers top-notch solutions to businesses and individuals. With a strong focus on reliability, efficiency, and customer satisfaction, we ensure that every shipment is handled with the utmost care and delivered on time.
Our team of experts has years of experience in the industry, and we use the latest technology to streamline logistics and make transport hassle-free for our Clients. Join us today and make your success story with ""STALWART""","Telecommunications Carriers","11-50 employees","Privately Held","Lahore, Punjab","Pakistan",,"https://www.linkedin.com/company/stalwart-enterprises"
,"WIOCC Group","We have invested >US$750m in deploying digital infrastructure into Africa, fundamentally changing the cost, reliability and nature of communications on the continent.

Group companies and brands include WIOCC, Open Access Data Centres, Open Access Technical Service, Open Access Fabric and Open Access Metro.","Telecommunications Carriers","201-500 employees","Privately Held","Cybercity , Ebene","Mauritius","wioccgroup.net","https://www.linkedin.com/company/wiocc-group"
,"IntelliAlgos","Intellialgos: Where Technology, Innovation, and Business Acumen  Converge

Intellialgos is not just another name in the tech space. Birthed in the vibrant heart of Dubai, we've matured into a global entity that strives to be at the intersection of technology, innovation, and business acumen . With a team of seasoned experts, we're dedicated to transforming challenges into opportunities and visions into tangible digital realities.

Our Mission: Empowering Connections through Technology 

At Intellialgos, we believe that effective communication is the cornerstone of success. We are committed to developing cutting-edge SMS and software solutions that enable businesses and individuals to connect seamlessly and efficiently.

Our Expertise: A Spectrum of Cutting-Edge Solutions 
Our expertise spans a wide range of services, including:

SMS Gateway Development ,SMS API Integration ,Software Development for Various Industries ,Mobile App Development ,Web Application Development ,SMS Verification and Authentication ,Custom SMS Applications ,Custom SMS Applications ,Bulk SMS Messaging Solutions ,Artificial Intelligence (AI) and Machine Learning (ML) Integration ,Data Management and Analytics ,Cloud-based Software Solutions ,Project Management Expertise ,Quality Assurance (QA) Testing ,Technical Documentation .

 Our Commitment: Your Success

At Intellialgos, we are committed to providing our clients with exceptional service and support . We believe in building long-lasting partnerships  and helping our clients achieve their business goals .

 Contact us today to learn how Intellialgos can transform your business through technology .","Telecommunications Carriers","11-50 employees","Public Company","Dubai Silicon Oasis","United Arab Emirates","intellialgos.com","https://www.linkedin.com/company/intellialgos"
,"Clotech Telecom & Cloud Solutions","We Are Clotech Telecommunications Limited, A Full-Service Design & Consulting Firm Specializing In Cloud Telecommunication, Cloud Solutions & Digital Transformation.

We Ensure Reliable Telecommunication Connections, Robust Cloud Solutions And A Smooth Digital Transformation. With our extensive experience, our staff offers a unique blend of expertise as technicians and consultants.

Our clients testimonials validate that our combination of talents uniquely supports our clients’ needs, and we believe our hands on experience and knowledge of building systems are the foundation of the specialized
services we offer.","Telecommunications Carriers","11-50 employees","Privately Held","Nicosia","Cyprus","clo-tech.com","https://www.linkedin.com/company/clo-tech"
,"Angnet FTTX","Shenzhen Angnet Technology Limited: Your Trusted Partner in Fiber Optic and Network Cabling Solutions

We are a leading manufacturer of fiber optic and network cabling, with over 10 years of experience in the industry. Our company is dedicated to high-quality management, continuous human resource development, product innovation, and efforts to reduce production costs, which enable us to build strong partnerships with telecom companies around the world.

Angnet FTTX  looks forward to the opportunity to work with you!","Telecommunications Carriers","51-200 employees","Privately Held","深圳","China","szangnet.com","https://www.linkedin.com/company/angnet-fttx"
,"Helium Mobile","Together, we’re rising above big telco and revolutionizing how we all connect with Helium Mobile. Join the movement to put power back in the hands of the people.","Telecommunications Carriers","51-200 employees","Privately Held",,,,"https://www.linkedin.com/company/heliummobile"
,"LionPublic","Somos una empresa de tercerización de servicios | Telecomunicaciones | Servicio de customer service","Telecommunications Carriers","11-50 employees","Self Owned",,,"lionpublic.com","https://www.linkedin.com/company/lionpublic"
,"TozCall","We provide complete call centre solution.","Telecommunications Carriers","11-50 employees","Partnership","Mississauga, Ontario","Canada","tozcall.com","https://www.linkedin.com/company/tozcall"
,"Olin","En Olin somos expertos en telecomunicaciones, ofrecemos servicios de fibra y móvil de alta calidad y velocidad para particulares y empresa en la Costa del Sol, Costa Cálida y Costa de la Luz.","Telecommunications Carriers","51-200 employees","Privately Held","Málaga, Málaga","Spain","olin.es","https://www.linkedin.com/company/olin-telecom"
,"TozCall","We provide complete call centre solution.","Telecommunications Carriers","11-50 employees","Partnership","Mississauga, Ontario","Canada","tozcall.com","https://www.linkedin.com/company/toz-call"
