"Find companies","Name","Description","Primary Industry","Size","Type","Location","Country","Domain","LinkedIn URL"
,"VoIP ISP Channel - VoIP ISP LTD","VOIP ISP LTD – We are an UK registered telecommunication voice carrier to provide VoIP service. We registered at 2017 as a wholesale VoIP carrier and we started our retail part at 2018 with the brand name “ VOIP ISP CHANNEL ”. Our company registered number : 11093751. Our registered address at Seymour Chambers, 92 London Road, Liverpool, Merseyside, L3 5NW, UK.

VoIP ISP Channel is actively involved in wholesale and retail voice business. The company was founded from a management with years of experience in the voice market. Versatility of the offered VoIP terminations allows us to be pointed towards partner’s needs. We are able to work on direct terminations, top quality routes and personalized routes to offer a perfect mix between price and quality. Innovation of the technical infrastructure, developed in strict collaboration with our software and systems for the voice transit are flexible and fully developed for the quality control of VoIP terminations with sophisticated quality warnings. VoIP ISP Channel has a wide range of constant-improving services to meet any need for any customer. Checking our offerings, most interesting products are: A-Z Termination, VoIP Wholesale, VoIP Retail and CLI Routes and Phone Center traffic. We have been selected as a partner by numerous Tier 1 international carriers, corporate carriers and residential VoIP businesses; so wholesale carriers and VoIP retail providers can take advantage of our telecom services and grow up with us. You can confidently expect more smart innovations and useful solutions for your future needs.
VoIP ISP Channel helps telecom operators and carriers to provide global coverage to their customers. The company has exclusive traffic arrangements with MNOs, MVNOs, enterprise customers and more to provide multi-service level offerings.","Telecommunications Carriers","11-50 employees","Privately Held","Liverpool, Merseyside","United Kingdom","ispchannel.com","https://www.linkedin.com/company/voip-isp-channel-voip-isp-ltd"
,"NT Mobiel Accessoires","NT Mobiel Accessoires is the official B2B supplier of phone and tablet accessories from world-renowned brands such as Guess, Karl Lagerfeld, Hello Kitty, Tumi, iDeal of Sweden, Audi, BMW, Mercedes-Benz, Ferrari, Pierre Cardin, Lamborghini and UNIQ Accessory.","Telecommunications Carriers","11-50 employees","Privately Held","Rotterdam, South Holland","Netherlands","nt-mobiel.nl","https://www.linkedin.com/company/nt-mobiel-accessoires"
,"Swisscom World Shop Allschwil","Ihre persönliche Anlaufstelle in Allschwil rund um Mobile, TV, Internet & Festnetz von Swisscom.","Telecommunications Carriers","2-10 employees","Public Company","Allschwil, Basel-Country","Switzerland","baselnetgroup.shop","https://www.linkedin.com/company/swisscom-world-shop-allschwil"
,"PT Macme Global Indonesia",,"Telecommunications Carriers","11-50 employees","Self Owned",,,"macmeglobal.id","https://www.linkedin.com/company/pt-macme-global-indonesia"
,"FPX INVESTIMENTOS","Somos uma empresa de telemarketing fundada em 2022, voltada para produtos bancários em grande processo de expansão.","Telecommunications Carriers","201-500 employees","Privately Held","Porto Alegre, Rio Grande do Sul","Brazil",,"https://www.linkedin.com/company/fpx-investimentos"
,"Link Communication Services LLC.","DAS
Link Communications develops, customize and installs a turnkey in-building DAS (iDAS), outdoor DAS (oDAS) and neutral Host DAS applications supporting all carriers and technologies including AT&T, Verizon, Sprint and T-Mobile.
WiFi Networks
 Link Communications design, implement and deploy a customized network for your needs to give the best performance while minimizing potential problems such as dead spots and interference for any enterprise, Hospitals, School, etc.
Professional Services
Link Communications engineers, technicians, and project managers who provide a range of professional services, including consultation, design and installation, Testing,  project  management, as well as maintenance.","Telecommunications Carriers","2-10 employees","Self Owned","Nutley, NJ","United States","linkcommunicationservices.com","https://www.linkedin.com/company/link-communication-services-llc"
,"Microtalk India Private Limited","Microtalk India Pvt Ltd is a subsidiary of Microtalk Europe. Microtalk Europe has been a trusted provider of voice and data services since 2008. With over 600 businesses and thousands of consumers relying on our solutions, we have established ourselves as a key player in the telecommunications industry. 

Our highly resilient and advanced IP network spans four state-of-the-art data centers across three continents, ensuring superior connectivity and reliability for our customers. Supported by a 24/7 Network Operations Centre, we are committed to delivering seamless, uninterrupted communication services.

Each month, our network handles over 100 million calls, underscoring our capacity and expertise in handling large-scale communication needs. With local operating companies and offices in key global markets, including the UK, USA, India, Philippines, and Canada, we are strategically positioned to offer world-class services to customers around the globe.

Microtalk continues to lead the way in providing innovative, scalable, and secure telecommunications solutions that meet the diverse needs of businesses and consumers alike.","Telecommunications Carriers","11-50 employees","Privately Held","Kolkata, West Bengal","India","microtalkindia.com","https://www.linkedin.com/company/microtalk-india-private-limited"
,"NRS Guatemala","Software distribution company for merchants in USA, with administrative headquarters in Guatemala.","Telecommunications Carriers","201-500 employees","Self Owned","Guatemala, Guatemala","Guatemala","nrsguatemala.com","https://www.linkedin.com/company/nrs-guatemala"
,"Use Conectividade","Somos a USE Conectividade, uma empresa comprometida em fornecer soluções proprietárias e confiáveis de conectividade para o setor agrícola e industrial. Combinando expertise técnica com uma profunda compreensão das necessidades do seu negócio, estamos aqui para impulsionar o progresso e a eficiência nas fazendas e indústrias por meio da tecnologia.

Por isso, nos esforçamos para oferecer não apenas torres, antenas e chips de celular, mas também serviços personalizados que ajudam os empresários rurais e industriais a superar os desafios e aproveitar as oportunidades em seus setores que carregam o PIB deste país.","Telecommunications Carriers","2-10 employees","Privately Held","Campinas, SP","Brazil","useconectividade.com.br","https://www.linkedin.com/company/use-conectividade"
,"KEVAG Telekom GmbH","Für Unternehmen, Institutionen und öffentliche Verwaltung
Die KEVAG Telekom (KTK) ist seit 1997 Ihr zuverlässiger Partner für professionelle Telekommunikationslösungen. Unter der Marke ""KTK teliko"" bieten wir Ihnen Telekommunikation aus Limburg und Koblenz mit besonderem Service.","Telecommunications Carriers","51-200 employees","Public Company","Koblenz, Rheinland-Pfalz","Germany","kevag-telekom.de","https://www.linkedin.com/company/kevag-telekom-gmbh-koblenz"
,"Phreeli","Phreeli is the first Privacy by Design wireless service that prioritizes security and freedom.

Our mission is to give customers control of their personal data, while keeping them connected to their world. We help you take control of your digital life by sharing trusted tools and recommendations so you can make privacy-conscious decisions with confidence. 

Designed to minimize the personal data we collect and reduce unnecessary exposure, Phreeli is redefining wireless privacy. 

Learn more at: Phreeli.com","Telecommunications Carriers","11-50 employees","Privately Held",,,"phreeli.com","https://www.linkedin.com/company/phreeli"
,"Fusion Networks","Fusion Networks is also a NEC (National Exchange Carrier) that can provide voice and data services across the nation. With our class 4/5 voice switches and carrier grade data network infrastructure, Fusion Networks is able to provide our clients with reliability, resiliency and cutting edge functionality.","Telecommunications Carriers","11-50 employees","Privately Held","Port Jefferson, NY","United States","fusionnetworks.net","https://www.linkedin.com/company/fusion-networks"
,"1SimpleConnect","We created 1SimpleConnect /1SimplePhone to simplify business communications by providing straightforward options for critical communications and phone systems designed to meet your company’s needs and budget without sacrificing the latest features. 

We believe that while operating a business can be complicated, with the right solution, your critical communications and phone system doesn't have to be. We know technology is constantly advancing and making sense of communication options can make your head spin. Who has time for that? 

At 1SimpleConnect we offer solutions that can reduce your costs and deliver mobility while increasing your reliability. All the bells and whistles, without all the headache.","Telecommunications Carriers","2-10 employees","Privately Held",,,"1simpleconnect.com","https://www.linkedin.com/company/1simpleconnect"
,"MovilCare","At MovilCare, we are dedicated to providing top-notch digital world protection and seamless FlySIM - eSIM connectivity services. Our mission is to revolutionize the telecommunications industry by offering cutting-edge solutions that cater to the evolving needs of our customers. With a focus on customer satisfaction,

MovilCare ensures that every interaction with our services is smooth and efficient.

Join us in the digital era and experience the future of connectivity with MovilCare.","Telecommunications Carriers","51-200 employees","Partnership","Davie, FL","United States","movilcare.com","https://www.linkedin.com/company/movilcare-cell-phone-and-tablet-esim-connection"
,"Alter Telecom","Alter Telecom met à disposition de ses clients son expertise et son expérience de plus de 17 ans en services de téléphonie Cloud ou sur site, services de Centres de Contacts Cloud ou sur site, en intégration de la téléphonie avec les CRM et ERP de ses clients, en services d’opérateur IP et en prestations d’intégration réseaux et télécom et de maintenance. 

En quelques mots : 

Alter Telecom s’inscrit avant tout comme un partenaire de confiance qui, à travers des prestations personnalisées de qualité, répond aux attentes de ses clients en vue d’atteindre leur entière satisfaction.  

Les clients d’Alter Telecom sont des entreprises moyennes et ETI, des associations et des collectivités territoriales qui recherchent un prestataire de services à taille humaine, expert dans son domaine qui s’engage pour la réussite des projets. 

Alter Telecom a noué des partenariats forts et de long terme avec l’éditeurs français Wazo et avec les éditeurs leaders mondiaux Avaya, Microsoft et Mitel. En 2022, Alter Telecom a conclu un partenariat avec RingCentral, le leader mondial des solutions de communications unifiées et de collaboration dans le Cloud. 

Alter Telecom est opérateur de services IP et propose également des services de téléphonie SIP et des accès Internet Très Haut Débit. 

Notre raison d’être : 

Servir nos clients, bâtir des relations de confiance jusqu’à atteindre leur entière satisfaction, en proposant des prestations personnalisées et en fournissant des services numériques et de service de télécommunication utiles et efficients, afin de contribuer à une société bienveillante pour l’homme et pour la nature. 

Ce qui fait notre différence : 

“La satisfaction de nos clients est et a toujours été notre véritable moteur et notre meilleure carte de visite.” 

“Le développement durable est au cœur de notre politique d’entreprise.” 

Envie d’en savoir plus ? Découvrez toutes nos solutions sur https://www.alter-telecom.fr/nos-solutions/","Telecommunications Carriers","11-50 employees","Privately Held","montesson","France","alter-telecom.fr","https://www.linkedin.com/company/alter-telecom"
,"S-WAN IP","S-WAN IP est un opérateur de services Télécoms pour les TPE & PME avec une offre de services à valeurs ajoutées (Internet Only, SD-WAN, VoIP, Wifi, Sécurité & Cybersécurité...).","Telecommunications Carriers","2-10 employees","Privately Held","Toulon, Provence-Alpes-Côte d'Azur","France","s-wan-ip.fr","https://www.linkedin.com/company/s-wan-ip"
,"Somali Dispatchers in USA","A Dispatcher is a professional who ensures that everything runs smoothly by coordinating with customers, providing precise logistics for drivers to follow along on their routes, and coordinating delivery times. Dispatchers are the point of contact for drivers and have all the information needed to make deliveries.","Telecommunications Carriers","2-10 employees","Partnership","DENVER, CO","United States",,"https://www.linkedin.com/company/somali-dispatchers-in-usa"
,"RCC GROUP SERVICIOS INTEGRADOS","RCC Group Servicios Integrados. 
Distribuidor oficial de Directv & Hughesnets  desde I hasta IV región. 

En RCC GROUP nos enfocamos en ofrecer soluciones a las marcas que quieren abrir operación en el Norte de Chile a través de una estructura de profesionales locales, aprovechando las ventajas comparativas y know how de la zona.
Nos encargamos de la producción e implementación de soluciones y estrategias comerciales, ofreciendo a las empresas poder comercializar sus productos/servicios en toda la Zona Norte desarrollando sus marcas de manera local. 

Ofreciendo un servicio completo desde la contratación de personas, logística y bodegaje, comercialización, área técnica, post venta, call center, implementación de locales, etc.

Nos caracterizamos por ser especialistas en Norte de Chile y por operar de manera local hasta en las zonas más rurales y alejadas.

Nos enfocamos en hacer todo lo posible y la sinergia necesaria para operar de manera eficiente en todo el norte, incluso en las zonas más alejadas y rurales.

Contamos con un equipo de profesionales con valores, conocimientos de las regiones y conscientes de que la innovación y adaptación a los cambios son primordiales para el éxito.","Telecommunications Carriers","51-200 employees","Privately Held","La Serena, Región de Coquimbo","Chile","rccgroup.cl","https://www.linkedin.com/company/rcc-group-servicios-integrados"
,"Shanghai Symphony Telecom Marketing","Shanghai Symphony Telecommunications Co., Ltd. (SST) was founded in December 2000, jointly invested by China Telecom Co., Ltd. (CTC), American Telephone and Telegraph Company (AT&T) and Shanghai Information Investment Inc. (SII)

As a Sino-foreign joint venture for value-added telecom operation, SST benefits from its local telecom network, AT&T’s global resources and technical management experience, as well as the government's supportive industrial policies. Leveraging the advantages of its powerful shareholders, SST is devoted to building an information platform for business operation across geographical boundaries and cultural differences. SST takes customer demand as its first priority, providing multinationals in China with customized forward-looking super solution in the form of one-stop information network integration service. Moreover, people-oriented SST values the wisdom of its employees so as to provide powerful consulting services, bringing added value to its customers.

SST has long been providing high-quality telecom services for nearly 600 well-known multinational and local enterprises in finance, manufacturing, logistics and retail, etc. and offering strong support for many Chinese enterprises to go abroad for global competition.","Telecommunications Carriers","201-500 employees","Partnership","Shanghai, Shanghai","China","sst.net.cn","https://www.linkedin.com/company/shanghai-symphony-telecom-marketing"
,"Internet Activo S.A.","Somo una empresa líder en el sector de las Telecomunicaciones, que ha llevado por muchos años el servicio de Internet a cientos de hogares y empresas en áreas distantes tales como montañas,  islas, zonas rurales logrando así disminuir la brecha digital y llevando así el progreso tecnológico  y la conectividad al ciber espacio a un importante número de comunidades. En la actualidad, no solo seguimos brindando este servicio para zonas remotas, sino que hemos evolucionado de la mano de los avances tecnológicos brindando el servicio de internet también mediante Fibra Óptica, implementando una  variedad de servicios adicionales y soluciones tecnológicas adaptadas a las necesidades de cada cliente, tales como Telefonía VoIP, PBX, Video Vigilancia, Transporte de Datos, entre muchos otros más.
Ahora no solo Llegamos Más Lejos... Ahora estamos más cerca de ti!","Telecommunications Carriers","11-50 employees","Partnership","Calle G Sur y Ave. 4ta Oeste, Barrio Lassonde, David, Chiriquí","Panama","internetactivo.com","https://www.linkedin.com/company/internet-activo-s-a"
,"Imperial Telecomunicações","Nossa empresa acredita que pode ajudar as pessoas a se conectarem. Utilizamos as melhores tecnologias e equipamentos disponíveis no mercado, e em conjunto com uma equipe altamente treinada e experiente, proporcionamos a experiência de navegação em alta velocidade, estabilidade e qualidade que você merece.","Telecommunications Carriers","11-50 employees","Privately Held","Rio de Janeiro, RJ","Brazil","imperialnet.com.br","https://www.linkedin.com/company/imperial-telecomunicações"
,"MaxiConnect","MaxiConnect est un opérateur indépendant Suisse, le portefeuille de produits inclut de nombreux services innovants tels qu’accès Internet, téléphonie fixe, mobile et télévision.","Telecommunications Carriers","2-10 employees","Privately Held","Estavayer-le-Lac, Fribourg","Switzerland","maxiconnect.ch","https://www.linkedin.com/company/maxiconnect"
,"Kalitech Aboriginal Corporation","Kalitech is a local Aboriginal owned and operated not for profit charity organisation with years of experience with unique telecommunications. Our team is passionate and focused on designing standalone communication solutions with the latest, up to date technologies and products. Kalitech prides itself on supplying its customers with the most robust and reliable solutions to meet the needs of outback Western Australia and remote communities, focused on bridging the gap of the digital divide.","Telecommunications Carriers","2-10 employees","Non Profit","Canning Vale, Western Australia","Australia","kalitech.com.au","https://www.linkedin.com/company/kalitech-aboriginal-corporation"
,"Bravo Telecom","Somos uma empresa credenciada CLARO e oferecemos todas as soluções para você. Telefonia móvel, telefonia fixa, banda larga e TV por assinatura e mais, atendemos tanto pessoa física, quanto pessoa jurídica. Nosso foco é na sua satisfação, então prezamos muito pelo pós-venda.","Telecommunications Carriers","11-50 employees","Privately Held","São José, Santa Catarina","Brazil",,"https://www.linkedin.com/company/bravo-telecom-claro"
,"Invesco Telecommunications (InvescoTel) Inc.","We are InvescoTel 
& 
We are one of the dominant VoIP termination Provider.

A Single source of Direct Routes Worldwide.

InvescoTel’s wide framework combines several telecom professionals, co-ops and direct relations with a enormous number of termination points over the globe that empowers us to give customized voice deal establishment on every individual customer’s needs.

InvescoTel is one of the main dependable International voice termination providers with practical experience in worldwide and residential voice. InvescoTel incorporated in July 2019 as Invesco Telecommunications (InvescoTel) Inc. Jurisdiction of Nova Scotia, Canada by the experts with more than 10 years’ involvement in Voice Termination.

Our mission is to provide a cost effective WHOLESALE & RETAIL VoIP termination rates for international calls to any area of the globe to its customers with the competitive, high quality telecommunications services.

Our Vision is to be the one of dominant VoIP termination Provider, along with our Customer & Partners where our in house team & Our international staff of experts and professionals are dedicated with our partners to provide quality, reliability and stability at all times to our customers.

Our Solutions & Cooperation offers:
• DEPENDABILITY
• VERSATILITY
• QUALITY ASSURANCE
• COST EFFECTIVE VOIP SERVICES
• ASR, ACD, PDD AND STABILITY ASSURANCE
• DEDICATED CAPACITY
• SMS & CLI, TDM AND GSM  ROUTES
• ROUTES MONITORED 24X7 BEFORE LIVE PRODUCTION
• GET TROUBLE RESOLVED FAST WITH 24X7 EXTREME CUSTOMER CARE WITH TECHNICAL EXPERTS
• NO VOLUME COMMITMENTS, COMPLICATED AGREEMENTS OR RESTRICTIVE CREDIT DEPARTMENT
• SOLUTIONS TO CARRIERS, SMALL BUSINESSES, RESELLERS AND OTHER VOIP PROVIDERS
• EXPERIENCED MANAGEMENT TEAM
• FINANCIALLY STABLE PARTNER

Drop us an email or reach us with your questions, suggestions, inquiries or for business opportunities at :
+1 (902) 700-6878
+1 (902) 920-5838

Email: info@invescotel.com","Telecommunications Carriers","11-50 employees","Partnership","Truro, Nova Scotia","Canada","invescotel.com","https://www.linkedin.com/company/invescotel"
,"Alpes Networks","Alpes Networks, l'opérateur réseau local vous propose des connexions ultra haut débit par fibre optique via sa propre infrastructure dernière génération. 
Avec un cœur de réseau à Chavanod, Alpes Networks c'est l'hébergement de vos serveurs dans un Data Center sécurisé ainsi qu'une offre complète de Firewalls. Et surtout, Alpes Networks c'est une équipe de professionnels passionnés, axée sur la qualité du service, la réactivité et la proximité avec ses clients. 
Marre de rappeler X fois votre opérateur pour répéter le même problème à un agent différent à chaque fois ? Alors passez au local aussi pour votre abonnement internet!","Telecommunications Carriers","2-10 employees","Privately Held","Chavanod, Auvergne-Rhône-Alpes","France","alpes.net","https://www.linkedin.com/company/alpes-networks"
,"LyoNAP","LyoNAP est un nœud d'échange Internet (IXP - Internet eXchange Point) de Lyon organisant également les évènements bimensuels LyoNAPéro

Pour rejoindre notre GIX/NAP et peerer avec nous, nous vous remercions d'adresser un courriel à LyoNAP@LyoNAP.net

Pour accueillir/sponsoriser un évènement, nous vous remercions d'adresser un mail à LyoNAPero@LyoNAPero.net","Telecommunications Carriers","10,001+ employees","Non Profit","Lyon","France","lyonap.net","https://www.linkedin.com/company/lyonap"
,"VoiceTec Comunicações Unificadas","Somos uma operadora de telefonia VoIP, especializada em soluções de comunicação em nuvem, que visa fornecer serviços de alta qualidade e inovação tecnológica para seus clientes. Nosso foco é garantir o sucesso e a satisfação dos nossos parceiros, sempre com transparência e comprometimento. 

O PABX VoiceTec Cloud é uma solução disponível para a sua empresa com um alto desempenho e processamento das chamadas. A solução permite o acesso a todas as vantagens da telefonia IP somada aos serviços padrões das centrais telefônicas tradicionais. Isso é a VoiceTec Comunicações Unificadas trabalhando para o crescimento e modernização da sua empresa.

A sede da VoiceTec atualmente é localizada em Recife, capital Pernambucana.

A nossa equipe é treinada para dar o melhor e mais rápido atendimento/suporte, sempre. Nossa plataforma tem máxima confiabilidade pois estamos na nuvem da Amazon, também conhecido como AWS (Amazon Web Services)

Nosso time de profissionais atua no mercado há mais de 20 (vinte) anos, sendo assim, formada por uma equipe interdisciplinar de engenheiro de telecomunicações, técnicos, desenvolvedores, administradores, publicitários, mercadólogos, suporte e atendimento.","Telecommunications Carriers","11-50 employees","Privately Held","Recife, Pernambuco","Brazil","voicetec.com.br","https://www.linkedin.com/company/voicetec-comunicações-unificadas"
,"A&D Merchants","At A&D Merchants, we are dedicated to delivering high-quality communication and customer engagement solutions that help businesses grow and succeed. Our mission is to provide seamless, reliable, and scalable services including inbound and outbound call solutions, hosted VoIP systems, telesales strategies, virtual receptionist services, and after-hours support. By utilizing advanced VoIP technology, we empower businesses to enhance customer interactions, streamline operations, and drive growth. With a focus on professionalism, efficiency, and customer satisfaction, we ensure that every communication is impactful and every customer experience exceeds expectations.","Telecommunications Carriers","11-50 employees","Public Company",,,"admerchants.us","https://www.linkedin.com/company/a-d-merchants"
,"GlobeLink Fiber","2400 Miles of new, Greenfield fiber connecting the Permian Basin to the four largest data center markets in the Americas: Dallas, Austin, San Antonio and Houston. In addition, GlobeLink is in the process of building a subsea, low latency route from Corpus Christi to Mexico City.","Telecommunications Carriers","11-50 employees","Privately Held",,,"globelinkfiber.com","https://www.linkedin.com/company/globelink-fiber"
