"Find companies","Name","Description","Primary Industry","Size","Type","Location","Country","Domain","LinkedIn URL"
,"Tarragona Link","La operadora de referència de la província de Tarragona.

- Som una empresa de proximitat.
- No subcontractem al nostre personal i apostem per una contractació justa i ètica.
- Venem allò que millor s’adapta a les teves necessitats
- Busquem contínuament fórmules per millorar la teva tarifa.
- Oferim preus molt competitius i clars.
- Garantim la nostra qualitat i professionalitat en tots els serveis que oferim.
- No ens agrada complicar-nos ni complicar-te, som clars.
- Compromís en conèixer millor al nostre client per aconseguir la seva major satisfacció.
- Estem en constant aprenentatge de nous mètodes i sistemes, per a desenvolupar millors serveis.","Telecommunications Carriers","11-50 employees","Privately Held","Tarragona, Catalonia","Spain","tarragona.link","https://www.linkedin.com/company/tarragonalink"
,"TV ZAMORA, C.A","El líder en Telecomunicaciones en el estado Bolívar. Ofreciendo internet por fibra óptica, televisión digital y internet empresarial con servicio dedicado.","Telecommunications Carriers","201-500 employees","Privately Held","Puerto Ordaz , Bolivar","Venezuela","tvzamora.com","https://www.linkedin.com/company/tvzamora-ve"
,"SWISSCOMTEC Pvt Ltd","SWISSCOMTEC is a trusted name in global telecommunications, specializing in Wholesale VoIP and CLI Termination Services. We empower carriers, VoIP providers, and telecom businesses with reliable, high-quality voice termination solutions across international destinations. With a strong focus on Crystal-Clear Call Quality, Competitive Rates, and 24/7 Network Monitoring, SWISSCOMTEC ensures seamless connectivity and optimized routing tailored to meet the demands of today’s global communication landscape.

Whether you're looking to expand your reach, enhance call quality, or reduce operational costs, SWISSCOMTEC is your strategic partner for scalable and secure VoIP solutions

If you’re passionate about AI, fintech, sustainability, growth, Improvements, Business let’s connect info@SWISSCOMTEC.COM","Telecommunications Carriers","2-10 employees","Privately Held","LONDON","United Kingdom","swisscomtec.com","https://www.linkedin.com/company/swiss-comtec"
,"UNITED GROUP NETWORK INFRASTRUCTURE d.o.o.","United Group Network Infrastructure or UGNI d.o.o. is a company that primarily operates in the field of telecommunications and provides business users within the United Group with a wide range of video and IP services.
Committed to advancing the digital transformation of the Southeastern European region, UGNI is dedicated to hastening the evolution of next-generation networks, with a particular focus on fiber optic networks.
With a strong emphasis on technological progress, innovation, and the adoption of best practices from the wider region, UGNI, which currently owns the largest fiber optic network in Southeastern Europe, is accelerating its committed investment in constructing its own state-of-the-art extensive fiber optic network.
Dedicated to delivering highly scalable bandwidth and low-latency connectivity, with a fiberoptic network that extends thousands of kilometers, we bring innovation, speed, and quality through a full range of services making sure our clients' businesses can thrive.","Telecommunications Carriers","11-50 employees","Privately Held","New Belgrade, Central Serbia","Serbia","ugni.net","https://www.linkedin.com/company/ugnirs"
,"Oxygen Communication GmbH & Co.KG","Mit der Gründung im Jahre 2010, haben wir uns fest vorgenommen, eine Kommunikationsmöglichkeit für unsere Kunden zu bieten, mit der man rundum zufrieden ist. Mit kompetenter und persönlicher Betreuung, bilden wir die beste Grundlage für eine langjährige und vor allem loyale Geschäftsbeziehung.

Wir schaffen Struktur in ihrem Unternehmen und ermöglichen Ihnen somit ein effizienteres Arbeiten, ohne dass Sie sich Sorgen um Ihre Kommunikationskanäle machen müssen.

In enger Zusammenarbeit mit Ihnen finden wir immer eine Lösung, mit der Sie am Ende rundum zufrieden sind, denn nur wenn Sie zufrieden sind, sind wir es auch.","Telecommunications Carriers","2-10 employees","Public Company","Dortmund, North Rhine-Westphalia","Germany","oxygen-communication.de","https://www.linkedin.com/company/oxygen-communication-gmbh"
,"SICLU Telecom","Nos encargamos de ser tú único punto de contacto para tus servicios de telecomunicaciones & TI.","Telecommunications Carriers","11-50 employees","Privately Held","Av. Ejercito Nacional 505 Miguel Hidalgo , CDMX","Mexico","siclu.mx","https://www.linkedin.com/company/siclu-telecom"
,"Neptucom","Neptucom is a leading global roaming service provider (take out comma) offering resellers, distributors, and partners an easy way into the GSM / VOIP business without the need for complex integrations and roaming agreements.

Our Expertise in roaming for the past 15 years helped many businesses obtain a lucrative revenue stream with high margins, offering their retail customers high-end products with added value services.

The world is now global. Our mission is help people stay connected, wherever they are.","Telecommunications Carriers","11-50 employees","Privately Held","Bney Brak","Israel","neptucom.com","https://www.linkedin.com/company/neptucom"
,"Asteria","INNOVATIVE CLOUD PBX-BILLING-PLATTFORM
Asteria ist eine neue Plattform, über die Sie exklusiv  ihren Kunden Cloud PBX- und TK-Produkte verschiedener Provider anbieten und ihren Kunden in eigenem Namen in Rechnung stellen können. Das Software-Angebot ermöglicht so den Auf- oder Ausbau Ihres Geschäfts in diesem wachsenden, hochdynamischen Umfeld.

Der Clou des SaaS-Angebotpakets:
Über eine zentrale Plattform buchen Sie für Ihre Kunden anbieterübergreifend Produkte, verwalten deren Daten und können automatisiert die erbrachten Leistungen abrechnen. Teilnehmer der ersten Stunde ist der führende Vorlieferant www.Kwebbl.de

Das macht Asteria einzigartig im deutschen Markt. Anders als bei einem herkömmlichen Resellermodell können Sie als GFT-Mitglied Services passend zu den individuellen Wünschen Ihrer Kunden und ohne Festlegung auf einen oder mehrere bestimmte Anbieter auswählen. Auch der über Jahre aufgebaute direkte Kundenkontakt verbleibt so immer in Ihren Händen.


EINFACHE NUTZUNG
Sobald Sie sich bei Asteria eingeloggt haben, können Sie die Daten Ihrer Kunden anlegen und für die Produkte der verschiedenen Vorlieferanten gemäß Ihres Kundenauftrags konfigurieren. Auch können Sie Ihr Firmenlogo hochladen und Farben anpassen, damit Rechnungen, die das System Ihren Kunden per Webportal, E-Mail oder Post zur Verfügung stellt, im Look Ihres Unternehmens erscheinen.","Telecommunications Carriers","2-10 employees","Privately Held","Hilden, NRW","Germany","gft-eg.de","https://www.linkedin.com/company/gft-asteria"
,"Ran-Telecom","Nuestra infraestructura 5G, respaldada por Intracom Telecom, ofrece una solución robusta de backup y complementa nuestra conexión de fibra óptica, garantizando la continuidad de sus operaciones comerciales.","Telecommunications Carriers","2-10 employees","Privately Held","Lloret de Mar, Catalonia","Spain","ran-telecom.com","https://www.linkedin.com/company/ran-telecom"
,"Easybell NL",,"Telecommunications Carriers","51-200 employees","Public Company",,,"easybell.nl","https://www.linkedin.com/company/easybell-nl"
,"SymCall","SymCall, filiale 100% du Groupe Symexo, propose des services de téléphonie d'entreprise sous Teams de Microsoft et/ou Centrex en mode Cloud.

Intégrateur TEAMS et/ou Centrex en mode cloud, la mission de SymCall est de conseiller et accompagner ses clients dans l'adaptation de leurs systèmes de téléphonie fixe d'entreprise par une réponse IT souple, efficace et évolutive.","Telecommunications Carriers","51-200 employees","Privately Held","BALMA","France","symcall.fr","https://www.linkedin.com/company/symcall"
,"OTZ Telecommunications","OTZ Telephone Cooperative Inc. is a member-owned company headquartered in Kotzebue that provides telephone, wireless (also known as “cellphone”) and Internet services throughout Northwest Alaska.","Telecommunications Carriers","11-50 employees","Non Profit","Kotzebue, Alaska","United States","otz.net","https://www.linkedin.com/company/otz-telecommunications"
,"XmartCall","Somos un equipo que prospera a través de la digitalización.

Nuestros clientes son principalmente del área de Telecomunicaciones. Los cuales llegan a XmartCall gracias a innovación constante en Digital Marketing, donde trabajamos día a día ampliando nuestro conocimiento e implementando nueva tecnología. Esto garantiza el crecimiento de nuestra empresa y de nuestro equipo de trabajo.

A demás de todo esto siempre estamos en constante capacitación de liderazgo y desarrollo personal.","Telecommunications Carriers","51-200 employees","Privately Held",,,"xmartcall.com","https://www.linkedin.com/company/xmartcall"
,"BV Digital Holdings LLC.","More coming soon","Telecommunications Carriers","11-50 employees","Partnership","South Orange, New Jersey","United States","broadcastvoip.com","https://www.linkedin.com/company/broadcast-voice-digital"
,"OfficePerks Mobility"," Exclusive Employee-Only Discount on Wireless and Home Internet Plans!

Eligible employees can now take advantage of the Rogers Preferred Program with exceptional savings on 5G+ wireless and home internet plans. 

Who’s Eligible? This program is open exclusively to employees in various sectors, including but not limited to:

 Ride-Sharing: Uber, Lyft, Skip the Dishes
 Food Services: Tim Hortons, McDonald's, Harvey's etc
 Education: Schools and Colleges
 Banking: Top 5 Banks
 Real Estate Professionals: Agents, Brokers.
 Healthcare: Hospitals, Doctors, Nurses
 Retail: Walmart, Sobeys, Amazon etc
 Public Sector: City and Municipal Workers, 
Government Employees
 Pharmacy
 Law Enforcement

…and many more! Proof of eligibility is required.
Get your eligibility checked today!

Ready to Switch?

For details or to confirm eligibility, I’m available Monday to Friday, 10 AM - 6 PM.

 Call/Text: 416-727-8445

 Chat with us on WhatsApp: https://lnkd.in/gwbzZ7D4

Take advantage of this opportunity to save on your wireless and internet plans!","Telecommunications Carriers","2-10 employees","Privately Held",,,,"https://www.linkedin.com/company/officeperks-mobility"
,"Spaceall","Somos o primeiro operador de redes LoRaWAN de Angola, oferecendo soluções de IoT e conectividade de baixo custo para empresas e cidades. Através da nossa rede off-grid, garantimos que equipas em campo e sensores remotos permaneçam sempre ligados, troque e processem dados críticos mesmo sem cobertura celular.","Telecommunications Carriers","51-200 employees","Privately Held","Luanda","Angola","spaceall.net","https://www.linkedin.com/company/spaceall"
,"Reseauline","Bienvenue chez Reseauline, votre partenaire de confiance en matière de solutions intégrées. En tant qu'opérateur téléphonique et intégrateur spécialisé, nous excellons dans la téléphonie, la bureautique, la cybersécurité, ainsi que dans la conception et l'optimisation de réseaux LAN et WiFi.","Telecommunications Carriers","2-10 employees","Privately Held","Lyon, Auvergne-Rhône-Alpes","France","reseauline.fr","https://www.linkedin.com/company/reseauline"
,"EVO TELECOM","Evo Telecom est né d’un constat simple : le manque de proximité entre le client et son opérateur. Chez nous, pas de robot, pas d’attente interminable, une équipe à taille humaine à votre écoute.","Telecommunications Carriers","2-10 employees","Self Owned","LES HERBIERS, VENDEE","France","evotelecom.fr","https://www.linkedin.com/company/evotelecom"
,"NETPLANET GmbH",,"Telecommunications Carriers","11-50 employees","Public Company","Vienna, Wien","Austria","netplanet.at","https://www.linkedin.com/company/netplanet-gmbh"
,"ENC Mobile","ENC mobile is a mobile operator specializing in overseas Chinese services. We are committed to providing a variety of communication services for international students, Chinese USs and Chinese enterprises, to meet the different needs of different groups of people. Headquartered in Los Angeles, the company has more than 20 years of history, has been for international operators, multinational companies and Chinese customers in the us to provide comprehensive, high quality comprehensive information services solutions, including Internet access data services, bandwidth services, unified communication services, data center services, ICT services, fixed-line and mobile voice services, mobile virtual operations and global iot connection services, professional customized services, industry solutions, telecom operations consulting and service outsourcing business.","Telecommunications Carriers","11-50 employees","Privately Held",,,"encmobile.com","https://www.linkedin.com/company/enc-mobile"
,"Gener Télécom"," Gener Télécom 

Gener Télécom est un fournisseur de services de téléphonie fixe, d'internet et de solutions monétiques spécialisé dans le domaine de la pharmacie.

 Téléphonie Fixe : Nous offrons des solutions de téléphonie fixe professionnelles adaptées aux besoins de votre officine.

 Internet : Avec nos services internet haut débit, bénéficiez d'une connexion rapide et stable pour gérer efficacement vos opérations quotidiennes.

 Solutions Monétiques : Simplifiez les transactions financières dans votre officine avec nos solutions monétiques sécurisées.

Chez Gener Télécom, nous nous engageons à fournir des services de qualité supérieure et un support client exceptionnel ouvert le samedi !","Telecommunications Carriers","2-10 employees","Self Owned","Moissy-Cramayel, Îles-de-France","France",,"https://www.linkedin.com/company/gener-telecom"
,"Téléphonie sur IP","Téléphonie sur IP - Le standard téléphonique virtuel le plus abordable et performant du marché

Solution évolutive, orienté client, fiable, abordable et SANS engagement
Mise en service express de 1h00 à quelques jours maximum

TÉLÉPHONIE SUR IP - COLLABORATION - COMMUNICATION UNIFIÉE - VISIOCONFÉRENCE

Plateforme de téléphonie IP et de collaboration dans un cloud souverain pour les entreprises, les administrations et les associations de toutes tailles

Solution certifiée par l’Agence nationale de la sécurité des systèmes d’information (ANSSI) et non soumis au Patriot Act !

Communiquez dans des environnements sécurisés et de confiance
Communication asynchrone et en temps réel, appels RTPC
Conférences audio et vidéo
Collaboration et messagerie
Partage d’écran
Échange de fichiers volumineux
Groupe de travail
Contrôle à distance et bien plus encore
Pour les équipes de toutes tailles
Installation ultra-simple pour tout modèle de déploiement, tout appareil, tout en maintenant la sécurité
Une qualité de Téléphonie IP inégalée qui dérange la concurrence
Découvrez notre standard téléphonique virtuel basé sur la Téléphonie sur IP, une solution innovante qui révolutionne le marché grâce à sa qualité exceptionnelle. Nos concurrents nous détestent, mais nos clients nous adorent ! Pourquoi ? Parce que nous offrons un service de Téléphonie IP de haute qualité, rapide et fiable, qui répond parfaitement aux besoins des entreprises d’aujourd’hui.

Une mise en œuvre rapide et une flexibilité inégalée avec la Téléphonie IP
Notre solution de standard téléphonique virtuel basée sur la Téléphonie IP se distingue par sa rapidité de mise en œuvre. En un temps record, votre entreprise bénéficiera d’un système de communication performant et adapté à vos besoins. De plus, notre solution de Téléphonie sur IP est souple et évolutive, vous permettant de l’adapter à tout moment en fonction de l’évolution de votre entreprise.

La Téléphonie IP la moins chère du marché
Cerise sur le gâteau, not...","Telecommunications Carriers","2-10 employees","Privately Held","Vincennes Cedex","United States","telephonie-sur-ip.com","https://www.linkedin.com/company/telephonie-sur-ip"
,"Fernando Net","A Fernando Net é uma provedora de internet com mais de 15 anos de história em Valparaíso de Goiás, especializada em oferecer serviços de conectividade de alta qualidade. Nossa jornada começou de maneira simples, quando um ex-serralheiro, com pouca experiência em tecnologia, encontrou sua paixão no mundo da telecomunicação. Desde então, com dedicação e inovação, nos tornamos referência em serviços de internet na região, com uma rede 100% Fibra Óptica.

Missão: Proporcionar experiências e oportunidades através da conexão digital, conectando pessoas e revolucionando vidas.

Visão: Ser referência no segmento de conectividade, buscando sempre a excelência.

Valores: Honestidade, dedicação, flexibilidade, inovação, respeito e foco no cliente.

A Fernando Net é mais do que uma provedora de internet. Somos a ponte que conecta você ao que há de melhor no mundo digital.","Telecommunications Carriers","11-50 employees","Privately Held","Valparaíso de Goiás, Goiás","Brazil","fernandonet.net.br","https://www.linkedin.com/company/fernando-net"
,"liello","Nous nous attachons à vous proposer des solutions adaptées a vos besoins, fiables et évolutives.
- Internet sécurisé - backup 4G et 5G
- Téléphonie d'entreprise
- Sécurité des biens et des personnes","Telecommunications Carriers","2-10 employees","Privately Held","Toulouse","France","liello.fr","https://www.linkedin.com/company/liello"
,"AbsoluteVoice","AbsoluteVOICE managed VoIP Platform with Enterprise Level Support","Telecommunications Carriers","11-50 employees","Self Owned","Schertz, Texas","United States","absolutevoice.net","https://www.linkedin.com/company/absolutevoice"
,"Malty - Opérateur Télécom","Malty est un opérateur télécom dédié aux entreprises et aux collectivités locales. Nous proposons tous les services de communication dont elles ont besoin (internet, téléphonie fixe, communication unifiée, téléphonie mobile, visioconférence, etc.). Notre force ? Vous faire profiter d’une multitude de services en ayant un seul interlocuteur.

- Accès Internet : 
Découvrez nos solutions d’accès internet : connexions très haut débit grâce à la fibre, accès ADSL et solutions 4G ou 5G en cas d’inéligibilité à la fibre optique.

- Téléphonie Teams :
La solution Malty SBC for Teams permet l’interconnexion de l’univers Microsoft et de la téléphonie grâce à un service clé en main.

- Communication unifiée :
Retrouvez les fonctionnalités de votre téléphone fixe sur PC / Mobile et intégrez d’autres services intelligents et connectés comme la visioconférence.

- Téléphonie mobile :
Optez pour la gestion centralisée et simplifiée de votre mobilité. Malty propose une offre multi-opérateurs sans engagement et intégrant la technologie 5G.

- Trunk SIP :
Flexible et économique : adoptez la VoIP pour faire transiter les appels entrants et sortants de votre entreprise à partir d’une connexion Internet.

- Visioconférence :
Malty vous propose des solutions sur-mesure pour organiser des réunions, diffuser du contenu ou encore réaliser de la formation en ligne.","Telecommunications Carriers","Self-employed","Privately Held","Chavanoz, Auvergne-Rhône-Alpes","France","malty.fr","https://www.linkedin.com/company/malty-telecom"
,"Siditel S.a","Nuestro compromiso es entender las necesidades de nuestros aliados, para brindar la mejor asesoría con eficiencia y eficacia en todo el proceso de acompañamiento, de modo que nos permita establecer relaciones comerciales confiables y duraderas.","Telecommunications Carriers","11-50 employees","Privately Held","Medellín","Colombia","siditel-sa.com","https://www.linkedin.com/company/siditel-s-a"
,"Helix SMS FZC  LLC","Helix SMS is the smoothest and fastest solution to manage your customers, Sales & support. All you need is our App and an Internet Connection and you are good to go.

SMS Service
Send Instant Messages To Clients and Subordinates.

API Access
Enhances Communication
Immediately inform and communicate to your clients or teammates.

Time Efficient
Personalize your daily communication and save time.","Telecommunications Carriers","11-50 employees","Privately Held",,,"helixsms.in","https://www.linkedin.com/company/helix-sms"
,"spusu CH",,"Telecommunications Carriers","201-500 employees","Public Company",,,"spusu.ch","https://www.linkedin.com/company/spusu-ch"
,"TechRed","Empresa Telco Líder en Ventas de calidad en Colombia. Nuestros empleados son parte de nuestra gran familia, porque somos felices para ganar clientes","Telecommunications Carriers","51-200 employees","Self Employed",,,,"https://www.linkedin.com/company/techred"
,"eSIMware","Welcome to your new travel inspiration hub 

Here, we explore must-see destinations around the world, from epic seasonal getaways to local festivals, cultural events and hidden gems worth the journey.

No more roaming fees, no more limits — just smart, connected travel.
Wherever you go, stay online instantly with eSIMware, available on iOS & Android.

Follow us for:
 Seasonal travel ideas (winter escapes, summer adventures, spring festivals…)
 Trending global events & cultural highlights
 Hidden gems and underrated destinations
 Travel without roaming using eSIM technology

Travel smart. Travel inspired. Travel connected. 

#TravelMore #NoRoaming #eSIM #TravelInspiration #AdventureAwaits

What We Offer
 Global eSIM Plans – Stay connected in 190+ countries
 Instant Activation – No physical SIM, no delays
 Affordable Rates – Flexible plans for travel, business, and IoT
 Seamless User Experience – Easy setup, no contracts

Why Choose eSIM?
 No Roaming Fees – Pay only for what you need
 Multiple Networks – Connect to the best local provider automatically
 Eco-Friendly – Ditch plastic SIMs for a sustainable alternative
 Multi-Device Compatibility – Works on smartphones, tablets, and IoT devices

Who is it for?
 Frequent Travelers – Stay online without expensive roaming
 Digital Nomads & Remote Workers – Reliable global coverage
 Businesses & Enterprises – Simplified mobile management","Telecommunications Carriers","2-10 employees","Privately Held",,,"esimware.com","https://www.linkedin.com/company/esimware"
,"Talk 247",,"Telecommunications Carriers","11-50 employees","Privately Held",,,"talk247.co.uk","https://www.linkedin.com/company/talk247"
,"ABIB Móvil","Telefonía e internet móvil con cobertura en México, USA y Canadá
eSIM para iPone y Galaxy","Telecommunications Carriers","51-200 employees","Self Owned","MEXICO, MEXICO","Mexico","abibmovil.com","https://www.linkedin.com/company/abibmexico"
,"Claro Empresas | MOBO CR","No se quede atrás, digitalice su Negocio. PYMES, Emprendimiento, Profesional Independiente, Empresa y sus Afiliados. Llévelo a otro Nivel y mejore la experiencia del usuario. Contáctenos en Claro Empresas | MOBO CR le ayudaremos wa.me/50671319085","Telecommunications Carriers","11-50 employees","Self Owned","San José","United States",,"https://www.linkedin.com/company/mobo-claro-empresas-cr"
,"NOWTELCO","FE&DO Telecom con marca registrada NOW Telco, nace fruto de la experiencia adquirida a lo largo de más de 14 años en el mundo de las telecomunicaciones, 18 en el sector de la informática.
Formado por un equipo joven y dinámico, somos un operador virtual nacional especializado en servicios de voz y datos tanto para empresas como particulares, sin descartar el acceso a la pequeña administración pública.","Telecommunications Carriers","2-10 employees","Self Owned","Úbeda, Andalucia","Spain","nowtelco.es","https://www.linkedin.com/company/fe-do-telecom-sca-now-telco"
,"Speed3 Telecom LTDA",,"Telecommunications Carriers","2-10 employees","Partnership",,,,"https://www.linkedin.com/company/speed3-telecom-ltda"
,"Anexo Soluciones","Somos especialistas en la reducción de costes de las empresas y los particulares. Gestionamos, de una forma ética, tus telecomunicaciones, energía, alarmas o seguros.","Telecommunications Carriers","2-10 employees","Self Owned","Terrassa, Catalonia","Spain","anexosoluciones.com","https://www.linkedin.com/company/anexo-soluciones"
,"Zevo Fibra",,"Telecommunications Carriers","11-50 employees","Privately Held",,,"zevo.com.br","https://www.linkedin.com/company/zevo-fibra"
,"NUVEXA LLC","Nuvexa LLC is a dynamic BPO and call center solutions provider, specializing in lead generation, live transfers, and customer support services. We partner with businesses worldwide to accelerate their growth through high-quality leads, real-time customer connections, and tailored outsourcing strategies.

Our mission is to deliver measurable results with a focus on performance, reliability, and transparency. Whether you need to expand your sales pipeline, improve customer engagement, or optimize your outreach campaigns — Nuvexa LLC is your trusted partner for scalable success.","Telecommunications Carriers","11-50 employees","Privately Held",,,"nuvexallc.com","https://www.linkedin.com/company/nuvexallc"
,"NETZ33","Die NETZ33 GmbH baut ein neues bundesweit zusammenhängendes, hochleistungsfähiges und homogenes Glasfaser-Backbonenetz aus einer Hand.

Die hochvermaschte Netzarchitektur bietet durch mehrfach redundante Verbindungen der Netzknoten und den Einsatz modernster Technologie ein Maximum an Ausfallsicherheit und Zukunftsfähigkeit. Das Glasfasernetz der NETZ33 GmbH steht für sichere, resiliente und hochleistungsfähige Datenverbindungen, auch bei möglichen Bedrohungslagen oder Krisensituationen, und entspricht den Vorgaben von NIS2 und dem zukünftigen KRITIS-Dachgesetz.","Telecommunications Carriers","2-10 employees","Public Company","Neustadt/Wied-Rahms","Germany","netz33.de","https://www.linkedin.com/company/netz33"
