"Find companies","Name","Description","Primary Industry","Size","Type","Location","Country","Domain","LinkedIn URL"
,".","Die Temp-Work GmbH ist Ihr zuverlässiger Partner im Bereich Zeitarbeit, Personaldienstleistungen und Werkverträgen. 

Gerne unterstützen wir Sie in den Bereichen Zeitarbeit, On-Site-Management, Personalvermittlung und Outsourcing.

Zur Überbrückung von Auftragsspitzen, Personalbesetzungen von Großprojekten, bei krankheitsbedingten Ausfällen und bei individuellen Stellenbesetzungen sind wir für Sie da.

Schnell, kompetent, flexibel.

Kommen Sie in unser Team und finden Sie abwechslungsreiche und spannende Tätigkeiten.

Als etabliertes dynamisches Unternehmen haben wir die Möglichkeit, uns schnell den Bedürfnissen unserer Mitarbeiter und Kunden anzupassen.

Die Mitarbeitenden der Firma Temp-Work stellen Tag für Tag bundesweit unsere Leistungsfähigkeit unter Beweis.","Temporary Help Services","51-200 employees","Public Company","Leer (Ostfriesland), Lower Saxony","Germany","temp-work.de","https://www.linkedin.com/company/temp-work-gmbh"
,"Kowsen-Pol Sp. z o.o.","Kowsen-Pol to agencja pracy z ugruntowaną pozycją na rynku. Zapewniamy pracowników dla firm z całej Polski z zakresu obróbki metalu, branży produkcyjnej, przemysłowej oraz farmaceutycznej. 

Zapewniamy pełen zakres usług outsourcingu pracowników:
- rekrutacja pracowników,
- legalizacja ich zatrudnienia (załatwiamy wojewódzkie zezwolenia, karty pobytu, pozwalające na długookresową pracę),
- badania lekarskie,
- szkolenie BHP ogólne,
- opieka koordynatora,
- wypłata wynagrodzeń i zaliczek pracowniczych,
- prowadzenie dokumentacji pracowniczej. 

Zapewniamy wszelkie formalności związane z legalizacją pracy, rekrutacją, koordynacją pracowników. Systematycznie uzupełniamy oraz prowadzimy dokumentację pracowniczą tak, aby przedsiębiorca miał możliwość podjęcia trwałej współpracy z pracownikiem. 

Jeśli jesteś pracodawcą, chętnie wspomożemy Ciebie w zapewnieniu kadry pracowniczej dopasowanej do Twoich potrzeb. Zapraszamy do kontaktu.","Temporary Help Services","51-200 employees","Partnership","Poznań, Wielkopolskie","Poland","kowsenpol.pl","https://www.linkedin.com/company/kowsen-pol-sp-z-o-o"
,"Rivers of Jannah","Rivers of Jannah is a non-profit organization that facilitates a water well funding program to provide clean water to communities in need","Temporary Help Services","Self-employed","Public Company",,,"riversofjannah.org","https://www.linkedin.com/company/rivers-of-jannah"
,"Império das tendas locação de tendas LTDA",,"Temporary Help Services","11-50 employees","Privately Held",,,"imperiodastendas.com.br","https://www.linkedin.com/company/império-das-tendas-locação-de-tendas-ltda"
,"Supply Mix","Agência de Promotores de Vendas e Merchandising;
Promotores de Vendas Exclusivos, Compartilhados, Fixos ou Roteirizados.","Temporary Help Services","11-50 employees","Privately Held",,,"supplymix.com.br","https://www.linkedin.com/company/supply-mix"
,"TEMPORIS MARMANDE",,"Temporary Help Services","2-10 employees","Self Employed",,,"temporis-franchise.fr","https://www.linkedin.com/company/temporis-marmande"
,"Cruzari","CRUZARI | Agencia de Empleo y Turismo

En Cruzari, conectamos personas con oportunidades reales de empleo en el exterior. Somos una agencia especializada en asesoría profesional y ubicación laboral para quienes buscan construir un futuro fuera de su país.","Temporary Help Services","2-10 employees","Partnership","Bogotá D.C, Bogotá","Colombia",,"https://www.linkedin.com/company/cruzari"
,"Templink","Templink - Connecting Dental Professionals with Opportunities

Templink is an innovative online platform revolutionizing temporary staffing for dental offices in Las Vegas and Texas. We seamlessly connect skilled dental professionals with practices needing temporary support, offering a user-friendly experience at an affordable $10 monthly fee for full access—no permanent placement fees. Our recently upgraded platform ensures effortless navigation, making it easier than ever for dental offices to find the right talent quickly. Join Templink today and discover a smarter way to meet your staffing needs!","Temporary Help Services","51-200 employees","Self Owned",,,"mytemplink.com","https://www.linkedin.com/company/templinkdental"
,"Potik",,"Temporary Help Services","2-10 employees","Non Profit",,,"potik.org","https://www.linkedin.com/company/potikbot"
,"Empleos Personal GmbH","Deutschlandweite Personaldienstleistungen, Personalvermittlungen und Personalberatung","Temporary Help Services","51-200 employees","Public Company","Ludwigshafen, Rhineland-Pfalz","Germany","empleos-personal.de","https://www.linkedin.com/company/empleos-personal-gmbh"
,"BEAMING SMILES AGENCY","Notre agence d’hôtesse d’accueil, située à Casablanca, est dédiée à offrir des services d’accueil professionnels et de qualité supérieure.

Notre mission est de garantir une première impression mémorable pour chaque évènement, en plaçant l’humain au cœur de notre démarche. Nous croyons fermement que l’accueil est le reflet de votre image et nous nous engageons à valoriser cette expérience à travers un service personnalisé et attentionné. Nos valeurs fondamentales incluent le professionnalisme, l’empathie, l’adaptabilité et l’engagement envers l’excellence, ce qui nous permet de construire des relations de confiance avec nos clients.

FAÎTES DE VOTRE ACCUEIL UNE SIGNATURE","Temporary Help Services","2-10 employees","Self Owned","Casablanca , Casablanca settat","Morocco","beamingsmiles.ma","https://www.linkedin.com/company/beaming-smiles-agency"
,"E-Social Services LTDA",,"Temporary Help Services","11-50 employees","Privately Held",,,,"https://www.linkedin.com/company/e-social-services-ltda"
,"Krutzsch locação de equipamentos para construção civil",,"Temporary Help Services","2-10 employees","Privately Held",,,,"https://www.linkedin.com/company/krutzsch-locação-de-equipamentos-para-construção-civil"
,"Sanzeni Srl","L’azienda nasce nel 1975 dai due fratelli Sanzeni ed entra a far parte del gruppo Immergas nel lontano 1978 come unico centro assistenza nel Bresciano.
Sviluppando successi e consenso sul territorio nascerà negli anni l’esigenza di ingrandirsi, mentre l’esperienza e la serietà nel seguire gli interventi porteranno alla scelta di specializzarsi in un solo marchio.
Nel 1995 i due fondatori si separano, proseguendo nel servizio accurato della clientela su zone diverse.
Nel 2005 l’azienda diventa proprietà di Jessica Sanzeni, tutt’ora amministratore unico.

L'azienda, centro autorizzato Immergas, si occupa di collaudo, manutenzione, riparazione ed inserimento al curit su caldaie e pompe di calore immergas","Temporary Help Services","2-10 employees","Privately Held","Camignone, Bs",,"sanzenisrl.it","https://www.linkedin.com/company/sanzeni-srl"
,"Max Serviços de Mão de Obra Ltda",,"Temporary Help Services","11-50 employees","Privately Held",,,,"https://www.linkedin.com/company/max-service-ceara"
,"Grupo Vartal","Más de 34 años de experiencia.
Su temporal con blindaje jurídico.
Agilidad y efectividad en selección.","Temporary Help Services","10,001+ employees","Privately Held","Barranquilla, Atlantico","Colombia","grupovartal.com","https://www.linkedin.com/company/grupo-vartal-1"
,"Largo Group","Agencja pracy tymczasowej","Temporary Help Services","1,001-5,000 employees","Public Company",,,"largogroup.pl","https://www.linkedin.com/company/largogroup"
,"eduempower",,"Temporary Help Services","11-50 employees","Non Profit",,,,"https://www.linkedin.com/company/eduempower"
,"Ace Industry",,"Temporary Help Services","2-10 employees","Public Company","Dadeville, Alabama","United States","aceindustryco.com","https://www.linkedin.com/company/ace-industry"
,"RED POINT HMS",,"Temporary Help Services","2-10 employees","Privately Held",,,,"https://www.linkedin.com/company/red-point-hms"
,"Adservicon Administração, Serviços de Limpeza e Conservação LTDA",,"Temporary Help Services","51-200 employees","Privately Held",,,,"https://www.linkedin.com/company/adservicon-administração-serviços-de-limpeza-e-conservação-ltda"
,"ASMO Solutions OZE","W ASMO Solutions OZE specjalizujemy się w rekrutacji dla sektora energii wiatrowej, dostarczając specjalistów na każdy etap życia projektów wiatrowych w Niemczech — od planowania i projektowania, przez instalację, aż po konserwację oraz zarządzanie turbinami wiatrowymi.

Oto, jak możemy wesprzeć Twoją karierę w energetyce wiatrowej:

Projektowanie i instalacja: Oferujemy stanowiska, które pozwalają wykorzystać Twoje umiejętności inżynieryjne i techniczne przy tworzeniu nowoczesnych instalacji wiatrowych.

Utrzymanie i eksploatacja: Zapewniamy dostęp do ról kluczowych dla utrzymania wydajności i długowieczności turbin wiatrowych.

Zarządzanie projektami: Posiadamy oferty pracy dla doświadczonych menedżerów projektów, umożliwiające zarządzanie projektami od ich początku aż do realizacji.

W ASMO Solutions OZE, dostarczamy nie tylko miejsca pracy, ale także oferujemy możliwości rozwoju i zdobywania cennych doświadczeń w sektorze energetyki wiatrowej. Dołącz do nas, aby razem budować przyszłość na zielonych zasadach.","Temporary Help Services","51-200 employees","Privately Held","Włochy, Masovian Voivodeship","Poland","asmo-solutions.pl","https://www.linkedin.com/company/asmo-oze"
,"Modesto Salvation Army",,"Temporary Help Services","51-200 employees","Non Profit",,,,"https://www.linkedin.com/company/modesto-salvation-army"
,"SouzaFlex - Apoio Logístico e Administrativo","Na SouzaFlex, oferecemos soluções terceirizadas em logística e apoio administrativo, conectando empresas com eficiência e confiança. Nosso foco é fornecer serviços flexíveis e precisos que impulsionam a operação de nossos clientes, garantindo suporte especializado para cada desafio. De gestão logística a apoio operacional.","Temporary Help Services","2-10 employees","Self Owned","Guarulhos","Brazil",,"https://www.linkedin.com/company/souzaflex-apoio-logísticoadministrativo"
,"Proline Vikar","Proline Vikar yder vikarservice herunder hjemmehjælp, pædagoger og rengøringsservices på hele Sjælland. Vi leverer vikaren der passer netop til din forretning og behov.","Temporary Help Services","2-10 employees","Self Employed",,,"prolinevikar.dk","https://www.linkedin.com/company/proline-vikar"
,"Construworkers","Construworkers is a pioneering construction-focused hiring tool that leverages AI to combat the prevailing shortage of manual labor workers in developed countries. Through digital transformation, we revolutionize the process of hiring manual laborers, both domestically and internationally, addressing the scarcity by tapping into a vast pool of approximately 14,000 individuals from Latin America and around the world. We meticulously evaluate candidates, providing contractors with essential information and a calculated algorithmic score to make informed hiring decisions. Our tool streamlines the selection process, recognizing the unique challenges faced by manual workers in developing nations.","Temporary Help Services","2-10 employees","Self Owned",,,"construworkers.com","https://www.linkedin.com/company/construworkers"
,"HR Dialog",,"Temporary Help Services","51-200 employees","Privately Held",,,,"https://www.linkedin.com/company/hr-dialog"
,"A ᗡifferent Company","A ᗡifferent Company is more than just the name of our company, it's a new way of thinking.  Don't worry we are not a cult, and there will be no punch to drink, LOL.  

But seriously, we are trying to break social & economic paradigms by taking a ""Deferred Gratification"" mentality to everything we do.","Temporary Help Services","11-50 employees","Privately Held","Las Vegas, Nevada","United States","adifferentcompany.org","https://www.linkedin.com/company/adifcodotorg"
,"DreamTeam GmbH",,"Temporary Help Services","11-50 employees","Privately Held","Neuss, Nordrhein-Westfallen","Germany","dreamteamgmbh.de","https://www.linkedin.com/company/dreamteam-gmbh"
,"Level Empreiteira de Mão de Obra",,"Temporary Help Services","11-50 employees","Privately Held",,,,"https://www.linkedin.com/company/level-empreiteira-de-mão-de-obra"
,"Nord Sud Intérim",,"Temporary Help Services","2-10 employees","Non Profit",,,,"https://www.linkedin.com/company/nord-sud-intérim"
,"WORK LAND sp. z o. o.",,"Temporary Help Services","51-200 employees","Privately Held",,,"work-land.pl","https://www.linkedin.com/company/work-land-sp-z-o-o"
,"TeachPartner","TeachPartner adalah layanan yang mendukung pekerjaan guru dengan menyediakan bantuan dalam pembuatan materi ajar dan pengoreksian lembar kerja siswa. Kami hadir untuk meringankan beban administratif dan akademik guru, sehingga mereka bisa lebih fokus pada proses pengajaran dan pengembangan siswa.
 Layanan kami mencakup:
• Penyusunan materi pembelajaran sesuai kurikulum
• Pengoreksian tugas/lembar kerja siswa dengan teliti
• Dukungan akademik yang efisien dan terpercaya
Kami percaya bahwa guru tidak harus bekerja sendiri. Bersama TeachPartner, mari ciptakan proses belajar mengajar yang lebih efektif dan menyenangkan.","Temporary Help Services","Self-employed","Self Employed",,,,"https://www.linkedin.com/company/teachpartner"
,"Agrilo Lochristi","Wij ondersteunen bedrijven die tijdelijk een extra wiellader-machinist nodig hebben. Flexibiliteit en ervaring in zowat alle sectoren zijn daarbij onze grootste troef.","Temporary Help Services","Self-employed","Self Owned","Ghent, Flemish Region","Belgium",,"https://www.linkedin.com/company/agrilo-lochristi"
,"Coworking.tn","Grâce à notre plateforme dédiée de réservation d'espace de coworking, vous êtes assuré de trouver le lieu de travail qui répond à vos besoins partout en Tunisie.","Temporary Help Services","2-10 employees","Privately Held","Tunis, Tunis","Tunisia","coworking.tn","https://www.linkedin.com/company/coworking-tn"
,"Niji Family Inc.",,"Temporary Help Services","2-10 employees","Self Employed",,,,"https://www.linkedin.com/company/niji-family-inc"
,"FHOJiS Recruitment sp. z o.o","Pośredniczymy w zatrudnieniu wykwalifikowanych pracowników z Filipin. Oferujemy pełne wsparcie w procesie zatrudnienia – począwszy od selekcji, poprzez sprawy formalne oraz obsługę w trakcie zatrudnienia.","Temporary Help Services","2-10 employees","Partnership","Świętochłowice, Śląskie","Poland","fhojis.pl","https://www.linkedin.com/company/fhojis-recruitment-sp-z-o-o"
,"Carejob AG Zürich ZH","""Seit über 15 Jahren beschäftigen wir uns mit anspruchsvollen Aufgaben im modernen Personalmarkt. Unser Kapital sind unser Beziehungsnetzwerk, Partner, unsere Datenbank und Weiterempfehlungen durch ehemalige vermittelte und aktuell im Einsatz stehende Kandidaten als Referenzträger. Die Carejob AG unterstützt und entlastet Sie in allen Personalangelegenheiten, damit Sie sich voll auf Ihre Kerntätigkeit konzentrieren können. Wir sind spezialisiert in der Stellenbesetzung im handwerklichen und technischen Bereich, sowie in der Medical- und Pharmabranche. Wir von der Carejob AG setzen auf langjährige Partnerschaften mit Engagement und Betreuung, statt auf einmalige Einsätze.""","Temporary Help Services","1,001-5,000 employees","Public Company","Stadtkreis 9, Zurich","Switzerland","carejob.ch","https://www.linkedin.com/company/carejob-ag-zürich-zh"
,"Expertis Intérim St Sulpice","Appartenant au groupe Expertis Intérim, notre agence située à Saint-Sulpice est une agence d'intérim généraliste. Nous proposons notamment des missions d'intérim mais notre équipe de recrutement propose aussi des placements en CDD et CDI. Nous sommes disponibles et à votre écoute pour vous accompagner dans vos recherches de nouvelles opportunités professionnelles sur la ville de Saint-Sulpice ou d'autres villes environnantes.
Entreprises tarnaises, Expertis intérim Saint-Sulpice vous propose ses solutions RH pour pallier à vos besoins en recrutements.","Temporary Help Services","2-10 employees","Privately Held","Saint-Sulpice, Occitanie","France","expertis-interim.fr","https://www.linkedin.com/company/expertis-intérim-st-sulpice"
,"Novaterc Terceirização e Serviços","Alocamos mão de obra treinada e especializada para executar atividade de inspeção de recebimento ou no processo produtivo da sua empresa.","Temporary Help Services","2-10 employees","Privately Held","Sorocaba, São Paulo","Brazil","novaterc.com.br","https://www.linkedin.com/company/novaterc"
,"Momentum Enrichment","Everyone deserves a second chance and a safe place to land is the first step toward rising!

Momentum Enrichment is a transitional home in the Metro Atlanta area, providing more than shelter. We support formerly incarcerated individuals as they rebuild their lives with dignity and direction. 

Our program offers safe housing, life skills coaching, job readiness support in a structured, compassionate environment.

This isn’t just a program—it’s a place where people are seen, heard, and empowered to grow. We believe healing happens in community, and change starts from within. 

Because lasting transformation doesn’t happen overnight—but it starts with ME.","Temporary Help Services","2-10 employees","Public Company","Atlanta, Georgia","United States",,"https://www.linkedin.com/company/momentum-enrichment"
,"Teshima Locações de Plataformas","Qualidade, segurança e agilidade! 
Soluções em trabalho em altura, locação de plataformas tesouras e articuladas!
 (42) 9 9102-0011","Temporary Help Services","11-50 employees","Privately Held",,,"teshimalocacoes.com","https://www.linkedin.com/company/teshima-locações-de-plataformas"
,"ADALPOL","Specjalizujemy się w organizacji zespołów do zakładów produkcyjnych i centrów logistycznych- głównie w branży mięsnej, rybnej, przemysłowej oraz magazynowej.","Temporary Help Services","11-50 employees","Public Company","starogard gdański, pomorskie","Poland","adalpol.pl","https://www.linkedin.com/company/adalpol"
,"Athenas Locações","Fundada por Cristiano Domingues em 2016, a Athenas Locações nasceu da paixão e expertise acumulada ao longo de mais de 30 anos no setor de marcenaria. Nos últimos 10 anos, canalizamos essa experiência para especializar-nos na criação de mobiliário exclusivo para eventos, atendendo a um mercado em constante evolução.

Nossa jornada não é apenas sobre móveis; é sobre criar experiências memoráveis. Cada peça que desenvolvemos e fabricamos é mais do que um item de decoração; é uma extensão da nossa dedicação à qualidade e ao design. Priorizamos tendências atuais, mas sempre com um olhar atento às necessidades e desejos únicos dos nossos clientes.

Comprometidos com a excelência, buscamos constantemente inovar e superar expectativas. Acreditamos que cada evento é único, e nosso objetivo é fornecer o mobiliário perfeito para tornar cada ocasião verdadeiramente especial.","Temporary Help Services","2-10 employees","Privately Held","São José dos Campos, São Paulo","Brazil","athenaslocacoes.com.br","https://www.linkedin.com/company/athenaslocacoes"
,"MS SERVIÇOS PROFISSIONAIS LTDA - ME","Prestação de serviços","Temporary Help Services","51-200 employees","Privately Held","Areia Branca, Rio Grande do Norte","Brazil",,"https://www.linkedin.com/company/ms-servicos-profissionais-ltda-me"
,"VCH Group",,"Temporary Help Services","2-10 employees","Privately Held",,,"vchgroup.pl","https://www.linkedin.com/company/vch-group"
,"Prime Work","Outsourcing pracowników ze wschodu – szybko, legalnie i wygodnie.
Chcesz zatrudnić pracowników z Ukrainy, Mołdawii czy Białorusi? Zapraszamy do współpracy. Jesteśmy agencją outsourcingu personalnego, która wie, jak szybko i skutecznie przeprowadzić rekrutację. 
Zapewnimy Ci stały dopływ wykwalifikowanych pracowników – takich, dzięki którym Twoja firma utrzyma ciągłość zatrudnienia i wysoki poziom produktywności.
Jeden partner – pełna obsługa pracowników ze wschodu. Bez problemów i stresu.
Prime Work zajmuje się obsługą całego procesu legalnego zatrudnienia pracowników ze wschodu. 
Nasza oferta:
•	kompleksowa rekrutacja pracowników;
•	legalizacja ich pobytu i pracy;
•	rejestracja w ZUS na potrzeby kontraktu;
•	zakwaterowanie pracowników;
•	badania lekarskie i szkolenia BHP;
•	odzież robocza;
•	stała opieka koordynatora polsko- i ukraińskojęzycznego.
Błyskawiczne obsadzenie stanowisk – najczęściej do 2 tygodni od podpisania umowy.
Z Prime Work nie tracisz czasu. Zadbamy o szybką rekrutację i obsadzenie stanowisk w Twoim zakładzie. Pomożemy Ci zmaksymalizować zyski.","Temporary Help Services","2-10 employees","Privately Held","Oława, Dolnośląskie","Poland","prime-work.pl","https://www.linkedin.com/company/prime-work"
,"Tempo Interim","Notre agence Tempo Interim,  située à Bucarest, en Roumanie,  est spécialisée dans le travail détaché à travers l’Europe, notamment en France. Nous proposons des solutions adaptées aux entreprises cherchant une main-d’œuvre qualifiée et fiable, tout en respectant les réglementations en vigueur. Grâce à notre expertise, nous facilitons le recrutement et l’intégration de professionnels compétents dans divers secteurs d’activité.

Nous opérons dans des domaines variés, notamment la construction, l’industrie, la logistique, l’agriculture et l’hôtellerie. Nos services incluent la sélection rigoureuse des candidats, la gestion administrative et légale ainsi que l’accompagnement des travailleurs tout au long de leur mission. Nous nous assurons également que les conditions de travail respectent les standards européens.

Notre approche repose sur trois principes fondamentaux : qualité, conformité et transparence. Nous nous engageons à offrir aux entreprises des solutions efficaces tout en garantissant aux travailleurs un environnement professionnel sécurisé et conforme aux normes européennes. La directive 96/71/CE est strictement respectée pour assurer un cadre légal optimal aux missions de travail détaché.

Grâce à notre professionnalisme et notre rigueur, nous sommes devenus un partenaire privilégié des entreprises européennes en quête de personnel qualifié et opérationnel. Nous poursuivons notre mission en améliorant continuellement nos processus pour offrir des solutions de recrutement performantes et adaptées aux besoins du marché.

Notre engagement envers la satisfaction de nos clients et le bien-être de nos travailleurs nous permet de nous imposer comme un acteur majeur du travail détaché en Europe. Avec une approche axée sur l’efficacité et le respect des réglementations, nous restons à l’écoute des entreprises pour leur proposer un service réactif et fiable.","Temporary Help Services","51-200 employees","Privately Held",,,"tempo-interim.com","https://www.linkedin.com/company/tempo-interim"
,"Líder Multiservice",,"Temporary Help Services","11-50 employees","Privately Held",,,,"https://www.linkedin.com/company/líder-multiservice"
,"Wellhead Subsea Services","Wellhead Subsea Services is a Brazilian company specialized in providing highly qualified technical manpower for Subsea, Industrial, and Offshore operations, supporting operators and service providers in the Oil & Gas sector.
We are committed to delivering professionals who uphold the highest standards of technical excellence, integrity, and operational reliability.

Areas of Expertise:

Field Engineers

Field Technicians

Subsea Technicians and Subsea Assistants

Specialized Technicians and Engineers in Offshore Operations


Our Internal Divisions:

Wellhead Empower — a program focused on technical and human development, preparing high-performance professionals and future leaders in the offshore environment.

Wellhead Training — a specialized training platform dedicated to practical and technical qualification in Wellhead Systems and Offshore Operations.


 Headquarters: Brazil
 Operations: National & International

Our Commitment:
Delivering the right people, with the right skills, for mission-critical offshore and subsea operations — safely, efficiently, and with excellence.","Temporary Help Services","11-50 employees","Privately Held",,,"wellheasubseaservices.com.br","https://www.linkedin.com/company/wellhead-subsea-services"
,"Antares Personal-Leasing GmbH","Antares Personal-Leasing GmbH steht für moderne Zeitarbeit und Personalvermittlung in Baden-Württemberg. Wir bringen Unternehmen und Fachkräfte aus Industrie, Handwerk, Logistik und Produktion schnell und passgenau zusammen. Mit Erfahrung, Engagement und regionaler Nähe sorgen wir für erfolgreiche Einsätze und langfristige Partnerschaften.","Temporary Help Services","51-200 employees","Public Company","Ludwigsburg, Baden-Württemberg","Germany","antares-personalleasing.de","https://www.linkedin.com/company/antares-personal-leasing-gmbh"
,"Triângulo",,"Temporary Help Services","51-200 employees","Privately Held",,,"triangulolda.com","https://www.linkedin.com/company/triângulolda"
,"Altopp Locação e Comércio de Equipamentos LTDA.",,"Temporary Help Services","51-200 employees","Privately Held",,,"altopp.com.br","https://www.linkedin.com/company/altopp-locação-e-comércio-de-equipamentos-ltda"
