"Find companies","Name","Description","Primary Industry","Size","Type","Location","Country","Domain","LinkedIn URL"
,"Remote Work EU",,"Temporary Help Services","51-200 employees","Privately Held",,,,"https://www.linkedin.com/company/remote-work-eu"
,"PROMAN France","With more than 1,278 branches and 100,000 persons at work every day PROMAN is the 4th European player on the temporary work market and recruitment.

Company with a human dimension, 100% independent and family-owned, our group owes its position to its values: work, kindness, agility, audacity, pleasure and common sense.

In constant growth, the PROMAN Family is expanding and looking for new collaborators to join the adventure!","Temporary Help Services","5,001-10,000 employees","Privately Held","MANOSQUE","France","proman-emploi.fr","https://www.linkedin.com/company/groupeproman"
,"iziwork","iziwork is a JobTech startup that leverages technological innovation to improve the work experience and access to jobs for everyone.

Its fully digitised temporary employment platform offers temporary workers simple and instant access to a wide range of jobs, but also personalised support that rewards individual merit. Breaking with market practices, iziwork offers a 'worker centric' approach to attract, develop and retain the most reliable and competent workers. For client companies, this translates to recruitments that are not only more reliable, but also more responsive and more economical.","Temporary Help Services","201-500 employees","Privately Held","Paris, Île-de-France","France","iziwork.com","https://www.linkedin.com/company/iziwork"
,"First RH Group","A First RH Group é composta por empresas reconhecidas pela excelência em Recursos Humanos.
A ETT FIRST é especializada em mão de obra temporária e a SHIFT em soluções para projetos de terceirização em serviços. Já a FIRST CONNECTING é responsável pelas parcerias estratégicas de negócios, visando cada vez mais avanços tecnológicos e melhores experiências aos nossos colaboradores e clientes. Nossas empresas são especialistas em pessoas, seus diferentes perfis e potenciais.

Acreditamos no poder da interação, por isso, conectamos pessoas e oportunidades.","Temporary Help Services","501-1,000 employees","Partnership","Rio de Janeiro, Rio de Janeiro","Brazil","firstrhgroup.com","https://www.linkedin.com/company/firstrhgroup"
,"Artemis Success","ARTEMIS SUCCESS est un cabinet de recrutement & agence d’intérim spécialisé dans les métiers du bâtiment et de la construction, se basant sur un important réseau de candidats que nous considérons comme de véritables talents et qui nous font confiance pour leur carrière. 
Nous avons également développé ARTEMIS PARTNER, le réseau des indépendants qui permet à tout le monde de pouvoir travailler sur les métiers de l'intérim.","Temporary Help Services","2-10 employees","Self Owned","Paris, Île-de-France","France",,"https://www.linkedin.com/company/artemissuccess"
,"CENTSTONE","CENTSTONE distinguishes itself in a fiercely competitive industry by offering comprehensive, end-to-end services spanning various business and technical platforms. 
Our unique nationwide coverage in staffing and permanent recruitment sets us apart, as no other company can replicate our extensive range of services. 
Additionally, our demonstrated success in attracting and retaining highly skilled professionals in an exceptionally competitive market underscores our credibility and expertise.

SERVICES OFFERED 
Staff Augmentation (Contract, Contract to Hire, Direct Hire, Single Source) 
Data Analysis Project-Based Services & Solutions 
Hire Train Deploy Service Model 
Offshore Staff Augmentation 

AREAS OF EXPERTISE 
- Information Technology 
- Aerospace/Engineering 
- Business Professional 
- Accounting/Finance 
- Admin/Clerical/Call Center 
- Healthcare/Clinical/Scientific 
- Marketing/Creative

Website: https://centstone.com/
332-255-7171","Temporary Help Services","51-200 employees","Privately Held","Hazlet, New Jersey","United States","centstone.com","https://www.linkedin.com/company/centstone"
,"ROI - Workforce as a Service (WaaS)","Our vision at ROI Agency is to connect great talent with meaningful opportunities and help clients find their next greatest hire. We provide exceptional service to both our clients and employees. We strive to positively impact the lives of individuals and companies by connecting them with each other.","Temporary Help Services","11-50 employees","Privately Held","Houston, TEXAS (TX)","United States","roiagency.us","https://www.linkedin.com/company/roi-agency-staffing-recruiting-payroll"
,"Qadreen","مساعدة السودانيين العالقين بالخارج والنازحين بسبب الحرب لدخول سوق العمل في الخارج","Temporary Help Services","2-10 employees","Non Profit",,,,"https://www.linkedin.com/company/qadreen"
,"TechGuard Enterprises","TechGuard Enterprises – Where humor meets growth! This page is dedicated to spreading laughter and positive vibes. No specific agenda, just a space for fun and connecting with awesome people. Let's make the world a better place, one smile at a time! #B2BETTER","Temporary Help Services","11-50 employees","Self Employed","Delhi","India",,"https://www.linkedin.com/company/mandhan-solutions"
,"VICOS - MANPOWER","Faglært arbejdskraft til industrien - hurtigt, sikkert og uden bøvl.

Hos VICOS MANPOWER har vi i over 12 år hjulpet danske industrivirksomheder med vikarservice, projektansættelser og rekruttering.

Vi hjælper bl.a. med dygtige smede, svejsere, CNC-operatører, montører, overfladebehandlere og skibsbyggere.

Vi leverer kvalitet og fleksibilitet, samtidig med at vi sikrer 100 % compliance med dansk lovgivning, vikarloven og gældende overenskomster.

Hvorfor vælge VICOS?

 Netværk af 500+ faglærte håndværkere

 Hurtig levering og fleksible løsninger

 +12 års erfaring med bemanding til industrien 

 Medlem af Dansk Industri – vi tager ansvar for kvalitet, sikkerhed og gode vilkår

Fuld service: bolig · transport · arbejdstøj · certifikater.

Vores bemandingsløsninger:

 Vikarservice til industrien
 Rekruttering og Try & Hire
 Projektansættelser

Få et tilbud på få timer  mail@vicos.dk

 Læs mere på vores hjemmeside","Temporary Help Services","51-200 employees","Privately Held","Esbjerg, South Denmark","Denmark","vicos.dk","https://www.linkedin.com/company/vicos"
,"Groupe Santé IPA","Groupe Santé IPA a comme mission de valoriser le travail des professionnels de la santé ainsi que de leur offrir un environnement de travail leur permettant une grande liberté de mouvement.

L'engagement du Groupe Santé IPA est simple et très clair. Nous souhaitons offrir les meilleurs soins de santé en régions nordiques et éloignées. Comme nous y arrivons? En recrutant des professionnels de la santé qualifiés et expérimentés. Notre équipe de développement fait de son mieux afin de rendre accessible aux populations éloignées des soins de santé de qualité par le biais de notre personnel.","Temporary Help Services","1,001-5,000 employees","Privately Held","Gatineau, Quebec","Canada","groupesanteipa.com","https://www.linkedin.com/company/agencegroupesanteipa"
,"SHANAVAS UV |The only goal is to provide news to the unemployed.","The only goal is to help until the unemployed","Temporary Help Services","Self-employed","Non Profit","Ajman, Ajman","United Arab Emirates",,"https://www.linkedin.com/company/al-shanavas-hospital"
,"Mandskabsudlejning Vikar Rekruttering Rengøring Snerydning Brandvagt","Sandvoss.dk - Mandskabsudlejning er et firma med speciale i udlejning af danske arbejdsmænd til alle former for opgaver på byggepladser og ejendomme. Vi udlejer både faglært og ufaglært mandskab. Se mere under mandskabsudlejning. 

 Sandvoss.dk leverer også en række serviceydelser indenfor vagt og erhvervsrengøring.

Vi er en kvalitetsbevidst servicevirksomhed som altid løser opgaver og udfører arbejde til konkurrencedygtige priser og til de aftalte leveringstider og betingelser.

En af vores mange styrker ligger i at vi altid kan skaffe det fornødne mandskab enhver opgave må kræve og derfor ikke behøver at sige nej til vore kunder.

Af opgaver vi kan hjælpe med kan bl.a. nævnes:
Mandskabsudlejning, rengøring af mandskabsvogne, rengøring erhverv/private, nedrivning, byggeplads-oprydning, arbejdsmænd, montage-arbejde, affaldshåndtering/bortskaffelse af affald, hjælp til flytning, hjælp til optagning/nedtagning af scener, konferencesale fx.. Det er dig der bestemmer hvad vi skal hjælpe med.
Endvidere kan vi hjælpe vedr. opgaver der indebærer: vvs, tømrer, elektriker, maler, snedker, entrepriser, kloak, fugtsikring, nedrivning, byggeplads-sikring, byggeplads-vagt, chauffør m.m.

Hos Sandvoss.dk yder vi service i særklasse, og sætter en stor ære i at være en stabil, pålidelig og fleksibel samarbejdspartner med positive, dygtige og arbejdsomme medarbejdere som tilfredsstiller vore kunder.

www.sandvoss.dk

Tlf.: 5290 5985

Find os på Facebook:
www.facebook.com/sandvossmandskabsudlejning

Følg os på Twitter:
https://twitter.com/Sandvossdk

Søger du arbejde??

Sandvoss.dk. søger altid efter medarbejdere, der ønsker, at være en del af vores familie. 
Se på vores  hjemmeside hvilke former for service vi tilbyder vores kunder.
Har du erfaring inden for et af emnerne (se under: ""vi tilbyder"")  så tøv ikke med, at sende os en mail med info om dig selv samt et billede.
Vi gemmer da dine data til senere brug når vi har brug for mandskab.","Temporary Help Services","11-50 employees","Privately Held","Copenhagen, Capital Region of Denmark","Denmark","sandvoss.dk","https://www.linkedin.com/company/sandvoss-dk---mandskabsudlejning"
,"Diretiva Group","Com 25 anos de experiência no mercado, nosso grupo se consolidou como uma referência em terceirização de serviços (Facilities) e contabilidade. Oferecemos soluções personalizadas e integradas, focadas em otimizar processos, reduzir custos e aumentar a eficiência operacional das empresas. Nossa equipe de especialistas está comprometida em entregar resultados de alta qualidade, assegurando conformidade e inovação para o crescimento sustentável de nossos clientes. Priorizamos um atendimento excepcional, qualidade e profissionalismo em todas as nossas operações.

Especializações:
 
Terceirização de Serviços:
Somos especialistas na contratação e prestação de serviços para empresas, incluindo auxiliar administrativo, recepcionista, motorista, copeira, limpeza e segurança, entre outros. Atendemos a diversos segmentos do mercado, oferecendo um serviço personalizado que se adapta às necessidades específicas de cada cliente. Nossa prioridade é garantir um atendimento de alta qualidade, sempre focado na melhoria contínua.

Contabilidade:
Oferecemos uma gama completa de serviços contábeis, incluindo alteração e baixa contratual, contabilidade especializada na área da saúde, recursos humanos, abertura de empresas, escrituração contábil, consultoria tributária e gestão de contratos intermitentes. Nossa equipe está preparada para fornecer soluções que asseguram conformidade e eficiência, apoiando o crescimento e a sustentabilidade dos nossos clientes.","Temporary Help Services","51-200 employees","Privately Held","Curitiba, Paraná","Brazil","diretivacontabilidade.com.br","https://www.linkedin.com/company/diretivagroup"
,"PROMAN jobs Wallonie",,"Temporary Help Services","5,001-10,000 employees","Privately Held",,,"proman.be","https://www.linkedin.com/company/proman-jobs-fr"
,"Agencia Ocean - Trabajo en Cruceros","Trabaja en las mejores compañías de cruceros del mundo, somos una agencia autorizada. Conoce todos nuestros puestos disponibles y postula ahora!","Temporary Help Services","2-10 employees","Self Owned","San Isidro, LIMA","Peru","agenciaocean.net","https://www.linkedin.com/company/agenciaocean"
,"Oxygène Intérim & Recrutement","Oxygène Intérim, réseau d’agences d’emploi multirégional, regroupe 25 agences implantées dans le Grand Sud-Ouest de la France. Spécialisée dans le recrutement multisectoriel, nous proposons des opportunités en CDD, CDI et intérim, adaptées aux besoins des entreprises locales et aux attentes des candidats.

Notre mission : accompagner nos intérimaires tout au long de leur parcours professionnel, de la recherche de poste à l’accomplissement de leurs missions. Nous mettons tout en œuvre pour valoriser leurs compétences, faciliter leur intégration et les soutenir à chaque étape de leur carrière.

Entreprise à taille humaine, nous cultivons des valeurs de proximité, simplicité et bienveillance. Notre objectif est de construire des relations solides et durables avec nos salariés intérimaires et nos partenaires.

Rejoignez une équipe passionnée et dynamique, engagée à faire de chaque collaboration une réussite !

Ensemble, trouvons un job !","Temporary Help Services","51-200 employees","Privately Held","Tarbes, Occitanie","France","oxygene-interim.fr","https://www.linkedin.com/company/oxygene-recrutement-interim"
,"TWG Polska Sp. z o.o.","TWG to rodzinna spółka z holenderskim kapitałem należąca do grupy kapitałowej The Wiendels Group. Na rynku europejskim istniejemy już od 1988 roku. W Polsce działamy od 2008 roku – najpierw poprzez sieć biur przedstawicielski, a obecnie – jako TWG Polska. Naszym głównym celem jest rozwój na rynku europejskim. Nie boimy się innowacyjnych rozwiązań i odważnych zmian, wiedząc, że podejmowane przez nas decyzje podnoszą jakość naszych usług. Śledzimy na bieżąco rynkowe trendy, dzięki czemu stale udoskonalamy nasz proces rekrutacji oraz kontakt z klientem. Bazując na naszym ogromnym doświadczeniu spełniamy oczekiwania nawet najbardziej wymagających klientów, oferując i wdrażając skuteczne – przede wszystkim – spersonalizowane rozwiązania. Dzięki temu nasi klienci mogą koncentrować się na swoim sukcesie – my zajmiemy się resztą.","Temporary Help Services","501-1,000 employees","Privately Held","Środa Śląska, Dolnośląskie","Poland","twg-polska.pl","https://www.linkedin.com/company/twg-polska-sp-z-o-o"
,"Maxtec Serviços Gerais e Manutenção Industrial","Atuando há 20 anos com excelência na prestação de serviços de higienização hospitalar, fornecimento de mão de obra e consolidada em soluções de Gerenciamento Integrado de Resíduos Sólidos e Líquidos.","Temporary Help Services","1,001-5,000 employees","Privately Held","São Luís, Maranhão","Brazil","maxtecservicos.com.br","https://www.linkedin.com/company/maxtecservicosgerais"
,"SeproTem ETT","La rapidez y profesionalidad son las señas de identidad de SeproTem ETT, una empresa de trabajo temporal con más de 30 años de experiencia cuyo objetivo es cubrir las necesidades de su compañía aportando una alta flexibilidad y cualificación en los recursos humanos. 

Además, en coordinación y colaboración con los Servicios Públicos de Empleo,SeproTem trabaja como Agencia de Colocación con la finalidad de proporcionar a las personas trabajadoras un empleo adecuado a su perfil y facilitar a los empleadores las personas trabajadoras más adecuadas a sus necesidades y expectativas. Para ello, SeproTem como Agencia de Colocación, valora los diferentes perfiles, aptitudes, conocimientos y cualificación de las personas trabajadoras que requieren estos servicios, así como los requerimientos y características de los puestos de trabajo ofertado.","Temporary Help Services","11-50 employees","Privately Held","Madrid, Madrid","Spain","seprotem.com","https://www.linkedin.com/company/seprotem-ett"
,"BREXA Technology, Inc.","IT・機械・電子・電気・ソフトウェアの技術者派遣及び開発請負
※次世代自動車・デジタル家電・ロボティクス・医療機器の研究開発、生産、技術開発など
職業紹介業務（専門職の職業紹介）
例：カーオーディオチューナー製造・販売電子部品、完成品の受託生産（テレビ基板、PC光学ドライブ、無線オーディオ、カメラ、無線監視装置）
企業向けネットワーク、コンピュータ及び情報通信システム関連のハードウェア・ソフトウェア・サービスの輸出入、販売、設計・構築、保守・その他技術サービスなど","Temporary Help Services","10,001+ employees","Privately Held","Chiyoda, Tokyo","Japan","brexa.com","https://www.linkedin.com/company/outsourcing-technology-inc-"
,"Flexit","Flexit te permite contratar personal para trabajos y horas específicas. En nuestra App se publicará tu oferta y podrás encontrar al candidato perfecto en solo un clic. Fácil, rápido y flexible. Somos Flexit.","Temporary Help Services","5,001-10,000 employees","Self Owned","Santiago","Chile",,"https://www.linkedin.com/company/flexitfalabella"
,"ECOPORT SUL SERVIÇOS LOGISTICOS LTDA","Fundada em 1984 como Cetec – Centro de Estudos Técnicos, a ECOPORT SERVIÇOS LTDA. acumulou durante seus mais de 30 anos de atividades, um acervo de trabalhos desenvolvidos que lhe dá credibilidade, consistência técnica e uma sólida cultura de Qualidade em Serviços.","Temporary Help Services","51-200 employees","Privately Held","Paranaguá, Paraná","Brazil",,"https://www.linkedin.com/company/ecoport-sul-serviços-logisticos-ltda"
,"Flexwork LATAM","""Conectando talento, potenciando proyectos""
Plataforma que conecta talento y oportunidades en América Latina. Nuestro enfoque combina tecnología con un toque humano, ofreciendo soluciones de staffing especializadas en proyectos temporales.","Temporary Help Services","2-10 employees","Self Owned","Lima, Lima","Peru",,"https://www.linkedin.com/company/flexwork-latam"
,"Goodjob inc","Vous avez des quarts de travail à combler ? Vous cherchez à remplacer un employé en vacances ? Les travailleurs que vous recherchez sont sur GoodJob !
GoodJob est l'application innovante qui met en relation les entreprises et les travailleurs autonomes. Simplifiez la gestion de vos ressources temporaires avec notre agence de placement virtuelle : nous nous occupons de tout, des horaires à la facturation.
Trouvez vos prochains travailleurs temporaires dès maintenant sur GoodJob app !","Temporary Help Services","2-10 employees","Partnership","Montréal, Québec","Canada","goodjobapp.ca","https://www.linkedin.com/company/corporation-goodjob-inc"
,"Rescousse Santé","Agence de placement et de remplacement en santé","Temporary Help Services","2-10 employees","Self Employed","Blainville, Québec","Canada","rescoussesante.com","https://www.linkedin.com/company/rescousse-santé"
,"RM Groupe","RM Groupe est un réseau de 10 agences regroupant 4 enseignes de travail temporaire : 
-	RM Intérim
-	Rochefort Intérim
-	LR Intérim
-	RM Médicales

Cette page a pour but de rassembler les différentes entités et faciliter les échanges au sein de notre réseau professionnel. Ici, vous trouverez toutes les informations clés sur ces agences, ainsi que les dernières actualités et opportunités de carrière au sein de RM Groupe.
Que vous soyez un chercheur d'emploi à la recherche de nouvelles opportunités, une entreprise en quête de talents qualifiés ou simplement intéressé par le secteur de l'intérim, cette page est faite pour vous. Notre équipe de professionnels expérimentés met tout en œuvre pour vous accompagner dans votre recherche d'emploi et répondre à vos besoins spécifiques.

RM Intérim, c’est : 5 agences généralistes, offrant une variété d'opportunités dans différents domaines d’activité comme le BTP, l’industrie, le tertiaire et bien d'autres. Nous sommes là pour vous aider à trouver le poste qui correspond le mieux à vos compétences et à vos aspirations.

Rochefort Intérim est une agence généraliste située dans la commune de Rochefort-sur-Mer et agissant pour l'emploi en Charente-Maritime. Notre équipe met tout en œuvre pour identifier les candidats les plus qualifiés et les adapter aux postes disponibles, tout en accompagnant les entreprises dans leurs problématiques de recrutement. 

LR Intérim propose des opportunités professionnelles dans divers domaines d’activité dans la ville de Rouen et de Périgny, elles offrent des solutions de recrutement pour répondre aux besoins spécifiques des entreprises.

RM Médicales se concentre sur les professions de la santé et propose des opportunités dans les hôpitaux, les cliniques et autres établissements médicaux. Nous sommes fiers de fournir des solutions de recrutement efficaces pour répondre aux besoins croissants du secteur de la santé.","Temporary Help Services","11-50 employees","Self Owned","Paris","France",,"https://www.linkedin.com/company/rmgroupe"
,"GLOBAL RESSOURCES HUMAINES GRH","Nous sommes un groupe de premier plan opérant dans le secteur des ressources humaines au Maroc. Depuis notre création en 2002, nous nous sommes forgés une réputation solide en fournissant des services d'intérim de qualité à nos clients à travers le pays.

Notre équipe passionnée et dévouée est là pour vous accompagner dans tous vos projets professionnels. Nous mettons l'accent sur la création de relations durables basées sur la confiance mutuelle et le respect.

Chez GRH, la flexibilité est au cœur de notre approche. Nous comprenons les défis auxquels font face les entreprises d'aujourd'hui et nous nous efforçons de fournir des solutions adaptées à vos besoins spécifiques.

Notre objectif est de fournir des talents compétents et qualifiés qui s'intègrent parfaitement dans votre entreprise. La sécurité et le bien-être de nos collaborateurs sont également une priorité absolue.

Nous sommes fiers de contribuer à votre développement professionnel et nous sommes convaincus que notre collaboration sera mutuellement bénéfique.","Temporary Help Services","201-500 employees","Privately Held",,,"grhmaroc.ma","https://www.linkedin.com/company/global-ressources-humaines-grh"
,"Log Diária","A Log Diária é especialista em terceirização de mão de obra qualificada para operações logísticas. Contamos com uma equipe treinada e experiente para executar atividades como carga e descarga, separação, conferência, expedição, apoio logístico e serviços administrativos.

Nosso propósito é oferecer soluções sob medida que garantam eficiência, segurança e resultados confiáveis, permitindo que cada cliente concentre seus esforços no crescimento do negócio.

Com dedicação, infraestrutura adequada e foco em produtividade, a Log Diária entrega uma experiência logística ágil, estratégica e de confiança.","Temporary Help Services","501-1,000 employees","Privately Held","Goiânia, Goiás","Brazil",,"https://www.linkedin.com/company/log-diária"
,"The Smith Agency","The Smith Agency provides premier temporary staffing for wholesale apparel and gift markets in Atlanta, Dallas and New York.","Temporary Help Services","51-200 employees","Self Owned","atlanta","United States","thesmithagency.net","https://www.linkedin.com/company/the-smith-agency"
,"iperdi Deutschland","iperdi ist ein mittelständisches Unternehmen für Personaldienstleistungen in Familien- bzw. Privatbesitz. An 60 Standorten bietet iperdi bundesweit individuelle und intelligente Personalservices.

Ob qualifiziertes Personal für zeitlich begrenzte Projektarbeit benötigt wird (Arbeitnehmerüberlassung) oder auf feste Mitarbeiter eingestellt werden sollen (Direkt-/Personalvermittlung) – mit unseren Personaldienstleistungen sind wir jederzeit ein kompetenter Ansprechpartner!","Temporary Help Services","1,001-5,000 employees","Privately Held","Weinheim","Germany","iperdi.de","https://www.linkedin.com/company/iperdi-deutschland"
,"RM Intérim Gretz-Armainvilliers","Notre agence de recrutement et de placement, RM Intérim - Gretz-Armainvilliers, vous accompagne tout au long de votre parcours professionnel en Île-de-France. Que vous cherchiez un emploi en région parisienne ou que vous souhaitiez évoluer dans votre carrière, notre équipe est là pour vous soutenir.

RM Intérim - Gretz-Armainvilliers propose un accompagnement dans divers secteurs d'activité, tels que l'industrie, le médical, le tertiaire, le bâtiment, la logistique et la menuiserie.

Pour mener à bien vos missions professionnelles, nos équipes sont à votre écoute, vous offrant un service de qualité et une relation fondée sur des valeurs humaines solides.","Temporary Help Services","2-10 employees","Self Employed","Gretz-Armainvilliers, Île-de-France","France","rm-interim.fr","https://www.linkedin.com/company/rm-intérim-gretz-armainvilliers"
