"Find companies","Name","Description","Primary Industry","Size","Type","Location","Country","Domain","LinkedIn URL"
,"MBO Job-Boom GmbH","Die MBO Job-Boom GmbH unterstützt Sie zuverlässig bei Personalengpässen, Projektrealisierungen und der Auswahl qualifizierter Mitarbeiter. Unser Ziel: Effektive Lösungen zu fairen Preisen – mit persönlicher Beratung, schneller Umsetzung und messbarem Erfolg.","Temporary Help Services","2-10 employees","Public Company","Wilhelmshaven, Lower Saxony","Germany","job-boom.de","https://www.linkedin.com/company/mbo-job-boom-gmbh"
,"COROME INTERIM","Agence de travail temporaire.
Ouvert du Lundi au Vendredi de 8H45/12H et 14H/18H
Pour toute inscription (prendre rendez-vous) et vous munir :
CV
CARTE D'IDENTITE
CARTE VITALE
JUSTIFICATIF DE DOMICILE
RIB","Temporary Help Services","2-10 employees","Privately Held","L'Arbresle, Auvergne-Rhône-Alpes","France","corome-interim.fr","https://www.linkedin.com/company/corome-interim"
,"JAH Entreprise","JAH Entreprise er din dedikerede samarbejdspartner, der specialiserer sig i at tilbyde kvalificeret arbejdskraft til entreprenører og byggefirmaer. Vores arbejdskraft er nøje udvalgt og certificeret, så du kan stole på, at dit projekt udføres professionelt og sikkert. Vores team arbejder tæt sammen med dig for at forstå dine krav og skræddersy løsninger, der passer til dine behov og budget.","Temporary Help Services","2-10 employees","Partnership","Frederiksberg, Capital Region of Denmark","Denmark","jahentreprise.dk","https://www.linkedin.com/company/jah-entreprise"
,"simplecare GmbH","Zeitarbeit für die Pädagogik. Flexibel. Kompetent. Pädagogisch.","Temporary Help Services","11-50 employees","Public Company","Hamburg, HH","Germany","simplecare-personal.de","https://www.linkedin.com/company/simplecare-gmbh"
,"SBR ENGENHARIA LTDA",,"Temporary Help Services","11-50 employees","Privately Held",,,,"https://www.linkedin.com/company/sbr-engenharia-ltda"
,"Consultores en Gestion Humana S.A.S","Bienvenido a Consultores en Gestión Humana, tu puerta de entrada al mundo laboral. Somos una empresa especializada en proveer soluciones de empleo a empresas y candidatos que buscan oportunidades laborales flexibles y adaptadas a sus necesidades.","Temporary Help Services","11-50 employees","Privately Held","Bogotá, Bogotá","Colombia","consultoresgh.com","https://www.linkedin.com/company/consultores-en-gestion-humana-s-a-s"
,"Carpediem Care - Arbeit in Deutschland","Wir sind eine polnische Arbeitsagentur, die sich auf die Vermittlung von Betreuungskräften für ältere Menschen in Deutschland spezialisiert. Unser Unternehmen sorgt mit langjähriger Erfahrung für Beschäftigungsstabilität und hochwertige Betreuungstleistungen.

Unser Ziel ist es, den Betreuungskräften in jeder Phase der Zusammenarbeit ein Gefühl der Sicherheit zu gewährleisten und unseren Pflegebedürftigen ein angenehmes und friedliches Leben zu ermöglichen.

Wir stellen über einen Dienstleistungsvetrag ein, bieten eine europäische Versicherung, attraktive Vergütungen und einen von Haus-zu-Haus-Transport an. Dank eines gründlichen Rekrutierungsprozesses können wir Aufträge an die Anforderungen unserer Betreuungskräfte anpassen.

Wenn Sie auf der Suche nach einer festen Anstellung sind und sich in der Betreuungsbranche in Deutschland weiterentwickeln möchten, kommen Sie noch heute zu uns!","Temporary Help Services","51-200 employees","Privately Held","Prószków, opolskie","Poland","carpediemcare.eu","https://www.linkedin.com/company/carpediem-care-arbeit-in-deutschland"
,"Conzept Personalmanagement und -service GmbH","Die Conzept Personalmanagement und -service GmbH ist ein erfolgreiches und etabliertes Personaldienstleistungsunternehmen mit den Schwerpunkten in der qualitätsorientierten Arbeitnehmerüberlassung und Personalvermittlung von qualifizierten Fach- und Führungskräften im gewerblich-technischen, kaufmännischen und medizinischen Bereich.","Temporary Help Services","11-50 employees","Public Company","Munich, Bavaria","Germany","conzept-personalmanagement.de","https://www.linkedin.com/company/conzept-personalmanagement-service-gmbh"
,"Prima Job Center","Wir sind ein Zeitarbeitsunternehmen und dafür da, um Ihr Unternehmen zu unterstützen. Dank langjähriger Erfahrung in der Branche wissen wir, wie wir die Erwartungen unserer Kunden erfüllen können. Wir sind uns der Probleme, Einschränkungen und Herausforderungen bewusst, mit denen sich Unternehmen täglich auseinandersetzenmüssen. Deshalb tun wir unser Bestes, um Personalprobleme unserer Kunden zu lösen und so auf die Nachfrage und Marktsituation reagieren zu können.Wir vermitteln Arbeitskräfte in ganz Deutschland. Egal, ob Sie Zeitarbeitskräfte (mindestens 6 Wochen) benötigen oder Stabilität und langfristige Zusammenarbeit suchen: Wir sind in der Lage, Ihre Erwartungen zu erfüllen. Nutzen Sie unsere Dienstleistungen und fordern Sie Mitarbeiter an, um die Effizienz Ihres Unternehmens zu steigern!","Temporary Help Services","11-50 employees","Self Owned","Ruda Śląska, śląskie","Poland","primajobcenter.de","https://www.linkedin.com/company/prima-job-center"
,"AeL Group Srl","Forniamo un servizio qualificato di installazione, riparazione e assistenza tecnica a domicilio di elettrodomestici da incasso e di libera installazione.","Temporary Help Services","11-50 employees","Privately Held","Gorgonzola, Lombardy","Italy","aelgroup.it","https://www.linkedin.com/company/ael-group-srl"
,"Fleckz","Fleckz is een alles in 1 platform om uitzendkrachten in te lenen. 
Van zoeken tot facturatie. Vind jouw geschikte kandidaten vandaag nog met Fleckz.","Temporary Help Services","2-10 employees","Privately Held","The Hague, South Holland","Netherlands","fleckz.nl","https://www.linkedin.com/company/fleckz"
,"IEEE Horus Electronics Store","IEEE Store is a student-led e-commerce platform that provides innovative electronic and tech products designed for engineers, makers, and students.
Our goal is to make technology more accessible by offering high-quality gadgets, components, and accessories at affordable prices.
Powered by the IEEE Horus Student Branch, we combine creativity, precision, and passion for technology to deliver value to every customer.","Temporary Help Services","2-10 employees","Non Profit",,,,"https://www.linkedin.com/company/ieeehue-es"
,"MC OFFICE+","Assistante","Temporary Help Services","Self-employed","Privately Held",,,"mcofficeplus.fr","https://www.linkedin.com/company/mc-office"
,"Elite2Serve Healthcare Solutions","Welcome to Elite2Serve, a Solution-based Healthcare network located in the vibrant city of Fort Washington, PA. As a diverse group of passionate Healthcare Clinicians and Administrators, we established Elite2Serve in 2023 with a shared vision of delivering exceptional healthcare solutions to our community.

With over 20 years of combined experience and an unwavering commitment to professional development, our team brings a wealth of expertise and a deep understanding of the ever-evolving healthcare landscape. We have dedicated ourselves to staying at the forefront of industry advancements, ensuring that we provide our clients with the most innovative and effective solutions.

At Elite2Serve Healthcare Solutions, we are not just service providers but trusted partners on your journey towards excellence in healthcare. We are committed to building long-term relationships with our clients, earning their trust through exceptional products and services with integrity, and a genuine dedication to their success. By working together, we strive to make a meaningful and lasting impact on the healthcare industry, one organization at a time.

Join us on our journey to transform healthcare. Together, we can shape a future where excellence, innovation, and compassion define every healthcare interaction.","Temporary Help Services","2-10 employees","Self Owned","Fort Washington, Pennsylvania","United States","elite2servehealthcare.solutions","https://www.linkedin.com/company/elite2serve-healthcare-solutions-llc"
,"Traffic Management & Control","Traffic Management & Control is a company based out of Dunedin, Otago, New Zealand.","Temporary Help Services","51-200 employees","Self Owned","Dunedin, Otago","New Zealand","tmcteam.co.nz","https://www.linkedin.com/company/traffic-management-&-control"
,"شرکت دانش بنیان بین المللی افتخار مدیران خاورمیانه eftekhar modiran khavarmiyaneh intl co","Identify technological needs by analyzing, diagnosing and improving organizational processes, synergy in human resources with the aim of better management and leadership in the organization, purposeful structuring and structuring, upgrading design skills and key personnel in school design, scheduling scheduling. Along with the index of measurement and analysis of deviation by problem solving method with fish model and FMEA analysis, technological software of human resources by character analysis, identification and introduction of human capital.","Temporary Help Services","11-50 employees","Self Employed","Isfahan","Iran","eftekharmodiran.com","https://www.linkedin.com/company/eftekharmodiran"
,"ORDENdelCAOSinconsciente","#jardineria #jardinería #trabajos #mantenimientos #limpieza #poda #casas #terrenos #mardelplata #mardelplataarg

Sebastián 2235032746","Temporary Help Services","2-10 employees","Self Owned","MAR DEL PLATA, Provincia","Argentina",,"https://www.linkedin.com/company/orden7del7caos7incosciente7"
,"INFINITEAM Montpellier",,"Temporary Help Services","11-50 employees","Self Owned","Montpellier, Occitanie","France","infiniteam.fr","https://www.linkedin.com/company/infiniteam-montpellier"
,"KM BEST JOB",,"Temporary Help Services","2-10 employees","Self Owned",,,,"https://www.linkedin.com/company/km-best-job"
,"IHL Beaujolais Val de Saône","Vous cherchez un travail, une mission pour du court, moyen, long terme, IHL peut vous aider.","Temporary Help Services","2-10 employees","Self Owned","Belleville-sur-Saône, Auvergne-Rhône-Alpes","France","ihl.fr","https://www.linkedin.com/company/ihl-beaujolais-val-de-saône"
,"Work in Progres ApS","Med gode lytlappere, et bredt netværk og en kæmpe nysgerrighed, hjælper vi dig videre med din næste arbejdsrelation - om du er arbejdsgiver eller jobsøger!","Temporary Help Services","Self-employed","Self Employed","Bastrup Mark, Region of Southern Denmark","Denmark","workip.dk","https://www.linkedin.com/company/work-in-progres-aps"
,"Agencja Pracy Successful People","Jesteśmy Agencją Pracy Tymczasowej Successful People działającą w branży międzynarodowego i krajowego pośrednictwa pracy. Zajmujemy się rekrutacją, pośrednictwem pracy i kierowaniem do naszych kontrahentów pracowników z Ukrainy, Białorusi, Gruzji, Polski oraz innych krajów. Świadczymy kompleksowe procesy rekrutacyjne. Posiadamy dużą bazę kandydatów do pracy z każdej specjalizacji.","Temporary Help Services","201-500 employees","Privately Held","Środa Śląska , dolnośląskie","Poland","agencjapracy-sp.pl","https://www.linkedin.com/company/agencja-pracy-successful-people"
,"Aserp Locação e Serviços Gerais LTDA","Somos uma empresa prestadora de serviços para órgãos públicos, dedicada a oferecer soluções eficientes e de alta qualidade. Com mais de 15 anos de experiência no setor.","Temporary Help Services","51-200 employees","Privately Held",,,,"https://www.linkedin.com/company/aserp-locação-e-serviços-gerais-ltda"
,"F&I Solutions Inc","Specialists are AFIP certified, pass a comprehensive background check, and have a minimum of 8years F&I experience, with extensive tech knowledge of most CRM’s, DMS, credit app submission platforms, eContracting & remote sign with the ability to hit the ground running.","Temporary Help Services","11-50 employees","Self Owned","Delray Beach , Florida","United States","fandisolutionsinc.com","https://www.linkedin.com/company/f-i-solutions-inc"
,"Confiance Terceirização","Terceirização de mao de obra","Temporary Help Services","11-50 employees","Privately Held",,,"confiancenordeste.com.br","https://www.linkedin.com/company/confiance-terceirização"
,"TM Solutions","TM Solutions - dynamic leader in the Polish job placement market, specialized in providing highly skilled warehouse workers. We ensure efficient service to our clients in various regions of the country and guarantee flexibility and a quick response to their needs. 

Each of our projects is treated individually. Our HR specialists not only offer qualified workers, but also guarantee comprehensive support. Every project has its own coordinator who supervises the work and ensures perfect performance of assigned tasks. This approach allows us to effectively manage processes while maintaining constant communication with clients and employees.

Excellent working conditions with safety and comfort, are our top priority. We have our own vehicle fleet as well as hotels and apartments base, providing employees with convenient accommodation and efficient transportation.

TM Solutions is not just a provider of workers but also a strategic partner dedicated to supporting the growth of your company.","Temporary Help Services","1,001-5,000 employees","Public Company","POZNAŃ","Poland","tmsolutions.pl","https://www.linkedin.com/company/tms-tm-solutions"
,"Workzen Consulting","En Workzen Consulting ayudamos a las empresas a modernizar su gestión implementando soluciones del ecosistema Zoho. Diseñamos procesos más ágiles y conectados mediante analítica de datos, integraciones inteligentes y estrategias orientadas a resultados. Acompañamos a cada cliente en su evolución digital, con un enfoque práctico basado en eficiencia, innovación y crecimiento sostenible.

 Especialidades: Zoho CRM, Books, Projects, Creator, Campaigns, Desk, Analytics y SalesIQ, automatización empresarial, integraciones personalizadas, analítica avanzada, Growth Marketing, inteligencia artificial aplicada a ventas y transformación digital.","Temporary Help Services","2-10 employees","Self Owned",,,,"https://www.linkedin.com/company/workzen-consulting"
,"ADD zeitweise GmbH","Über uns:

Seit 1992 ist ADD zeitweise Ihr vertrauenswürdiger Spezialist für Zeitarbeit und Personalvermittlung in OWL. Mit jahrelanger Erfahrung und einem engagierten Team von Fachkräften unterstützen wir Ihre Unternehmen dabei, Personalanforderungen effizient und flexibel zu bewältigen.

Unser Team:
Wir verfügen über umfassendes Branchenwissen und ein Netzwerk flexibler Angestellter. Wir finden die personelle Unterstützung, die perfekt zu Ihrem Unternehmen passt und helfen Ihnen, Ihr Team effektiv zu verstärken.

Unsere Dienstleistungen:
• Arbeitnehmerüberlassung
• Personalvermittlung
• Projektmanagement
• HR-Beratung

Warum ADD zeitweise?
• Schnelle und effektive Rekrutierung
• Flexibilität in der Personalbeschaffung
• Kostenoptimierung
• Rechtliche Compliance
• Kontinuierliche Unterstützung

Unsere Kunden vertrauen uns, weil wir ihre Anforderungen verstehen und in der Lage sind, flexibel und schnell zu reagieren. Erfahren Sie, wie die ADD zeitweise GmbH Unternehmen in verschiedenen Branchen dabei geholfen hat, ihre Ziele zu erreichen.

Bereit, mit uns zusammenzuarbeiten oder mehr zu erfahren? Kontaktieren Sie uns noch heute! Wir freuen uns darauf, Ihre Anforderungen zu besprechen und eine maßgeschneiderte Lösung für Ihr Unternehmen zu entwickeln.

#Arbeitnehmerüberlassung #Zeitarbeit #Arbeitsvermittlung #Personaldienstleistungen #HCM #Rekrutierung #Talente #Karriere #Ostwestfalen #Bielefeld #Gütersloh","Temporary Help Services","201-500 employees","Public Company","Gütersloh, North Rhine-Westphalia","Germany","add-zeitweise.de","https://www.linkedin.com/company/add-zeitweise"
,"DFI MEDICAL","Présent sur le marché du travail temporaire dans le paramédical depuis plus de 21 ans, DFI MÉDICAL s’engage chaque jour dans une relation de confiance auprès des établissements de santé et des soignants.","Temporary Help Services","201-500 employees","Self Owned",,,"dfi-medical.fr","https://www.linkedin.com/company/dfi-medical"
,"COMPAS SERVICES","Créée depuis 2004 nous sommes une société d’intérim spécialisée en menuiserie bois.

Nous sommes situés à Paris au 9 rue Tourneux – Métro Daumesnil.

Nous travaillons la plupart du temps sur Paris et Ile de France, mais aussi en province et à l’étranger.

Nos menuisiers sont délégués en fabrication et en pose dans différents secteurs d’activité :

• Agencement de bureaux et magasins •
• Menuiserie générale avec pose de fenêtres et portes •
• Aménagement d’Hôtels particuliers •
• Evènementiel •
• Stand •
• Monuments historiques •

Les références professionnelles de notre personnel sont très diversifiées, elles englobent de grands chantiers réputés comme : Grands Hôtels (Le Meurice, Ritz, Georges V…), le Louvre, la Grande Bibliothèque, l’Elysée,
les Ministères, les aéroports et agencement de magasins (Guerlain, Vuitton, Histoire d’Or, …).

Dans le domaine du stand et de l’événementiel nos menuisiers ont acquis suffisamment d’expériences pour collaborer à la fabrication et au montage des salons (automobile, maison et objet, aéronautique, défilés de mode, Carrousel du Louvre…).","Temporary Help Services","11-50 employees","Privately Held","Paris, Île-de-France","France","compas-services.fr","https://www.linkedin.com/company/compas-services-intérim"
,"Forma Interim","Chez FORMA INTERIM, nous mettons notre expertise au service des entreprises et des candidats depuis maintenant deux décennies. Fort de 20 ans d'expérience dans le milieu de l'intérim, nous avons développé une connaissance détaillée et unique du marché.
nous proposons des solutions de recrutement adaptées à votre entreprise.","Temporary Help Services","2-10 employees","Partnership",,,"forma-interim.fr","https://www.linkedin.com/company/forma-interim83"
,"Ferempleo ETT","Ferempleo ETT es mucho más que una plataforma de búsqueda de empleo. Es un ecosistema en línea diseñado para reunir a talentosos profesionales y a empresas líderes que buscan enriquecer sus equipos con habilidades únicas y una pasión compartida por el éxito.","Temporary Help Services","51-200 employees","Self Owned","Cox, Alicante","Spain","ferempleo.com","https://www.linkedin.com/company/ferempleo-ett"
,"Workinn.app","Jedyny portal, gdzie pracodawca w aplikacji „rezerwuje” czas pracownika! Pracownik i pracodawca wzajemnie potwierdzają umowę jednym kliknięciem - i gotowe. Z nami nie wydrukujesz już żadnego CV! Żegnamy pradawne portale z ogłoszeniami o pracę - pora z tym skończyć! Przyłącz się do nas i bądź wolny, a pracodawca znajdzie Cię sam. Zobacz poniżej jak to działa.","Temporary Help Services","11-50 employees","Partnership","Kraków","Poland","workinn.app","https://www.linkedin.com/company/workinn-app"
,"de FIXERij","Uit frustratie van vele bedrijven is de FIXERij geboren.
Deze vonden geen partij om snel klussen uit te voeren in en rond hun bedrijf. De FIXERij wil deze frustraties met een korte kwalitatieve doorlooptijd de wereld uit helpen. Er zijn genoeg andere dingen om zorgen over te maken in de bedrijfswereld.

COMMERCIEEL I RESIDENTIEEL I INDSTRIEEL","Temporary Help Services","2-10 employees","Public Company","Genk, Flemish Region","Belgium","defixerij.be","https://www.linkedin.com/company/de-fixerij"
,"Nexa Project","Nexa Project – en specialiseret staffing- og rekrutteringsvirksomhed med fokus på de tekniske fag og stærke kompetencer inden for både dansk og udenlandsk bemanding, særligt fra Baltikum.

Med solid erfaring og en passion for at få det rigtige team på plads, tilbyder vi:
  Fleksibel og skræddersyet bemanding
  Grundig screening og opstartsstøtte
  Fokus på kvalitet, fremdrift og trivsel
  Onsite tilsyn og én fast kontaktperson
  Effektiv kommunikation – altid tæt på opgaven

Vi hjælper jer med at få de rette hænder på opgaven – til tiden, med det rette udstyr og kvalitet.","Temporary Help Services","11-50 employees","Self Employed",,,"nexaproject.dk","https://www.linkedin.com/company/nexa-project"
,"Trabaja y Explora","Somos una Agencia de Trabajo especializada en el reclutamiento de profesionales en el area de hotelería y gastronomía para cubrir posiciones en los Alpes austriacos.","Temporary Help Services","2-10 employees","Self Owned",,,"trabajayexplora.com","https://www.linkedin.com/company/trabajayexploraaustria"
,"Manbroker Sp. z o.o.","Oferujemy kompleksowe, innowacyjne, specjalistyczne usługi z zakresu zarządzania zasobami ludzkimi, outsourcingu procesów biznesowych, szkoleń, a także z sektora OZE i energetycznego.","Temporary Help Services","51-200 employees","Privately Held","Gdańsk, Pomorskie","Poland","manbroker.pl","https://www.linkedin.com/company/manbrokerspzoo"
,"LK Personal GmbH","LK Personal GmbH- Ihr kompetenter Partner für Personaldienstleistungen in der Haus- und Gebäudetechnikbranche.

Seit unserer Gründung im Jahr 2019 in Altötting, Deutschland, haben wir uns zum Ziel gesetzt, Qualität, Zuverlässigkeit, Fairness und Menschlichkeit in den Mittelpunkt unseres Handelns zu stellen.

Jan Lübbe, Gründer und Geschäftsführer von LK Personal, verfügt über umfangreiche Erfahrungen in der Personaldienstleistungsbranche, die er seit Beginn seiner Karriere im Jahr 2011 aufgebaut hat. Sein Engagement, die Arbeitswelt fairer und menschlicher zu gestalten, spiegelt sich in allen Aspekten der Unternehmensführung wider. Jan Lübbe ist nicht nur für seine fachliche Kompetenz bekannt, sondern auch für seine integre und empathische Führungsweise. Unter seiner Leitung hat sich LK Personal zu einem vertrauenswürdigen Partner für Unternehmen und Arbeitnehmer in der Haus- und Gebäudetechnikbranche entwickelt.

Wir bieten eine umfassende Palette an Dienstleistungen, darunter Arbeitnehmerüberlassung, Personalvermittlung, Werkzeugvermietung und 
Monteurzimmervermietung. Unsere Spezialisierung ermöglicht es uns, flexibel, schnell und zielgerichtet auf die Bedürfnisse unserer Kunden einzugehen und eine effiziente, erfolgreiche und langfristige Zusammenarbeit zu gewährleisten. Wir sind stolz darauf, mittlerweile engagierte Mitarbeiter im dreistelligen Bereich zu beschäftigen und langfristige Beziehungen zu unseren Partner-Unternehmen auf der Basis von Vertrauen und Respekt zu pflegen.","Temporary Help Services","51-200 employees","Public Company","Altötting, Bavaria","Germany","lk-personal.de","https://www.linkedin.com/company/lk-personal-gmbh"
,"Esperança Serviços Terceirizados","FACILITIES:
Cargas e Descargas
Vigias | Controladores de Acessos
Empilhadores
Conferência
Organização de CD's
Jardinagem | Paisagismo
Aux. de Limpeza 
Limpeza Pós-Obra
Impermeabilização de Estofados
Copeira
Recepcionista
Manutenção e Limpeza de Piscinas
Fornecedor de Insumos 

Solicite seu orçamento aqui ","Temporary Help Services","51-200 employees","Privately Held","Rio de Janeiro, Rio de Janeiro","Brazil",,"https://www.linkedin.com/company/esperança-serviços-terceirizados"
,"Maxitempo SAS",,"Temporary Help Services","1,001-5,000 employees","Partnership",,,"maxitempo.com","https://www.linkedin.com/company/maxitempoco"
,"TEMPORIS Alès",,"Temporary Help Services","2-10 employees","Self Employed",,,"temporis-franchise.fr","https://www.linkedin.com/company/temporis-alès"
,"Soma-Tech Personal-Service GmbH","Zeitarbeit- eine Chance für jeden
 Ihr Partner in Fragen Arbeitsplatz und Personal. Wir bieten allen ein offenes Ohr und zeichnen uns durch unsere Zuverlässigkeit aus.","Temporary Help Services","51-200 employees","Public Company","Ludwigsburg, Baden- Württemberg","Germany","soma-tech.de","https://www.linkedin.com/company/soma-tech-personal-service-gmbh"
,"handicap intérim","handicap intérim, est une entreprise de travail temporaire et de placement, 100% dédiée au handicap. L’agence accompagne les demandeurs d’emploi en situation de handicap, pour leur permettre de rebondir et accéder au marché de l’emploi, même après un long moment d’absence. 

Son objectif pour le bénéficiaire est de co-construire un projet professionnel avec le candidat pour favoriser son emploi durable en entreprise, grâce à l’intérim. 

Son objectif pour l’entreprise est de favoriser sa démarche d’inclusion en stimulant son impact sociétal tout en répondant à l’enjeu financier et légal que représente l’obligation d’emploi de travailleurs handicapés (OETH).

handicap intérim est une filiale d’APF France handicap, importante association française, reconnue d’utilité publique, de défense et de représentation des personnes en situation de handicap et de The Adecco Group, pour une société plus inclusive et solidaire.","Temporary Help Services","11-50 employees","Privately Held","Paris, Île-de-France","France","handicap-interim.fr","https://www.linkedin.com/company/handicap-interim"
,"IMS GmbH","Seit mehr als 40 Jahren überlassen und vermitteln wir qualifizierte Arbeitnehmer und schaffen somit Verbindungen zwischen Unternehmen mit Personalbedarf und Jobsuchenden gleichermaßen.
Wir streben langfristige Beziehungen an und gehen die „Extrameile“ für Ihren Erfolg. Parallel dazu, bauen wir Brücken von Mensch zu Mensch, so gewinnen letztendlich alle.","Temporary Help Services","201-500 employees","Public Company","Hamburg","Germany","ims-zeitarbeit.eu","https://www.linkedin.com/company/ims-personal-gmbh"
