"Find companies","Name","Description","Primary Industry","Size","Type","Location","Country","Domain","LinkedIn URL"
,"Grupo Patini Br","Sobre o Grupo Patini BR
O Grupo Patini BR é uma empresa especializada em soluções completas de facilities, oferecendo serviços de limpeza industrial, limpeza pós-obra, portaria e terceirização de serviços. Com um compromisso sólido com a excelência e a inovação, atendemos empresas que buscam ambientes organizados, seguros e com alta qualidade operacional.

Nossos profissionais são altamente capacitados e dedicados a entregar resultados que superem as expectativas, garantindo uma experiência impecável e soluções sob medida para cada necessidade. Seja na limpeza detalhada de ambientes, no cuidado com áreas de alto tráfego ou na gestão de serviços essenciais, nós do Grupo Patini BR estamos prontos para fazer a diferença, priorizando o bem-estar e a segurança de nossos clientes.

Nossa missão é simplificar e elevar a qualidade dos serviços de facilities, atuando com ética, responsabilidade e eficiência em cada etapa.

Nossos valores são baseados na confiança, transparência e compromisso com a satisfação de nossos clientes e parceiros.

Convidamos você a conhecer o Grupo Patini BR e descobrir como nossa experiência e dedicação podem transformar o seu ambiente.","Temporary Help Services","501-1,000 employees","Privately Held","São Paulo, sp","Brazil","patinibr.com.br","https://www.linkedin.com/company/grupo-patini-br"
,"TERO GmbH","Wir sind ein regional ansässiges Familienunternehmen mit einer über 30-jährigen Tradition in der Überlassung von gewerblichem und kaufmännischem Personal sowie im Stahl- und Rohrleitungsbau.
Mit unserer Unterstützung überbrücken unsere Kunden kurz- oder langfristige Personalengpässe in NRW. Durch unsere Standorte in Ratingen, Hilden, Mönchengladbach und Neuss sind wir mit unseren Leistungen immer in Ihrer Nähe.","Temporary Help Services","201-500 employees","Public Company","Ratingen, Nordrhein-Westfalen","Germany","tero-personal.de","https://www.linkedin.com/company/terogmbh"
,"WorkPluss",,"Temporary Help Services","2-10 employees","Privately Held",,,"workpluss.com","https://www.linkedin.com/company/workpluss"
,"株式会社Fellowship","Fellowship Co., Ltd. is located in Marunouchi, one of the big business centers in Tokyo. Our company has worked with not only the biggest and top listed companies in Japan and all over the world (such as CyberAgent, DeNA, Segagames, Recruit, GungHo, VisionConsulting, Fujitsu, ADK and other giants), but also with start-ups, foreign businesses, venture companies and more.

There are many experienced multilingual HR agents who can help you get professional advice in your own language so that you can avoid getting lost in translation. 



フェローシップは、企業の求人を単にご案内するだけの派遣会社・紹介会社ではありません。
“がんばる人の成長”にスポットを当てて、あらゆる角度からサポートする会社です。

そのせいでしょうか。私たちに求人をご依頼いただく企業の大部分は、 「仕事の幅を広げたい！」「成長したい！」方々を大歓迎してくださっています。 さまざまな企業が、あなたの意欲を待っています。
フェローシップを通じて、あなたの可能性を刺激する企業や仕事に出会ってください。http://www.f-ship.jp/about/","Temporary Help Services","51-200 employees","Privately Held","千代田区, 東京","Japan","f-ship.jp","https://www.linkedin.com/company/f-ship"
,"CFTC Adecco","Parce que les salariés du travail temporaire relèvent d’une législation spécifique et unique, les salariés de l’intérim, intérimaires et permanents ont créé le syndicat national CFTC Intérim auquel est rattachée la section Adecco

Son objectif :
Avoir une structure forte capable de représenter les salariés intérimaires et permanents au sein des entreprises de travail temporaire mais aussi dans nos branches professionnelles, les ministères et les négociations interpro où l’intérim est systématiquement oublié.

La valeur d’un salarié ne dépend ni de sa condition, ni de son âge, ni de sa religion, ni de son sexe ni de son niveau hiérarchique dans l’entreprise ; cadre, non cadre, intérimaire, permanent…

Chez Adecco, cela se traduit par l’intérêt porté à tous par la négociation, par le refus que les personnes soient traitées comme des objets, des marchandises ou des machines.

Le respect de la dignité nous conduit à être acteur de la vie de notre entreprise

Le parcours est difficile, mais vos élus Adecco présents dans l’entreprise et en région sont aussi présents au sein du FASTT et de l’OPCO (ex FAFTT). Ils négocient afin que vos droits et vos avantages soient respectés : logement, garde d’enfants, crédits, location de véhicules, secours social, formations pour évoluer et avoir des salaires décents…

Qui sont vos représentants ?
Nous sommes un trait d’union entre vous, salariés, et la direction d’Adecco et les organismes de la profession afin d’améliorer vos conditions de travail, faire respecter la vie de famille en conciliant vie personnelle et vie professionnelle.

Tout ceci ne passe pas sans des salaires décents. La direction d’Adecco ne verse plus de participations depuis des années, un intéressement inexistant, des variables en baisse. En revanche, des dividendes énormes remontent à nos actionnaires.

Experts du travail temporaire, vos représentants CFTC sont présents à chaque instant pour vous conseiller, avec l’aide de nos juristes, formateurs et spécialistes.","Temporary Help Services","51-200 employees","Non Profit","Paris, Île-de-France","France","cftc-adecco.com","https://www.linkedin.com/company/cftcadecco"
,"BumbleVA",,"Temporary Help Services","2-10 employees","Privately Held",,,"bumbleva.com","https://www.linkedin.com/company/bumbleva"
,"RM Intérim Lescar","Située à deux pas de la ville de Pau, RM Intérim Lescar est une agence généraliste. Nous vous proposons ainsi une multitude d’Offres d’emplois dans des secteurs variés. RH, BTP, tertiaire, industrie, commerce, logistique, espace vert ou encore automobile, nous nous adaptons à vos besoins.

Nos valeurs ? 
Confiance et proximité ! Nous avons à cœur d’accompagner nos intérimaires en respectant leurs envies et volontés. Le tout, en s’adaptant à vos compétences. 

Vous êtes à la recherche d’un emploi qui vous correspond et en accord avec vos ambitions professionnelles ? Retrouvez toutes nos offres en cliquant ici ! Vous pouvez postuler directement en ligne ou venir nous voir en agence. N’oubliez pas votre CV ! 

Nous sommes à l’écoute de vos projets dans toute la région des Pyrénées-Atlantiques.","Temporary Help Services","2-10 employees","Privately Held","Lescar","France","rm-interim.fr","https://www.linkedin.com/company/rm-intérim-lescar"
,"SAMEN","La qualité des liens que nous tissons donne un sens profond au monde qui nous entoure. 

Chez SAMEN, nous croyons en la force de la connexion, en particulier celle forgée par la proximité et par la synergie de nos compétences.

Le recrutement est notre métier et cela signifie pour nous d’aller bien au delà de la simple mise en relation. Notre démarche repose sur une compréhension approfondie des besoins de nos clients et un engagement sincère auprès de nos collaborateurs. 

Chez SAMEN, nous cherchons à établir des partenariats solides. Aller au-devant des entreprises, comprendre et traduire leurs aspirations, offrir à nos collaborateurs des opportunités enrichissantes.

SAMEN est certifiée MASE et CEFRI.","Temporary Help Services","2-10 employees","Self Employed",,,"samen.fr","https://www.linkedin.com/company/samenfrance"
,"NL Work","NL Work to agencja pracy tymczasowej. Nasz zespół to specjaliści z długoletnim doświadczeniem w branży, którzy swoja wiedzą oraz umiejętnościami wspierają naszych Kontrahentów w każdej sytuacji i na każdym etapie współpracy. 
Bez względu na rodzaj oferowanej przez nas usługi można liczyć na nasz profesjonalizm oraz rzetelność. Zależy nam na budowaniu dobrych relacji biznesowych, które ciężką pracę przekuwają w sukces obu stron.","Temporary Help Services","51-200 employees","Privately Held","Bielsko-Biała, śląskie","Poland","nlworkservice.pl","https://www.linkedin.com/company/nl-work"
,"Rosk",,"Temporary Help Services","2-10 employees","Partnership",,,"rosk.com","https://www.linkedin.com/company/rosk-app"
,"Trabajo en Remoto","Nuestra misión es facilitar la búsqueda de empleo remoto, brindando una amplia variedad de ofertas en diversos sectores y ubicaciones.","Temporary Help Services","Self-employed","Self Employed",,,"trabajoenremoto.top","https://www.linkedin.com/company/trabajoenremoto-top"
,"GIMA","GIMA propose aux entreprises de renforcer leurs effectifs avec les meilleurs candidats, qualifiés et expérimentés.

Que vous proposiez des missions à temps plein ou à temps partiel, nous sommes là pour vous aider à trouver le profil qui correspond au mieux à vos attentes.
Notre équipe s’engage auprès des candidats à trouver les meilleures offres d’emplois correspondant à vos attentes, vos besoins ainsi que vos compétences.","Temporary Help Services","2-10 employees","Privately Held","Champs-sur-Marne, Île-de-France","France","gima-stt.fr","https://www.linkedin.com/company/gimastt"
,"Unik Clean","Limpeza, higienização e impermeabilização de estofados.
Atendimento em BC e região.
(47) 9 9626-3368","Temporary Help Services","2-10 employees","Privately Held","Itajaí, Santa Catarina","Brazil",,"https://www.linkedin.com/company/cleanunik"
,"helthcare",,"Temporary Help Services","2-10 employees","Self Owned",,,,"https://www.linkedin.com/company/helthcare"
,"GROUPE VFC - MLC","Le groupe VFC contient trois entreprises (VFC GmbH, VFC INTERIM, MLC PRO INTERIM).
 Nos trois agences sont spécialisé dans les métiers qualifiés de l'industrie (Soudeurs, Monteurs, Tuyauteur). Le groupe VFC détient plus de 30 des expériences dans le domaine. 
Nos intérimaires sont réhabilités souvent pour pouvoir répondre à la demande ainsi que de travailler en toutes sécurités.","Temporary Help Services","2-10 employees","Privately Held","Spicheren, Grand Est","France","travailtemporaire.net","https://www.linkedin.com/company/groupe-vfc-mlc"
,"Madmax work","MadMax Work – Agencja pracy tymczasowej dla logistyki i przemysłu

Od 2016 roku wspieramy firmy logistyczne, magazynowe i produkcyjne w całej Polsce, dostarczając zaangażowanych, legalnie zatrudnionych pracowników z Ukrainy, Białorusi, Mołdawii, Azji Centralnej, Afryki i Ameryki Południowej.

Współpracując z MadMax Work, otrzymują Państwo więcej niż agencję rekrutacyjną. Tworzymy pełny system wsparcia – od analizy potrzeb i selekcji kandydatów, przez legalizację pobytu i pracy, aż po codzienną opiekę koordynatorów i ograniczanie rotacji.

Nasze atuty:

Elastyczność – dopasowujemy ilość i profil pracowników do zmieniających się potrzeb produkcji i logistyki.
Skuteczna rekrutacja – selekcjonujemy tylko tych kandydatów, którzy są gotowi do długoterminowej współpracy.
Legalizacja i dokumentacja – dbamy o pełną zgodność z przepisami prawa.
Wewnętrzni koordynatorzy – codzienny kontakt, rozwiązywanie problemów, pełna opieka nad pracownikiem.
Stabilność – nasi pracownicy zostają, co oznacza mniej szkoleń, mniejsze koszty i większą efektywność.
Jesteśmy tam, gdzie potrzebni są ludzie gotowi do działania.
Dostarczamy zespoły, które realnie wspierają rozwój firm naszych partnerów.

MadMax Work – Good job. Friendly people.

Skontaktuj się z nami i sprawdź, jak możemy wesprzeć Twoją firmę.","Temporary Help Services","1,001-5,000 employees","Privately Held","Katowice, Silesian Voivodeship","Poland","madmaxwork.pl","https://www.linkedin.com/company/madmaxwork"
,"Adour Services Interim","Nous sommes ravis d'annoncer l'ouverture de notre nouvelle agence d'intérim : Adour Services Intérim (ASI) ! Spécialisée dans le recrutement et la mise à disposition de personnel qualifié dans le domaine de l'aéronautique, ASI se veut être votre partenaire de confiance pour répondre à vos besoins en ressources humaines. Que vous soyez une entreprise à la recherche de talents ou un candidat à la recherche de nouvelles opportunités, ASI est là pour vous accompagner. Contactez-nous dès aujourd'hui pour en savoir plus sur nos services et découvrez comment nous pouvons vous aider à atteindre vos objectifs professionnels ! ","Temporary Help Services","2-10 employees","Privately Held","Aire sur l'Adour","France","asi-interim.com","https://www.linkedin.com/company/adour-services-interim"
,"LAFER SOLUÇÕES INDUSTRIAIS","A LAFER é uma empresa prestadora de serviços de manutenção, consultoria em serviços de manutenção e segurança do trabalhado, atua em diversos segmentos industriais como automotivo, alimentício, energia e indústria de transformação de plástico, borracha e metais. Ao longo deste tempo conquistamos todas as certificações de segurança necessárias para realizar os serviços com alto nível de excelência.","Temporary Help Services","11-50 employees","Privately Held","São Paulo, SP","Brazil","lafersolucoes.com.br","https://www.linkedin.com/company/lafer-solucoes"
,"ARTTIME Group","ARTTIME to grupa wyspecjalizowanych spółek działających w sektorze usług HR. Łączy doświadczenie i eksperckie kompetencje, oferując kompleksowe rozwiązania w zakresie pracy tymczasowej i outsourcingu procesowego,  rekrutacji stałej, legalizacji zatrudnienia cudzoziemców, obsługi kadrowo-płacowej oraz doradztwa HR.
Od 2020 roku ARTTIME wspiera firmy z branży produkcyjnej, logistycznej, magazynowej i e-commerce, dostarczając gotowe do pracy zespoły – szybko, legalnie i z pełnym zapleczem operacyjnym. Skoncentrowana na optymalizacji procesów zatrudnienia, firma upraszcza działania, oszczędza czas i skutecznie wspiera realizację celów biznesowych klientów.","Temporary Help Services","51-200 employees","Public Company","Warsaw, Mazowieckie","Poland","art-time.pl","https://www.linkedin.com/company/art-time-agencja-pracy"
,"Human & Hunter APT","Jesteśmy agencją pośrednictwa pracy (numer KRAZ 6664) która od 2008 roku wspiera pracodawców w pozyskiwaniu najlepszych talentów, a kandydatów w znalezieniu idealnej pracy. Bierzemy za Ciebie odpowiedzialność, dając Ci legalne i bezpieczne zatrudnienie. W naszej codziennej pracy dokładamy wszelkich starań, aby jak najlepiej dopasować Twoje kwalifikacje do miejsca pracy. Nasze oddziały znajdują się w Katowicach, Częstochowie, Łodzi, Wrocławiu, Poznaniu, Gdańsku i Lublinie a nasze usługi świadczymy na terenie całej Polski. Współpracujemy również z firmami z Niemiec, gdzie delegujemy pracowników.","Temporary Help Services","51-200 employees","Privately Held","Katowice, Śląskie","Poland","human-hunter.eu","https://www.linkedin.com/company/humanhuntereu"
,"PERSONAL SUMINISTRO | TALENT GROUP SERVICE","Somos una empresa de servicios temporales con experiencia en la administración del talento humano, brindando a nuestros clientes suministro de personal en misión y asesoría en el manejo administrativo bajo la modalidad de Outsourcing para el sector empresarial, garantizando tranquilidad y bienestar a nuestros USUARIOS.","Temporary Help Services","201-500 employees","Public Company","Cartagena","Colombia","talentgroupsas.com","https://www.linkedin.com/company/temporal-personal-suministro-talent-group-service"
,"Celta RH","Há 18 anos no mercado, somos uma consultoria em Recursos Humanos, oferecendo diversos serviços, negócios e oportunidades, tanto para o mercado corporativo quanto para pessoas físicas.","Temporary Help Services","201-500 employees","Privately Held",,,,"https://www.linkedin.com/company/celta-rh"
,"Perceptio Stödboende","Vårt stödboende erbjuder en komplett lösning för vuxna kvinnor och män med särskilda behov. Vi samarbetar nära med både klienten och handläggaren för att säkerställa att målen uppnås. Vi lägger stor vikt vid färdighetsträning samt att skapa en hållbar och hälsosam livsstil. Vi erbjuder våra klienter coach samtal och personlig träning samt arbetstränig inom flera olika branscher.","Temporary Help Services","Self-employed","Public Company","Borlänge, Dalarna County","Sweden","perceptio.se","https://www.linkedin.com/company/perceptio-stödboende"
,"Hub Prolog","Resolvemos problemas de movimentação de carga, desde a chegada até a expedição, através do emprego de mão de obra e tecnologia.

A hub é resultado do mais de 20 anos de experiência de seus fundadores, time multidisciplinar com forte atuação nos segmentos de logística, industrial e cadeia de suprimentos. Spin Off do Grupo Premier, a hub nasce com forte base operacional, robusta infra-estrutura e capital para atendimento em 100% do território nacional.","Temporary Help Services","11-50 employees","Privately Held","São José dos Pinhais, Paraná","Brazil","hubprolog.com.br","https://www.linkedin.com/company/hubsupply"
,"VikarCare","VikarCare – Omsorg med nærvær og kvalitet

Hos VikarCare tror vi på, at god omsorg starter med tillid, respekt og menneskelighed. Vi er en professionel vikarbureaupartner for sundhedssektoren og tilbyder fleksible løsninger, der tilpasses både institutioners og borgeres behov.

Vi ved, at behovet for vikarer kan opstå pludseligt – og vi er klar til at træde til, uanset om der er tale om akutte opgaver eller længerevarende forløb. Med et stærkt team af engagerede og kompetente medarbejdere sikrer vi, at plejen altid udføres med empati, kvalitet og høj faglighed.

Det, der kendetegner VikarCare:

Fokus på omsorg og nærvær i alle opgaver

Fleksible løsninger tilpasset både kortvarige og langsigtede behov

Professionelle og erfarne medarbejdere, som brænder for at gøre en forskel

Tryghed for både institutioner, borgere og medarbejdere

Vi stræber efter at skabe rammer, hvor medarbejderne trives, og hvor kvaliteten i omsorgen aldrig kompromitteres. For os handler vikararbejde ikke kun om bemanding – det handler om mennesker.

Med VikarCare får du en samarbejdspartner, der kombinerer professionalisme med nærvær og respekt, og som altid sætter mennesket i centrum.","Temporary Help Services","2-10 employees","Partnership","København","Denmark","vikarcare.dk","https://www.linkedin.com/company/vikarcare-dk"
,"TJI RH - Diárias e Temporários","A mais de 6 anos conectando empresas e pessoas capacitadas em poucas horas","Temporary Help Services","501-1,000 employees","Privately Held","Extrema, MG","Brazil","tjiservicos.com.br","https://www.linkedin.com/company/tji-recursos-logísticos"
,"JD Personale","Vi er et vikar og rekrutterings bureau med hjertet på rette sted, vi går op i alle er tilfredse, både medarbejderen og kunden, kontakt os for et godt tilbud.","Temporary Help Services","11-50 employees","Self Owned","Lille Skensved, Region Zealand","Denmark","jdpersonale.dk","https://www.linkedin.com/company/jd-personale"
,"H-MEDIA JOB","Missions de travail","Temporary Help Services","2-10 employees","Self Employed",,,"hmedia.site","https://www.linkedin.com/company/hmedia-job"
,"Virtual Assistant Work From Home","We hire people to fill simple survays by putting their numbers and emails. We pay them higher than local/Professional websites. It's like free money for you.","Temporary Help Services","10,001+ employees","Self Owned","Karachi, Sindh","Pakistan",,"https://www.linkedin.com/company/virtual-assistant-work-from-home"
,"RM Intérim Paris 11","Implantée au cœur du 11e arrondissement de Paris, notre agence propose des contrats en intérim, CDI et CDD. Notre objectif est de vous accompagner activement dans votre recherche d'emploi en vous offrant des opportunités régulières via notre site internet.

En tant qu'agence de travail temporaire généraliste, nous mettons un point d'honneur à placer l'humain au centre de nos services. Nous nous engageons à offrir des solutions personnalisées et de qualité, répondant à vos besoins spécifiques.

Rejoignez-nous pour saisir des opportunités professionnelles enrichissantes et pour bénéficier d'un accompagnement sur mesure dans votre parcours d'emploi. .","Temporary Help Services","2-10 employees","Privately Held","Paris, Île-de-France","France","rm-interim.fr","https://www.linkedin.com/company/rm-intérim-paris-11"
,"FlexTemp","Hos FlexTemp matcher vi kvalificerede kandidater med attraktive virksomheder i hele Danmark. Vi tror på, at det rette match gør en forskel, hvorfor vi tilbyder fleksible løsninger inden for rekruttering, try&hire og mandskabsudlejning. 

FlexTemp tilbyder alt fra den simple ""her og nu"" løsning til det faste samarbejde. Uanset om du har behov for én faglært håndværker, eller søger en langsigtet samarbejdspartner, står vi klar til at hjælpe.

Vores tilgang er præget af samarbejde, høj kvalitet og et kompromisløst fokus på, at både kandidater og virksomheder får den bedst mulige oplevelse hele vejen igennem.

Hos FlexTemp specialiserer vi os i udenlandsk arbejdskraft, da vi både ser et stort potentiale og en reel nødvendighed i de kompetencer, som internationale kandidater bringer med sig. I takt med en stigende efterspørgsel på specialiseret arbejdskraft og en aldrende befolkning, er udenlandsk arbejdskraft blevet en afgørende ressource for mange danske virksomheder.

Lær mere om udenlandsk arbejdskraft her: https://flextemp.dk/services/udenlandsk-arbejdskraft/ 

Vores team består af dygtige og dedikerede medarbejdere, der behersker dansk, polsk og engelsk både mundtligt og skriftligt. Vi tror nemlig på, at en klar og effektiv kommunikation mellem alle parter, og det at skabe forståelse mellem kulturer og mennesker, er nøglen til solide samarbejder, der holder. 

Mangler du bemanding til et forestående projekt, eller søger du rådgivning om udenlandske arbejdere, så ring til os på +45 70 60 55 64","Temporary Help Services","2-10 employees","Privately Held","Aalborg, North Denmark Region","Denmark","flextemp.dk","https://www.linkedin.com/company/flextemp"
,"ATN Service ApS","Vi er et vikarbureau. Mangler du vikarer i din virksomhed, eller vil du gerne arbejde som vikar?","Temporary Help Services","11-50 employees","Partnership","Skjern, Central Denmark Region","Denmark","atnserviceaps.dk","https://www.linkedin.com/company/atn-service-aps1"
,"Sealand Maritime Services","Sealand Maritime Service Co., Ltd. is a crew dispatch service provider registered with the State Administration for Industry and Commerce and approved by the Fujian Maritime Safety Administration. For many years, we have specialized in international cruise crew labor cooperation. The company has established close partnerships with major cruise lines worldwide and boasts extensive experience in training and dispatching cruise crew members. Since 1996, we have trained and dispatched nearly 20,000 crew members of various ranks to cruise companies in Europe, the U.S., Singapore, and Hong Kong, ranking among the top in China's cruise crew dispatch industry. Based in Xiamen, we have established companies in Shanghai and Wuhan, and in June 2020, we opened a branch in Kunming to serve the Southwest region. We also have joint ventures in several countries. Through continuous efforts, Sealand has become the most influential cruise crew training and dispatch service provider in China. Our business scope includes dispatching various labor personnel abroad, providing overseas employment information, consulting, and intermediary services (including interns), recruiting overseas personnel on behalf of foreign employers, offering pre-departure training for overseas workers, assisting in the notarization of vocational qualifications, and facilitating outbound procedures for overseas workers.","Temporary Help Services","11-50 employees","Self Owned","Xiamen city, Xiamen city","China","chncrew.com","https://www.linkedin.com/company/sealand-maritime-services"
,"PakoJobs","We are an international recruitment agency that specialises in the recruitment of workers from Asia. We started our business in 2011, where we began our first successes. PakoJobs stands for new opportunities - combining professionalism, taking on challenges and providing comfort to each of our business partners. The dynamic growth of the company and our years of experience have allowed us to operate as independent companies in countries such as Nepal, India, Vietnam, Uzbekistan, Kazakhstan and the Philippines.","Temporary Help Services","2-10 employees","Self Owned","Rzeszów, Podkarpackie","Poland","pakojobs.pl","https://www.linkedin.com/company/pakojobs"
,"A M A N I R H","Agence de travail temporaire","Temporary Help Services","2-10 employees","Privately Held","Lens","France",,"https://www.linkedin.com/company/amanirh"
