"Find companies","Name","Description","Primary Industry","Size","Type","Location","Country","Domain","LinkedIn URL"
,"Assessment Rehabilitation Services Ltd.","A.R.S. Assessment Rehabilitation Services Ltd. provides medical evaluation services nationwide. From Western Canada to northern or southern Ontario, and out to the Atlantic or Maritime Provinces; from rural communities to urban locales, our clients can rest assured that their assessment needs are met with consistency, professionalism and expertise.

We strive to achieve optimal health and disability management outcomes through goal-driven, legally defensible reports that are high in quality, cost effective, and time-targeted to ensure an early and safe transition to pre-injury activities.

A.R.S. Assessment Rehabilitation Services Ltd. provides medical-legal reports that are written with precision and expertly reviewed. Our reports are transparent, legally defensible and practical for all medical/professional disciplines.

A.R.S has the ability to perform a wide array of assessments and are able to adhere to all of the guideline fees. We have an integrated administration system that utilizes IME workflow, IME Centric and SecureDox. We are able and willing to adapt our system to better serve your needs.

With the help of our experienced office staff and our team of Health Professionals all of your objectives will be achieved through our services.","Vocational Rehabilitation Services","11-50 employees","Self Owned","North York, Ontario","Canada","arsi.ca","https://www.linkedin.com/company/assessment-rehabilitation-services-ltd"
,"Mothers Of Special Heroes Trust (MOSH)","Disability award winning organisation formed in Bulawayo in 2021.","Vocational Rehabilitation Services","11-50 employees","Non Profit","Bulawayo, Bulawayo","Zimbabwe","moshh.org","https://www.linkedin.com/company/mothers-of-special-heroes-trust-mosh"
,"Le Drakkar bleu","Notre but est d'aider bénévolement les humains et les animaux.","Vocational Rehabilitation Services","2-10 employees","Non Profit","SCEY SUR SAONE ET ST ALBIN, Haute-Saône","France","ledrakkarbleu.fr","https://www.linkedin.com/company/le-drakkar-bleu"
,"Purposework Vocational Rehabilitation Services","Purposework specializes in the psychosocial adjustment to disability, removing environmental barriers in the workplace and community through vocational rehabilitation counseling.","Vocational Rehabilitation Services","Self-employed","Self Owned",,,"purpose-work.org","https://www.linkedin.com/company/purposework-pllc"
,"TDIU Expert",,"Vocational Rehabilitation Services","2-10 employees","Privately Held","Atlanta, Georgia","United States","tdiuexpert.com","https://www.linkedin.com/company/tdiu-expert"
,"Live Well Addiction Treatment Center","Live Well Addiction Treatment Center is here to help you on your road to recovery. Our center offers caring and compassionate support to those struggling with addiction. All our staff members specialize in treating addictions of all kinds, allowing us to customize a treatment plan around each client's needs. We use evidence-based treatments in combination with holistic approaches so that you can find a solution that best suits your situation. We aim to help you end your addiction and work toward long-term recovery and well-being. At Live Well Addiction Treatment Center, we realize this is an arduous journey—but we are here for you every step of the way.","Vocational Rehabilitation Services","51-200 employees","Privately Held","Salem, Oregon","United States","rehabilitationoregon.org","https://www.linkedin.com/company/live-well-addiction-treatment-center"
,"Jardin de Cocagne de la Barbuise",,"Vocational Rehabilitation Services","11-50 employees","Non Profit",,,"cocagnebio.fr","https://www.linkedin.com/company/jardin-de-cocagne-de-la-barbuise"
,"Bock Consulting Inc.","Bock Consulting is a curator of specialized knowledge harnessed and creatively directed towards carrying out specific plans of action to secure sound industrial claim resolution.  Time has been the measure of our success and the trust we have gained in the industry.

Bock Consulting provides a comprehensive package of services developed to address the needs of individuals and entities confronting issues related to industrial injuries.


With over 100 years of combined experience, we are second to none when it comes to understanding the vocational and medical case management intricacies of the Washington State Workers' Compensation System.

We bring claims to resolution and pride ourselves on being responsive to all the participants' needs during the process.","Vocational Rehabilitation Services","11-50 employees","Privately Held",,,"bockconsulting.com","https://www.linkedin.com/company/bock-consulting-inc"
,"جمعية بنان للتأهيل المهني لذوي الإعاقة والظروف الخاصة","جمعية أهلية غير ربحية متخصصة في التدريب والتأهيل المهني
للأشخاص ذوي الإعاقة والظروف الخاصة (المصابين بالأمراض المزمنة )
وتحويلهم من محتاجين الى منتجين مستقلين بذاتهم معتمدين على أنفسهم
بعد اكسابهم المهارات التي تناسب قدراتهم  وتدخلهم سوق العمل بروح التحدي.
كما تقدم برامج مماثله لا منهجية خلال الفترة المسائية للأسوياء بكافة الأعمار
لجميع مسارات التدريب بالجمعية.","Vocational Rehabilitation Services","11-50 employees","Non Profit","الدمام, الدمام","Saudi Arabia","banan.org.sa","https://www.linkedin.com/company/banan1sa"
,"BetterChoice Treatment Center","At BetterChoice Treatment Center, we're here to help you redefine your rehabilitation experience. We combine addiction treatment that's backed by evidence with the comfort and exclusivity of a luxury wellness retreat. We're located in Las Vegas, and we provide a serene and supportive environment where individuals can heal, rebuild, and reclaim their lives while enjoying resort-style amenities.

We understand that addiction is more than a physical dependency; it affects the mind, body, and spirit. That's why our programs are so unique.

Personalized Treatment Plans – We address both substance use and co-occurring mental health conditions.

We also offer holistic wellness therapies like yoga, meditations  and mindfulness practices to support your emotional and physical well-being.

Luxury accommodations and amenities, like private suites, spa treatments, a swimming pool, and access to golf, so you can truly relax.

Our team of dedicated psychiatrists, therapists, and wellness professionals is here to provide you with cutting-edge, compassionate treatment.

Nutritional and Fitness Programs – Delicious gourmet meals, personalized training, and dedicated wellness coaching to help you feel your best, inside and out.
We're here to help you feel your best and offer a serene environment where you can focus on your recovery. Whether you're a professional seeking discreet care or someone who values a premium approach to recovery, our facility is designed to provide the highest standard of treatment.

We are always looking for dedicated professionals in mental health, wellness, and addiction recovery.
If you are passionate about helping others transform their lives, explore our career opportunities and become part of an elite team.

We would love to hear from you!
info@lvtreatmentcenter.com
(747) 300-5000
betterchoicenv.com
At BetterChoice, recovery meets luxury, and healing becomes a lifestyle.","Vocational Rehabilitation Services","11-50 employees","Privately Held","Las Vegas, Nevada","United States","betterchoicenv.com","https://www.linkedin.com/company/betterchoice-treatment-center"
,"Akces-Med International","yt","Vocational Rehabilitation Services","51-200 employees","Privately Held","Jasionka, Podkarpackie","Poland","akces-med.com","https://www.linkedin.com/company/akces-med-international"
,"Oregon Rehab Help Center And Addiction Treatment","The Oregon Rehabilitation Help Center and Addiction Treatment Program is a resource dedicated to helping addicts and their families by providing timely, accurate, and helpful content related to addiction, substance abuse treatment, and dual diagnosis treatment. To this end, our directory contains information pages about a range of treatment facilities and rehabilitation programs and services. The primary goal of the Oregon Recovery Help Center and Addiction Treatment Program is to connect people struggling with drug or alcohol addiction with resources, treatment options, and a supportive community to help more people find the recovery they deserve. By providing relevant information about addiction and addiction treatment referral services, we aim to be the primary resource for all of your substance abuse treatment needs.","Vocational Rehabilitation Services","11-50 employees","Partnership","Eugene, Oregon","United States",,"https://www.linkedin.com/company/oregon-rehab-help-center-and-addiction-treatment"
,"Poliambulatorio Fisiomedi","Fisiomedi è il centro, dotato di palestra attrezzata e macchinari all’avanguardia, capace di offrire assistenza sanitaria qualificata, proponendo un percorso completo per la salute fisica e riabilitativa.","Vocational Rehabilitation Services","2-10 employees","Privately Held",,,"fisiomedi.it","https://www.linkedin.com/company/poliambulatorio-fisiomedi-salsomaggiore"
,"Konnect Solutions Inc","An industry leader, Konnect Solutions is Worker's compensation's gold standard when it comes to SJDB Vouchers. Founded with over 30 years of industry experience, ""Konnect"" has grown to serve thousands of injured workers statewide. With an emphasis on the injured worker, Konnect provides unmatched quality SJDB voucher service for the California's worker’s compensation industry.","Vocational Rehabilitation Services","11-50 employees","Privately Held","Santa Rosa, California","United States","injuredatworkhelp.com","https://www.linkedin.com/company/konnect-solutions-vocational-services"
,"Nashville Alcohol & Drug Rehabilitation Center","At Nashville Alcohol & Drug Rehabilitation Center , we are dedicated to giving our customers the greatest advice, support, and service. We are dedicated to comprehending your specific needs and serving as a partner and resource. Drug and alcohol treatment programs assist users in reducing or quitting their drug and alcohol usage, which helps them enhance the quality of their life. Services for drug and alcohol recovery offer assistance and therapy. These programs are occasionally referred to as ""rehab"" services. Thousands seek therapy every day to recover from their addiction to this potent chemical, which affects millions of people. Recovery choices are plentiful, and many individuals have experienced success. If you're prepared to take back control of your life from alcohol, assistance is available. Contact a treatment facility right now to learn more about alternative treatment options.","Vocational Rehabilitation Services","51-200 employees","Privately Held","Nashville, Tennessee","United States","new-rehab.com","https://www.linkedin.com/company/new-vision-rehab-neshvile"
,"Association Skills Projet Pro",,"Vocational Rehabilitation Services","Self-employed","Non Profit",,,,"https://www.linkedin.com/company/skills-projet-pro"
,"Alpha Consultants",,"Vocational Rehabilitation Services","11-50 employees","Privately Held",,,"alphaconsultants.co.nz","https://www.linkedin.com/company/alpha-consultants-nz"
,"Uşaqların Sağlam Gələcəyi IB","The Early Intervention Center was founded on the 15th of October by the non-governmental organization “Children’s Healthy Future”. All activities of the center are regulated by the Azerbaijani legislation and in compliance with the UN Convention on the Rights of the Child (December 12, 1989) and Mental Health Declaration for Europe (Helsinki, January 14, 2005) The main goals of the Center are the following:
 Psychosocial care for disabled children
 Achievement of the highest possible quality of life and needs satisfaction
 Integration of children with special needs into the society
 Support for families of disabled children
The Center provides equal access to free services regardless of the ethnicity or social status of the clients. At present the bellow specified activities are implemented in the Center:
Early Intervention Program
Inclusive preschool education Program
Trainings for caregivers of disabled children
Researches in the field of psychosocial rehabilitation
The essential principles of the care provision are efficiency, consistency, comprehensiveness, community-based approach, and equality, adherence to the highest ethical standards, professionalism, and accountability. At the initial stage of the establishment of the center, a training program was held on 17 -22 October 2005. The training was conducted by 7 specialists of the ""Early Intervention and Family Support"" center based in Appleton, Wisconsin, USA. The main goal of the training was to become familiar with a completely new approach in Azerbaijan in terms of rehabilitation of children with special needs within the “Early Intervention program”. About 4,000 children aged between 1-7 were provided with comprehensive rehabilitation treatment at the Early Intervention Center within the Association. The measures taken especially at a younger age are most important for more effective medical and psychological rehabilitation.","Vocational Rehabilitation Services","11-50 employees","Non Profit","Baku , Contiguous Azerbaijan","Azerbaijan","usgib.az","https://www.linkedin.com/company/uşaqların-sağlam-gələcəyi-ib"
,"Center KORAK","Od leta 2003 razvijamo in izvajamo program dolgotrajne rehabilitacije za osebe pridobljeno možgansko poškodbo.

Naša vizija
Verjamemo v svet, kjer je vsak posameznik deležen največjega spoštovanja, dostojanstva in empatije.

Naše poslanstvo
Posameznikom s pridobljeno možgansko poškodbo zagotavljamo kvalitetno dolgotrajno rehabilitacijo, samostojnost, podporo in oskrbo.

Zaposlitveni center
Že od leta 2012 zaposluje invalide s 30 % do 70 % delovne zmožnosti.","Vocational Rehabilitation Services","11-50 employees","Non Profit","Kranj","Slovenia","center-korak.si","https://www.linkedin.com/company/center-korak"
,"JAOFCERT","We are the foremost Cameroonian Certification Agency for verifying skilled artisans through competence-based assessments and skill-upgrading workshops.
We specialize in providing certificates to artisans in Cameroon who are informally trained but are vastly experienced in their fields.","Vocational Rehabilitation Services","2-10 employees","Privately Held","Yaounde","Cameroon",,"https://www.linkedin.com/company/jaofcert"
,"Idhuit",,"Vocational Rehabilitation Services","2-10 employees","Self Owned",,,"idhuit.com","https://www.linkedin.com/company/idhuit"
,"Pivetta Riabilitazione Motoria","Sin dal 1954, Pivetta Riabilitazione Motoria è un punto di riferimento a Milano nel settore della ginnastica medica.

Offriamo servizi di riabilitazione, rieducazione posturale, fisioterapia del pavimento pelvico, osteopatia e visite mediche specialistiche.

Per la riabilitazione utilizziamo esercizio terapeutico unito a terapie fisiche all'avanguardia quali onde d'urto, radiofrequenza e tecar terapia, QMR e laser terapia. 

Il paziente e il suo benessere sono la nostra priorità.","Vocational Rehabilitation Services","11-50 employees","Privately Held","Milano, Lombardy","Italy","pivetta.net","https://www.linkedin.com/company/pivetta-riabilitazione-motoria"
,"Ren'fort Mobilet'",,"Vocational Rehabilitation Services","2-10 employees","Non Profit",,,"mobilet.ch","https://www.linkedin.com/company/ren-fort-mobilet"
,"Eveline Sautaux","Direction de projet de formation professionnelle et projet de réinsertion
Ingénierie de la formation 
Formation continue dans le domaine de l’orientation et de l’insertion professionnelle 
Personne de confiance 
Coaching pour entreprise et santé au travail","Vocational Rehabilitation Services","2-10 employees","Non Profit","Lausanne, Vaud","Switzerland","immunitas.ch","https://www.linkedin.com/company/eveline-sautaux"
,"San Francisco Addiction Treatment Center","The medical and clinical personnel of San Francisco Addiction Treatment Center, as well as the administrative leadership team that oversees our company, are all highly skilled and committed individuals. Your recovery is our goal, and we prioritize making sure every client receives the individualized attention they need for a lifetime of recovery.","Vocational Rehabilitation Services","51-200 employees","Privately Held","San Francisco, CA","United States","sanfranciscotreatment.org","https://www.linkedin.com/company/sanfranciscoaddictiontreatmentcenter1"
,"Fix Up Academy","A brand-new training academy working with businesses to offer young people employment skills in conjunction with robust mental health and nutritional advice. Set up by top professionals in health, aesthetics (including barbering and tattoo artistry), media and training, we are working with students currently on the margins of society. Referrals and offers of support particularly welcome.   Donate at  https://tinyurl.com/mrxfn9z5","Vocational Rehabilitation Services","2-10 employees","Educational","Manchester","United Kingdom","fixupacademy.co.uk","https://www.linkedin.com/company/fix-up-academy"
,"Faizan Rehabilitation Center",,"Vocational Rehabilitation Services","51-200 employees","Non Profit",,,"faizanrehab.org","https://www.linkedin.com/company/faizan-rehabilitation-center"
,"Chantiers Eau et Pierre","Association Loi 1901 type ACI (Atelier et de Chantier d’Insertion) située à Corcieux dans les Vosges depuis 2004, financée en grande partie par l’État et le Département.","Vocational Rehabilitation Services","11-50 employees","Non Profit","Corcieux","France","chantierseauetpierre.fr","https://www.linkedin.com/company/chantiers-eau-et-pierre"
,"Κιβωτός","«Κιβωτός»  είναι μία πρωτοποριακή και εξειδικευμένη μονάδα Αποκατάστασης και Πρόληψης της Ε.ΨΥ.ΜΕ. για παιδιά και εφήβους.","Vocational Rehabilitation Services","11-50 employees","Privately Held","ΣΑΛΑΜΙΝΑ, Αττική","Greece","ploes.org.gr","https://www.linkedin.com/company/kivotos1998"
,"HACKER OUVERT",,"Vocational Rehabilitation Services","Self-employed","Non Profit",,,,"https://www.linkedin.com/company/hacker-ouvert"
,"Synergy Medical Pty Ltd",,"Vocational Rehabilitation Services","2-10 employees","Self Owned",,,"synergymed.com.au","https://www.linkedin.com/company/synergy-medical-pty-ltd"
,"Mobility Towards Independence","We provide orientation and mobility services","Vocational Rehabilitation Services","Self-employed","Self Owned","Ottawa","Canada","mobilitytowardsindependence.ca","https://www.linkedin.com/company/mobility-towards-independence"
,"Chlorophylle - Jardin de Cocagne","L'association Chlorophylle est un Jardin de Cocagne faisant partie du Réseau Cocagne.
Nous employons une quarantaine de salariés en transition professionnelle encadrés par 12 salariés permanents.
Nos secteurs d'activité sont le maraîchage bio, l'entretien des espaces verts et des locaux.","Vocational Rehabilitation Services","11-50 employees","Non Profit","Romilly-sur-Seine, Grand Est","France","chlorophylle-asso.fr","https://www.linkedin.com/company/chlorophylle-jardin-de-cocagne"
,"Ressana Riabilitazione","L’ inizio dell’attività del Centro Riabilitativo Ressana risale al 1999 e nasce per rispondere alle richieste della “realtà del disabile”. E’ ubicato nella città di Bernalda, in prov. di Matera, in Corso Umberto 127, in pieno centro cittadino in una villa antica risalente al XVI secolo

La struttura sanitaria è di natura riabilitativa in ottemperanza a quanto previsto dalla legge 833/78 ex articolo 26, istituzionalmente accredita con il Servizio Sanitario Nazionale.","Vocational Rehabilitation Services","11-50 employees","Self Owned","Bernalda, Basilicata","Italy","ressana.it","https://www.linkedin.com/company/ressana-riabilitazione"
,"New Vision Rehab","New Vision Rehab is a cutting-edge drug treatment. You will receive support and care to address the self-defeating behaviors that might be encountered in active addiction in this warm, safe setting. Each member of the staff is a respected professional with extensive training in addiction therapy, and they have a lengthy history of assisting patients in beating addiction and other related diseases.","Vocational Rehabilitation Services","51-200 employees","Privately Held","Raleigh, North Carolina","United States","new-rehab.com","https://www.linkedin.com/company/new-vision-rehab4"
,"Galen dla Biznesu","JAK MOŻEMY POMÓC TOBIE I TWOJEJ FIRMIE ?

Komfort fizyczny pracownika ma bezpośrednie przełożenie na jego:
dobrostan psychiczny,
motywację,
wydajność.
Przygotowaliśmy dla Ciebie i Twojej firmy specjalny pakiet pełen praktycznych, sprawdzonych i skutecznych rozwiązań, które pokażą Twojemu zespołowi, jak wykonywać codziennie czynności w pracy z troską o swoje ciało!

TWOI PRACOWNICY DOWIEDZĄ SIĘTWOI PRACOWNICY DOWIEDZĄ SIĘ
Jak zadbać o swoje zdrowie, pracując w trybie siedzącym;
- Jak niwelować negatywne skutki długotrwałego siedzenia;
Jak indywidualnie dopasować swoje stanowisko pracy dla większego komfortu;
Jak unikać kontuzji, zapobiegać urazom podczas wykonywanej pracy fizycznej;
- Jak prawidłowo załadować ciężki towar;
Jak efektywnie wykorzystać przerwy w pracy, żeby dodać sobie energii i aktywnie odpocząć;
Oraz wiele innych wartościowych i użytecznych wskazówek.
Jak zadbać o swoje zdrowie, pracując w trybie siedzącym;
Jak niwelować negatywne skutki długotrwałego siedzenia;
Jak indywidualnie dopasować swoje stanowisko pracy dla większego komfortu;
Jak unikać kontuzji, zapobiegać urazom podczas wykonywanej pracy fizycznej;
Jak prawidłowo załadować ciężki towar;
Jak efektywnie wykorzystać przerwy w pracy, żeby dodać sobie energii i aktywnie odpocząć;
Oraz wiele innych wartościowych i użytecznych wskazówek.","Vocational Rehabilitation Services","11-50 employees","Privately Held","Katowice, śląskie","Poland","galen.pl","https://www.linkedin.com/company/galendlabiznesu"
,"Mountain Employment Training LLC","Job Development
We partner with job seekers to develop the pre-employment skills necessary to find and obtain successful employment opportunities. We provide comprehensive job development services, including career exploration, job search assistance, resume writing, and interviewing. We are dedicated to helping individuals with disabilities reach their goals of meaningful, competitive employment.

Supported Employment
Supported Employment focuses on creating tailored opportunities for job seekers in a competitive, integrated setting. This setting allows individuals to focus on their strengths, preferences, and abilities to ensure job retention.  This system of support offers individuals with disabilities the opportunity for greater independence, personal satisfaction, and upward mobility.

Job Coaching
Our job coaching services are designed to help individuals maintain meaningful employment. We work one-on-one with clients to assist them in developing the skills and self-confidence they need to succeed in the workplace. Our approach includes job skill training, job site orientation, and liaising with employers. Our job coaching services are tailored to each individual, offering personalization and support every step of the way.","Vocational Rehabilitation Services","2-10 employees","Self Owned","Colorado Springs, Co","United States","metofcolorado.com","https://www.linkedin.com/company/mountain-employment-training-llc"
,"Centro MACLA","Il Centro Medico Posturale & Dentistico ""MACLA"" nasce dall'esigenza di unire vari professionisti per la cura del benessere a 360° dei propri clienti

Studio Medico Posturale:
- Valutazione e Analisi della Postura
- Osteopatia
- Rieducazione Posturale
- Massoterapia
- Linfodrenaggio Manuale (Metodo Vodder)
- Fascia Taping
- Rieducazione Post Traumatica e Post Intervento

Ortodonzia: 
- Disturbi del Sonno
- Ortodonzia
- Dentosofia 
- Igiene Orale e Prevenzione

Psicologia:
- Psicologia dello sviluppo e dell'educazione
- Psicologia dell'apprendimento
- Sostegno Psicologico

Visite Specialistiche","Vocational Rehabilitation Services","Self-employed","Privately Held","Ispra, Lombardia","Italy","centromacla.it","https://www.linkedin.com/company/centro-macla"
,"Plus Medical Rehabilitation Centre","We offering Physiotherapy,Occupational Therapy,Speech Therapy, Mental Health, Cardiac Rehabilitation, Psychotherapy, Prosthetics and Orthotics, Work Ergonomics, Fitness Training, Sports injury Rehabilitation, Athlete Training and Management and Rehabilitative Devices.","Vocational Rehabilitation Services","11-50 employees","Privately Held","Lilongwe, Area 43","South Africa","plusmedicalrehab.com","https://www.linkedin.com/company/plusmedicalrehab"
,"Forum National des Stages du Burkina","Le Forum National des Stages est une initiative de GLOBAL EXPERTISE HC SIA, qui a pour but de promouvoir les stages pour une meilleure insertion professionnelle des étudiants.","Vocational Rehabilitation Services","11-50 employees","Non Profit",,,,"https://www.linkedin.com/company/forum-national-des-stages-du-burkina"
