"Find companies","Name","Description","Primary Industry","Size","Type","Location","Country","Domain","LinkedIn URL"
,"Le Repere des CIP","La veille pour nous les CIP (Conseiller d'Insertion Professionnelle)

Offres d'emploi, aides pour les CIP, pour les futurs apprenants, pour les apprenants.
Retrouvez nous également sur :
https://formation.lereperedescip.com/ (pour des cours et du coaching)
https://www.lereperedescip.com (notre site pour tout savoir sur le LRDCiP)
https://www.facebook.com/groups/lereêredescip (pour partager des infos entre cip)
https://anchor.fm/s/104a302a0/podcast/rss (podcasts sur l'insertion pro)","Vocational Rehabilitation Services","2-10 employees","Non Profit","Reims","France","lereperedescip.com","https://www.linkedin.com/company/le-repere-des-cip"
,"PME Consulting Group","Cher(e) candidat(e)

L’équipe Conseil Stage - Emploi de PME Consulting Group est  en attente de recevoir de votre CV actualisé à pmeconsultingroup@gmail.com pour un entretien d'évaluation Stage ou Emploi
Vous pouvez nous contacter au Tel/WATHSAPP(+225) 07 79 45 70 08 entre 08 heures et 18 heures, jour ouvrable pour plus d'informations sur nos services et pour obtenir des réponses sur d' éventuelles questions ou pour discuter d'autres façons dont nous pourrions vous aider.

Cordialement

L’équipe Conseil Stage - Emploi

PME Consulting Group
CENTRE APPUI STAGE - EMPLOI
INFORMATION - FORMATION - ASSISTANCES ETUDIANTS 
COMMERCIAUX - MARKETING - PUBLICITÉ
Email: pmeconsultingroup@gmail.com
WATHSAPP: (+225) 07 79 45 70 08
ABIDJAN COCODY RIVIERA PALMERAIE
COTE D'IVOIRE","Vocational Rehabilitation Services","2-10 employees","Privately Held","ABIDJAN, LAGUNE","Ivory Coast","pmeconsultingroup.com","https://www.linkedin.com/company/pme-consulting-group"
,"Mission locale de Paris","La Mission Locale de Paris est une structure chargée de l’accueil, de l’information, de l’orientation et de l’accompagnement des jeunes de 16 à 25 ans, en démarche d’insertion professionnelle et sociale.
 
Les valeurs de la Mission Locale de Paris s’articulent autour de quatre piliers : la solidarité, la confiance, la coopération et l’engagement.
 
Chaque année elle reçoit environ 10 000 nouveaux·elles jeunes et en accompagne 22 000.
Chargée d’une mission de service public, elle est financée par la ville de Paris, l’Etat et la région Ile-de-France. 

En 2024 : 
Plus de 9 270 jeunes ont été accueilli·e·s pour la première fois 
Plus de 2 781 jeunes sont en suivi renforcé dans le cadre du Contrat d'Engagement Jeune
Plus de 1063 ont reçu une aide au titre du Fonds d'Aide aux Jeunes Parisiens (FAJP)
Plus de 2 184 jeunes ont commencé un emploi durable (CDI ou CDD de plus de 6 mois)","Vocational Rehabilitation Services","201-500 employees","Non Profit","Paris, Île-de-France","France","missionlocaledeparis.fr","https://www.linkedin.com/company/mission-locale-de-paris"
,"Diagoriente","Diagoriente est une start-up d'État du Ministère du Travail. Notre objectif est de vous accompagner dans votre projet d'orientation professionnelle, quel que soit votre niveau d'études ou d'expériences. Sur Diagoriente Plateforme, vous trouverez des outils novateurs, faciles d'utilisation, vous permettant de valoriser l'ensemble de vos expériences et de vos compétences. Au fil de votre parcours sur notre plateforme, vous découvrirez votre potentiel pour le valoriser. À tout moment, vous pourrez entrer en contact avec un écosystème professionnel proche de chez vous, qu’il s’agisse de centres de formation ou de possibles employeurs. Diagoriente est un révélateur de compétences et développe des outils d'accompagnement professionnel ouvert à toutes et tous !","Vocational Rehabilitation Services","11-50 employees","Government Agency","Lille, Hauts-de-France","France","beta.gouv.fr","https://www.linkedin.com/company/diagoriente"
,"YUPEEK","-","Vocational Rehabilitation Services","11-50 employees","Partnership","Metz, Grand Est","France","yupeek.com","https://www.linkedin.com/company/yupeek"
,"Konekt","Konekt is one of the largest workplace injury management and workplace health solutions providers in Australia. Konekt’s focus is on helping organisations, individuals and government to maximise workforce participation and productivity, and minimise the impact of workplace injury.

We help organisations minimise workplace costs, resulting in increased participation, reduced workers compensation premiums and safer workplaces.

We assist employers and insurance companies in recruiting the right person physically and psychologically, keeping them safe and well, responding to OHS incidents, returning the individual to the workplace and redeploying if necessary. 

Konekt's allied health professionals deliver services across a diversity of industries including government, mining, retail, manufacturing, transport, hospitality and labour hire. 

Australia's largest corporations rely on Konekt's integrated solutions to manage the health of their workforce, improve processes and identify escalating costs or non-compliance in occupational health and safety, risk management and injury management.  

Konekt also has significant customers across large government departments and agencies, as well as private employers.

Learn more at www.konekt.com.au","Vocational Rehabilitation Services","501-1,000 employees","Public Company","West Perth, Western Australia","Australia","konekt.com.au","https://www.linkedin.com/company/konekt"
,"Ambassade du Postulant","𝙰𝚖𝚋𝚊𝚜𝚜𝚊𝚍𝚎 𝚍𝚎𝚜 𝙿𝚘𝚜𝚝𝚞𝚕𝚊𝚗𝚝𝚜
Notre engagement : Ne laisser passer aucune chance de réussite.
Nous accompagnons les candidats aux concours d’admission à travers un suivi personnalisé et des ressources pédagogiques adaptées à leurs objectifs.
Au-delà de la préparation académique, nous scrutons activement le terrain des opportunités — offres d’emploi, bourses d’études, formations, appels à candidatures — afin de les rendre accessibles aux étudiants, jeunes diplômés et professionnels en quête de progression ou de reconversion.","Vocational Rehabilitation Services","2-10 employees","Self Employed","Port-au-Prince , Ouest","Haiti",,"https://www.linkedin.com/company/ambassade-du-postulant"
,"BimBamJob","Chez BimBamJob, nous croyons en une société qui place en son coeur la dignité des personnes.
 
Depuis 10 ans, nous œuvrons aux côtés de publics en situation de fragilité socio-professionnelle. 

Notre approche repose sur 4 piliers méthodologiques : le développement du pouvoir d'agir, le regard positif comme levier de confiance en soi, l'individualisation des parcours et la connexion à l'écosystème partenarial de l'accompagnement social et de l'emploi.

En 2025, nous avons accompagné près de 10 000 personnes sur quatre régions (Ile-de-France, Auvergne-Rhône-Alpes, Bretagne et Provence-Alpes-Côtes d'Azur). Via notre outil numérique Horizon, 70 000 personnes ont été suivies par des CIP et des travailleurs sociaux de collectivités et nous avons formé 200 d'entre eux aux méthodologies que nous avons développées.","Vocational Rehabilitation Services","51-200 employees","Privately Held","Paris, Île-de-France","France","bimbamjob.fr","https://www.linkedin.com/company/bimbamjob"
,"MASAR","مبادرة تطوعية تهدف إلى تثقيف الخريجين و الباحثين عن عمل بالمسميات الوظيفية في سوق العمل السعودي ومتطلباتها ومساعدتهم لتحديد مسارهم المهني ","Vocational Rehabilitation Services","11-50 employees","Non Profit","السعودية","Saudi Arabia",,"https://www.linkedin.com/company/masar2030"
,"Mission Locale de Roubaix","Le saviez-vous ? La Mission Locale de Roubaix bénéficie du soutien financier de l’Union européenne dans le cadre de plusieurs actions : 
- une actions « Du repérage à l'emploi - QPV Roubaix » permettant de repérer des jeunes NEET en QPV afin de remobiliser les jeunes dans un parcours d’insertion socio-professionnelle.
 - une action ""Tu vas déployer tes ailes"" visant à accompagner au mieux les jeunes dans la construction et la réalisation de leurs projets professionnels.

La Mission Locale de Roubaix s'adresse aux jeunes Roubaisiens de 16 à 25 ans sortis du système scolaire.
La Mission Locale est un espace d’intervention au service des jeunes. Chaque jeune accueilli bénéficie d’un suivi personnalisé dans le cadre de ses démarches. Elle apporte des réponses aux questions d’emploi, de formation mais aussi sur le logement ou la santé. 
La Mission Locale développe et accompagne un réseau d’entreprises.","Vocational Rehabilitation Services","51-200 employees","Non Profit","Roubaix","France","mlroubaix.com","https://www.linkedin.com/company/mission-locale-de-roubaix-mlrbx"
,"Lulu dans ma rue","Lulu dans ma rue est la toute première Entreprise d'insertion par le Travail Indépendant (EiTI) en France. 

Qu'est-ce que l'EiTI ? 
Le modèle EiTI est une innovation sociale qui est venue combler un manque : celui d’un dispositif accompagnant des publics très éloignés de l’emploi qui ne peuvent pas, ou ne veulent plus, reprendre une activité salariée mais souhaitent se lancer dans le travail indépendant.

Notre mission ? 
Accompagner vers une reprise d’activité et être un tremplin pour des publics cumulant des problématiques sociales et éloignés de l’emploi en s’appuyant sur la flexibilité et le pouvoir d’autonomisation qu’apporte le travail indépendant.

À qui s'adresse l'EiTI Lulu dans ma rue ? 
La flexibilité et l’absence de hiérarchie apportées par le travail indépendant s’avèrent particulièrement adaptées aux : familles monoparentales, seniors, aidants, personnes en situation de handicap, personnes ayant un parcours de vie chaotique et n’ayant jamais travaillé dans une entreprise, publics dits « invisibles » car sous les radars ou en rupture d’accompagnement.

Quel accompagnement propose Lulu dans ma rue ? 
L'EiTI Lulu dans ma rue offre un parcours global avec mise en activité pendant le parcours par l’apport de clients et un accompagnement fondé sur 3 piliers : un accompagnement administratif et entrepreneurial, un accompagnement socioprofessionnel et un accompagnement commercial/apport d’affaires.

Aujourd’hui, Lulu dans ma rue c’est près de 3 000 Lulus accompagnés dans la reprise d'une activité à Paris, Lyon et Lille.","Vocational Rehabilitation Services","11-50 employees","Non Profit","Paris, Île-de-France","France","luludansmarue.org","https://www.linkedin.com/company/lulu-dans-ma-rue"
,"Nouvelle Attitude","NOUVELLE ATTITUDE, filiale du Groupe LA POSTE, est une entreprise d'insertion conventionnée par l’Etat et le Pôle Emploi, spécialisée dans la valorisation des matières dans l'objectif de les recycler en proximité sur le territoire français.
Entreprise experte du tri et de la valorisation, Nouvelle Attitude apporte un soutien et une expertise au Groupe La Poste, pour développer de nouvelles filières.
Nouvelle Attitude est basée sur différents sites sur la France : 
St Germain (78), Mions (69), Tours (37), Vitrolles (13), Saint-Etienne-du-Rouvray (76), Portet-Sur-Garonne (31), Créteil (94), Poincy (77) et Verdun (55). 
Elle se diversifie sur de nouvelles activités autour du réemploi et du reconditionnement avec de belles réussites du reconditionnement d'ordinateurs et de Vélo à Assistance Electrique su site client ou dans nos ateliers. 
Sur l'activité vélo, nous opérons la maintenance de vélos de facteurs, la maintenance de vélos Véligo, le reconditionnement de Vélos à Assistance Electrique. Nos Vélos reconditionnés sont commercialisés dans 140 bureaux de poste en France.","Vocational Rehabilitation Services","51-200 employees","Privately Held","Montigny, Île-de-France","France","nouvelle-attitude.fr","https://www.linkedin.com/company/nouvelle-attitude"
,"Meet Your Boss","Nous nous engageons au quotidien auprès des demandeurs d'emploi vers une insertion réussie et durable sur le marché du travail. Grâce à un accompagnement sur mesure, à l'organisation d'événements, d’ateliers de formation, de réseautage ciblés, tels que nos ""Job Datings"", et à une mobilisation efficace des ressources disponibles, nous créons des opportunités concrètes pour faciliter votre transition professionnelle.
Au sein de Meet Your Boss, nous croyons en la force de la collaboration et du partage de connaissances pour renforcer l'intégration socioprofessionnelle et garantir un impact positif durable.","Vocational Rehabilitation Services","2-10 employees","Non Profit","Montreux, Vaud","Switzerland","myboss.ch","https://www.linkedin.com/company/meet-your-boss"
,"Generation Health","Generation Health is a newly formed Australian company which brings together a number of high quality well established health brands. Through our brands, we deliver services across personal injury, occupational health, medico-legal and disability employment. 

Our nationwide teams of consultants are committed to delivering the best quality services - at the highest standards - to improve lives across the country. They do this by delivering measurable individual solutions; utilising technology and mobility; and by leveraging our powerful shared services function. 

Ensuring our solutions are both specific to the individual and measurable is important to us, and this focus is reflected in our purpose, vision and values. If we can’t measure the difference we have made to someone’s life – how do we know we have been successful?","Vocational Rehabilitation Services","201-500 employees","Public Company","North Sydney, NSW","Australia","generationhealth.com.au","https://www.linkedin.com/company/generation-health-aus"
,"Le labo des CIP"," Qu’est-ce que c’est ?
Le Labo des CIP est un espace d’expérimentation, de partage et d’innovation pour les Conseillers en Insertion Professionnelle (CIP) et tous ceux qui gravitent autour de l’accompagnement vers l’emploi.
C’est un terrain neutre, créatif et collaboratif : on y décortique les pratiques, on teste de nouveaux outils (IA, pédagogie, logiciels, méthodes d’accompagnement), on rigole parfois de nos galères… mais toujours avec un objectif : mieux accompagner les personnes vers l’insertion.

 Les piliers du Labo
 La connaissance : articles, veilles, fiches pratiques, ressources pédagogiques adaptées aux réalités du terrain.
 La créativité : BD, visuels, formats décalés pour rendre visibles et vivants les enjeux de l’insertion.
 La communauté : un lieu où CIP, formateurs, partenaires, bénéficiaires et curieux échangent sans jargon institutionnel.
 L’innovation : expérimenter l’intelligence artificielle, les outils numériques et les nouvelles approches pédagogiques pour gagner en efficacité et en impact.

 La philosophie du Labo
Pas de langue de bois : on parle vrai, avec humour quand il faut.
Pas d’isolement : chaque CIP peut trouver des idées, du soutien, et sentir qu’il fait partie d’une communauté.
Pas d’ennui : même les sujets les plus sérieux s’expliquent avec pédagogie et légèreté (le vert fluo n’est pas là pour décorer).

 L’ambition du Labo
Être un point de repère pour les professionnels de l’insertion :
Un lieu où les conseillers gagnent du temps.
Où les bénéficiaires retrouvent de l’autonomie.
Où les partenaires découvrent de nouvelles façons de collaborer.

En clair : un laboratoire vivant de l’insertion, avec du concret, du partage et du fun.","Vocational Rehabilitation Services","Self-employed","Non Profit","Lunel","France","lelabodescip.fr","https://www.linkedin.com/company/le-labo-des-cip"
,"DREAMIN'JOB","Dreamin’job innove pour automatiser le placement des étudiants vers le bon emploi, car chaque étudiant mérite de trouver son stage, alternance ou 1er emploi de rêve 

Dreamin’job inaugure une nouvelle ère post Jobboards avec la 1ère solution SAAS de Job Matching IA , dédiée aux étudiants et jeunes diplômés qui sont nombreux à galérer pour trouver un emploi épanouissant.

Déjà adoptée par 50 campus en France et en Suisse 

 Pour nous rencontrer : contact@dreaminjob.fr","Vocational Rehabilitation Services","2-10 employees","Privately Held","Lyon, Rhône","France","dreaminjob.fr","https://www.linkedin.com/company/dreaminjob"
,"Division Insertion Professionnelle et Relations avec les Diplômés","La Division Insertion Professionnelle et Relations avec les Diplômés (IPRD) est une Unité de la Faculté des Sciences Agronomiques (FSA) de l’Université d’Abomey-Calavi (UAC). Notre mission est d'accompagner les apprenants et diplômés de la Faculté dans leur insertion professionnelle.
A cet effet, nous avons conçu un programme dynamique de renforcement des capacités dont la mise en œuvre permet aux apprenants et diplômés de la FSA de développer les compétences recherchées sur le marché. Le travail de la Division inclut la facilitation de l’accès aux opportunités de stage et d’emploi pour les apprenants et diplômés, et l’accompagnement des porteurs d’idée d’entreprise. Enfin, nous effectuons le suivi post-graduation des diplômés de la Faculté et la mesure de leur insertion professionnelle, ainsi que le suivi des évolutions du marché du travail pour l’identification des révisions requises dans les curricula de formation. 
Nos activités comprennent des ateliers de formation au profit des apprenants et diplômés, l’écoute et la veille, le partage d’opportunités, la mise en réseau et la connexion avec les entreprises pour le bien des apprenants et diplômés.","Vocational Rehabilitation Services","2-10 employees","Educational","Abomey-Calavi, Bénin","Benin","fsa-uac.bj","https://www.linkedin.com/company/division-insertion-professionnelle-et-relations-avec-les-diplômés"
,"Viva Sports Rehab",,"Vocational Rehabilitation Services","11-50 employees","Privately Held",,,,"https://www.linkedin.com/company/viva-sport-rehab"
,"Sunshine Rehabilitation Center","Sunshine Rehabilitation Welfare Center is a non-profit organization dedicated to providing comprehensive rehabilitation services to individuals suffering from drug addiction in Karachi, Pakistan. Established in 2020, Sunshine is committed to creating a drug-free society and has been providing rehabilitation services for the past 2 years. Our center provides a safe and secure environment for patients to recover from addiction and achieve long-term sobriety.

At Sunshine, we offer a range of rehabilitation services, including medical treatment, counseling, vocational training, and reintegration into society. Our medical team consists of certified psychiatrists, psychologists, and medical staff who are trained in evidence-based treatment methods. We believe in a holistic approach to rehabilitation, which includes not only addressing the physical aspects of addiction but also the psychological, emotional, and social components.

We also offer vocational training programs to equip patients with the necessary skills to reintegrate into society and become productive members. Our vocational training includes computer skills, sewing and embroidery, and other trades. We believe that providing patients with these skills will help them rebuild their lives and reduce the risk of relapse.

Sunshine Rehabilitation Welfare Center has a proven track record of successfully rehabilitating patients suffering from addiction. Our team is dedicated to providing the highest quality care to our patients and helping them achieve long-term sobriety. We believe in the power of rehabilitation and are committed to creating a better and drug-free society.","Vocational Rehabilitation Services","11-50 employees","Non Profit","Karachi","Pakistan","srwc.pk","https://www.linkedin.com/company/sunshine-rehabilitation-center"
,"La Ferme des Possibles (Novaedia)","Coopérative d'insertion pour des personnes éloignées de l'emploi, La Ferme des Possibles (Novaedia) développe une boucle alimentaire biologique, locale et solidaire en Seine-Saint-Denis. À la fois agriculteur urbain, restaurateur et logisticien, la SCIC propose des produits agricoles et des services aux entreprises.","Vocational Rehabilitation Services","11-50 employees","Privately Held","Stains, Île-de-France","France","fermedespossibles.fr","https://www.linkedin.com/company/fermedespossibles"
,"Mission Locale réseaux pour l'emploi du Pays de Lorient","La Mission Locale réseaux pour l'emploi du Pays de Lorient exerce une mission de service public de proximité avec un objectif essentiel : accompagner les jeunes de 16 à 25 ans (29 ans pour les personnes en situation de handicap), dans leurs parcours d’accès à l’autonomie et à l’emploi.

Elle met en œuvre un accompagnement global qui permet de traiter l’ensemble des leviers qui favorisent l’insertion socio-professionnelle : emploi, formation, orientation, citoyenneté, mobilité, logement, santé, accès aux droits, à la culture et aux loisirs.

Forte de ses 60 salariés, ses 3 antennes et ses 12 permanences d’accueil répartis sur le territoire lorientais, la Mission Locale de Lorient accompagne près de 4000 jeunes de tous niveaux scolaires (sans qualification à Bac+5). 2 jeunes sur 3 décrochent une situation d’emploi, de contrat en alternance ou de formation dans l’année.

𝐋𝐚 𝐌𝐢𝐬𝐬𝐢𝐨𝐧 𝐋𝐨𝐜𝐚𝐥𝐞 𝐞𝐭 𝐥𝐞𝐬 𝐞𝐧𝐭𝐫𝐞𝐩𝐫𝐢𝐬𝐞𝐬 𝐝𝐮 𝐭𝐞𝐫𝐫𝐢𝐭𝐨𝐢𝐫𝐞
Parce que nous connaissons notre territoire, les besoins des entreprises et les attentes et compétences des jeunes que nous rencontrons, la Mission Locale du Pays de Lorient propose des solutions adéquates.

Forte d’une quinzaine d’années d’expérience de collaboration avec les entreprises locales, notamment au travers de son activité de coaching « Le Parrainage », la Mission locale du Pays de Lorient poursuit ses efforts d’innovation et d’adaptation afin d’améliorer la mise à l'emploi des jeunes du pays de Lorient.

Attirez et fidélisez les jeunes générations dans vos entreprises, renforcez votre démarche RSE en devenant partenaire de la Mission Locale du Pays de Lorient. 

𝐋𝐚 𝐌𝐢𝐬𝐬𝐢𝐨𝐧 𝐋𝐨𝐜𝐚𝐥𝐞 𝐞𝐭 𝐥𝐞 𝐫é𝐬𝐞𝐚𝐮
La Mission Locale réseaux pour l'emploi du Pays de Lorient fait parti de l'Association régionale des Missions Locales de Bretagne, elle-même soutenue par l'Union nationale des Missions Locales. 436 missions locales accompagnent les jeunes sur le territoire national.","Vocational Rehabilitation Services","51-200 employees","Non Profit","Lorient, Bretagne","France","mllorient.org","https://www.linkedin.com/company/mission-locale-r-seaux-pour-l-emploi-du-pays-de-lorient"
,"Le Bureau d'Amelie","LE BUREAU D'AMÉLIE c'est votre partenaire de votre réussite professionnelle : 

En tant que particulier : je vous accompagne dans vos projets d'évolution ou de reconversion professionnelle, dans votre recherche d'emploi et dans votre développement personnel et professionnel. 

En tant qu'entreprise : Je vous accompagne dans les projets de mobilités de vos collaborateurs, dans la gestion et la rétention des compétences et dans le recrutement de vos futurs talents. 

Le Bureau d'Amélie mise avant tout sur l'humain, un accompagnement personnalisé et adapté à vos besoins. 

Vous souhaitez plus d'informations? Profitez du premier entretien OFFERT. Vous pouvez prendre rendez-vous directement depuis la page ""contact"" de mon site internet. 

Besoin d'une analyse et d'un devis ? Contactez-moi directement au 0631448729 ou par mail : lebureaudamelie@gmail.com","Vocational Rehabilitation Services","Self-employed","Self Owned","Savigné-l’Évêque, Pays de la Loire","France","lebureaudamelie.fr","https://www.linkedin.com/company/le-bureau-d-amelie"
,"Cap emploi 95","Ressources Carrières & Handicaps 95, Organisme de Placement Spécialisé, assure depuis plus de 20 ans une mission de service public qui consiste : 
1. A faciliter l’embauche, l'évolution professionnelle, la transition professionnelle et le maintien dans l'emploi des personnes en situation de handicap en milieu ordinaire de travail. 
2. A informer les employeurs privés et publics sur le cadre légal de l'Obligation d'emploi des Travailleurs Handicapés, à les sensibiliser au recrutement et au maintien dans l'emploi de personnes en situation de handicap et à les accompagner dans leurs projets de recrutement, d'intégration et de maintien dans l'emploi de la définition du projet à sa concrétisation.

Cap emploi 95, vous propose :
- un service adapté, personnalisé et réactif,
- une expertise du cadre légal,
- une aide à la mobilisation des mesures et aides de droit commun et spécifiques liées à l’embauche des personnes handicapées.

Opérateur du Conseil en Évolution Professionnelle et membre du Service Public de l'Emploi, RCH 95 porte le label Cap emploi 95 délivré par l'Etat, l'Agefiph, le FIPHFP et Pôle emploi.","Vocational Rehabilitation Services","11-50 employees","Non Profit","Cergy, Île-de-France","France","capemploi-95.com","https://www.linkedin.com/company/capemploi95"
