"Find companies","Name","Description","Primary Industry","Size","Type","Location","Country","Domain","LinkedIn URL"
,"Mission Locale de Saint Etienne","Au service des jeunes de 16 à 25 ans :
    Repérer, accueillir, informer, orienter et accompagner les jeunes en élaborant avec chacun un parcours personnalisé vers l’emploi.
    Aider le jeune à s’orienter et examiner avec lui les moyens à mobiliser pour lever les freins à l’emploi.
    Mobiliser l’offre d’insertion disponible sur un territoire avec les partenaires locaux.
    Soutenir les jeunes dans leur recherche d’emploi ainsi que dans leurs démarches d’orientation professionnelle, d’accès à la formation, à la santé, au logement, aux droits, à la citoyenneté et à la mobilité.
    Préparer les jeunes candidats à une offre d’emploi, aide au maintien dans l’emploi (soutien matériel, médiation jeune-employeur) et accompagnement post emploi.

Au service des entreprises et recruteurs du territoire :
    Aider au recrutement grâce à l’analyse des besoins de l’entreprise, la proposition de candidats et la construction d’une réponse individualisée (type de contrat, aides mobilisables, formation…).
    Accompagner dans l’emploi : suivi du jeune dans la phase d’intégration sur son poste de travail, bilans réguliers dans l’entreprise, médiation si nécessaire.
    Valoriser les entreprises locales grâce à l’information des jeunes et des professionnels sur le secteur et les métiers exercés (visites, stages découverte des métiers, etc.).
    Organiser des actions de recrutements.","Vocational Rehabilitation Services","11-50 employees","Privately Held","St-Étienne, Auvergne-Rhône-Alpes","France","ml-st-etienne.org","https://www.linkedin.com/company/mission-locale-de-saint-etienne"
,"le TAF",,"Vocational Rehabilitation Services","Self-employed","Non Profit",,,,"https://www.linkedin.com/company/le-taf"
,"Mission Locale de l'Arrondissement de Béthune","Mission Locale Béthune","Vocational Rehabilitation Services","51-200 employees","Non Profit","BETHUNE","France","mlabethune.fr","https://www.linkedin.com/company/mlabethune"
,"Mentorat Lycée Jean Lurçat Fleury-les-Aubrais","Nous proposons à des professionnel(le)s en activité d'accompagner l'un(e) de nos élèves tout au long de l'année scolaire. 
En fonction de vos disponibilités, plusieurs formules sont possibles, de 1 heure à 1 an ! 
Dans tous les cas, vous aurez le plaisir de partager avec l'un de nos élèves pour l'aider à grandir.
Peu importe votre secteur d'activité, votre niveau hiérarchique, l'accompagnement porte sur le savoir-être et sur les codes professionnels.
Nous sommes à votre écoute pour répondre à vos questions.
A très bientôt ?","Vocational Rehabilitation Services","51-200 employees","Self Employed","Fleury-les-Aubrais","France","lycee-jean-lurcat.com","https://www.linkedin.com/company/mentorat-lycee-jean-lurcat"
,"Geiq AMS","Le GEIQ AMS est un groupement d’employeurs pour l’insertion et la qualification spécialisé dans le secteur de l’aide à la personne. Nouvel outil pour l’emploi, disponible sur l’ensemble de la région Auvergne Rhône-Alpes, notre objectif est de mettre en relation des personnes qui souhaitent se former aux métiers de l’aide à la personne avec des associations qui recrutent et sont en besoin constant de personnel.
Nous nous chargeons de recruter des candidats motivés, qui correspondent au profil de nos associations adhérentes, pour ensuite les embaucher en contrat de professionnalisation.

Notre fondement : Valoriser le secteur de l'Aide à domicile en contribuant à l'épanouissement social et professionnel des personnes en recherche d'emploi dans un parcours de réussite et de qualification.","Vocational Rehabilitation Services","11-50 employees","Non Profit","Vénissieux","France","geiq-ams.fr","https://www.linkedin.com/company/geiq-ams"
,"Groupe SOLIF","Constitué sous format associatif, le Groupe SOLIF recrute et accompagne des demandeurs d’emploi de longue durée vers le retour à la vie professionnelle.

Nous créons des emplois, assurons l’accueil et l’intégration, l’accompagnement social et professionnel et la formation de l’ensemble de nos salariés en parcours.

Avec un siège social basé à Charolles et plusieurs antennes implantées sur le territoire, notre association réalise ses missions sur l’ensemble de la Saône et Loire et sur les départements limitrophes. Elles sont réalisées grâce à ses activités économiques qui contribuent au développement territorial.

En vue de faciliter l’insertion durable de nos collaborateurs dans le monde du travail, l’activité économique est utilisée comme un outil de socialisation et de pédagogie dans la construction du parcours professionnel des salariés. Nous sommes attentifs au fait d’inscrire nos actions dans une démarche RSE tout en veillant à ce que nos activités aient un impact positif sur la société, en respectant notamment des notions d’économie circulaire, de protection des environnements naturels et architecturaux.

Notre association est agréée ESUS (Entreprise Solidaire d’Utilité Sociale).

 https://www.solif.org/fse/","Vocational Rehabilitation Services","51-200 employees","Non Profit","Charolles","France","solif.org","https://www.linkedin.com/company/groupe-solif"
,"Mission Locale du Lot","La Mission Locale du Lot, votre alliée pour l'emploi des jeunes et le recrutement des entreprises locales.

Vous avez des besoins en recrutement ? Nous mettons nos compétences à votre service pour répondre à vos besoins spécifiques. Nos Chargé.es Relations Entreprises vous accompagnent dans le choix des candidats, leur recrutement, leur intégration et leur suivi en emploi.

Nous avons une mission claire : accompagner et orienter les jeunes de 16 à 25 ans (sortis du système scolaire) dans leur insertion professionnelle et sociale. Forts de notre expérience de collaboration avec les entreprises locales, nous continuons d'innover pour améliorer la mise à l'emploi des jeunes du Lot.

En tant qu'acteur central de l'emploi des jeunes, nous créons des liens solides entre les jeunes talents et les employeurs. Rejoignez-nous pour attirer et fidéliser la jeune génération au sein de vos entreprises.

Ancrés dans notre territoire, nous comprenons les besoins des entreprises locales et les aspirations des jeunes que nous accompagnons. Nous offrons des solutions sur mesure pour le succès de tous.

La Mission Locale du Lot : Votre partenaire pour un avenir prometteur, où jeunes talents et employeurs se rencontrent pour bâtir ensemble un avenir prometteur.","Vocational Rehabilitation Services","11-50 employees","Non Profit","Cahors","France","ml46.fr","https://www.linkedin.com/company/mission-locale-du-lot"
,"FORUM NATIONAL SUR L'EMPLOI",,"Vocational Rehabilitation Services","2-10 employees","Non Profit",,,,"https://www.linkedin.com/company/forum-national-sur-l-emploi"
,"Mission Locale Rives de Seine","La Mission Locale Rives de Seine regroupe regroupe les villes de Bois-Colombes, Courbevoie, Garches, La Garenne-Colombes, Levallois, Neuilly-sur-Seine, Puteaux, Rueil-Malmaison et Suresnes.

Elle est au service des jeunes de 16 à 25 ans pour favoriser leur accès à l’emploi, à l’alternance et à la formation. Une passerelle entre les jeunes et l’entreprise qui apporte une réponse adaptée en matière de recrutement.","Vocational Rehabilitation Services","11-50 employees","Non Profit","Courbevoie, IDF","France","mlrivesdeseine.com","https://www.linkedin.com/company/mlrivesdeseine"
,"Terri'Mouv Inclusion","Organisme intermédiaire","Vocational Rehabilitation Services","2-10 employees","Non Profit","Arras","France",,"https://www.linkedin.com/company/terri-mouv-inclusion"
,"DigitalRehab","DigitalRehab riscrive le regole della riabilitazione, trasformandola in un’esperienza connessa, accessibile e science-based. 

Con soluzioni digitali avanzate, sblocchiamo nuovo potenziale per i terapisti, ottimizzando le risorse e migliorando l’efficienza del lavoro clinico, creando spazio per la cura di più pazienti. Con dispositivi intelligenti che uniscono monitoraggio continuo e supporto personalizzato, mettiamo il paziente al centro, promuovendo il suo ruolo attivo nel percorso di recupero e mantenendo una connessione costante con lo specialista.

Immaginiamo un futuro in cui la riabilitazione non sia più un peso, ma un percorso sostenibile e stimolante, dove la tecnologia è al servizio della salute e al centro ci sono le persone.","Vocational Rehabilitation Services","2-10 employees","Privately Held","milan",,"digitalrehab.eu","https://www.linkedin.com/company/digitalrehab-srl"
,"ESAT L'Etape Tournière","L’Etape Tournière est un Établissement et Service d’Aide par le Travail (ESAT) basé à Carquefou, en Loire-Atlantique (44), et géré par l’Association L’Etape. 

L’ESAT L’Etape Tournière propose des services de blanchisserie, d'entretien des espaces verts, d'hygiène des locaux et de conditionnement et de sous-traitance.
Nous accueillons 130 travailleurs en situation de handicap psychique et 30 professionnels encadrants.","Vocational Rehabilitation Services","11-50 employees","Non Profit","Carquefou, Pays de la Loire","France","letape-association.fr","https://www.linkedin.com/company/esat-l-etape-tourniere"
,"NOor Eco School","Cabinet d'insertion professionnelle, chargé de l'accompagnement des étudiants durant leur parcours académiques afin de leur permettre la meilleure insertion au monde professionnel, en termes de formations, stages et recherches de travails. 
Nous accompagnons également les salariés, les entrepreneurs et les enseignants à développer leur carrière. 
Nous aidons également les entreprises dans leurs stratégies de communication et la génération des ventes.","Vocational Rehabilitation Services","2-10 employees","Educational","ALGIERS","Algeria",,"https://www.linkedin.com/company/noor-eco-school"
,"Positival AS","We help businesses retain and support employees post-cancer with NAV-backed workplace strategies that boost productivity, improve employee retention, and reduce absenteeism—without increasing company costs

#PostCancerSupport #WorkplaceWellbeing #CorporateResponsibility","Vocational Rehabilitation Services","2-10 employees","Privately Held","Stavanger","Norway","positival.no","https://www.linkedin.com/company/positival"
,"Le Propulseur","Le Propulseur était une entreprise d'insertion par le travail indépendant (EITI), portée par le groupe StaffMe. Ce dispositif innovant a permis d’accompagner de nombreux jeunes vers l’emploi durable, en mobilisant les opportunités du travail indépendant comme levier d’insertion.","Vocational Rehabilitation Services","2-10 employees","Non Profit",,,"staffme.fr","https://www.linkedin.com/company/le-propulseur-marseille"
,"Limitless Surfers - גולשים ללא גבולות","A non-profit organization that works to rehabilitate IDF-disabled and PTSD veterans through surfing activities and Community integration.

Helping veterans cope better with the challenges of life through the love of surfing. One wave at a time.","Vocational Rehabilitation Services","51-200 employees","Non Profit","tel aviv","Israel","golshimllogvulot.com","https://www.linkedin.com/company/surfers-without-limits-גולשים-ללא-גבולות"
,"Job4Mi Ouest","Job4Mi Ouest est un réseau dont l’objectif est de développer et d’accompagner l’accès à l’emploi de personnes migrantes, motivées et impliquées, pour faciliter leur intégration sur le territoire, en favorisant leur embauche sur des emplois non pourvus.

Notre action part des besoins en recrutement des entreprises. C'est pourquoi l'association repose sur un processus multi-partenarial composé d'entreprises qui recrutent, des organismes et des associations qui accompagnent les personnes migrantes, des collectivités territoriales et enfin les bénévoles de Job4Mi Ouest.","Vocational Rehabilitation Services","2-10 employees","Non Profit","Nantes, Pays de la Loire","France","job4miouest.fr","https://www.linkedin.com/company/job4mi-ouest"
,"AIDE","Association Intermédiaire pour les Demandeurs d'Emploi","Vocational Rehabilitation Services","11-50 employees","Non Profit","Amnéville, Grand Est","France","aide57.com","https://www.linkedin.com/company/a-i-d-e"
,"CENTRO DI RIABILITAZIONE LARS  - S.R.L. -","CENTRO DI RIABILITAZIONE LARS SRL è una società di diritto italiano costituita in data 25 luglio 1987, avente la propria sede legale in Sarno - Sa, Via Beveraturo 93.
La società svolge l’attività di servizi in ambito sanitario. Per la precisione l’attività si svolge nell’ambito del settore dei servizi sanitari riabilitativi e dei servizi sociosanitari assistenziali, resi a favore del pubblico attraverso la gestione di alcuni centri privati, accreditati con il Servizio Sanitario Nazionale.
Nell’ambito della riabilitazione il Centro di Riabilitazione LARS ha l’obiettivo dichiarato di migliorare gli standard qualitativi delle prestazioni erogate e di riduzione progressiva delle già bassissime percentuali di inefficienza di risultati nella riabilitazione. Ed è proprio nell’ottica del raggiungimento di tali obbiettivi che l’azienda si è dotata recentemente di strumenti all’avanguardia dal punto di vista tecnologico:
•	Il Sistema Lokomat Pro V6, sistema di deambulazione robotizzato;
•	l’Armeopower, esoscheletro motorizzato progettato per i pazienti con severi deficit di movimento;
•	Il Nirvana, sistema di realtà virtuale per la riabilitazione in pazienti affetti da patologie neuromotorie;
•	Il Vibra 3.0, per il trattamento di patologie neuro-muscolari;
•	Il Biodex Gait, per pazienti affetti da disturbi della deambulazione;
•	Il Biodex Balance, per il miglioramento dell’equilibrio;
•	L’RT 200/300, sistema di elettrostimolazione funzionale;
•	L’Andago, dispositivo medico robotizzato di rieducazione alla deambulazione.
L’attività principale viene svolta in una struttura all’avanguardia di proprietà di circa 12.000 mq. che sorge su un’area complessiva di circa 95.000 mq., ubicata all’interno del Parco Tecnologico - Fluviale Sarno. 
Sono attualmente occupate circa 450 unità lavorative fra medici, terapisti della riabilitazione, operatori tecnici assistenziali, assistenti ed ausiliari.","Vocational Rehabilitation Services","201-500 employees","Self Owned","Sarno, Campania","Italy","centrolars.com","https://www.linkedin.com/company/centro-di-riabilitazione-lars---s.r.l.--"
,"Pôle Formation Insertion Normandie",,"Vocational Rehabilitation Services","2-10 employees","Non Profit",,,"apprentis-auteuil.org","https://www.linkedin.com/company/pfi-normandie"
,"VIT'INSER","Vit'Inser bénéficie d'un soutien financier de l'Union Européenne pour la réalisation de sa mission d'insertion sociale et professionnelle de publics fragilisés. Dans le cadre de l'appel à projet ""Encadrement et accompagnement des publics en ateliers et chantiers d'insertion (ACI)"", l'Union Européenne co-finance les postes d'encadrant·es techniques et de CISP qui permettent d'accompagner annuellement plus de 140 personnes très éloignées de l'emploi.


VIT'INSER is a paper & forest products company based out of 2 BD THOMSON, Lesquin, Hautsdefrance, France.","Vocational Rehabilitation Services","51-200 employees","Non Profit","Lesquin, Hautsdefrance","France","groupevitaminet.com","https://www.linkedin.com/company/vit'inser"
,"Les Valoristes en Vaucluse","recyclage","Vocational Rehabilitation Services","2-10 employees","Non Profit","Avignon, Provence-Alpes-Côte d'Azur","France",,"https://www.linkedin.com/company/les-valoristes-en-vaucluse"
,"L'Amarrez","En délivrant des services utiles localement, L’Amarrez embauche en CDI, à temps choisi, les personnes éloignées de l’emploi volontaires pour travailler. contact@lamarrez.fr","Vocational Rehabilitation Services","11-50 employees","Non Profit","Rezé, Pays de la Loire","France","ecossolies.fr","https://www.linkedin.com/company/l-amarrez"
,"MARIACenterSa","تقديم خدمات الرعاية الصحية المتميزة وبرامج إعادة التأهيل للأطفال ضمن أفضل فريق عمل متخصص وأحدث الأجهزة في الشرق الأوسط","Vocational Rehabilitation Services","51-200 employees","Public Company","Khobar, Eastren","Saudi Arabia","maria-center.com","https://www.linkedin.com/company/mariacentersa"
,"PFI13 - Pôle Formation Insertion des Bouches-du-Rhône","Le PFI 13 s'engage à offrir un accompagnement global et personnalisé pour chaque jeune et famille des Bouches-du-Rhône, favorisant leur chemin vers l'autonomie et l'insertion durable. En proposant diverses opportunités de remobilisation, de formation et d'insertion, nous travaillons en étroite collaboration avec les entreprises, les associations et les acteurs du territoire. Ensemble, nous construisons des solutions concrètes et adaptées. Rejoignez-nous dans cette mission et collaborons pour un bâtir un monde plus juste !","Vocational Rehabilitation Services","11-50 employees","Non Profit","Marseille, Provence-Alpes-Côte d'Azur","France","apprentis-auteuil.org","https://www.linkedin.com/company/pfi13"
,"Plateformes Emploi Accompagné de Franche-Comté","Portées par l'AFTC BFC, les Plateformes Emploi Accompagné de Franche-Comté s'adressent aux personnes en situation de handicap qui recherchent un emploi en milieu ordinaire. Elles accompagnent également les employeurs pour une intégration de qualité et un maintien durable de leurs salariés en situation de handicap. Et tout cela sans limitation de durée.","Vocational Rehabilitation Services","11-50 employees","Non Profit",,,"aftc-bfc.fr","https://www.linkedin.com/company/plateformes-emploi-accompagné-de-franche-comté"
,"La Recyclerie du Sport Lorraine","Première recyclerie du sport de Lorraine, nous collectons des articles de sport et loisir dans toute la Moselle afin de les trier et de les valoriser en vue de leur réemploi et d’une redistribution ou revente à bas prix.","Vocational Rehabilitation Services","2-10 employees","Non Profit","Metz, Grand Est","France",,"https://www.linkedin.com/company/larecycleriedusportlorraine"
,"Association FIMECO","FIMECO est une association créée en décembre 2022. Elle cherche à  proposer des DISPOSITIFS SOLIDAIRES qui favorisent l'insertion et le maintien dans l'emploi, de personnes manifestant des situations de handicap cognitif.
Ses objectifs :
- S'appuyer sur l'existant pour apporter un appui expert à la sécurisation des parcours en collaboration avec d'autres associations notamment
- Mettre en œuvre des dispositifs innovants
- Partager les connaissances et les compétences dans le domaine des troubles cognitifs
- Informer et sensibiliser le grand public, les institutions publiques et privées, les employeurs, les organismes de formation et les aidants professionnels
- Proposer des actions spécifiques facilitant la compréhension des dysfonctionnements cognitifs pour :  
- améliorer la mise en œuvre d'aménagements et de compensations
- prévenir les ruptures d'accompagnement et faciliter la continuité des parcours individuels
- favoriser l'orientation professionnelle des personnes en situation de handicap cognitif
- aider dans l'élaboration et la mise en œuvre de projet professionnels réalistes et réalisables
- Communiquer sur la situation de handicap, sur les limites et besoins des personnes concernées, en valorisant leur potentiel
- Proposer des évaluations des troubles cognitifs et de leurs conséquences en termes de limitations d'activités et de restriction de participation; 
- proposer des accompagnements individualisés visant à améliorer le fonctionnement cognitif en situation professionnelle : stimulation de la métacognition, remédiation cognitive, thérapies cognitives et comportementales, affirmation de soi et habiletés communicationnelles.","Vocational Rehabilitation Services","2-10 employees","Non Profit","Aix-en-Provence, Provence-Alpes-Côte d'Azur","France","fimeco13.fr","https://www.linkedin.com/company/association-fimeco"
,"متنافس - Mutanafes","متنافس - جسر من الجامعة الى سوق العمل","Vocational Rehabilitation Services","2-10 employees","Self Owned","Al Riyadh","Saudi Arabia","mutanafes.sa","https://www.linkedin.com/company/mutanafes"
,"Vocamotive, Inc.","Founded in 1992 by Joseph Belmonte, Vocamotive is a vocational rehabilitation firm focused on enhancing the dignity, independence, and quality of life for individuals with disabilities and others facing employment barriers. The name “Vocamotive” merges the Latin words vocatio (calling) and motum (passion), reflecting the firm’s mission to empower people through meaningful employment.

Vocamotive serves a diverse range of clients—including litigators, insurance carriers, third-party administrators, self-insured employers, and individuals with disabilities—and is trusted by both defense and petitioner attorneys. Over the years, the firm has assisted thousands of injured workers and people with limitations, offering expert vocational evaluation, rehabilitation, and job placement services throughout Illinois and the United States.

Vocamotive’s services play a vital role in legal matters such as workers’ compensation, personal injury, employment law, divorce, education law, and ergonomic job analysis. Their experienced professionals provide vocational testing, labor market analysis, counseling, and placement. They also conduct ergonomic job assessments, helping with return-to-work decisions, ADA compliance, and reasonable accommodations.

As a licensed vocational school under the Illinois Board of Higher Education, Vocamotive incorporates computer-based training into rehabilitation plans. One-on-one instruction is available in keyboarding and Microsoft Office, with remote learning options.

Beyond rehabilitation, Vocamotive offers comprehensive career services including résumé writing, employment correspondence, career coaching, and job search support. Guided by core values of quality, fairness, innovation, and a commitment to people, Vocamotive stands out as a trusted resource. Contact them today for expert vocational services or a free consultation.","Vocational Rehabilitation Services","11-50 employees","Privately Held","Lombard, Illinois","United States","vocamotive.com","https://www.linkedin.com/company/vocamotive-inc-"
,"Mission Locale de Vénissieux","Les Missions Locales exercent une mission de service public de proximité, avec le rôle essentiel d'accompagner tous les jeunes sortis du système de formation initiale, âgés de 16 à 25 ans, qui le souhaitent ou qui en expriment le besoin, dans leurs parcours d’accès à l’emploi, à la formation et à l’autonomie sociale (santé, logement, mobilité, etc.).
Les Missions Locales contribuent à l’élaboration et à la mise en oeuvre d’une politique locale concertée d’insertion professionnelle et sociale des jeunes, en mobilisant les compétences de l’ensemble des partenaires publics et privés, dont les entreprises. Membres à part entière du service public de l’emploi, elles développent de nombreuses actions avec les entreprises et leurs fédérations.","Vocational Rehabilitation Services","11-50 employees","Non Profit","Vénissieux, Auvergne-Rhône-Alpes","France","mlvenissieux.fr","https://www.linkedin.com/company/mission-locale-de-vénissieux"
,"La Charte de l'inclusion des personnes réfugiées et migrantes en entreprise","La Charte est un outil favorisant l’insertion professionnelle des personnes réfugiées et migrantes en Suisse. Les signataires s’engagent à mettre en place une ou plusieurs actions concrètes, avec le soutien des trois organisations à l’origine du projet : SINGA Switzerland, Yojoa et l’Association découvrir. Pour en savoir plus et devenir signataire, contactez nous via cette page ou sur notre site !","Vocational Rehabilitation Services","2-10 employees","Non Profit","Suisse romande","Switzerland","inclusionentreprise.ch","https://www.linkedin.com/company/la-charte-de-l-inclusion-des-personnes-refugiees-et-migrantes-en-entreprise"
,"Argos Conseils et Formation","Centre de formation certifié Qualiopi, Argos Conseils et Formation, est le partenaire de proximité en Sarthe, de votre parcours professionnel.
Spécialisé dans la formation sanitaire et sociale en particulier les auxiliaires de vie, Argos Conseils déploie aussi des actions d'insertion professionnelle et des bilans de compétences sur l'ensemble du département et dans d'autres régions de France.
Equipe pluridisciplinaire et joyeuse de formateurs, conseillers en insertion professionnelle, Argos Conseils est au service des demandeurs d'emploi du territoire en proximité. 
Alliant suivis individuels et actions collectives innovantes, l'équipe Argos place la bienveillance et l'écoute au cœur de chacune de ces actions.
C'est sans compter son large réseau de partenaires mobilisés auprès des bénéficiaires suivis et des stagiaires formés dans nos locaux.","Vocational Rehabilitation Services","11-50 employees","Partnership","Le Mans, Pays de la Loire","France","argosconseils.fr","https://www.linkedin.com/company/argos-conseils-et-formation"
